,Date,Reviews,Ratings
0,"March 10, 2020","My 2019 Ram had a defective passenger side fender, and since it was a warranty issue, Rockwall CDJR sent me to Rockwall Fords body shop to handle. When I walked in CDJR, I was not greeted and it seemed like nobody wanted to help. I finally asked if they were open(it was 5pm), and Meagan Stepped up to help. I told her about the issue, and she jumped right on it. She took pics, explained the process then sent the pics over, but never followed up with an answer from Ram. I called back a week later, still nothing. Finally after 2-1/2 to 3 weeks, the pics were approved. I got my truck in and they set me up with a rental. I only called once a week for an update, and sadly, I had to initiate most calls, and they couldn’t tell me much when we spoke. I finally got smart and called the body shop direct and that’s when I started working with Shelby. She started off strong, and I felt good about how things were going, but there were a couple of set backs, which I was more than understanding about, but during those set backs, she stopped calling me with updates. They finally got the fender replaced, and it looked great. They did forget to put the pinstripes back on the passenger door and fender, as well as the badges, which I pointed out immediately. I was told I could bring the truck back before 5 on any week day and they would take care of it. I went back the following day, and even called ahead, but all they could do is put the badges back on, due to the cold wet weather. Shelby told me she would give my info to their pinstripe guy and he would come to me and put the stripes on. Well, he didn’t call for 2+ weeks, so I called Shelby. She apologized and said she’d reach out to him. About 3-4 days later, he called. To this date, he has never called me back to schedule, so I just took them off of my entire truck. The part I’m most disappointed in is next. On my way home from the shop on Jan 20th, which was the first day I got it back, I stopped to fuel up. While I was fueling up, I was admiring the great work on the fender, but I noticed a scratch on my passenger mirror, and 2 very small gouges on my hood, right above the newly replaced fender. I immediately called Shelby to inform her, and she instantly said they didn’t do it and it was a rock chip, I politely disagreed and asked her to look into it the following day when I was going to be at the shop. When I was at the shop the following day, I pointed it out, and she continued saying it was a rock chip. I was very nice about it and told her whatever it was, it wasn’t there when I turned the truck over to Rockwall CDJR. She offered to get with Courtney, who took over with helping me, to see if he had pics. When I called to ask for an update, she said she hadn’t been able to speak with Courtney, but would keep trying. Another week passed and I hadn’t heard anything, so I called Courtney and got the pics myself. They were not broad enough pics, and only showed the defective fender, so I asked him if I could get the other pics, and who I needed to speak with, I never heard back from him. I called back later that week and spoke with JB(?), who was awesome, and he got with Meagan who had pics of my truck from the initial report, which clearly shows there was no damage when I turned the truck in. I called Shelby to inform her. She was very hesitant to offer to look at them. I obtained her email, emailed the pics, highlighting where the damage was and was not, and still haven't heard back from her, and that’s been 3+ weeks. I even emailed her again to ask if she had a chance to review... and haven't received a response. Sorry for the book, but this service was ridiculous! The gouges are very minor, and I could probably live with them, but this is now about the principle of the matter. I don’t know where to go if this essay falls on deaf ears, but I’m ready to do so if necessary. It’s comical how small these gouges are, and that I was in a rental from Dec 10 to Jan 20, but it’s also comical to know this is how you treat your customers. ",1.0
1,"March 06, 2020","Got a new Renegade from here. Staff was friendly and helpful. Sal our salesman was knowledgeable and understanding of what we wanted. We unfortunately had an issue with the car after 1 day, but they were able get it taken care of right away. ",5.0
2,"March 04, 2020","Although I overpaid for the vehicle, it was an overall good experience. Sidney was a pleasure to work with, as was Martin. I was in and out quickly. ",4.6
3,"March 02, 2020",We have always had a great experience.  No problems.  Everyone is very nice and helpful. We would recommend this dealership to family and friends in the future. ,5.0
4,"February 28, 2020","Service was in and out.  The 5 stars is for the service advisor, Carey.  This guy went out of his way in a world that rarely does that!  Thank you.",5.0
5,"February 24, 2020",Awesome and quick service! Will definitely continue to bring my vehicle to this location for service. Very efficient & didn’t have a long wait! Thank you guys. ,5.0
6,"February 20, 2020",Shane was great to work with. Very personable and professional. Also very knowledgeable about the Jeep Wrangler I purchased for my son.  Would definitely recommend him to friends!,5.0
7,"February 19, 2020",Great customer service! They were very knowledgeable and able to answer all of my questions. I felt very comfortable purchasing from this dealership and would recommend to someone else!,5.0
8,"February 19, 2020","I brought my 2017 RAM in on 2/18 & 2017 Durango on 2/19 for maintenance service. Kevin Fail was my advisor on the 18th and Carey Lindsey on the 19th. Both excellent representatives for your dealership. Both are professional, knowledgeable and courteous. They both made my trip to your dealership a pleasant experience. ",5.0
9,"February 17, 2020","Great Experience. In/out ASAP. Usually have to wait two or more hours. 30 minutes this time! Good work thank you, see ya'll next time.",5.0
10,"February 14, 2020","The App told me a low price, but upon walking in I found out it was 5 times as much, rep gave me a discount ",4.6
11,"February 13, 2020",We found Rockwall on line.  Aaron jumped through hoops to make sure the truck we wanted would fit our needs.  He even did a video walk-thru of the truck so we could feel comfortable before we drove 2 hours to get it.  The one minor surprise we had was handled professionally.  I would recommend them.,4.4
12,"February 13, 2020",Had a great experience with Michael my service advisor. I did not have the work completed by your dealership as I felt the overall price far exceeded the level of effort required for the job. I am giving you five stars on the price as it reflexes the zero dollar bill for diagnosing the issue. If I was to rate your estimate of 500.00 to replace a coolant expansion tank it would be two to three stars. ,5.0
13,"February 12, 2020",Service department gets you in and gets you out!!! Erica took care of all my needs during my service appointment. Quality work. Fair Price. Will be back.,5.0
14,"February 12, 2020",James and Ben Harris - Made the deal happen! That is what I needed! Great Service! James and Ben will get the job done - No worries when I work with them....,5.0
15,"February 12, 2020",I saw the listing for a used 2018 Pacifica and immediately visited the dealership.  Destiny met me at the door and brought the vehicle around for me to look at.  It was still in receiving so she went above and beyond to retrieve it so I could see it.  When I returned to make the purchase it went very smoothly. ,5.0
16,"February 06, 2020","My service appointment was scheduled same day I called.  Work was done quickly and Chris, my service coordinator, did an excellent job keeping me updated on cost, repair description and when my Challenger would be ready for pick up.",5.0
17,"February 05, 2020",Has a great service department. Service advisors are always good. Jobs are done right the first time. Will definitely go back for service again. I do recommend them.,5.0
18,"February 05, 2020","Kevin did an outstanding job informing us of all our options and took time to walk the entire lot with us showing us multiple vehicles.  I was set on a 4x4 with very specific criteria, but once Kevin informed me the nuances between the 4x4 and 4x2 models, I quickly pivoted to the 4x2...and you had 2 of what I wanted.  great job all around!  ",5.0
19,"February 05, 2020",I was extremely happy with my experience. It was painless and I was pleased with how they worked with my trade in to make the payments work for me. Thank you Rockwall Dodge!!,5.0
20,"February 04, 2020","Got off to rocky start, but got better. had a problem with the first car I brought but Stevie ? took care of it. I was taking good care of.",5.0
21,"February 01, 2020",As soon as I got in I was greeted from the service agent. Very polite and shared that it may take a while until I can drive off. Even when I paid he did apologize for the waiting. :),5.0
22,"January 31, 2020",Good to see ‘customer’ in customer service again 😬👍🏻 Super improvement over the last few years team. Glad to be going to Rockwall Dodge again. Thanks!,5.0
23,"January 30, 2020","I live in Denton over 55 miles away from Rockwall, so it took a lot to get me to make the trip to purchase a new Ram Laramie Longhorn. It all started when I called Navy Federal Credit Union to get prequalified for a loan. After receiving credit approval they transferred the call to their preferred purchasing department. They explained as a member I would get the best deal using their preferred Dealer. They ask what brand and options I was looking for and they told me about Rockwall Ram.  Within a couple of hours I received a phone call from the dealer to make an appointment. When I arrived at the Dealership I was met by Kevin Round. He showed me several Ram 1500s with the equipment I wanted in my price range. I selected the one I wanted and the deal was made. I suggest all my fellow Veterans to use this service from Navy Federal Credit Union and Rockwall Ram. ",5.0
24,"January 28, 2020","He was Responsive, customer driven, curious and he followup when I arrived on time came to the lobby and made me aware of updates and more",5.0
25,"January 21, 2020",Outstanding service. Kept up to date on my wrangler.Megan answered all questions and was prompt in getting me on the road. First time to use service here but definitely not the last. Great experience ,5.0
26,"January 19, 2020","If it wasn’t for you’re great team I don’t know if I would been in a truck this year thank y’all. Definitely will be back to buy my next vehicle. 
",5.0
27,"January 16, 2020",Mike was great...excellent service issue quickly solved! Mike was great....excellent service issue quickly solved! Mike was great... excellent service issue quickly solved Mike was great...!!!!,5.0
28,"January 16, 2020","From the time I arrived for scheduled service and the time I left received Spot-On customer service. Michael Gunter met me at scheduled time and explained the services to be completed. I was very confident that my Jeep was in good hands at the Service Department. 
Just want to emphasize the professional and courteous customer service Michael provided me throughout my appointment.   ",4.6
29,"January 15, 2020","Very pleasant dealership to work with. Shirley, our sale associate was more than accomadating when it came to the bottom line for the vehicle. They have a new customer and will use them in the future. ",5.0
30,"January 11, 2020","The service Dept. has definitely improved over prior visits. Chris, my service advisor was prompt to take care of me and got me in and out quickly. ",4.0
31,"January 10, 2020",Willingly worked with us on price we could afford; was quick with financing and got the payment we needed; Shirley followed up to make sure we understood drivers manuel.,5.0
32,"January 10, 2020",Courtney met me at drive up and went thru my appointment details. He was honest about wait time and recommended a shuttle ride hime.  He continued to communicate with me regarding needed repairs.   A good experience!,5.0
33,"January 09, 2020","Through out the purchasing process, Kevin showed a great professionalism by providing the in-depth knowledge of the vehicle and the step-by-step purchasing guide in a courteous manner.",5.0
34,"January 07, 2020",Very professional work on my car had an oil change done they check the 25 points and also filled all my fluids. Will have all my service done at Rockwall Dodge,5.0
35,"January 06, 2020",I received good service . I was greeted and the adviser was professional . I explained my issue with my vehicle and offered his advise. Also I did not have a long wait time.,5.0
36,"January 05, 2020",Courtney was very apologetic about the delay. His professionalism was appreciated. We had made an appointment but the garage was unexpectedly backed up. I will return because of Courtney. ,5.0
37,"January 04, 2020","On the eve of the new year, I had a flat.  They fixed it within 30 minutes before they were going to close.  Thank you.",5.0
38,"January 01, 2020",Great job! I was in and out in 39 minutes and Erica took the time to explain and keep me updated! She even printed me my service schedule.,5.0
39,"December 30, 2019","It was great dealing with Big Ben, Ashley Rhodes, James, and the McGregor lookalike. 
No haggling and very patient.
Will definitely refer friends and family!",5.0
40,"December 29, 2019","I think its been the fastest negotiation i ever done at any dealership. Other dealers give customers a hard time with negotiating the price of the vehicle, these people are straight forward, and i like that!
Overall it was a great experience and i got a great truck! I'm happy! Sales person was excellent, Financing was great too!!",5.0
41,"December 29, 2019","Took my Jeep Wrangler in for service only took a couple of days. Needed a new sensor for my brakes, they ordered the part and installed it as soon as it came in. Service tech: Erica Nemcek was very nice and helpful. Overall, very positive experience. ",5.0
42,"December 25, 2019",Have been faithful to Rockwall since first purchase with them. Chris Miles is awesome salesman as well as follow up and service handler! Give him a shot before you buy elsewhere!,5.0
43,"December 24, 2019","In an out in a timely manner. Greeted asI arrived Oil Change fine and out the the door in One Hour awesome experience.
I approve this message",5.0
44,"December 24, 2019",Lesley came in on his day off to help us finalize the deal. Everyone was very nice and helpful i will be buying another car from them next year. ,5.0
45,"December 22, 2019","I needed an oil change, rotation of tires and yearly inspection for my 2018 Jeep. Service Adviser said it would take two hours but it was done in one hour. I was pleased it didn't take 2 hours. I also had multiple questions for my Service Adviser, Jon Franks, regarding my battery and a white bar on my screen. He was able to answer my questions and he suggested prevented measures to take for my battery.  Many times you don't want to go to the dealer because they are overpriced and slow, but I am happy to say they were fairly priced and accomplished the work in an acceptable amount of time.",5.0
46,"December 19, 2019",Chris Miles was great.  He was very knowledgeable about the Jeep wrangler and all the electronics.  I would reccomend him to everyone. Thank you karen murphy,5.0
47,"December 19, 2019",Chris and Shirley were very helpful and courteous. Would definitely recommend Rockwall Dodge. They showed a great amount of patience and were so informative and made my decision easy to make. ,5.0
48,"December 15, 2019",Great service. Service advisor Kevin Fail was phenomenal!  He took great care of me and kept me advised.  Was in and out in not time at all!,5.0
49,"December 11, 2019","I went in to have the windows tinted on my recently purchased Durango.    They had the windows tinted and ready to go so quickly,  I never had to leave the dealership.",5.0
50,"December 09, 2019",Service was great and appreciate the text and email notices which enable you to alter and/or change your service needs.    My service rep Courtney Swift was very friendly and helpful.,4.6
51,"December 09, 2019","This was our 2nd purchase from Christopher and he was efficient and cordial throughout.  We knew what we wanted & how much we wanted to pay (a reasonable price for all parties!).  
We were out of there within 2-3 hours.",5.0
52,"December 06, 2019","I have owned a Dodge Truck, a Jeep Wrangler and now a Jeep Grand Cherokee and Rockwall Dodge has preformed the service work on all three vehicles. The service work has always been excellent and that is why I keep coming back to Rockwall Dodge. .  ",5.0
53,"November 08, 2019","Rockwall Dodge has always provided me with very good to excellent service with any of my vehicles.  From the purchase process to the regularly scheduled services.  Carey was very helpful this most recent visit.  He made sure he understood exactly what I needed done, offered suggested services, but did not press, and ensured the service was done timely.  He also made sure I had transportation to and from the dealership if I needed it.  Thank you!  ",5.0
54,"November 06, 2019","Service was very good, well taken care of by service rep Zane. Not happy about putting an engine thermostat in a car with only 29000 miles on it!. That was $600 I have never paid before!",4.4
55,"November 06, 2019","New customer to this location. I came in for a service appt and I was greeted by Erica. From the beginning to the end, Erica was very attentive and displayed great communication to ensure my service needs were met. The wait time was minimum and I was in and out in no time. I will definitely return to the Rockwall CDJR location. ",5.0
56,"November 05, 2019","I was pleasantly surprised with the amazing service I received from this dealership! Mostly, I was quite impressed with Ms. Erica Nemcek! I was greeted with enthusiasm and a smile. She was very kind and helpful and thanks to her willingness to go above and beyond, I will be seeing her again soon! Thank you Erica! This company is lucky to have you Representing their brand!",5.0
57,"November 05, 2019","Set up appointment on-line and arrived a few minutes early for my appointment.  Kevin Fail met me and checked me in.  He told me that they do a lot of oil changes for Saturday service and said he would call when the job had been completed.  I left the jeep and did other errands that I needed to do.

Kevin contacted me within a few hours that the service was completed.

My wife dropped me off to pick up the jeep.  It took a while for the jeep to be brought around, but I was happy with the service.

Very nice experience.",5.0
58,"October 31, 2019",We had a very good experience Purchased a used car for my daughter and a new truck for me.   I would recommend them to anyone for their new and used car needs. ,5.0
59,"October 29, 2019",Received great service.  Chris got me right in and had the jeep repaired by early afternoon.  Diffently will be back to this dealership. Thanks for the great service.,5.0
60,"October 26, 2019", I bought a 2014 Volkswagen Passat TDI and less than 40 hours of having it it blew a turbo hose and broke a turbo hose clamp.  Wow this was very irritating the car was in limp mode and I got it back to the dealer.  They quickly put me in a rental and upon being there I pointed out that all four tires were in my opinion below legal and very dry rotted.  They did fix my car as well as replace all four tires in as much of a timely manner as was possible due to the fact they were waiting on parts from Volkswagen.  Erica in-service is good at keeping communication overall I’m very happy with the experience this time things have definitely improved since my last purchase of the Chrysler town and country.  The only reason I gave four stars instead of five is due to the fact that I feel that both of the issues with the tires and the turbo should have been recognized upon inspection of the vehicle before sale.,4.2
61,"October 25, 2019",Excellent customer service! Extremely fast! They really work with you as a person and seem to want your business more than your money. Highly recommended!!!,5.0
62,"October 24, 2019","Have just had a great experience purchasing a new vehicle from Frank, Tiffany and Kyle. They are awesome and I recommend you ask for them when you're in the market for a new car. They are extremely knowledgeable and their customer service skills are impeccable. We are so impressed with the service we receive from this dealership that we are willing to drive from Frisco knowing we will be treated like family. We highly recommend this establishment for all your vehicle purchases",5.0
63,"October 17, 2019",Had my car service and Rockwall Dodge and had great service within a reasonable time.  Very much appreciated Chris and Joseph making my experience a pleasant visit.   ,5.0
64,"October 16, 2019",I was very satisfied with the experience I had at this dealership.  Kevin Round my sales associate was very helpful and answered all of my questions during the purchase.,5.0
65,"October 13, 2019",Had a on the side of the road breakdown and dropped it by the dealer unexpected and it went pretty smooth.. thanks for the help ,4.4
66,"October 10, 2019","Everyone was pleasant, professional and helpful. A very good experience. The client advisor, Lesley Arnold, was great to work with. I would absolutely recommend this dealership. ",5.0
67,"October 09, 2019","Michael was awesome, got me right in and out, Great job! Repaired passenger side mirror in a hurry to avoid delaying my trip with our travel trailer.",5.0
68,"October 04, 2019","Great dealership, I think the add on ""extras"" that are billed along with the car are a bit of a ripoff; but overall a great dealer that I would deal with again.  Christopher was an excellent very knowledgeable sales representative.",4.8
69,"October 04, 2019",Great salesman and he really helped me with picking the right vehicle. Also did a great job walking me throughout the entire process. Thanks for everything!,5.0
70,"October 03, 2019",Mr Miles was very knowledgeable about all of the equipment on the truck. Help set up some of the options on the truck before we drove off. I have never met a sakes person with such knowledge of the various models i was contemplating buying. He helped me make the right choice. Love this truck.,5.0
71,"October 03, 2019","I have been to Rockwall Dodge Ram so many times I forget.. I always use Shirley who knowledgeable, experienced, and fast. Highly recommend Rockwall Ram",5.0
72,"October 01, 2019","Very friendly, no pressure, easy to do business with.  The car we were looking for wasn’t immediately available, rather than sitting around waiting, we test drove a similar car.  When we were done the car we wanted was available so we drove it and loved it.  ",5.0
73,"September 30, 2019","It was a great experience, and they were able to get me in my dream Jeep! Brad Atkinson was so great and helpful!! Ask for him ;)",5.0
74,"September 30, 2019","Ordered a 2019 Challenger Hellcat Redeye.  Went to several dealers to try and get information on what to order for my car.  When I stopped by Rockwall Dodge, Shirley was more than helpful in supporting my needs and sitting down with me to go over all the options available for ordering a new car.  Got regular updates to the status of my car being built.  When my car arrived, I had personal attention to my car is seeing that all was taking care of as I wanted.  Had a wonderful and pleasant experience.  The financing / paper work went well and easy.   I look forward to working with Rockwall Dodge in the future.  ",4.8
75,"September 30, 2019",I would highly recommend Rockwall Dodge.  Everyone was courteous and helpful.  I got the Jeep I have been wanting without any major issues!!👍. Give them a try and they will do everything in their power to make it work for you!,5.0
76,"September 29, 2019","Overall a great experience,  our salesmen was great in getting us in the vehicles we wanted. I got un upgrade to a 3/4ton diesel and my wife got her perfect car, a 19 Charger blacktop package with everything she wanted. The negotiations were easy and the finance team got us a great rate.",5.0
77,"September 28, 2019","We went in because of the advertised pricing and Kevin was very personable and he went above and beyond on getting us to know the Jeep we bought.  We traded in a BMW and more geared toward another BMW, but bought the Jeep Grand Cherokee because of Kevin.  If you are looking, ask for Kevin ",5.0
78,"September 27, 2019","Great truck so far and a good experience with dealership, 2nd truck I bought from them and same sales guy 7 years later!! Good team ",5.0
79,"September 25, 2019","Check in, take a seat, get a text asking if you need anything, watch Tv or play on phone, get a text it’s done, pay bill, vehicle is brought around for you, visit over very slick. 
A very pleasurable experience Thanks",5.0
80,"September 24, 2019","Had 2 recalls on my Jeep. Set an appointment, dropped it off. Done. Same day. Called upon completion. Service folks were great to work with. ",5.0
81,"September 24, 2019","Unprofessional!

Was promised on Saturday, that once I have proof of payment, I can take the car.  The money finally cleared Monday overnight.  

It's now 1PM Tuesday and they still refuse to release my car.  

I am not even from Dallas, so now I am stranded here waiting:

1 - they indicated that once I have prove that the funds cleared, I can take the car - seems to be not the case

2 - they refuse to simply call accounting for a confirmation so we can all get on with our lives",2.0
