,Date,Reviews,Ratings
82,"September 24, 2019","Don't believe any of their lies claiming to have integrity or caring about what's best for the customer because it's all a load of complete crap.  They'll blatantly lie to your face as much as they need to until you agree to something and then they'll pull the ole bait and switch and hope you don't notice it when you're signing the paperwork.  Then they'll claim ignorance and that you signed it so oh well nothing they can do about it now.

Thought I had a good experience with them only to find out they lied several times to my face on several different occasions and about several different things.  This dealership is why you're warned over and over again to read every detail as Rockwall Dodge tells you one thing but then the paper work is completely different.  Was lied to that I had to have the protection plan on a lease, which is conveniently buried in the numerous pages of the contract, but at least I have a 7 year warranty on a vehicle I was leasing.

STAY AWAY!!! ",1.0
83,"September 19, 2019","Nelson was great, went over everything about the car facts, previous owner, warranties and the contract. I was in and out with my new car in less than going to see a movie. ",4.8
84,"September 19, 2019",JR took terrific care of me as did Tommy for the shuttle drive to and from home. All made service much easier.thank you all for your part in this visit.,5.0
85,"September 19, 2019","Doesn't matter how small the issue, they always take care of me, and do it with a smile. Thank you Megan for always treating me like family.",5.0
86,"September 18, 2019","Very helpful in my purchase of my ram1500
Worked together to get to a place I was comfortable Was very happy with my overall experience.",5.0
87,"September 13, 2019","KurtP was very helpful. However, it took too long (8:00 am to 11:??) because your tire alignment equipment was not working right. The car had to be sent next door. ",5.0
88,"September 10, 2019",Brad was very friendly and helpful. I'm a little bit picky about my cars so he found what i was looking for. I will recommend my friend to shop at the ROCK!,5.0
89,"September 06, 2019","Attentive, quick and thorough. Service people were very friendly and helpful which made it a Very nice experience. I would highly recommend to anyone needing service.",5.0
90,"September 04, 2019","Thanks to Erica’s efforts and expertise, I had the best service experience ever!
Her genuine concern for my service needs, combined with her tremendous attention to detail, are unrivaled!",5.0
91,"September 04, 2019","Christopher Hogan & Shane O’Neal 
Had make my vehicle purchase is easy is possible 
And guide me to all the steps and with great respect and Customer Service I highly recommend them at Rockwall Dodge for your future purchase and I’ll be back in the future.

Thank you Guys ",5.0
92,"September 01, 2019",Great experience service team did a great job and were very timely couldn’t ask for more.  From check in to check out they were the bomb ,5.0
93,"August 28, 2019",Juan contacted me back after I left an inquiry on their website and he was very easy to work with. The whole process was quick and painless. Juan even followed up with me after the sale to make sure I was happy with the vehicle. ,4.8
94,"August 28, 2019","Another awesome experience. I arrived for my appointment for my second oil change and tire rotation on my Ram 1500.  Staff was courteous, punctual and knowledgeable.  They had me out the door in less than an hour.",5.0
95,"August 27, 2019","This is the 2nd time we’ve purchased a car from Chris Miles and the 2nd time we test drove 1 vehicle and within a couple hours it was ours. Also Karly in finance was seamless & efficient, fast finance ever!! Keep up the good work!",5.0
96,"August 21, 2019","Our sales team, Lesly, Ben and the rest, knocked it out of the ballpark in meeting my wife's need for her 2019 Charger. They went out of their way to make the sale occur and to make her glow as all those nuances one wants in a new car to be the best they could.

Great going Rockwall CDJR",5.0
97,"August 20, 2019",State inspection was completed faster than I have ever had one done. Arrival completed quickly and courteously. Check out was done quickly and friendly. Nice experience,5.0
98,"August 20, 2019",Rodney was awesome and went above and beyond my expectation got me fixed and out of there ahead of what I was told and expected,5.0
99,"August 20, 2019",Chris was able to work with my tight time table and get me into a vehicle that I love at a price I can afford. My friends are already aware of how great my experience was! ,5.0
100,"August 18, 2019",I always have a pleasant experience with Rockwall Dodge! Shirley is amazing! She is very knowledgeable and she has a big heart! Everyone is very friendly and willing to help. Carley in finance makes it happen!,5.0
101,"August 18, 2019",James went above and beyond to take care of all my needs. He walked me through the whole process and always communicated everything. I’m extremely happy that I chose Rockwall Dodge to purchase from. And I’m beyond happy James was my salesman. It was the best buying experience. I became close with so many people there and I will recommend them to everyone looking to buy a new car. Thank you for 5 star service. ,5.0
102,"August 15, 2019",I never drove my car after it was serviced because I bought a 2017 Chrysler 300S.  I love my 2017 better than my 2014.  The employees are better than any place I have ever been.,5.0
103,"August 15, 2019",Best experience I have ever had but a car. Would highly recommend this dealership to anyone I know. Definitely worth driving out there from East DFW. ,5.0
104,"August 12, 2019",My service advisor did an excellent job taking care of my car. Very knowledgeable and friendly. He kept in close contact all though out the repair. Well be considering a new vehicle next year and plan to go back here.,5.0
105,"August 11, 2019",Noticed truck leaking water. Brought it in to Rockwall Dodge. Megan asked the right questions and got the process started. The technician  found the problem and replaced the water pump.  ,4.8
106,"August 08, 2019",Dealer great to work with and knowledgeable about the automobile industry. Will continue to use them for all service work. And they have plenty of free coffee...,5.0
107,"August 08, 2019","I had an appointment for an oil change. They were running a little behind because they were short handed 
They made up for my inconvenience so J was completely satisfied with my visit ",5.0
108,"August 08, 2019","Robert did a great job getting my truck repaired before the weekend, had to go out of town, they made it happen.
Thanks

Great Job.",5.0
109,"August 06, 2019",My husband and I recently bought a 2019 Chrysler Pacifica. We were happy with our purchase as well as our experience at Rockwall CDJR. Chris Miles was very helpful and knowledgeable especially with all of the features of the Pacifica. ,5.0
110,"August 06, 2019","Chris knew products and different options well, no haggle, great pricing.  Definitely would recommend the overall team.  Ram Rebel truck is a great truck for off road and hauling dirt bikes in all kinds of weather.",5.0
111,"August 02, 2019",Everyone especially Me. Pinson who stood in for Chris Miles was exceptionally helpful.  The finance person was also top rate.  Shopping among friendly and caring people made the experience worthwhile.,5.0
112,"August 02, 2019","Joseph & Megan are the top of their game. Always professional, pleasant and efficient. 2 top notch associates at the back of your house. You should commend them.",5.0
113,"July 31, 2019","This was our first lease, and they made it easy.  Happy with our new car, and pleased with the terms of our lease.  All good!",4.8
114,"July 31, 2019","Good experience, for a car dealer or a dentist...best Wrangler prices I found.  The only negative is the crazy expensive (295.00 lug nut locks...really?) dealer add on stuff that I did not want and did not pay for.  My salesman Frank was great.",4.8
115,"July 30, 2019",We bought our 2019 Jeep Wrangler. We were in & out. The experience was fun and super easy.  Kevin kept us in the loop the entire time. Will never buy a car anywhere else! ,5.0
116,"July 30, 2019","Been dealing with Rockwall Chrysler Dodge Jeep RAM since 2013 and from buying our Jeep to getting routine maintenance and repairs have been very pleased with it all. Friendly staff. Service writers are all good at what they do. Only thing I would change is the seats in the customer waiting area. Not that comfortable after a while when you decide to wait. Over all, would definitely recommend the dealership.",4.8
117,"July 30, 2019","I have many places to choose from for the services i need for my 2018 RAM. By choosing Rockwall Dodge for that service work i know that i will get the best service available. The service people are the best.
Megan is at the top.",5.0
118,"July 29, 2019",Great experience. Felt like they actually cared about the customers. I didn’t have to stay all day to get a car. Had a great experience.,5.0
119,"July 28, 2019","The staff goes out of their way to make you feel comfortable. I do not feel pressured into making a purchase and I was allowed extra time to not only test drive the vehicle, but to get to know its features prior to making a final decision.  Helping with the process was Lesley Arnold, who just joined the Rockwall team that same week.  He is very knowledgeable, answered all my questions, and best of all, has reached out to me twice just to see if I had any questions. At other dealerships, the staff forgets you as soon as you sign the contract.  Not the case here.  In fact, several members of the staff remembered me from my prior purchases. Lesley works hard to earn your business, and even harder to ensure you are completely satisfied. ",5.0
120,"July 28, 2019",Everything was great and Ridney is working with me about bringing my car in for some problems I am having with it. He is very courteous!,5.0
121,"July 26, 2019",Everything went well. My service guy was very nice and helpful. The oil change coupon was also nice to receive  I was going to use the shuttle but the service department got me in and out quick. Very happy and would go back for my next oil change when I get the coupon. Thanks ,5.0
122,"July 19, 2019","It was easy to get in and out and completed. The staff was helpful and friendly, advised what other services I need from my diagnostic testing.",5.0
123,"July 18, 2019","Great service, vehicle delivered as promised. If I have one comment is other dealerships once they service your vehicle they wash it, didn’t happen in this case",5.0
124,"July 17, 2019","I was in and out with no problems, service rep kept me updated on the progress of my vehicle.  I would recommend this dealership for service.",5.0
125,"July 16, 2019",Sean O’Neal is a true professional.  This was by far the easiest car buying experience of my life. I highly recommend dealing with Sean.,5.0
126,"July 14, 2019",Shane O’Neil found exactly what I wanted. Everybody else very personable and helpful. Felt like they really cared for what I wanted and needed. ,5.0
127,"July 12, 2019",Because the people up front tries to help but the service takes too long for simple stuff like an oil change.  They need not to schedule people if they are not going to be able to service them on a reasonable time. ,5.0
128,"July 07, 2019",Tow truck brought my Dodge Ram to the service center. Rhonda picked up the service paperwork quickly and put the vehicle in the queue. Service technician found and corrected the problem and provided good detail about the issue. ,4.8
129,"July 03, 2019","I seen a truck online that I absolutely LOVED! My schedule is often times very demanding and hard to work around but the team work of Frank, Karl, Ben, and Caleb in financing. They sure did exceed my expectations in the delivery of my gorgeous Laramie! Thank you so much for the professionalism and making me feel valued. ",5.0
130,"July 03, 2019",Appointment was easily set-up.  Status was expertly provided. Details were explained precisely. Service was performed efficiently and effectively.  Service managers were very courteous and friendly.  Will definitely use for future needs on my Jeep! ,5.0
131,"July 01, 2019","I brought my Jeep Wrangler in for service, it was late in the afternoon.   Service officer was polite and very helpful.  Would return to this location again",5.0
132,"July 01, 2019","when i phoned to make an appointment I spoke with Cane he stated that he would be there to Greet me Friday morning at 0700  guess what?  that's right he was not, he did note the reason i was coming in Thank you Warren for handling my service for me.   Cane do no lie to customers!!!!!!!!!!!,  i need to know that when my wife brings her truck there she will be greeted with the service person that was spoken with.    this is one of the reason we stopped coming her for service.  ",3.8
133,"June 29, 2019","Title says it all. Found the deal online, looked too good to be true. Called and spoke to James and the Sales Manager. Got the assurances I needed to make the trip to go test drive. Truck was better than the pictures and the deal was perfect; almost 20% off. The transaction was low pressure and very fast. Just what I expect for an experienced buyer and from a reputable dealership.

I had to go to the dealership in my wife's vehicle and the sales team was gracious enough to drive my new truck to where my wife was (over 30 miles away in rush hour traffic) so that I wouldn't have to go back to the dealership to take delivery. It was truly service 'above and beyond'.

2nd purchase from here and would highly recommend.",5.0
134,"June 29, 2019","Great service in all departments.  My salesman, James was exceptional.  I've bought many vehicles from Rockwall Dodge and Jeep and I intent to keep coming back.  Great service and great people.",5.0
135,"June 27, 2019","Shirley, Jason, and Finance went beyound to help me trade in my Jeep.
I had bought a 2019 Jeep in April, I was so dissastifed with the Jeep and explained it to Shirley. 
She listenened and got me in my new Jeep. I will never go to another Dodge dealer. I make sure if I know someone looking to buy I highly reccommend Rockwall dodge and of course Shirley.

Sincerely, Kathleen

",5.0
136,"June 26, 2019","In the market for a ram 3500 drw. We had a long list of needs, and a special problem. Our sales lady and the GM stepped up and made it work. We had visted other dealers, and they were not interested in working with us. That buying experience was the best car purchase we ever experienced. Can’t say enough about them.",4.8
137,"June 23, 2019",This is the second vehicle (new and used) I have purchased from this dealership and all the way from the salesperson(Kevin) to the financing (Karly) was very smooth and easy.  They are great people and would recommend them all the way.,4.8
138,"June 23, 2019","best truck buying experience, ever.  will buy my wife's next car here.  great salesman - Chris Miles. explained everything, made sure I was happy with the truck and the deal.",5.0
139,"June 20, 2019","Had a great experience the first time around, so I decided to come back here again to check out a car I was looking for. I wanted a 2019 Challenger 392 Widebody and there wasn’t any in the area. They were able to find one within 500 miles and get it delivered to the dealership within 2 days. We were able to work out a good deal with finance and I went home with another great car.  ",5.0
140,"June 19, 2019",Great experience with Brad made this purchase a pleasure. Decided on a truck this time around searched online at dealer web site. Showed up with inventory numbers. Brad greeted us and showed us the trucks we wanted no pressure. By the time we finished had the truck we came for at a good deal.,5.0
141,"June 12, 2019","I had been looking for a truck for quite some time using primarily Cars.com for my search.  I found the truck that I wanted and made contact with the dealership.  We made a deal primarily through text messages and a few phone calls back and forth.  The overall process was easy, I never felt pressured into making a decision and the Sales team were very friendly and eager to meet my terms.  Finance was quick and easy and they found me the interest rate I was after.  Couldn't be happier with the truck and the sales experience at the dealer just made the whole experience that much better.  I live about 3 hours away from this dealership but it was worth the drive.",5.0
142,"June 11, 2019",Attentive to the specifics of what we were looking for. Easy to work with. Good selection to choose from. Easily found the right vehicle at the price we were willing to pay. ,5.0
143,"June 07, 2019",I went in for a simple oil change and the staff was great and the wait time was not long at all. I highly suggest for you to try it.,5.0
144,"June 04, 2019",Do not go to this dealership if you want honest help and a honest process to buy and finance a car or truck.  We were in the store on 6/3.  We looked at the used car we set an appointment for. We agreed to buy the car.  No haggle priced.  My son and I stated we had done the research on the trade and were offered an extremely low offer on his car.  We declined. Upon coming back to us again I ask that we get out price we wanted or there was no deal.  Then once more they came back in again and offering a little higher offer.  So we decided to go.  They promptly gave us the requested price.  Then off to finacing.  This was much less than professional.  We obviously know how to use a calculator to figure automotive lending calculations.   We were told we would not qualify for the payment we requested as the credit was not sufficient to do so with absolutely perfect credit and co-signing for my 18 yr old son also perfect credit.   We went to another dealer and were told there is absolutely no problem getting what we need and all is good.  We bought another car from another dealer.  However after we stated we would use our own bank the dealer proceeds to send my sons application to 9 banks and did not send my wife’s application to knowone.  We specifically ask that they send both applications to one back to prevent multipal inquiries.  This did not happen.  We know now that the finance office did not want to obtain financing the deal as they would not make a profit in that office because we may have been looking at a calculator.  So we were told it could not be done and we promptly left.  We ask for a buyers order so we could use our own bank.  They still sent the application out to banks after they said it would not get done.  ??    This is not the only bad experience with this store as one will see in other reviews.   As if selling the car is not enough the store had to make additional money for you to buy from them.  They do not want an educated customer there.  Be careful with what you hear from them.  Very bad experience.  ,1.0
145,"May 27, 2019",Came Rockwall Dodge with my 2018 Dodge Ram 2500 in for oil change & tire rotation. Worked with Warren! He was excellent!!! Answered all of my questions. ,5.0
146,"May 21, 2019","My problem with my truck had me worried; however, these people took care of it with no problems or surprises.  They were professional and deliberate, and added one less worry to my life; for that I am grateful.  I will always use this service option when in need.",5.0
147,"May 21, 2019","Went to get an oil change and tires rotated, plus a couple other items needing checked.  Was told it would be about two hours.  Waited in lounge. After two hours started looking for my service writer to check on progress, sign on desk said out to lunch, but my keys and paperwork were on the desk. I asked another service writer and he got the ball rolling, other items checked out and paperwork to the cashier.  Overall good work, just don't like to be left hanging. ",4.4
148,"May 11, 2019",Excellent service and great communication. Rodney Gibbs worked tirelessly to get approval set up with Chrysler for paint repair. All repair issues were resolved satisfactorily.,5.0
149,"May 08, 2019",A repair is not a pleasant experience. But Kane went out of his way to make sure it got done in a timely matter and was very knowledgeable. . ,4.6
150,"May 08, 2019","Team worked with me to get two vehicles traded, worked the numbers and came to an agreement we both were satisfied with. This is how all dealerships should be !",5.0
151,"May 08, 2019",Rogelio was informed about the car I wanted. Chris was crucial in getting my financing for the only vehicle I wanted. They made sure I was comfortable and knowledgeable about my car.,5.0
152,"May 07, 2019","Let me say this statement represents upper management. 
You would think when you are going to get picked up or dropped off you would have new vehicle not something from 1994 with over 200000 miles and smells and is dirty. 
This vehicle represents the dealership ",5.0
153,"May 06, 2019",Rodney was helpful. Love the ability to make appointments online and the text notifications. The car was done sooner than promised. Good experience for service. Definitely recommend.,5.0
154,"May 03, 2019",Went to Dallas Dodge to look at new & used Chargers. They weren’t very helpful and did not want to present me with any options. Went to Rockwall Dodge even though it was farther. Brad was very helpful and worked with us to get us the car we wanted at the price we wanted.  ,5.0
155,"May 03, 2019",Customer service is excellent and Shane was easy to work with . He listened to what I wanted and needed in a vehicle and he definitely delivered. ,5.0
156,"April 28, 2019","The sales person and finance manager, were very knowledgeable, courteous, polite and experienced.  
The sale of the car was disappointing, I previously bought two cars from this dealership, that did not go very far because I did not get any discount on the price of the used car.  Also I did not want the fabric guard and after negotiating cost down to $100 above dealers cost I agreed to it. However I called the manufacturer and they told me that it did not cover vehicles four years or older, furthermore I cannot cancel the fabric guard. So the paint chips or fabric tears are not covered on the 2015 Challenger I bought, they said the only thing they would cover would be just to clean the fabric.  So I was mislead in the sales of the fabric guard. 
After the sale of the car, I found out the a/c compressor was bad, that was disappointing but the sales person assured me that it would be fixed and it was, the service department fixed it and had the car a day later. 
So, would I recommend this dealership to someone else, No, will I purchase another vehicle from this dealership, NO never again. 
I had a better experience with the first two cars I bought from this dealership, although I like the 2015 Challenger I purchased very much, I have to be honest and say I was disappointed with the sale of the car, a discounted price and no fabric option would have made the purchase a whole lot better. ",3.4
157,"April 25, 2019","I found my Jeep online and called to set up an appointment to stop by that evening. Kevin was waiting for me with keys in hand to go for a test drive. He demonstrated all the features and explained the purchasing process. I bought my Jeep that same evening and have enjoyed driving it ever since! Everyone at the dealership has been friendly and helpful, but Kevin really made a difference for me. He took the time to answer all my questions and made me feel valued as a customer. I highly recommend Rockwall Dodge!",5.0
158,"April 25, 2019","Explained what was do and did the Job. It took a little over an hour which I was told by the service writer, I will return to the dealership ",5.0
159,"April 25, 2019",I took my car in for repairs and the service was awesome! The service rep Allison was spot on with the communication of where my car was in the repair process and I got the car back 2 days before the expected date due. The best experience I have had at any dealership. ,5.0
160,"April 22, 2019","When I bought the truck I had 5 oil changes and tire rotations. I had completely forgotten I had the rotations.  I came in for an oil change. When Megan sent the truck back, (without having to be asked) she took it on herself to have the tires rotated. In this day and age initiative is rare. The service manager Joseph has trained them well. When all you ever hear is the negative in reviews when someone goes the extra mile they should be recognized.",5.0
161,"April 05, 2019",Did not have an appointment but Rodney was able to get me in and have a guy give me a ride home. I received a couple of phone calls with updates from Rodney. ,5.0
162,"April 03, 2019","Quick efficient service for scheduled oil and filter change/top off fluids.  The only complaint would be regarding the time ""on-hold"" to schedule the service.  I tried on-line and was not able to schedule the next morning time I wanted.  However, when I did get through on the phone, the service was great.  Thanks!",4.6
163,"March 25, 2019","they treat you like family, and they don't steer you wrong, they are always some one around to answer your question. cool place to visit.",5.0
164,"March 23, 2019","This is the second vehicle purchased from salesman, Chris Miles.  He is a great salesman and does not play games.  We love dealing with Chris and will continue to buy from him.  He goes above and beyond for his customers!  We appreciate the assistance and working with Ben as well!
Thanks, Chris and Ben for the best experience, again!",5.0
165,"March 23, 2019","Rodney was great! He got my Jeep inspected and new tires put on, first class service all the way! I would recommend this dealership to my friends and family!",5.0
