,Date,Reviews,Ratings
20,"March 18, 2016","Went to buy a car on Feb. 17, 2016.  Spoke with a Jose Soria.  That car I wanted was sold 15 mins. before I got there. A Nissan Versa Note  After arriving, I spoke with Jose and told him I did not want to buy rental.  He SOLD me not only a rental but a pre-cert. ford fiesta, vin. 3FADP4EJ2DM215779, 2013 model.  I thought being a female that something's had changed about our treatment in places like this.  I found out, it was no different.

I bought the car since I had a standard for 17 years and my body just couldn't handle the shifting anymore.  I informed Jose that I was using my car and $700.00 IN CASH as down payment on my car and that I forgot my title and would bring that on Saturday.

Long story short, went into finance to start paperwork and the cash was in a bank envelope and placed it on the guys desk.  Paid another $92.00 and some change to bring it down to $9,500.00 even.  On the way home I noticed there was a problem with the engine as if the car wanted to die.  Went back the following Wed. 2-24-16 for Jose to check it out.  I had received a call from Jose about the $700.00 in cash. Informed him of what I did and the guy picked up all the paperwork and put it in an envelope.

When we met with the main manger, the finance guy and Jose Soria, the finance guy said that I was going to bring the money in that Sat. with the title.  Why would I take $700.00 IN CASH HOME, to bring it back?????  REALLY?  So, buy the head manger, I was told to go home a look in nocks and cranes or between the wall and bed to see if that's were it fell.  I told him how could it have fallen at home, when I sat out in the parking lot counting the money.  In the mean time, the finance guy didn't talk---HE started --BY YELLING---""YOUR A LIAR!!!!""  Very professional dude.  Sad thing is, there were FIVE guys standing outside the door listening to all this and the sad thing----- an OLDER LADY who was a CUSTOMER standing there hearing all this.  What a SHAME.  

No many ever found, took me over a week and a half to get my car back, Jose Soria said they sold it, I told him it was against the law to sell a car without the title he said they could.  I still have my contract that states I paid the $700.00, the trade in and the $92.00 and change that both ME and the FIANCE GUY SIGNED.

To this date, I still don't have the $700.00 that was missed placed, they wanted me to give them another $700.00 or have it placed on my payment and during this WHOLE time, where is my CAR.  AS stated, I finally got that back, still waiting for the $700.00.  I will be seeking legal counsel in this matter to try and get the $700.00 in cash back that was misplaced.  Good NEWS:  I forgot to place a stamp on the envelope, so I THANK God, I got the title back.  So bye- bye to part of that money that was my income tax check.  

Now I own a NISSIAN 2016, a Nissan as I wanted at first, couldn't put the $700.00 cash down like I would have like to since they STILL haven't found it, BUT  NISSIANS RULE.  As for the 2013 PRE.-CERT ford fiesta good and ready to go???  Yeah, it stood up to the FORD name.  I was almost a FOUND ON ROAD DEAD when it almost staled on me going home from work in Austin.",1.0
21,"January 02, 2016","I drove 4 hours from Dallas to check out a Challenger on the BBDodge lot, and ended up buying it.  Tom Allen was my salesman, and he was great!  No pressure, just a great experience.  Jacob Campbell was the Finance Manager who helped me negotiate a lower interest rate on my loan, and was very patient with all my questions.  I left the dealership happy with the deal and the car.  Great job guys, thank you.

",5.0
22,"December 29, 2015",They helped us so much and it worked out so well! We loved them it's great I love my new car and I'm so happy thank you dodge!,5.0
23,"December 09, 2015","I drove 14 hours to San Antonio for a different truck that was grossly misrepresented. On my way home feeling completely disappointed we found a couple trucks on bb's website. When I arrived at the dealership ""Big Al"" took me to the vehicles and was incredible! The next morning I drove home in our 2013 F350. The service at their used lot is excellent and I will drive the 14 hours to work with them again!",5.0
24,"October 22, 2015","Well to start off, the initial sale was moderate to say the least. The sales rep knew little to nothing about the car itself (despite claiming his daughter owned one) and when I would point things out (small crack in the windshield, sunroof didn't close properly but it opened fine, didn't know how to shift out of manu-matic) he would just chuckle and shrug them off. I should have said no deal right there. Despite my gut I went ahead with the sale and during said sale I presented my financing to which they replied let me see if I can do better, another thing I should have said don't waste your time with. The next few weeks i got letters from 6 different credit agencies stating they had inquired my credit to see about financing. THANKS FOR THAT GUYS! 

After I got the car home I was happy.  On the 4th day after the sale I went out to my car to go to a lunch meeting I had. Lo and behold my car would not start. This was on sunday. I called them FIRST THING 8am monday morning and the secretary said ""oh everyone is in a meeting I'll have them call you back"" So I gave her my number and expected a call within the hour. 9:30 rolls around I give em another call. Everyone was no longer in a meeting and now they just decided to not call me back. So I talked to greg and told him the issue to which he replied let me talk to the sales manager. 11am I havent heard anything back so I called them and long story short he kept asking ""did I buy any extended warranty on it"" There is no way in hell anyone should need a warranty to cover something 4 days after the sales date. I don't care what you call it that is 100% bad business. Just asking is downright insulting. So after kindly telling greg that he was going to have the car towed and fixed and with much ""hand holding"" (calling and checking up and basically having to do his job for him) the car was picked up (tuesday) and off to the shop. At this point its out of my hands all i can do is wait for an update. which came the next day. ""Good news we got your car running again!"" to which my response was ""What was wrong with it."" Gregs response was ""Well we opened it up and nothing looked wrong so we just closed it back up and tried starting it a little later and it just started up. It seemed to be because the wheels were turned.""  I was baffeled but just wanted to get my car back and not have to deal with these guys again.

fast forward 8 weeks.
9/14/2013:
1400: left for work as usual, got to work and parked in one of the usual spots with wheels straight. 
1830 I went downstairs to go to dinner, at which point I put the key in the ignition and the car wont start. Same symptoms as last time. everything works but the windows and the car wont start. being that it was late in the day i did not think they would be open so I had to wait till monday, which meant not only did i have to find a ride home I also was stranded all day sunday. Monday morning I called and talked to greg and let him know this was happening again. he again brought up the warranty thing to which i replied ""I didn't think i was going to need a warranty within the first 90 days of having the car, that seems very unresonable"" I understand at a certain point what happens to the vehicle is my responsibility but being that this is the exact same issue and they didnt fix anything last time they should be more willing to help. needless to say I continued my hand holding that I had to do last time. called during my dinner break at around 1800 again with no response.
9/17/2013:Called all morning for Greg on his cell and through the office. Finally at around Noon I got a hold of him and he had the gall to tell me ""I didn't call you back because I didn't have any news"" At which point i filed a BBBcomplaint and left multiple voicemails on the Manager's voicemail, Brett Westbrook.

DO NOT BUY A USED CAR FROM THESE CROOKS.",2.2
25,"October 09, 2015","Just want to give a shout out and big thanks to those that helped me at bluebonnet dodge.
I knew what I was looking for ""a scat pack challenger with shaker package.  I saw one on line at your dealership 3 hours away but no one here even had one on order.  I connected with Tom Allen in sales and he took me step by step through the process staying in touch along the way.  He was very helpful and no pressure.  I would recommend Tom and Bluebonnet dodge to anyone looking to purchase a new vehicle.  It cant go without saying Michelle Voss in finance is the one that made it all happen and closed the deal she worked hard to get me a great interest rate and a payment I was happy with (finance is the hardest part in buying a new car for me many just don't seem to care) With Michelle she worked hard for ME and just gave me a good feeling about the whole experience.
I drove down on a Saturday all papers were ready to sign and was out in 30 minutes driving my awesome new car home!
Thanks guys
Ron 
",5.0
26,"September 28, 2015","Best experience I have ever had at Bluebonnet dodge. Will get all my business in the future .

I live in Mont Belvieu near Baytown. I called on Wednesday September 22 and spoke to Gregg Lutman about the Ram Outdoorsman. I could not believe the price of this loaded-out truck, $37,499. After finding out everything on this truck I asked him what's next. I was able to do everything online. They held the truck for 3 days with no money down! No other dealer has offered this. Once i arrived at the dealership they had the truck ready; washed, tagged out, tank full of gas.I test drove it and signed paperwork...out in 3 hrs. Best experience ever. Great job Bluebonnet!",5.0
27,"August 17, 2015","I went to look at a charger that I was interested in, but found a few small problems.  Taylor promised me that all of the problems I had found would be resolved.  Not only did he make good on his promise, but he went the extra distance and fixed some issues that I had not even found.  I highly recommend BlueBonnet, and I would not hesitate to buy from them again.",5.0
28,"May 11, 2015","I recently purchased a pre-owned  2012 Subaru Impreza from Jacob Plont back in Feb 2015. The process was easy I got the car I wanted and Jacob got the sale a win win. While there is always the chance I might have paid a little more than I really wanted to, I had looked several places for this model. Needless to say there were none within the traveling distance I wanted to go to, or to waste time from my schedule to shop. In the end I paid what I felt was comfortable for me. Price is not always the deciding factor convenience is worth paying for.
There were a few things that the car needed before I was ready to take it in particular an open recall plus I had also ordered window tint also thanks for the full tank of gas. One of the other issues was that the rear tire TPS Tire Pressure sensor was not the correct type for the Subaru brand.  Jacob had set up an open appointment with their sister dealership Subaru of San Antonio at the Dominion. The day they took it to Subaru for the recall they did not have the part to repair the sensor so I took delivery with a promise to get a repair at a future date.  While I would have liked the dealership to have taken care of the repair 3 months ago, they were true to their promise and finally today, I am here getting it fixed. The one thing I can come away with was they ability of Jacob to follow through, responding to my nagging texts and been up front. 
On a final note I would hope that in the future while staging a car for a test drive the sales team could back the car into the spaces at the dealership. It can be awkward backing out into traffic, especially in a vehicle your not quite used to.
Andrew Mc",4.3
29,"May 07, 2015","I bought my first 2015 Jeep Wrangler from Victor Dominguez, very helpful and patient I never felt so comfortable at a dealership. I would highly recommend Blue Bonnet to anyone, especially a first time buyer. Again, this was the best customer service, very impressed.",5.0
30,"December 18, 2014","I had a passing interest in looking for a newer vehicle.  I happened to be in the area of the Bluebonnet dealership and had seen on-line the type of car I was looking for.  Since I was there I stopped by not really expecting much since I wasn't really serious in buying that afternoon.

I met with Jeff Wegman and told him what I was looking for.  He checked his list and surprise surprise they had almost the exact car I was looking for in my price range.  Funny thing though, the car wasn't officially listed yet.  It was still in ""make-ready"".  Jeff wasted no time in tracking the keys and the car down so that I could take a look.

The car was in great shape.  Not only was I able to look at the car I was able to take a test drive the same car before ""make-ready"" had gotten to do their job.

Long story short, it was the car for me.  That's where Jeff went to bat for me yet again.  I was dead set on my price.  I had no wiggle room.  He was able to get his manager and finance to reduce the price by $500 so that I was within my budget and make the sale.

All in all... very professional, super friendly, and didn't hide or purposely try to make the process confusing.  The whole team was very straight forward and transparent with every process.  Why they needed this information and what the next step was going to be.  If I had any questions they were right there to talk me through it and explain it until I understood whatever it was.

Blue Bonnet has a well deserved great reputation in our area and they more than lived up to it me.

I highly recommend this dealership.  Whether its for a used car like me or a new car.  Go to Blue Bonnet and let the team take good care of you.  You won't regret it in the least.  You will have a hassle and stress free experience and get a great deal in the same process.",5.0
31,"October 23, 2014",Everytime I purchase a new Todd Mcbride goes above an beyond to give me a great sales person and deal. I recently made a purchase of 2013 Ford Edge and my awesome sales lady Lenore Pitts and Robert Mendez in finance. ,5.0
32,"October 08, 2014","This is the third vehicle that my husband Richard Hogue and I have bought from Lenore Pitts! Each and every time she has treated us like Family! Lenore is the only salesperson that we have ever met that actually listens to what we are looking for and the exact price range. She has never pushed us into anything that we didn't want. I have recommended Bluebonnet and Lenore to everybody that I know, who were looking for a vehicle. My husband even made the comment that he never rates anybody a ""perfect score"" because there is always room for improvement, but with Lenore it has been a perfect score every time! This Lady is worth her weight in Gold in our book!",5.0
33,"September 29, 2014","Seth, Lenore and Drew, thank you for all of your help with the purchase of my new truck.  Seth really dug in to find EXACTLY the vehicle my wife and I wanted.  After waiting (anxiously) he found it.  I saw it, loved it and then it was over to Drew in finance.  He worked up the financing and paperwork was done in record time so I could leave to attend a meeting in San Antonio.  My wife, son and mother came back with me to pick up our new truck and Lenore went over all of the last details.  As Seth promised, the truck made it through make ready and we left with our new prize.  It was great to see how the Bluebonnet team came together to get the deal done.  My wife and I are very happy and our son, ""Loves"" the new truck.  

Thanks, again.  ",4.7
34,"September 22, 2014","I drove all the way from Manor, Tx to look at their nice looking 300s that I had seen online. I arrived at the dealership at 7:20 pm. They don't close until 8:30 so time is not an issue to get horrible service.  I pulled in to the ""used car parking lot"" first where there is some horrible pot holes. apparently those potholes did something to my tire because as soon as i pulled out of the parking lot to drive to the ""new car parking lot"" my TPMS light came on. When i drove to where the new 300's where i got out of the car and heard a hissing noise coming from my tire. No salesperson in sight. i started to change my tire but needed a lug wrench. i walked to the office and a lot of salespeople just standing around and no one wanted to help me. They just pointed me into different directions. they told me to go across the street to a little garage where some guys were washing a truck that just sold. The guys in their were the only nice people there. They started looking for a lug wrench until a salesperson said that i had to wait until the truck was done. The whole time i was there nobody ever came to see if we needed anything. or if we still wanted to look at some cars. despite their nice cars i wouldn't recommend this dealership to anyone.
Take your business elsewhere!!",1.4
35,"September 04, 2014",We have never owned a Dodge before so when we decided to purchase a truck for our business we decided to have a look at Bluebonnet Dodge. I'm glad we did.  Lenore took great care of us and we love our Dodge Ram truck!!! I would definitely recommend this dealership. Thanks to Lenore for all her help.,5.0
36,"September 02, 2014","In buying a vehicle I did a lot of internet research - settling on the one that fit my criteria at Blue Bonnet. Found on ebay I asked a question and with in 30 minutes was contacted by Lenore Pitts. 
She was knowledgeable about the vehicle I was interested in and very patient with my questions. 
I bought the vehicle and was impressed with her professionalism and counsel. 
I am pleased. ",4.8
37,"August 12, 2014","Ms. Lenore made the buying process easy and stress free!  She's friendly and very patient!  Thank you so very much for being ""straight up, no chaser"" type of sales person.  IT WAS ALL ABOUT PAM!  I truly appreciate everything you did for me and my family.  You are a true professional!  I love my truck!  Pam",4.8
38,"August 06, 2014","Lenore Pitts was a fantastic point of contact for me at the dealership. When I called, she was informative, polite, friendly,and attentive to my needs. After I selected the truck I wanted, she was quick to process and move the vehicle, keeping me in the loop at all times. After a financing error from the dealership, she was quick to explain the mistake and overnighted a check for what I was owed to my address to ensure I was taken care of as quickly as possible. Great dealership and better service!",5.0
39,"July 30, 2014","Lenore was the bomb, she really made sure everything went smoothly
She is very friendly and a no b---s kind of sales person.

Thank you 
Stephen.",5.0
40,"July 01, 2014","My husband and I came into Bluebonnet Dodge late Saturday evening...just looking. The attention and care we received from our salesman, Ed Fabela, was above and beyond exceptional.  Ed treated us fairly and took the time to answer our questions.  We found the perfect truck for us.  Michelle Voss, in finance, was awesome to work with as well.  Even though we were the last customers of the day, we never felt rushed.  I will say that my husband and I left feeling we were the most important people to Ed and Michelle and that our satisfaction was the only thing that mattered.  We would definitely recommend (actually, already have) this dealership to others.",5.0
41,"June 15, 2014","I understand that, with the advent of the internet, used truck sales can be sold instantly (either on Ebay, or a buyer can ""beat me to it"", which was the case with the original truck I was going to buy).   It turned out that I was disappointed when my first truck selection was ""sold"" prior to me being able to get to New Braunfels, but this ended up being best for me.  You see.... Michael called me back to advise that the truck I wanted was sold already...but he (and Taylor) got together and let me know that they just gotten in another used truck that would exceed my needs for towing, and was right in my price-range.   That is the difference with Bluebonnet.  They take the time out to find out the needs of the customer, and then work hard to advise which vehicles meet (or in this case, exceed) your needs.   Other dealers might force the buyer into ""any old truck""....just to make a sale (or make more profit).   I felt like family in the entire process.  They were mindful of my time, and got me ""in and out"" in no time....even with Robert arranging the financing on a weekend!   What really set Bluebonnet apart was the fact that Michael called me back the next week, not only to ask if I was satisfied with the truck, but to let me know that he was able to quote me a great rate to get an additional keyfob/key to the truck cut and programmed.  There wouldn't be any ""follow up"" with most any other dealerships --- they would be on to the next sale.   I truly felt like I was part of the Bluebonnet family here and will refer many friends/relatives to Michael Resendez and Taylor Atkins.  Thanks to both of these professionals, and to Robert in the finance department.   I'll buy from them again!",5.0
42,"June 11, 2014","Mike Resendez is very professional and did what he said he would , I would recommend hlm to anyone ,I love my used truck and have sent mike some customers",5.0
43,"May 05, 2014","I contacted this dealership regarding a vehicle they showed to have in stock online.  Mark was the first person I spoke with, and knew a little about the vehicle I was asking about.  I spoke with him a couple of more times that week and left the conversation asking him to get me a final price on the vehicle before I would make the drive from DFW.  I received no further phone calls until, after many messages, I asked for another sales person.  I also left numerous messages for the pre owned management team with no response.  Once I finally did get a call back I was told that they had taken a deposit on the vehicle that day from an out of state buyer.  At this point I left a message for Brett Westbrook the general sales manager, and surprise surprise I received no response from him as well.  Clearly they are very interested in customer satisfaction.  I will never give this dealership another opportunity, and I advise you stay clear as well.",1.5
44,"April 25, 2014","Contacted the dealer about Chrysler 300S availability and was told that we would be contacted, which we weren't. After combing through their website, I found a vehicle that I liked and wanted more info on. I contacted them the next day and told them that there was a car that I was interested in and gave them the stock number. I was told that the price was $39,995. I then told them that on THEIR website it was listed at $33,995 at which point the sale rep stated that the listed price was again $39,995. And this was for a USED 2013 model 300S. At this point I terminated the conversation. Needless to say, I would NEVER recommend anyone purchasing from them especially after trying to make  an almost $10,000 profit over dealer invoice price and that on a used car.",1.3
45,"March 25, 2014","I was recommended to BlueBonnett by a family member after she had a great buying expirience with Mrs. Lenore Pitts. Contacted Lenore and set up a time for the following day to come check out a used Mercedes. Upon arrival I test drove the vehicle, filled out the application, and headed to the finance dept. Was unsure if I would be approved to finance the vehicle as I was a first time car buyer. Both Lenore and the gentleman from finance (Drew Cameron i believe) were very helpful when choosing financing options and they worked really hard to get me a great deal with a great payment and interest rate. I left bluebonnet with the satisfaction of knowing that they did not try to squeze every last penny out of me, and they were genuinly there to help me. They even went above and beyond and fixed 2 minor things issues with the car after the initial purchase I am recommending all of my family and friends to BlueBonnet. They are a great group of individuals. ",5.0
46,"February 13, 2014","brad murphy was super. brad needs a raise in his salary. this guy is not your everyday sales consultant. very knowledgeable on the vehicle i bought. i love  his attitude and his patients he had toward me and my wife. did not waste our time or his, took us to all the proper steps in financing our vehicle. you can tell brad enjoys his job because of all the little things he does extra in preparing the vehicle to sale to his customer. brad,thanks again. i also like to acknowledge jeff thomas for his expertise on the financial part of the sales. bluebonnet chrysler dodge gave me and my wife a very friendly atmosphere to visit and buy and i would highly recommend this dealership to all my family and friends to come and buy a vehicle. thanks, again gil",5.0
47,"January 23, 2014","I recently bought a used Jeep Wrangler from Bluebonnet Chrysler Dodge and worked with Lenore Pitts to complete the sale.  My experience was nothing but excellent all around.  Not only did I find a great vehicle at a great price, Lenore was simply amazing to work with, and went out of her way to ensure that the entire buying process went as smoothly as possible.  She was very prompt with any questions or concerns I had, and just a joy to work with.  Not only would I recommend purchasing a vehicle from Bluebonnet to a friend, I would be sure to send them directly to Lenore to ensure they received the same high quality customer service that I received.  Thank you Lenore and Bluebonnet for a great buying experience.  I'm loving my new Jeep!  A+++",5.0
