,Date,Reviews,Ratings
93,"May 06, 2018",I was treated with courtesy and respect. Other salespersons were friendly towards my wife and  me as well. Hector did a good job in explaining all the applicable incentives. The truck was delivered to me washed  and I was allowed a final inspection before taking possession. The tailgate needs to be repainted and Hector made acceptable arrangements with me to get this done.,4.8
94,"May 04, 2018","Quick, friendly professional services. Oil change and exhaust repair without much of a wait! Same day service was great! Highly recommend them. Ask for Alex.",5.0
95,"May 03, 2018",Thank you Raul for making it easy ! I finally got the truck of my dreams!  I was surprised to get a better interest rate than what I expected. The whole process was quick and simple. Highly recommended.,5.0
96,"May 03, 2018",Our experience with this dealership was awesome! Raul Falcon is the best car sales man we've ever delta with. I will always highly recommend this dealership. Thank you.,5.0
97,"May 03, 2018",Very satisfied with the professionalism and service I received at the dealership. My salesman went above and beyond to make sure I was happy with my purchase. Thank you so much raul falcon :) ,5.0
98,"May 03, 2018","Abel was awesome ! Helped us every step of the way ! Great communication! He delivered the car right to me ! There’s nothing negative to say ! I’ll definitely refer everyone to them ! 
",5.0
99,"May 01, 2018",Came in just to check out the cars wasn't really looking to buy on this day but the deal was to great to pass up the salesman is very professional and had every answer to my questions got everything done quick I will not hesitate to come back,5.0
100,"May 01, 2018","great service, friendly people, over all awesome experience. i'll definitely be coming back for my next vehicle & hopefully be working with the same people :)",5.0
101,"April 30, 2018",Belinda was extremely helpful and friendly. I was able to purchase a new 2018 Jeep Wrangler in the middle of a turnaround working 84+ hours a week due to her understanding and patience. ,5.0
102,"April 30, 2018","I went in after signing off my total car. Told them i needed a new car because of work, school, etc. and they helped me get in something quick. Nathan did everything possible he could to get me the best deal. Highly recommend them.",5.0
103,"April 30, 2018","Ok so I went to the dealership looking for a car. And I walked away with one. They did everything the could for me. I mean they tried and make me comfortable as much as possible. Offered me water and food  Cause it was a bit after lunch time. when I arrived. i mean my sales man Abel! Was awesome. He was really confident in getting me a car. And thank god he did. I was so happy after I signed paper work. It was a awesome expirence my first car. Also The whole crew there. We’re awesome too. They did eveything they could. Settled with what the money I had. Also like my place we’re I lived was Taft a bit of a drive for me. To get the vehicle. They drove the car to me. Washed detailed. I mean they were really awesome people to make a deal
With. I’m Glad I got the car I wanted and glad i got to meet the people I did. Everyone was so respectful and nice. They also helped me get insurance. They were really awesome people. I rate them a 5 and i am very very likely to refer anybody I know to them. Thanks again! To all you most importantly. Abel glad we could finally settle a deal and monthly payments I could work with. Awesome guys Awesome Awesome Awesome. Once again thanks Abel!! ",5.0
104,"April 29, 2018",They crunched numbers for multiple cars to get me what i wanted! I love my jeep and it's perfect for my unexpected growing family!,5.0
105,"April 29, 2018","Ladies & Gents....if your in the market, ask for Cassie. She is honest, knowledgeable, accommodating & makes the overall car buying experience enjoyable! Thanks again Cassie! We love our new Jeep! ",5.0
106,"April 29, 2018","Great staff, friendly service. No bs...awesome trust. Hope I get the opportunity to stay here with this dealership for years to come. I just love my new car...",5.0
107,"April 28, 2018","If you’re looking for a vehicle go see Mr.. Eddie Yzaguirre, he’ll take care of you. Bought my car from out of town so most of the proceeding were done through phone. It was all handled in a timely manner which was important to me.",4.4
108,"April 27, 2018",Felt that I was treated like I was important and I was given the best deal and I give a thumbs up for this great experence,5.0
109,"April 27, 2018","Set up appt.went in and was out in an hr..loved it!always get great ser ice from alex and the girls,terri and candie.",5.0
110,"April 27, 2018",Great service and fair pricing. Eddie got me in and out in record time. He was not pushy and made sure I got what I wanted. Omar in finance had my papers ready to sign and walked me through everything so i could understand it all before signing.,5.0
111,"April 26, 2018","Dealer tried to increase the cost of the vehicle after a price was agreed to.  They used adders, extras, and DOC fees.  I was also promised 2 keys and only received one.  They said they would send one when they receive it from the previous owner or make me one if they can't get it.   This would have ",3.7
112,"April 26, 2018","Oh my, I want to give a huge thx to Eddie for helping my husband with my amazing surprise!! Pulling into the driveway after leaving our daughter's t-ball game, and my husband telling he destroyed our roast somehow, and that I need to  come out back with him to see it. But little did I know my Ultimate Dream Vehicle was sitting out back while he was on video call with my parents!!!! I cant say enough how happy and excited I am. Once again thank you Eddie and everyone who helped with the sale. You guys were so helpful and so quick with the whole processes with my husband, and then to be able to pick it up and do a beautiful detail the next day, and deliver it back to our home. A million times thank you so much!",5.0
113,"April 25, 2018",Raul Falcon went out of his way to deliver my vehicle & paperwork.  He made our purchase very easy & made sure the truck was to our satisfaction! ,4.2
114,"April 25, 2018",Great sales team and customer service help they were always willing to help.    Would definitely refer anything me in the market for a vehicle or even having there vehicle service.   To try them.  ,5.0
115,"April 24, 2018","In and out, like a fat chick playing dodgeball. That's how fast my vehicle was ready. And also was given excellent advice on my next service. Like don't wait so long for my next oil change. Thank you Josh, best lube tech ever. ",5.0
116,"April 23, 2018","I want to thank Eddie, hes was very knowledgeable and very courteous with my wife and I. He kept his word when other dealer salesmen did not. The whole process was under 3 hours but it was a Saturday with little staff. Again I am very happy with the whole sales experience. ",5.0
117,"April 21, 2018",It's not often that dealerships don't give you the run-around but this time was different. I wasn't exactly in the buying mood but after working with Ed he hid no secrets about what to expect and the process to get out of the car I was in and into a new one. I was extremely pleased with the respect and honesty which was a huge reason behind my purchase. Overall I would go back for my next purchase in the future.,5.0
118,"April 13, 2018",Great people very friendly very helpful staff worked really hard to get the deal done and help me out in anyway possible I had a very great experience ,4.8
119,"April 11, 2018","Eddie was incredible to work with. As a first time car buyer, he was always available and quick to answer any questions I might of had. He didn’t hassle me and gave me space to make my decision. I have nothing negative to save about my experience and Neessen as a whole.  ",5.0
120,"April 11, 2018",My contact with the salesman Abel Contreras was very pleasant. He was knowledgeable about the vehicles we were interested in. He answered all of my questions and explained everything in detail about the Journey.  I wanted a different color that was not in his inventory.  He was able to get me the color I wanted. The sale and financing was done quickly and we were out of the dealership with our new vehicle in no time. I will be returning for future vehicles.,5.0
121,"April 09, 2018","I worked with Eddie Yzaguirre to custom order a Jeep Wrangler. My goal was to make it look like a Jeep I owned that is 18 years old now and was purchased from the same dealership under a previous owner. I wanted my new Jeep to be as simple as possible with no big tires, no tinted window, etc. The color I chose was Tank green, the closest color to my old Jeep.My new Jeep was even custom delivered to the local dealership. Since I plan on keeping my Jeep for as long as I live I decided to purchase the Chrysler Jeep lifetime warranty, which will limit repair costs, if any, once the original warranty expires. What I liked about working with Eddie was that there was no pressure to add features and thereby increase the cost. I wanted what I wanted, and I got what I wanted, thanks to working with Eddie. He even set up my hands free phone service. I also appreciated the service department. They have updated the Jeep's program a couple of times. They get to know the vehicle. I appreciated Eddie's help with my Jeep so much that when he had a temporary stint at the Chevy dealership (same owner as the Dodge dealership) I gave him a budget and said find me a truck. He picked the color and I bought it without even test driving it. Now he is back at Dodge Jeep. Again, no high pressure sales tactics from Eddie. He helped me get what I wanted!!",5.0
122,"April 09, 2018",The only reason I would refer this dealership is for the speed of getting me out Belinder my sales person was easy to work with but I feel I did not get the best possible rate I could have on my purchase so buyers always beware of the finance Dept as they tend to not always be clear on what your going to pay at the end of the day until they present you with the contract . I will have to refinance this vehicle some where else in 12 months do I don’t end up paying too much for the vehicle in the long run,3.2
