,Date,Reviews,Ratings
242,"December 04, 2015","I showed up just b4 closing and they ( especially Vinny and Dean)helped and se rved as if it was mid-day !!! Own A Piece Of Mind
",5.0
243,"December 04, 2015","Paul was referred to me by Todd Brown, Service and Parts Manager, whom I've dealt with for years.  Paul was so helpful, and found the used Ram that my friend wanted.  As I was involved as a helper in the buying process,  I, too, was so pleased with the service that Paul gave us, and all the information that was furnished to us while the purchase was being made, and after, explaining the equipment it had on it. 

The whole process was fantastic
",5.0
244,"December 03, 2015","This is the finest car buying experience I have had the pleasure of having in a very long time. Paul Caciola and Dean Hardy went out of their way to bring me a deal that worked with my finances. In addition, Paul went to great extremes to see that my truck was prepared in the way that I wanted. In addition, all members of this dealership treated me as a VIP. I highly recommend this dealership, especially Paul Caciola.",5.0
245,"November 25, 2015","I just bought a used Ram 3500 from Boerne Dodge. Vinny worked with us on every step of the process to make sure all of our questions were answered and that we had the right vehicle.  The truck was in great condition and they even went as far as fixing an item that malfunctioned while we were testing out the vehicle.  I've been to dealers that say their cars are in top shape only to show up and find that not even basic maintenance was up to date.  At Boerne Dodge, the vehicle was obviously well looked over and cleaned up before being placed on the lot (we've had dealer experiences where the vehicle was clearly marked for sale without being inspected or at least had minimal maintenance); believe me as we went over it with a fine tooth comb.  I'd say Vinny went above and beyond to make sure we had everything we needed by the time we finished the transaction.  As with any dealership, having your stuff (know what you need for a trade in, what you're buying, have your financing ready) together before make a buying decision will make for the best experience; and we had no complaints.   I got a fair price on my purchase as well as my trade in.  I'll be giving Vinny a call if we're back on the market for another vehicle.",5.0
246,"November 21, 2015","This was the third vehicle we have bought from Boerne Dodge and had the pleasure to have Vinny as our salesman.  I had been looking for a 2500 for quite some time and Vinny came thru for us with a great deal on Cummins diesel 2500. Vinny had the vehicle ready for us to test drive as son as we got there and that was all it took. If you need a salesman to work for you and get the  deal I highly recommend Vinny as your man.  Thanks again Vinny we really appreciate all the work you did for us.
Richard and Julie Boowles",5.0
247,"November 12, 2015",First off I want to say Joe Valadez is the best salesman I've had so far and Ive purchased several cars in my lifetime. I say mixed bag bc the dealership itself had a few issues in the past but Joe turned me into a customer and an extremely satisfied one at that. The issues are with this dealership but Joe's work ethic and customer service single handedly convinced me to give them another shot...Joe gets 5 stars in my book.,3.4
248,"November 07, 2015","Leroy, Jeff and Paul were professional and provided top quality service and sales.  No playing around, straight to business and getting a great deal done.  I rarely would recommend any dealer, however you will not go wrong with these guys.  I told a friend and he bought a truck the next day.  Great people, great deal, awesome experience. ",5.0
249,"October 29, 2015","Shopped a lot of dealers and this was by far the easiest and most respectful to deal with. Robert Bordieri  did a great job, I will be a return customer.",4.8
250,"October 17, 2015",Paul did an excellent job! He understood the vision we had in mind and helped us find Exactly what we wanted. All was fast and seamless. Thank you Paul for the great service. We will most definitely  be returning. ,5.0
251,"October 13, 2015","My salesman was Paul Caciola and I am extremely satisfied with the couple of hours I spent with him.  To be honest I don't think anyone really likes to deal with car/truck salesman (joking), but working with Paul was a real pleasant time.  I got the truck I wanted and he got me the price that fit my budget.  He is very honest and a ""let's get you into a truck"" kind of person.  Thanks Paul....love the truck.

Robert Miller",5.0
252,"October 09, 2015","So I was browsing online for an 15 RT Challenger and inquired about the car online. Within 10 minutes, Chuck from internet sales called and I was on my way. I have purchased a vehicle from Boerne Dodge before and that was 2 years ago! I must say the customer service remains impeccable! Robert Bordieri is the most professional, knowledgeable, and fun salesman you'll ever meet. I did the paperwork and out the door with keys to my beautiful red ride within 2 hours. Thank you Boerne Dodge for your wonderful service and fun atmosphere! ",5.0
253,"October 07, 2015","I went to three other dealerships. Then I stopped at Boerne Dodge and was met by Paul as soon as I arrived. And unlike the other suit and tie, slick willy, salesman I had dealt with Paul actually listened to what was important to me, which was getting the best financial deal on a vehicle. Paul explained which trucks had the best incentives and explained the difference between the other models. When I understood the basics I asked if we could set down with his manager and discuss a sales price, and that's is exactly what we did (Manager Jeff). It was especially nice to be included in the discussion instead of left setting in an empty office. I purchased my truck before I ever drove it! I love the deal they gave me and now I love the truck I have. Thank you for listening Paul / Jeff. I have not dealt with the service department, but my experience with the sales department was 5 stars. ",5.0
254,"October 03, 2015","My wife and I called the dealership in the morning and we're contacted promptly by Joe Valdez. He was very helpful and friendly to talk to. We visited the dealership later the same day and we're shown several trucks that fit the description we had given Joe. To our surprise we made a deal that day and bought a new Ram 2500 Laramie diesel. The sales staff were great to work with,  and the finance staff even remembered us from our last truck purchase 4 years ago.  ",4.8
255,"September 26, 2015","I want to give all my thanks to Joe Valadez this is one man that does his job very very well, he spend most of the morning looking for me a good deal on a new car and i do have to say he put his all into it. Joe even had came and picked me up from work to finalizes everything and send me on my way in a new 2015 Chrysler 200, this has been a blessing Joe Valdaz THANK YOU!!! ",5.0
256,"September 24, 2015","Went to Boerne Dodge on a whim, they had exactly what my wife and I were looking for.  Joe Valadez took the time and showed us the vehicle inside and out.  My wife took it for a nice long test drive and put it through its paces.  We quickly negotiated a final price and we were on our way in less than 1.5 hours.  My wife has a new B5 Blue Dodge Challenger Shaker, and we are extremely happy with the price and our dealings with Joe and Boerne Dodge.  Now if they could only get the car I want!",5.0
257,"September 23, 2015",Went in there with intentions of looking but you know how that goes! Ended up trading my old jeep in for a new one. Vinny has been awesome even when I text him a month later he's still helping me with some add-ons. Thanks again :),5.0
258,"September 23, 2015","I was helped by Robert Bordieri. He found the truck I wanted out of state, got it here and I am quite happy with it and the service. Would I purchase my next truck there, yes.
Thank you Robert for your help. One item I would note is the extended warranties that are offered, stop pushing them.

David L.",5.0
259,"September 21, 2015",Mr Caciola was amazing salesman.  He did an awesome job in getting us into a bigger vehicle  and made sure we were comfortable while we waiting. The staff their was all so generous as well.,5.0
260,"September 21, 2015","Paul Caciola was a true professional to work with and he treated my wife and and I with courtesy and respect.  Mr. Caciola  didn't waste our Saturday with superfluous fluff, he simply told us about the Jeep we were looking at and answered any questions we had. ",5.0
261,"September 09, 2015",Very nice sales person. Cut thru the BS. Dean Hardy the finance person also did a good job and found the product that I wished to have.,5.0
262,"September 01, 2015","Vinny and Mark were absolutely awesome!!! I came in just to look at the new Ram 1500 and  drove away with one! I was completely blown away by not only the options, but for them to make sure that I had 100,000 mile bumper to bumper warranty too? I am completely sold on the ""no BS"" approach as they were completely up front and honest with no sales pitch. Definitely recommending this dealership!",5.0
263,"August 28, 2015","We bought a 2015 ram fully loaded!!! The absolutely best salesman was JOE VALADEZ he took his time and showed us the full details of our new truck , his knowledge blew us away , his courtesy was great , we looked at a few dealers before going to  Boerne and just HIGH FIVES ALL THE WAY AROUND WE WOULD SO HIGHLY RECOMMEND TALKING WITH JOE GO SEE HIM AND ALLOW HIM TO GIVE YOU THE BEST SERVICE ONE CAN GIVE !!! GREAT JOB AND NOW A NEW FRIEND! !!  The finance man Mr Dean was so pleasant and made this fun and interesting! !!! ",5.0
264,"August 26, 2015",This dealership is awesome. Every time I've went there for any reason I've received excellent service. My salesman Rob really cares about his customers and does everything he can to make sure they are satisfied.  They have a customer for life.  Thanks so much guys!!!!!,5.0
265,"August 17, 2015","We drove from Converse to see a specific truck but when we arrived it was just sold. Vincent helped us find a similar truck but better then the previous one for approximately the same price. Vinny was so kind and helpful with my transition from my loving SUV ""family car"" into a truck. He understood how attached I was to it. Vinny helped with all the paperwork and even sat with us while we were being approved sensing our nervousness. I will always be grateful to him for everything. The best car salesman we ever had to do business with. Ask for Vincent and he will help u out. ",5.0
266,"August 04, 2015",Awesome people very friendly and the best thing is they got it done and now me and my family have something to cruising in.. thx Robert bordieri! ,5.0
267,"July 08, 2015","We have bought our last 5 vehicles from Boerne Dodge Chrysler Jeep.  We refuse to go anywhere else! Great people, great service and they treat you like family! ",5.0
268,"July 03, 2015",This dealership was very professional and helpful. Robert Bordieri was my salesman and all I can say is that I couldn't ask for a better person. He was very knowledgeable and answered all my questions. He didn't pressure me into something and was patient with me. I felt like I was talking to a family member rather than a salesman. It was an extremely satisfying experience and would differently refer others to this dealership. ,5.0
269,"May 30, 2015","While I'd been a fairly frequent visitor to the Service department and had always been treated so well and taken care of no matter what the situation, this was my first visit to the sales department.  When CJ in Service told Joe Valadez about our problem trying to find a used SUV within our budget when the old Dodge pickup needed one too many repairs, he began looking for possibilities days before we ever met in person.  And when he had to return to the office, his associate Trey Roberts took over.  He wasn't able to find anything either--mainly because we were looking for a unicorn where price and mileage were concerned.  But when we began talking a newer model with partial financing, they got together and found two possibilities, one that Joe had been wise enough to spot for us already--just in case.  A 2015 Jeep Cherokee with great mileage and payments within our budget for the half we didn't pay down was just too wonderful a deal to pass up.  And when Mark Montz in the finance department helped us get a 5 year extended warranty that was so much more cost effective than only a 2 month warranty on a used SUV at another dealership, it made for the perfect deal.  Joe and Trey literally went the extra mile and followed us home with the new 
Jeep to save us a 50 mile return trip the next day to retrieve it.  They all did their very best to work with us for the best deal possible for us.   I can't recommend Boerne Dodge Chrysler Jeep highly enough, and the team of Joe Valadez and Trey Roberts is simply the best.",5.0
270,"May 29, 2015","Here you will receive top of the line service and  you will not leave this place disappointed!
Everyone that works here is so friendly and fun to work with! I absolutely LOVE my new car and will definitely recommend this dealership to anyone looking to buy a new car!",5.0
271,"May 27, 2015",This dealership went above and beyond. I couldn't be happier with the service we received. George and Dean jumped through hoops to get us financed. They were very good to us. ,5.0
272,"May 27, 2015",From beginning to to end we had a positive experience. Joe wasn't pushy or hovering. We got a fair price on a great vehicle. I would definitely recommend to friends and family.,5.0
273,"May 22, 2015","i would like to say this sales rep has put a new twist to car sale, in my experience I have never engaged with a car sales rep that is straight forward. Refreshing to see a car salesmen that can be honest and straightforward. Keep up the good work",5.0
274,"May 16, 2015","My wife and I drove out there to look at the Dodge Challengers one night.  We arrived with less than a hour left till their closing time.  It was the night of a big fight and NBA playoffs. But salesperson George Watson was very patient with us and never rushed us.  They honored all the internet sale prices, and gave us such a good financing deal we purchased a vehicle that night.  I would highly recommend  Boerne DCJ if you are looking for a vehicle.  ",5.0
275,"April 27, 2015","i just want to say that Robert Bordieri was very helpful with me and my fiancé, I had purchased a dodge avenger last year at north star dodge and we had decide that we wanted a Chrysler 200 so we went back to northstar dodge an the sell guy couldn't help us they wanted a lot of money down so we left, then my son went to dodge boerne and talked to Robert bordieri and he helped him get a truck and he asked me ""mom"" why don't you go to dodge in boerne an ask for Robert bordieri so I texted and I called and asked him what we want it and you know what he gave us the car that we have been wanting. And for that I am very grateful for him helping us. I know drive a Chrysler 200 and I love that car so we will be going back in 2 more years for that challenger lol. So I want Robert bordieri thank you so much for helping us a lot and he help us a lot ",5.0
276,"April 19, 2015",For the past 9 years I had been driving the same used vehicle i recieved when i turned 16. I was more then ready to finally purchase my own new vehicle. Three of my sisters had recently purchased jeedps from Boerne Dodge Jeep Chrysler so i decided to make them my first stop. There was no need to look further. Paul kindly and patiently walked me through the process i was unfamiliar with and set me up with a fantastic 2015 Chrysler 200 at the monthly price range i was hoping for. ,5.0
277,"April 17, 2015",Robert makes the experience very easy to go through. He explains and answers any questions I had. He doesn't guess or blow smoke up my tail pipes,5.0
278,"April 10, 2015","Robert was very helpful, me and my wife went over there about 6 months ago trying to get out of my Avenger and get into something better, unfortunately the banks still said it was too early to trade in but, Robert promised to keep in touch and do his best to get us out of it. 6 months later we returned and he kept his promise we got a Brand new Ram 1500 and Robert worked hard to get us the best interest rate he could and a fair monthly payment!!! Overall I'm completely satisfied with this dealership and Robert was very courteous and friendly and did his best to get us the vehicle we wanted!!! Thanks guys! I'll be back in 2-3 years for a 2500 :D ",5.0
279,"April 07, 2015","We have never done business with Boerne Dodge Chrysler Jeep before, but my co-worker Teresa Green had bought a vehicle from there and highly recommended them.  My husband and I just stopped in to ""look"", and was pleasantly surprised by the friendly service of Paul Caciola and the rest of the Boerne Dodge staff.   Within 2 hours, we were driving our new 2015 Jeep Cherokee Trailhawk off the lot.  I absolutely love it and got a great price for our trade in .  Service was exceptional !   I would definitely refer anyone to Boerne Dodge Chrysler Jeep in the future!  Paul was great!!

Thanks so much!

Jenny Vanckhoven 

",5.0
280,"April 04, 2015","My son bought a car from Joe Valadez a couple of weeks ago and when I saw the vehicle, I fell in love with it.  So, I went to Boerne Dodge Chrysler Jeep and asked for Joe (didn't know his last name at the time).  He showed me first the exact vehicle that my son wanted - but they didn't have in stock when he was looking.  I loved the vehicle but it was a little more than what I wanted.  So, he showed me a few others and then showed me the vehicle that I ended up buying.  From what I told him, he knew exactly what I wanted and needed.
This was a very pleasant experience and I love love love my new vehicle!!!",5.0
281,"April 02, 2015","Robert Bordieri was great sales person in fact he was more like a friend that I had not seen in a long time and saw my need of me getting a truck he was very patient with the specific requirements that I had giving him and was able to go above and beyond , this is the Second time we have purchased a truck from him and I'm sure it will not be the last time in fact I'm currently trying to get my mom and my best friend to come buy one from him because he left such positive impression on  me thank you very much . 
Marco G",5.0
282,"March 27, 2015",Thank you Joe Valdez for you help it was a great experiance and you were very helpfu to us it was a pleasure buyin a car there at boerne:),5.0
283,"March 25, 2015",I recently purchased a Challenger at Boerne DCJ. I have purchased multiple vehicles and have never experienced great customer service like I did in Boerne. Robert Bordieri is a GREAT salesperson. I would definitely recommend them to family and friends. Thanks again Robert!!,5.0
284,"March 25, 2015",I am thoroughly impressed with Boerne Dodge- the price was great and the service was outstanding. We have bought many vehicles through them and would recommend them to everyone.,5.0
285,"March 19, 2015",We bought a vehicle from Jonathan Hardy at Boerne Dodge Chrysler Jeep.  His customer service was great and he had a genuine personality that made us comfortable to work with on this transaction.  We left with a vehicle we love.  We're still waiting for our spare key from this dealership since we had only left with one key.  But that is the only thing we are waiting on and I hope it's coming I dont think it overshadows Mr. Hardys service though he really was great.  Please send me my spare key BDCJ.,5.0
286,"March 09, 2015",Bought a brand new caravan. Anthony was very knowledgeable in answering all my questions about the vehicle. They didn't have the exact one I wanted so they went out of their way to get me what I really wanted. Thanks,5.0
287,"March 05, 2015"," This is my 3rd purshase at Dodge Boerne
great experience,great service, I defently recomend it.
i love my new Durango 
Thank you Chris Garza",5.0
288,"March 02, 2015","Loved this place! My girlfriend and I went in to see about getting me a new truck. We looked at our options and it didn't seem like we'd be driving away with a new vehicle.  but Joe didn't give up. My girlfriend has been wanting a Jeep for some time and I needed to get out of my old car. We found a very nice and well equipped Cherokee that was right in our price range. We had a nice low down payment and very reasonable monthly payments that they negotiated for us. All we had to do was test drive, go over some options, make the down payment and sign some paperwork. We did spend the better part of the day there but it was worth it rolling out of there with a brand new Jeep!",5.0
289,"March 02, 2015",Paul Caciola was great! He was very friendly from the first minute I met with him. He didn't make things difficult at all. Very understanding of my needs and wants in a new car. This was my first car buying experience and I was very pleased with Paul. Would highly recommend working with him when buying a car. ,5.0
290,"February 18, 2015",Boerne CDJ -Anthony Thelemann is an excellent salesman with a great attitude. He was not pushy and went the extra mile to get us what we wanted. We will definitely come back and recommend him to our family and friends. ,5.0
291,"February 12, 2015",Boerne Dodge Chrysler and jeep is the dealership to go to!! Chriz garza helped me and was very informative overall i had a great experience i love my dodge challenger!!,5.0
292,"February 11, 2015",Boerne DCJ made my car buying experience painless. Everyone from the greeter to the sales guy and then the finance guy were polite and very friendly. I would definitely recommend this dealership to friends and family. ,5.0
293,"February 09, 2015","Purchased a Jeep Patriot.  Purchase was handled in a very professional manner. Did not leave with buyer's remorse. Felt like I received a fair trade-in value for my auto. They had it washed and waxed when I returned for it. The financial dept. was easy to deal with also. Have had no dealings with the service dept., so can't review that.",5.0
294,"February 04, 2015","For a first time buyer of a vehicle, Chris Garza did a great job helping me with the whole process. He answered every question I had about the vehicle I was interested in and had great communication skills. I didn't feel pressured throughout the process and I highly recommend him as a salesman. ",5.0
295,"February 02, 2015","Anthony at Boerne dodge was an excellent salesman, not pushy, and made our purchasing experience extremely easy.  We would definately recommend him to our friends.  
 ",5.0
296,"January 28, 2015","Service Department went out of their way to help me get my 2014 Ram 3500 service work done! Excellent attitude and overall great people! I am beyond satisfied with the service that I got from them. Would definitely come buy a truck or car from them again! Very friendly and down to earth people. Thank you!
A special Thank you to Andy Evans at the service desk and Thank you to the mechanics Abraham Diaz and Dennis Cole for all the attention to detail and Texas Friendly hospitality they provide. You guys a a great representation of Boerne Dodge and Customer Service.    ",5.0
297,"January 10, 2015","I definitely recommend this dealer, as well as Robert Bordieri.  My wife and I had a great experience buying a new 2015 Dodge, and we are even considering buying another one for her.  One of the best vehicle shopping experiences I've had so far.   ",5.0
298,"January 05, 2015","Robert Bordieri went out of his way to help me get my new Dodge Dart! Excellent attitude and overall great person! I am beyond satisfied with the service that I got from Robert. Would definitely come buy a car from him again! Very friendly and down to earth guy, and knows his cars. Thank you!",5.0
299,"December 30, 2014",ROBERT TOOK TIME WITH ME TO FIND THE RIGHT TRUCK. MY TRIP HOME TO NEW MEXICO WAS GREAT. NOW I HAVE THE POWER I NEED TO DO WHATEVER I WANT OR NEED. I WANT TO THANK ROBERT AGAIN FOR GOING THAT EXTRA MILE WITH ME.,5.0
300,"December 26, 2014","Worst experience ever! No appreciation for military and uses deceptive advertisement to get you in the door. Dealer did not want to advertise $13,500 discount being advertised on-line. The vehicle I was looking at was a 2500 priced at $65,600. The manager stated the 2500 was not a heavy duty truck and the add was for 3500s only, despite 2 other salesmen defining heady duty as the 2500 and 3500 class. When I brought that act to the floor manager he said he meant it was for the more expensive heavy duty trucks and stated there were some on the lot for $68,000 to $70,000 and he admitted it was all about advertising and getting traffic into the store. Then they would not honor a $500 military discount. Lastly, my trade it low booked on the NADA for between $15,000 and $17,500. They claimed my vehicle was in good condition but would not give me more than $12,000, stating they had a separate ""auction NADA listing"" and that it was impossible for people to get vehicles with more than 100, 000 miles on them financed. If you want more specifics, please contact me at popswilson39@yahoo.com.",1.4
301,"December 15, 2014","Wes made us feel like we were the most important customers ever.  The experience was the best in Texas.  Like old home week.  

My thanks to Wes and all at the best dealership in Texas.  Great place to buy a Grand Cherokee

Cary and Carol",4.8
302,"December 12, 2014",Paul has sold me and my family several SUV's and Trucks.  He is a joy to work with and would recommend him and Boerne Dodge as a great place to buy vehicles.  ,5.0
