,Date,Reviews,Ratings
0,"April 20, 2020","I would like to share my experience with Neesen Dodge, Chrysler in Kingsville, Texas. I was recently experiencing issues with the HVAC system in my 2015 so I called to schedule an appointment to have it serviced. Keep in mind the Durango only has 6,200 miles since the purchase date in October 2019. This repair was done partially under 36,000 mile extended warranty I purchased through AUL, which is $100 per extended warranty claim. I get a phonecall (04/15/2020) with a diagnosis. Technician stated that the condenser and the suction hose Schrader was leaking and it was NON-REPAIRABLE and had to be replaced and THIS WOULD NOT be covered under extended warranty, which would mean it have to be expensed out of pocket ($126.00). I did not believe this repair one bit or diagnosis, because I know these Schrader Valves are replaceable, just as they would be an any HVAC application....So I asked to keep the parts that A/C Line for self-inspection. So the pictures show that the Schrader Valve was not only removable, BUT REPLACEABLE. This valve core could have easily been replaced for at the least $10. INSTEAD they would rather not look out for the customer and decided to expense me for the cost of the entire line. I do not recommend this dealership for any repairs, even if you have extended warranty. TAKE IT SOMEWHERE ELSE. I will be reporting back to AUL about this experience as well. 

-Jeremy Witt",1.0
1,"January 04, 2020","Visited dealership on Saturday. Salesman ""Joey"".
 Test drove 2018 Grand Caravan. Was ready to purchase, but 2 useless items added to sales quote..
 Wanted to charge me $750 for ""Auto Butler"" which is simply paint protectant and $150 for glass VIN etching which was already on the van. They refused to remove these items from final price, so I removed myself from these snakes and purchased another Caravan elsewhere.",2.2
2,"December 13, 2019","From walking in to driving out with  new vehicle, the buying experience was great.  Bruno Mejia was very knowledgeable, courteous and did not pressure.  I highly recommend him for your buying needs.
The whole staff made buying a breeze.",5.0
3,"July 19, 2019","Teresa is a natural at selling, never tried to pressure sell a vehicle. She was very knowledgeable about the selling process given that she is fairly new in this industry. Thanks it was a pleasure working with you.
",5.0
4,"August 05, 2018","I didn’t have to wait long to make an appt . 
And very nice and helpful customer service . Reasonable price 
Very happy that a shuttle was offered , that was very convenient for my busy schedule . ",5.0
5,"August 03, 2018","Best pople to deal with .had gone to outher delars and all of them telling me no .came here and was helped out where I was able to leave with a brand new Jeep
1",5.0
6,"August 03, 2018","My and my mother went in to look at some vehicles and was helped out by Hector Deleon. He was referred to by my niece who just bought a vehicle from him. He was very helpful in showing us several vehicles.He also answered questions about the different vehicles which was very helpful in deciding.  It came down to choosing two vehicles between a Chevy Traverse and a Dodge Caravan. We ended up choosing the Dodge Caravan. My nieces that were with us loved the Caravan, they loved the room it has. They spend a lot of time with us so it was good to have their opinion also. We've had the Caravan a couple of days now and it runs great. Thank You to Hector Deleon for the great service and also the staff at Neessen Chrysler Dodge.",5.0
7,"August 02, 2018","Friendly helpful employees, timley on time service , they answered most of my questions to my satisfaction. .

I have recommended this dealership to many of my friends.",5.0
8,"July 31, 2018","Fast Service and welcoming customer service  
Went in on my day off hoping I wouldn’t spend the whole day there and I didn’t. 
Preety fast service.",5.0
9,"July 30, 2018","I like going to Neessen becuase it is a LOCAL Dealer but they are a minimum service department.
I  take my truck in for an oil change and that's exactly what they do. I would really appreciate a professional looking at my truck checking typical wear and tear parts.
Grease some joints, top off fluids or at least look to see if it needs fluids, grease, filter, fundamental maintenance.
Other than that I appreciate them.
Alex is always polite, friendly and helpful.",2.6
10,"July 30, 2018","I am very pleased with  my salesperson and his personable attitude towards me. He was very diligent in finding the vehicle that I wa tre, including the color. Hector Cruz rocks!",5.0
11,"July 28, 2018",I would definitely recommend my family and friends to this dealership. And the experience with the salesman was excellent. They were very informative and very friendly.,5.0
12,"July 28, 2018",Our salesman Abel Contreras was awesome. The deal was fast and process of paperwork was super easy. We had a great experience with salesman and dealership. ,5.0
13,"July 28, 2018",The service dept. was very courteous and helpful. My service took less than 1hr. and during that time I was asked twice if I was ok and needed or wanted water etc.,5.0
14,"July 28, 2018","Hector was not only a great salesman, but also a great person in general. He genuinely cared for my needs and made sure I felt comfortable with my decision. I'm very thankful for all he did for me and my son. ",5.0
15,"July 27, 2018",I was satisfied with the service I got. The dealer was nice and professional. He explained everything to me about the vehicle and the price. I recommend this place to anyone. ,5.0
16,"July 27, 2018","We live 45 minutes away. This dealership was definitely worth the trip. Hector De Leon was very informative and helpful. He even drove our new car to us the next day, saving us another long drive. We are very happy with our decision to buy from Neeson.",5.0
17,"July 24, 2018","I called for an appointment to have my ""recall"" checked. Alex made it a time and date that was convenient to me. He welcomed me on the day and even offered me a ride if I needed it. I was called when the Jeep was ready and they even drove it up for me to get in. 

Wow! Great Service!",5.0
18,"July 22, 2018","Excellent staffing n management...I have purchased several Dodges ram, charger, challenger, dart n now 2018 Dodge Journey..Joe Hernandez is an excellent manager n very knowledgeable of his vehicles..I have always purchased from him n truly trust his opinion...",5.0
19,"July 21, 2018",Very friendly and patient employees. A great experience with Kassandra Sauseda. Thank you for the Dodge Ram  I will continue to conduct budgets with this Dealership ,5.0
20,"July 21, 2018","The service was great they  jump straight on to ur case and help u find what ur look in for or what fits u best, thanks for the service I was giving and my salesmen was great my salesmen was a 10 ",5.0
21,"July 20, 2018",We've never owned a new vehicle and never thought it could happen to us but Cassandra Sauceda did everything to make it happen for us! Thank you and we will be sending all our family and friends to go see Cassandra at Neessen Dodge ,5.0
22,"July 18, 2018",I called my service advisor Alex Villarreal. He went above and beyond in servicing my Jeep. Same day service. Awesome. He called me back in the afternoon to inform me my vehicle had been serviced. With a part being replaced.,5.0
23,"July 18, 2018",I'm doing this because Hector are salesperson was very helpful other employees that were there I don't know their names we're really nice offer of bottled waters so I really think that this was a really great experience for me and we are happy with our new Dodge Charger,5.0
24,"July 18, 2018",Made an appointment for 1330 but needed to get in asap and out the door to meet my other commitments. Terri and the team went above and beyond to help me out. So thank you for that. ,5.0
25,"July 17, 2018",Hector asked what I was looking for and recommended what he felt would meet my needs/wants. The paperwork was fast and hassle free. This experience was the fastest I have had buying a vehicle.,5.0
26,"July 16, 2018","Neesseen Kingsville is a great dealership, the salespersons are super nice and are real helpful. I recommend this dealership to anyone who is trying to find a vehicle",5.0
27,"July 16, 2018","Alex is usually my go to person for service and he keeps up with the progress of the work, always informed!! Neesen Chrysler Dodge has earned their place in the top car manufacturers line here in Kingsville and the local operational control is a huge plus.",5.0
28,"July 14, 2018","Even though they can get busy, they make time for your service needs.  The place to go for all auto needs and know that it will be done right the first time.",5.0
29,"July 13, 2018","I have been trading here for years.  Folks are honest, sincere and caring.  Most of all, they will ensure you get your money' worth regardless of service or sales.  I had a flat tire and rather than go locally, visit my dealer as it has to do with trust and the assurance I will be taken care of.  Great folks to do business there.",5.0
30,"July 13, 2018","I was treated very good, no complaints I was only there to get truck inspection.  I  was also notified about recall on my truck concerning the passenger air bag,  need to be replaced ",5.0
31,"July 12, 2018","Buying process was fast, no pressure and staff was friendly. Salesman walked me through their service department and meet service department team. I would recommend this dealership to friends and family. ",5.0
32,"July 11, 2018","Helpful, friendly, attentive, knowledgeable staff. Worked with us in a great way. I would recommend family n friends to this facility. The car is also in good shape, drives very well and we love it... Thanks for everything..",4.0
33,"July 10, 2018",Cassandra was amazing as she was compassionate and caring to my personal situation! She made it happen in less than 24 hours! She understood my busy schedule and worked around it! ,5.0
34,"July 07, 2018","Abel was so helpful and made it so easy. It’s tge only place I will buy from again. 
He was so knowledgeable and got me a really great rate in my Ram 2500 truck. ",5.0
35,"July 07, 2018","The salesperson, HD, was extremely helpful and kept me informed during each step of the process. Everyone involved was professional, friendly, and helpful. Each person involved along the way made me feel like I was important and treated me so.",5.0
36,"July 05, 2018",Service department was very thorough and finished the job in a timely manner. Will definitely go to them again. My wife drives a Dodge vehicle and when service is needed will take her car there as well.,5.0
37,"July 04, 2018",Awesome experience with Hector Deleon. Amazing deal and now we have a great new truck! Would recommend this dealer shop to anyone lookin to buy a new vehicle.,5.0
38,"July 02, 2018","I went in thinking I wouldn’t get anything but comes to find out god works wonders and Cassandra was able to help me out and get me & my kids in a brand new 2019 Jeep Cherokee! Her help and customer service was excellent! I would recommend anyone wanting to get a new car or even upgrade, to visit her or the dealership in general! ",5.0
39,"July 01, 2018","My experience here was fantastic, Cassandra was very professional and listened to what I wanted. Didn’t even try to push off to something else, she made it very possible. She explained every detail about the vehicle. Answered every question I had, took us on a tour introduced to the service dept for future services. Couldn’t be happier with our new Jeep Compass! ",5.0
40,"June 29, 2018",On getting the Deal done right on my 2018.we’re no others dealership Want to hlep but thay hlep me get in to a 2018 Dodge Ram 1500 thank y’all ,4.8
41,"June 29, 2018",Worked with Gabe on finding the right vehicle for us. He was very courteous and attentive. Really enjoyed workin with him and would recommend him to others.,4.8
42,"June 28, 2018","Very friendly I would definitely recommend this dealership to friends and family , didn’t have to go into the dealership did everything over the phone and brought vehicle to me I’m very satisfied with the service ",4.6
43,"June 28, 2018",My sales person did an amazing job in getting me into what I wanted . I gave her a price piont I wanted to stay with and she made that work for me. She didnt waste any time getting  me into the perfect vehicle. I will recommend her to anyone and I will be returning to her  when I am ready to purchase another vehicle. ,5.0
44,"June 28, 2018",No pressure and employees very friendly..my sales person Eddie was great and put no pressure on me while looking at the vehicle I was interested in..going through the process of purchasing the car was smooth...thank you Neesen Chrysler Dodge Jeep Ram in Kingsville ,5.0
45,"June 28, 2018",They were very helpful. Explained everything to me and very courteous. No pressure to buy they gave me several options to choose from and even got me pre approved before I made the trip which was well worth it .Thanks guy's you were awesome. No regrets and would definitely do it again. ,5.0
46,"June 28, 2018","Our experience with the salesman and the finance manager was overall very good. They were genuine people, very patient and really went above and beyond to give us a deal that we were satisfied with.
",5.0
47,"June 27, 2018",They were able to do the oil change on time and no questions asked. Alex has always tended to my concerns. And ensures that I leave satisfied.,4.8
48,"June 27, 2018","Who would have ever thought that purchasing a new vehicle could be a no-stress experience! The salespeople were not standing at the door waiting to pounce when we pulled up, but they were  available when we were ready to be helped. Vehicle pricing was exactly what was advertised on the Internet.  There was NO ""We got you here, but that vehicle is really $2,000 more with the add-ons."" They were fair on our trade-in. The small-town, ""You are more than a quota"" treatment was a nice change from the city dealerships we have dealt with in the past. We will be back when it's time to purchase another vehicle!",5.0
49,"June 23, 2018",Personal hometown customer service. They always know me by name when I walk in and treat me like family. And the courtesy transportation to and from work is appreciated also. ,5.0
50,"June 22, 2018",Never thought this day would happen. Thank you so much for yalls hard work to make this  possible for my FAMILY. Blessed with a great hubby always does what makes me happy. ,5.0
51,"June 22, 2018",Abel helped me find the perfect vehicle for my family. He also had awesome customer service.  I did not feel rush in making my purchase.,5.0
52,"June 20, 2018","Staff was friendly and helpful right from the start. Staff was very knowledgeable and had no qualms with answering even the smallest questions. Mr. Bruno Mejia, Jr. made sure that I was happy with my purchase and provided excellent service. I would highly recommend this dealership to others in particular Mr. Mejia, Jr. to anyone looking to have a great experience find the perfect car for them. ",4.8
53,"June 16, 2018","Great service, very attentive salesman, explained in detail, over all a great dealership got exactly what my husband was looking for, very happy with the purchase ",5.0
54,"June 15, 2018","This is my first time to got dodge truck and a berry happy end I recommend this dealership because the way they handle the customer 


",5.0
55,"June 14, 2018","Friendly fast service. Let my salesmen know exactly what I wanted, He delivered. Told him what I wanted as a payment and down payment and he made it happen. Will most defiantly recommend him to anyone and will be looking forward to purchasing another car feom him in the near future... ",5.0
56,"June 14, 2018","Excellent service very professional. Mr. Mejia was very kind and worked hard, customer definitely came first with him was very honest and straight forward. We give him two thumbs up.👍👍",5.0
57,"June 12, 2018",Didn’t have to wait forever for an answer on approval... great service from beginning to the end of the sale and even after! Thanks team Neessen ,5.0
58,"June 11, 2018",Working with this dealership was the best experience I have experienced when buying a vehicle. Our sales woman was very understanding throughout the process and made us feel at home within the office. Every one in the office was welcoming and greeted us with a smile! ,5.0
59,"June 11, 2018",You guys are amazing!!! I do admit that I was very concerned BUT the outcome was GREAT!!! So thankful for your hard work!!! Truly blessed!!! ,5.0
60,"June 11, 2018",Everyone was very helpful and understanding to financial availabilities! Was able to test drive and were given a bunch of interesting facts to know about the car’s interior. Great experience for first car!,5.0
61,"June 09, 2018","The labor rate @159.00 per hr. is so far out of line that I have sent memo to all employees of Drover Energy Services to never take a company vehicle to this dealership ever again. Case closed !  Did not allow service to be performed once received quote of 2,022.00 .Got three other quotes ,1150.00, 1075.00 and 990.00. ",1.7
62,"June 09, 2018","Raul was the best salesman we have ever had. He treated us with the upmost respect and wasn’t pushy. We explained to him what we wanted, where we needed to be be pricewise, and he delivered the best customer service we have ever experienced. The rest of the staff involved with the sale were very courteous, friendly, and knowledgeable. We are extremely pleased with the service we received and will be sending over anyone we know that is in the market for a new or used vehicle. ",5.0
63,"June 09, 2018","The best car buying experience ever.  Eddie was an awesome salesman.  As soon as he found out the Renegade was for me and not my husband, he directed all attention to me and my needs in a vehicle.  He was very professional.  I've never test drove a car before because it makes me so nervous.  Eddie encouraged me to drive and put me at ease. He worked hard to get it all to the price I had determined as my cap limit.  He walked me through ever simple detail of the Jeep.  He made me feel important the whole time we were in the dealership.  The rest of the people we met while there were so friendly.  This dealership and salesman hands down are the best we've ever had.  We will do our best to do business with them. Very pleased Renegade Owner.",5.0
64,"June 08, 2018",The oil change was done within an hour.  The waiting area was clean and comfortable.  We were treated very nice by the staff.  Will come back again!,5.0
65,"June 03, 2018","Hector and Omar were easy to work with, kept their word, and made the buying experience a lot better than most dealserships I’ve dealt with. ",4.6
66,"June 02, 2018",Great service amazing people good deals beautiful cars very friendly take the time to explain and break down options help you get the best deal,5.0
67,"June 02, 2018",This experience was a first for us. Alex found this car while in Japan on deployment. We came to the dealership and spoke with Cassandra and explained the situation that Alex would be home soon and was hoping to get into this vehicle and thru all that distance Cassandra really came thru with helping us stay informed on where we were at as far as payment and any questions we had. We can't thank you enough for ALL of your patience with us. We greatly appreciate it!,5.0
68,"June 01, 2018","We had been wanting a truck for many years and with just a few details, Cassandra was able to get us a perfect fit! She found a truck that meets my needs and answered any question I had. ",5.0
69,"May 30, 2018","During the past couple weeks, I had been shopping for a new minivan for my family.  I went to Neessen CDJR and spoke with Raul who was extremely helpful and patient as my wife and I discussed what was best for us.  At no point was I put under pressure to prematurely purchase a vehicle, or trade mine in before I was ready, he obviously stayed up to date because he had no issues answering all my questions and explaining in an easy to understand way why the Chrysler Pacifica was the correct vehicle for me.

5 Stars

My only feedback if any was selection, while I understand they are primarily a Dodge pick up truck dealer, more availability would have be n nice for comparison.",4.8
70,"May 29, 2018",I love this car so I’m pretty satisfied with everything. I thank everyone in this dealer ship that helped me get the car of my dreams. ,4.8
71,"May 26, 2018",We had a great car buying experience at Neessen Chrysler Dodge Jeep Ram! We went in with little hope because of credit issues but they went above and beyond to accommodate us. ,5.0
72,"May 25, 2018",Overall spectacular dearlership! They worked the numbers to meet my price range. I got the vehicle I wanted for the price I wanted. Plus friendly fun staff that help make the buying process easier. What more could you ask for ,5.0
73,"May 24, 2018",I had a very great experience. Excellent service and salesman I would definitely recommend to others. Very pleased with my purchase and I would most definitely come back again,5.0
74,"May 23, 2018",Easy experience. Eddies made the process painless and went out of his way to answer questions and took the time to explain everything thoroughly. Best place to buy a truck in South Texas,5.0
75,"May 23, 2018",Great experience!! In and out with nothing but great customer service from the time I walked in!! Thank you Belinda P.!! You were great to me!! ,5.0
76,"May 22, 2018","Cassandra was awesome, I couldn’t have asked for a better sales person. She made us (myself and father) feel like family and not just a customer. Just when I thought maybe it’s not my time to get a car, Cassandra surprised me with a great deal I couldn’t refuse. She also drove 90 miles south to get the papers signed so my dad wouldn’t have to make a trip. I left it all in Cassandra and God’s hands, and got the car of my dreams! ",5.0
77,"May 21, 2018",Great experience with this dealership.  Hector Deleon was very easy to work with and willing to negotiate with me to reach a deal that I was happy with. ,5.0
78,"May 19, 2018",Went in and deal was done within hours everyone was nice and courteous. Kept us informed on every move they were making to make sure I was able to make the purchase overall very satisfied ,5.0
79,"May 18, 2018","Took my 300 in for tires, oil change, and inspection. Had a wonderful experience with their friendly service department. I drop off and they gave a ride to where I needed to go.",5.0
80,"May 13, 2018",Omar was very helpful and so friendly he listened to our concerns and what we wanted and found the vehicle we wanted with everything we wanted and was knowledgeable about the vehicle and was never pushy. Our time and business was well spent at this dealership ,5.0
81,"May 11, 2018","Everyone at the dealership was friendly. My salesperson explained everything in detail.  The and, and buts about the vehicle. I enjoyed my visit while I was there.",5.0
82,"May 11, 2018",It was quick and easy and all done over the phone. Best place to get a car or truck. And Abel was so friendly and explained all the cool features the car had.,5.0
83,"May 10, 2018","I have to say I was treated very well by the sales person and manager and I greatly appreciate it, I'm definitely referring my friends and family.",5.0
84,"May 10, 2018","they were very helpful and understanding.. great services. Ms CASSANDRA IS A GREAT PERSON, SHE TREATED LIKE WANTING TO REALLY HELP ME GET THAT JEEP
. ",5.0
85,"May 10, 2018",Belinda was really GREAT and we were able to handle everything very smoothly.  I'm happy and excited for my daughter as this is her vehicle and she is also very happy that we were able to get out of her other vehicle which we were able to trade .,5.0
86,"May 10, 2018",Great experience purchasing my vehicle from Neessen! Friendly sales team with great management. Not only do they have a great sales team but they have a great service department. Overall I highly recommend anyone interested in purchasing a vehicle to contact the helpful staff at Neessen!  ,5.0
87,"May 09, 2018","Nate was attentive and willing to work with my conditions as the consumer. The whole purchasing process was made super simple thanks to Nate, the salesman. I recommend Nate due to the fact of how passionate he is about getting the consumer what they want. ",5.0
88,"May 08, 2018",Thank you so much Bruno!!! I’m beyond excited you’ll made this process extremely easy for me and I would not go anywhere else after this!!! You’ll are the best! ,5.0
89,"May 08, 2018",Eddie helped us out a lot. Was very supportive and patient while walking us through the process. Even after the purchase he took the time to follow up and make sure everything was set. Overall had a lot of anxiety about a first time purchase but it ended up being pleasant. ,4.4
90,"May 08, 2018","Like a family, not your traditional car lot! Would recommend to all peers.  They had the truck I was looking for and Hector helped get everything working for me. ",5.0
91,"May 07, 2018",We like to take this Oppurtunity to Thank Raul You truly exceeded our expectations you went above and beyond we truly appreciate you God Bless,5.0
92,"May 07, 2018",Thank you for all the hard work you did for us very courteous and professional.  I have the highest regard for this dealership.  I would recommend anyone to give them a try.  ,5.0
