,Date,Reviews,Ratings
178,"January 11, 2019",Great customer service and very friendly. I drove to this location from San Antonio because the dealerships in San Antonio are no good and do not compare. They also wrecked my car last time I went so I decided to come out to Boerne. The 40 minute drive was well worth it and I will continue to go back. ,5.0
179,"January 08, 2019","Service personnel were prompt, courteous and I felt my truck was in good hands.
The work was done in a timely manner.
Muy vehicle was left clean and orderly.",5.0
180,"January 04, 2019",Took my truck in for the first of six free oil changes. I didn’t know I had tire rotations as well but the service manager looked it up before I left and said they could take care of that too. The service was finished in under an hour and I didn’t even have to wait around for the recipient because the service manager said he’d mail it to me. Completely satisfied all around.,5.0
181,"December 29, 2018","The service was excellent from the moment I walked into the dealership thru taking possession of my 2018 Ram Laramie Longhorn Megacab.
I would recommend them to anyone.",5.0
182,"December 29, 2018","We were treated with respect and the sales person had a great personality that made this a great buying experience. Paul was able to answer all the questions about the jeep that was best for us.





",5.0
183,"December 28, 2018",Brian in sales was great. We got right down to business and there were no surprises or sales gimmicks tried. I felt very comfortable from the beginning and the whole process only took a couple of hours with trade in and all. Prices are better here than any other dealership in Texas. Highly recommend boerne dodge!,4.8
184,"December 28, 2018",The dealership was very straightforward and helpful. Charles got me a great deal. The finance staff was also very helpful. I recommend Boerne Dodge Chrysler Jeep.,5.0
185,"December 25, 2018","I love this dealership!  They are always courteous, honest, friendly, and efficient.  I was able to get three recalls addtessed and an oil chg in half the time other dealershits take for just an oil chg.  It is worth the drive to visit these guys!",5.0
186,"December 22, 2018",Vinny my Dealer was very professional and answered all my question in a professional.  Everyone in the Dealership were very nice and professional.  Will recommend Boerne Jeep to my friends.,5.0
187,"December 20, 2018","I owned my Dodge Ram pickup for almost 3 years and have used Boerne Dodge exclusively for service and repairs. I've been impressed with their service staff each time. They are very friendly, explain in detail the work they will perform and make sure I leave happy. If the work will be lengthy, they offer me a courtesy ride to and from home.  Get there early enough and they greet with donuts and kolaches from a local shop! Plus the new coffee machine made a great hot latte!  I'm a happy and satisfied customer!",5.0
188,"December 15, 2018",Eric who took over for Julie due to an emergency. The only thing I wish would have been told to me  were the add ons that were  already added before asking me. Even though I really like them. Just for future customers make sure add ons are on the online cars. I’m still waiting for your dealership to locate my second Key Fob. I would like to hear when I can pick up my 2nd FOB.,4.4
189,"December 03, 2018","Received an email  message that my new van was due to an oil change. Called the number to schedule an appointment and was told to bring it in on a certain day. I asked if I could get a car wash when scheduling and was told just tell the Service department you want one when you take the vehicle in. When I arrived at the Service department, there were 3 employees sitting behind the counter. I was never greeted and no one made any attempt to see what I needed. Finally someone offered to help. I told him I needed an oil change and requested a car wash like I had been told. He just seemed to laugh and said ""We don't offer that here"". He asked me who told me that, a saIes person or someone else. I said it was the lady who scheduled my appt. He said "" that was a third party who scheduled you. We don't offer car washes to our customers as we don't have any means to provide them"" In my opinion, he appeared rude. As it turns out the message I received from Chrysler was wrong and my vehicle did  not require servicing. However, when the technician ""showed me"" that the van did not require servicing, it felt like he was condescending and talking down to me. He seemed rushed and inconvenienced the entire time I was there. Perhaps he was just having a bad day. We really like our van and had hoped to purchase another vehicle from this dealership for my husband early next year, However, I have no desire to set foot in this dealership again because of this service department. We will go elsewhere to have our new van serviced and when we buy our next car. We rated this dealership very high when we purchased the van in Aug 2018 and really liked the salesperson we worked with, however, the service department has us questioning if we made the right decision to buy from this dealership.",1.3
190,"December 01, 2018","My Serive Technician was Michael and he was extremely accommodating, informative, and explained the issues with my vehicle very well.  I was very pleased with the service provided by all the staff.  ",4.2
191,"November 29, 2018","Very professional and courteous,enjoyed the experience, fast turn around,and donuts/coffeeand chatting with Paul.will definately return for service and or purchase of our next vehicle.",5.0
192,"November 29, 2018",Great service and super fast service i was very pleased to show up at 3pm and they had the car ready within 30 min for an oil change ,5.0
193,"November 27, 2018",Really nice folks- thank you Korbie & Vinnie!we are really excited about our new van. It has everything on my must-have list at the lowest price!,5.0
194,"November 26, 2018",Service Department is Top Notch and they are willing to help and get you back on the road as quick as possible.  Can’t thank these guys and ladies enough for their efforts.,5.0
195,"November 22, 2018",Dirk Sommers focuses on meeting our needs while ensuring that we received the perfect Jeep.  Bryan recognized our need for information and he took the time to explain in detail all contact elements.  Both gentlemen stayed until 10:30pm to get us signed up and ready to go.  Excellence is their middle name!  ,5.0
196,"November 13, 2018","Great people. Great services No stress. Drove all the way from Adkins, Tx to get a new RAM and other then false online pricing, my overall experience was great ! Quick and easy, and drove off the lot in the truck I wanted very quickly! I highly recommend them. Unlike most dealerships, the sales people and financial guys are vultures and will all hound you and follow you every move you make and start with the highest priced vehicle. Here, you get greeted  by one person, and they are relax and make the buying process less stressful. There willing to let you just be and walk around and look at different options and if you want something particular they will grab it for you and let you be. But remain in a reasonable close reach if you had any questions. I will be definitely returning in the future and highly recommended them. It was totally worth the drive. I had Brian as a sales person and Anthony as my financial guy. I highly recommend both of them. ",4.2
197,"November 12, 2018",Advisors and everyone else at the dealership make you feel like family and they are concerned about any issues you might have and fix them promptly. I will buy from them again!,5.0
198,"November 12, 2018","It was such a wonderful experience purchasing the vehicle that we like. We are from out of town and had been shopping a POV Lexus RX 350 when we came across the best deal....least mileage, lowest price to the latest (year 2017) model. Me and my husband run a very tight schedule (and not to mention that I was not feeling very well at this shopping time). We had a skeptical attitude, coming from out of town if we could do the purchase very easily and quickly. Lo & behold, it wasn’t a problem at all. I contacted Korbie Contreras first thing Monday AM and with all of my papers completed the same day....me and my husband left Houston Monday evening and 1st thing Tue AM (the next day) as soon as the dealership opened Donnie welcomed us in and allowed us for a test drive (though we waited a little bit from 8:30 AM til 9:30 for the paperworks) once it got started, it went so easily and quickly.  Alex took over and handed us off to Anthony to whom all the purchase transactions took place in his office. It took us 1 hr to get done and we left at 1030 AM heading back to H town with the vehicle with us. My husband was able to come to work at 2 PM. It was that so easy and convenient for us getting the car that we were loving to have!!!! We thank you for the whole sales team from Korbie who is our 1st person of contact to Donnie, Alex and Anthony as our last person of contact!!! More power to the whole team and may you keep this high quality customer service to be always at the top! ",5.0
199,"November 10, 2018","Had a great experience with George W., always accommodating and willing to work with us! It was a lengthy experience with some turn ins but it was a smooth ride through and through! Super excited about our new dually.",5.0
200,"November 07, 2018","Horrible experience in all respects with Boerne Dodge Chrysler Jeep. Sergio took us for a lot of money that we should not have had to pay. And when we received our car there was a lot of things on the car that we did not order ""oh, it comes that way"" was the response. Could have purchased the same car from a nearby dealership for a lot less money with less headaches.",1.4
201,"November 03, 2018",Left oil spilled all over motor.  I leave things to try weather or not the techs do what they are supposed to. On this trip front 2 tires need to be replaced and they were marked as good. 1 tire had 49psi when we brought it in and left the same way. Shocks and struts are marked as good but we have noise in the front end and tried to say the struts need to be replaced. That's a little contradiction. Also need new front breaks but were all marked as good.   ,3.2
202,"November 01, 2018","You would think a salesman would know his inventory. Salesman struggled to find the vehicles he wanted to show us. He finally went in to to talk numbers, they gave us 1 sheet and said that's the numbers. I gave them a counter offer that he did not go back to his sales manager to play the game. I had arranged my own finance in about 10 minutes of wondering out on the lot. As he quickly left and came back to tell me ""Thanks for coming in we are not willing to do business with you"". So, we got up and left. The price of truck could have been agreed upon but the dealer had so many overpriced addon options that we would have not used. They where unwilling to remove them. Had the addons been removed they price point would have been very close.",1.6
203,"October 16, 2018","Online and initial call truck was one price. Begin texting with ""Dirk"" truck has dealer add-ons that 1st call didnt mention nor were they visible online. $44939 truck is suddenly over 52k no thanks. Be honest and upfront and you'll gain more business. Buyer beware! ",1.0
204,"October 10, 2018","A sales person advertised a truck on Facebook. I asked for pics as none were available in the ad. She sent me a link to the dealerships website. No pics available. I again asked for pics and got the same link. No pics available. I asked her why she kept sending me a link to the website when all I wanted was pics (it's a long drive to their dealership), she replied that the vehicle was in service getting checked out and there were no pics available. My response was why did she keep sending me links then when she could have simply told me that. Her response was that this FB was her ""personal"" page and that when she has customers in front of her, she needed to take care of them first (understandable). I said that she should probably not advertise on her ""personal"" page then. Her reply was that she would advertise as she saw fit. 
THAT remark just cost them a customer on a $65,000.00 truck. 
Hello Bluebonnet Motors!!!",1.0
205,"October 02, 2018","I wish I would of read these reviews before making the long trip. Yes, worst experience EVER!!! After being upset and asking to speak to a manager, which no one ever came out, nor have I received a call. I spoke with several employee who shared that lying to customers is a common thing, over turn rate is so high in management, employee jobs are as unsecured as a customers buying experience. 
Most employees seemed as unhappy as I did to be there. 
I applied online at 9am. kept getting emails and calls from Alex that his manager asked that I get down there, everything looked good! I drive over an hour, get there and nothing has been done with my application and then was told the only way I can get the vehicle. I have to give a vehicle to get a vehicle. So, the stated I trade in my vehicle, they would buy  my 2015 with 53,400 miles for 6,973 and they will sell me their 2011 Jeep with 83,000 for 14,995. xxx!! This could of been told before making the trip. No common sense, No courtesy to the customer. 

Boerne Dodge Jeep- where people are numbers and your time/ travel wasted is not our problem. We may/ will lie to you but just get down here so we can tell you in your face NO WAY YOUR GETTING A VEHICLE.",1.0
206,"September 21, 2018","Sad that this place hasn’t changed in 20 years. Still so hard to deal with. Sales is pressured to rob us blind. They do things the old fashion way. I suggest they do advance the buying experience that the other dealerships have turned to. Making it a pleasure to shop for a car instead of hastle! 

Ever here the other dealers say NO HASSLE? 
These type of dealers are bottom feeders like lawyers. There is no justice! 

Drive to San Antonio. Many more dealers to choose from! ",1.0
207,"August 28, 2018","First off, I chose the wrong day to shop for a vehicle.  Not being in the best of moods, and a bit irritable, is not the way a person should be when looking to commit to a major purchase; however, upon arrival I met with Korbie and it all changed.  Korbie was exceptionally patient, understanding, and knew how to answer questions I had.  

In the end, I drove off (very confidently) knowing that my purchase of a 2019 Jeep Cherokee Latitude was wisely made.  For that, I cannot thank Korbie enough!  Korbie is someone I highly recommend if you are looking into buying a new vehicle from this location!  Korbie, if you are reading this, thank you very much, and I hope this message reaches your supervisor who has done an exceptional job in selecting his staff!  

Hector Talamantez Jr.",5.0
208,"April 29, 2018","My husband and I live in North Austin (Pflugerville) and have been specifically looking for a used Jeep Grand Cherokee Summit along with other specifics but I’ll just keep this as simple as possible. After trying for several weeks to find one in Austin with decent miles and a fair price attached that also matched my budget, we decided it may be a good idea to look outside of Austin. We searched the surrounding cities and found a great possible match at the Boerne Dodge Chrysler Jeep Dealership. We called and got more information on the SUV as it had just arrived to the dealership the day before and no pics had been posted yet. Eric was very nice and very helpful, he sent over pictures through text and email and more details of the vehicle. We scheduled an appointment for the next day around 10am-noon. We didn’t know exactly what time we would arrive. We showed up exactly at 11am. When we arrived, everyone was friendly and greeted us and asked what they could do for us. We checked in saying we are Jodi and Jacob here to see Eric and to look at the 2014 White Jeep Grand Cherokee Summit. The first associate said Eric “was just filling up a tank of gas for the car he just sold and he will be back in 5 minutes. We literally hovered around the car, sitting on the inside for about a week 10-15 minutes discussing it and checking out the condition of the vehicle. Another associate, Jason the floor Manager, asked if we had been helped yet and he knew our needs and also asked “could I get you a different associate to take care of us”. My husband didn’t care who helped but since Eric was on top of things and sent me pics I decided to wait for him. Jason said ok and said “he is just filling up a tank of gas and will back in 10 minutes.

We’ve now been waiting around for about 40 minutes and EVERYONE KNEW WE WERE IN LINE TO TEST DRIVE THIS VEHICLE AND THIS VEHICLE ONLY. 

We were approached by Rick, a diff rent employee who told us to go ahead and check out other pre-owned vehicles while we waited for our test drive. 

The next thing happened was unbelievable. We walked away from the Summit for literally 90 seconds and some blonde associate jumped in the vehicle with two prospects that just showed up and took off for a test drive. We asked what was going on...

Ever since we arrived it was always “oh yeah, Eric will be with you in 5 mins...”

What happened Eric??? Everyone else???? Y’all knew we were there waiting for a test drive. We were there to test and to buy THAT car. We didn’t know it would take Eric a whole hour to get with us.

The car was bought and we were very upset on how the situation was handled. 

Jason - you should’ve held onto the keys. Everyone knew we had driven two hours to see this car and to buy it. We had an appointment!!!

Very bad business.",2.2
209,"April 21, 2018","Purchased a 2018 charger SXT blacktop. Their prices for this car is the lowest anywhere in Texas! Search for yourself. $22,800!  I received an amazing deal. Told other dealers to match Boerne dodge price, but they wouldn't. Dirk Sommers was a fantastic salesguy. Easy going, waited very patiently for me to think for about 4 minutes without saying one word. No pressure to buy.  I have been researching for 1.5 months, every dealer, every deal. No one could match or better Boerne Dodge. I live near sea world, its about 15 mins from fiesta texas, but well worth it.  I explained all the bad reviews I saw on sites, they explained what happened and I believe them. Some people you can't please no matter what. You don't get anything in this world for free. But I guarantee they will be fair and honest.  Lastly, I want to personally thank John Montague, the owner, for his assurance of a great experience. It was a great experience and more. I will be going back to purchase a dodge grand caravan soon. Thank you Boerne Dodge! JESSE PEREZ",5.0
210,"March 30, 2018","One of the ABSOLUTE WORST places to try to buy a vehicle.  I will NEVER set foot in that place again.  I live 40 minutes away and they had me drive back and forth with their xxxxxxxx stories.  Prior to going to the dealership I filled out their credit app online and was told that I was qualified for $72,000.  While I was in there the sales manager had the nerve to tell me that the approval wasn't necessarily an approval.  WHAT!??  Then he doesn't try to apologize, but tells me, in a condescending tone, that it probably said ""up to..."" that amount.  Like I don't understand.   He's the one that doesn't understand what ""up to"" means.  It means my credit is approved all the way up to that amount...which I did not exceed.  It's ironic that there were no problems with financing the truck until I gave them a form that stated that my wife worked for United Healthcare and we get the vehicle for less than invoice.  All of a sudden my preapproval was no longer preapproved.  Please do not waste your time going to this deceptive dealership.  NEVER AGAIN!",1.0
211,"March 19, 2018","I have been looking to buy a new 2018 RAM Laramie That Boerne dodge have it in stock , so I drove 60+ miles to them after making an appointment with. ANDRE , finding the truck in 5 minutes so I said great news but boy I was wrong 3 hours past and we are still sitting don’t know what is going on , then finally Andre and his manager show up to tell me that the bank did not approve us for the entire amount and I need or to pay 20,000 in cash as the bank approved only around 50k. And they tried to put me on a cheaper truck , let me tell you something really fishy going on here the truck was marked way less than that . I was lucky to leave with our money in my pocket and not fall for a scam.I waisted my entire day in that dealership it was a nightmare .",1.0
212,"July 24, 2017","Just purchased a 2017 Chrysler Pacifica from Boerne Dodge, Chrysler, Jeep; and it was a GREAT experience!  Tyler, our salesperson, was a gem to work with throughout the sale.  He's very knowledgeable and straight-forward.  There were no games played, and they were upfront and honest about what they could do to help us get into the right vehicle.  This dealership is under new management and is lucky to have John Montague as their new General Manager!  If you've had a less than optimal experience with this dealership in the past, I highly recommend you go in, talk to John, and give him a chance to earn your business.  You won't be disappointed!  ",5.0
213,"April 02, 2017","This dealership is by far the worst you will ever encounter which makes me so sad because it's in a small town that is growing fast and I promise you, word will get around! The manager at this joke of a place, Orlando, basically held my friend and her children hostage in a the dealership. The background story is this: 

My friend went to buy a truck and used her 2015 Dodge Journey as a trade in. She purchased the truck on the 29th of March and on a April 1st was called to come into the dealership and sign one last paper. When she went in, they tried to tell her that the loan that she agreed to and signed a contract on for 5% APR was denied and therefore she would need to sign a new contract with a much higher interest rate and higher payment. Naturally she refused and that is when all xxxx broke loose. The manager tried to use his size to intimidate her, yelled at her in front of her children, locked her in the dealership, told her he had every right to change the terms and she had no choice and refused to give her back her trade in which the bank verified was still under a loan in her name. Even just one of those things is appalling but add it all up (and trust me, there was much more) and this place is despicable!!  

She was then told that she couldn't take the new truck with her or they would report it stolen and she also couldn't leave it on the lot or they would have it impounded at her expense and since they refused to let her turn it in and take back her trade in, she was left without a vehicle for her and her 2 young children. 

Please read all of the other horrible reviews on this place bay date back several years and use your coming sense. DO NOT shop at Boerne Dodge!!! There are too many other places that care about your business and your experience to waste your time getting bullied and lied to by this joke of a dealership!!!",1.0
214,"January 10, 2017","I've asked to see pictures 5 times of a Corvette they have for sale and they will not send. They use a stock photo and not the actual car. Why would they do this? Chuck Wood and his assistant Donna can not answer why they cant send pics of the car. They have had the car for a while so its not like its new to them. 

Chuck then lied and said the car was in for ""routine maintenance"" for the day. and that he would send pics ASAP when the car is back. Well, 3 weeks later, 5 emails later to many different people at this dealer, I just get lies and the run-a-round at this dealership. Also, I noticed a poor rating on www.cargurus.com.


Boerne Dodge Chrysler Jeep needs to make a personnel change with Chuck and Donna before they do further damage to this dealership.",1.4
