,Date,Reviews,Ratings
357,"February 26, 2014","I have been searching for a new vehicle for over a week and visited several dealerships. Although, I enjoyed the Boerne Dealership some time before, it seemed quite far as I'm conveniently located in the center of San Antonio, Texas. Nonetheless, I was fixed on a 2014 Dodge Ram 1500, Hemi-8 speed and had some frustrating time at the several conveniently located dealerships in regards to negotiating the price. That same day, I called Boerne Dodge and, luckily, Paul was working. I got in that evening and within 30 minutes Paul had me sitting down with a glass of water as he located the vehicle I wanted and assured me that the vehicle will be delivered the following day. Paul made the negotiation so simple and efficient and broke down the costs for me, explaining the purchase, and I was completely satisfied. Paul even offered to pick me up the next day, on his day off, to bring me to the dealership in Boerne to pick up my vehicle. Although, it wasn't necessary, the sincerity made me realize that I should have chosen Boerne Dodge from the beginning of my search. ",5.0
358,"February 25, 2014","Paul Caciola's knowledge, professionalism, and affability made our transaction a very positive one.  His tireless efforts to put the deal together were commendable and highly appreciated.  Paul never made us feel pressured as so many over dealerships do.  He instilled a sense of trustworthiness from the start.  Also, Pete's ability to secure the best financing was noteworthy too.  We appreciate the friendliness of the staff members with whom we came in contact.  Thank you for a job well done.",5.0
359,"February 24, 2014",Paul was extremely helpful and attentive to what i wanted! The sale went smoothly and quickly. Everyone I spoke with was very helpful and it was a good experience overall!,5.0
360,"February 14, 2014","Excellent service received form Paul and Mike, second truck I bought there. They found the exact truck I was looking for at great price. Best Dodge Ram dealer in San Antonio and the Hill Country",5.0
361,"February 05, 2014",Received awesome service from Boerne Dodge Crysler Jeep. Bought 2 jeeps here in the last 2 years. Paul helped me and multiple family members and we will continue to come here when we are in need of a new car. ,5.0
362,"January 31, 2014"," This my fourth vehicle to purchase from Boerne Dodge. I have worked each time with Paul Caciola who I have found to be sincere-honest and very knowledgeable. I have and will continue to recommend  Boerne Dodge to family and friends. I will be back in 2-3 years.

   Larry Mickey",5.0
363,"January 29, 2014"," THIS WAS MY FOURTH VEHICLE TO PURCHASE FROM Boerne Dodge---Salesman Paul Caciola has always been Fair-Honest  and Knowledgeable.-  I have told a number of friends about my experience. I will definitely be back in 2-3 years.

    Larry Mickey








",4.8
364,"January 16, 2014",This was a very good car buying experience it was really good service.  I will go back again to buy vehicles.  We also referred out neighbor and he went and bought a new truck as well.,5.0
365,"December 30, 2013","We bought 2 vehicles the service was great, I would recommend this dealer.  I will go back to this dealer again to buy my next vehicle",5.0
366,"December 27, 2013","I came to the dealership to purchase a work truck for our company.  My husband was so busy, I had the task of selecting the truck.  Vinny was very helpful and responsive.  His professionalism exceeded any dealership I have ever dealt with.  I would recommend Vinny to anyone looking for an efficient and professional salesman.  ",4.8
367,"December 26, 2013","I've lived in Boerne for many years and have dropped in here numerous times to buy a car/truck. On all occasions I've noticed Boerne Dodge is unwilling to negotiate price. What you see on the sticker is what you will pay. I find this odd because their overhead must be way below local competitors. Why?

The place looks like it was built in 1965. No remodeling. Antiquated in every respect. The salesmen are poorly dressed. So why do they offer high prices and an unwillingness to negotiate? 

I'm doubtful of all of the 5 start ratings I see here. As I said, my comments are not based on one visit, but many. I suspect that a lot of these supportive reviews were written by Boerne Dodge sales personnel with time on their hands, friends or people who believe that buying a car is like shopping at H-E-B where you can't haggle. 

In the end, I've always found far better pricing for Dodge vehicles in San Antonio.

Good luck shopping here.",1.5
368,"December 17, 2013","I have visited Boerne Dodge numerous times over the last year, and have purchased 4 vehicles. My salesperson was Dean Hardy, he is a very hard working and affectionate person. Very people oriented going way out of his way to ensure my visit went smooth. Even on occasions sending family birthday cards, in my eyes this is what makes for a great experience and what keeps me and my family coming back. And not to say that Dodge, Chrysler Jeep aren't the best vehicles around. If you want to experience car sales as it should be stop by and visit Dean and let him show you around........",5.0
369,"December 03, 2013","The overall experience was awesome!  Our salesman was Joe Valadez and he went out of his way and did everything in his power to make an easy and enjoyable buying experience, especially for our daughter.  Our salesman even drove the car to where we live so we could surprise our daughter with her very first car.",5.0
370,"December 03, 2013",Came by and met with Paul here in boerne tx and I can def say it was worth the extra 20min. Drive!! Everyone at the dealer had that good old Texas charm to begin with but he sure made such effort to make us feel extra comfortable. We told him what we wanted what we could afford. He was very up front with us and broke down every single detail and got to the point. There was no haggling or game playing. We literally changed numbers twice and he got us to the number we could afford. Best experience I've ever had purchasing a vehicle. If your looking for good honest people he's your guy. ,5.0
371,"December 02, 2013","Sale was handled by Paul, and I had a very positive experience throughout the entire process.  He also went the extra mile to ensure the vehicle we wanted was brought in from another dealership.  I would highly recommend this dealership.",5.0
372,"December 02, 2013","Paul has sold me my last two vehicles and he has always been very attentive to his customers and goes that extra mile! Highly recommended!
",5.0
373,"November 16, 2013","When we decided it was time for a new Ram truck, there was never any doubt that we would buy from Boerne CDJ.  We did purchase a new Ram truck. This makes the 5th vehicle that we have bought there and Paul Caciola has sold us every one of them.  We always feel we are respected and get an honest deal.  ",5.0
374,"November 04, 2013","We have purchased two Chrysler Town and Country minivans from Boerne Dodge, Chrysler & Jeep in the past two years.  Both times, Paul Caciola has helped us and the process has been very easy and enjoyable.  Paul has a very good knowledge of the selling and trading of cars business.  If we decide to purchase another new minivan in the next few years, we will be sure to ask for Paul again.  ",5.0
375,"October 18, 2013","
I recently was in search of trading in my car that I knew I was going to have negative equity on but having so many problems with that car I was wanting to trade it in. I took that vechicle to the dealership I orginially had purchase it, thinking since it was their make they would give me the most for it. Well that was totally incorrect, they gave me less than blue book value. 
I then continue to look at other dealerships but either they were too pushy or simply not helpful addressing my needs.
After hearing my story at work, my co-worker referred my to go see Joe Valadez at Boerne Dodge. The first thing I did was call him because at this point I was simply tired of running around in circles. From the moment I spoke to Joe Valadez on the phone, he listened to what I looking for and got straight to the point of addressing my needs. I then was able to do most of the pre-qualification paperwork via fax. Once I was approved, I went to see Joe and started test driving. Shortly after that, I was in the process of buying a beautiful 2014 Jeep Patriot. Not only was I satisfied with the great customer service, Boerne Dodge gave me more on my trade in then any other dealership had offered me!
Joe Valadez gave me personal customer service that I was in search of and the price range I was needing. I will continue referring family and friends to Boerne Dodge.

Happy Customer,
Elaine Castillo 
",5.0
376,"October 14, 2013","Tom was a absolutely top-notch.  Tom was masterfully able to find me the vehicle I wanted with zero problems.  He went above and beyond to locate my vehcile ensuring that it was the color, model, and had every last option I specifically wanted.  Hios professionalism and willingness to go the extra mile was spot-on.  Great salesman and great asset to Beorne Dodge!!",5.0
377,"October 09, 2013","Chris is a straight up guy that leaves all the nonsense a side gets directly to what you want. My family has bought 3 cars from and we way more than satisfied with the deals he has been able to work for us. I have had other experiences where they want to force you into what best fits your credit and not your needs. Chris simply puts you in the car that you will love at a great price. As long as this guy is selling cars he has my business. 

Thanks",5.0
378,"September 30, 2013",Best Car salesman ever!! Really listened to what I was looking for!! I didnt fell pressure at all!! Super Friendly and very Helpful! I will come back for future purchases!!,5.0
379,"September 26, 2013",This by far was one of the easiest car buying experiences! Joe was so helpful and understanding with our needs. I have recommend everyone we know! Thanks Joe for helping this military family out!,5.0
380,"September 24, 2013","One word: Incompetence.

Moving to San Antonio from LA, I needed to buy a new car.  I found a Jeep Grand Cherokee on Autotrader at Boerne Dodge that seemed like it would be a reasonable option.  After negotiating the deal over the phone, agreeing to a price, and getting approved for a loan through their credit provider, their finance manager Brandon said he would FedEx me the paperwork to complete the sale and I'd have the car waiting for me when I arrived in SA.  Received a FedEx package two days later with the appropriate paperwork, only my name was spelled wrong (Bryan) and they tried to sell me a 3 year 36,000 warranty for $1500 even though I confirmed three times that the warranty would be for 5 years and 100,000 miles over the phone for the same $1500.  After calling Brandon several times and not hearing anything back, I finally told the receptionist that if I didn't hear back in an hour I was going elsewhere.  Ten minutes later Brandon calls back, apologizes, and says he'll overnight the corrected paperwork to me.  Two days later no paperwork, so I call again.  Again get ignored after leaving several messages.  Spoke to the manager Matt, said this is ridiculous, this is total incompetence, this should be the easiest part of making the sale.  Matt agrees, promises to straighten it out and call me back within the hour.  Well it's been a week now and I've already bought a different Grand Cherokee from IPAC Jeep, so I guess that's that.

My hypothesis: they were trying to get a check from me in the mail, and when I went to pick up the car they'd say they couldn't title it to me due to the misspelling of my name and would use the fact that I'd already given them money to hold me hostage on a different car they'd bait and switch in.  Whether they're unethical or incompetent, either way STAY AWAY!!!",1.0
381,"September 24, 2013",Are sales man  was awesome they had the truck in Durango me my wife wanted we are very happy with the vehicles and the deathly come back to Dodge Bernie. ,5.0
382,"September 09, 2013","This is the third vehicle we have purchased from Boerne Dodge in 10 months.  They always take great care of us and deliver everything they promise.  I highly recomend you visit them when in the market for a new vehicle, ask for Leroy.",5.0
383,"September 04, 2013","Are you LOOKING for someone honest who has the TRUTH in WHITE & BLACK and NO surprises?

YOU'RE asking for

Joe Valadez

The SALESMAN ""The Best"" @ Boerne Dodge!!!!

I came to the dealership just for one car and left with a car and a truck!

AMAZING!!! Huh!

Why?

Because Joe Valadez - The SaleSMAN, brought the all deals and offers as such as specials and rebates over the table, to make it REAL!!!

I would like to thank you Joe, for all the time that you took in assisting me and my husband with purchasing our 
2013 Dodge Charger & 2010 1,500 Dodge Ram.

You quality customer service skills made me feel comfortable and honored that I was on the right and best hands.

We didnt have the best credit score, and you did worked hard to get us to low down payments, low monthly payments and lowest interest %.

From the test driving all trough the paperwork and APPROVAL!!!!

You did an EXCELLENT job to make our needs and dreams come true!

I would definitely come back to refinance (trade-in) or purchase another vehicle from you Joe and your Boerne Dodge dealership.

Thank You so' much for let us TRUST on you!

",5.0
384,"September 03, 2013",Joe was a great salesman and did everything in his power to get me a great deal. I will recommend this dealership to anyone looking for a new or used vehicle. Thank you so much,5.0
385,"September 03, 2013","We were looking to trade in 2 vehicles and get a new Durango. Im so glad we drove to Boerne. We had originally gone to dealership in SA and they were VERY shady. The other dealership basically wasn't getting me even close to what I wanted for my trade ins and was no putting me in what I wanted. Fast forward to when we came to Boerne....SUCH A GREAT EXPERIENCE.  We got more for both our trade ins, Joe Valadez treated us like family and got me in what was ideal for us with a few extras. :) it was probably the easiest car buying experience we've had.  I would  buy another car from Joe in a heart beat.  Not to mention my husband liked Joe too...and he doesn't warm up to just any one. ",4.8
386,"August 14, 2013","Our experience at Boerne Dodge was very pleasant.  Our sales guy Joe Valadez answered all of our questions, took us out on 2 separate test drives as we made our choice.  He made the decision making easy, no pushing or shoving, which I appreciate from anyone in sales.  He made it really easy for us to NOT want to shop around other dealers. He put us in a beautiful truck that we are just giddy with! 

Once we decided what we wanted we went in and talked numbers, he sealed the deal with a hard to beat price. 

1. knowledgable
2. accommodating
3. hard to beat deals

Boerne Dodge is where its at and Joe Valadez is your man!  
5 Stars Boerne Dodge!! 

A satisfied customer
Janice B. ",5.0
387,"August 03, 2013","It had to come to this. Since it has been so hard to receive a response from anyone, I am writing a review of mu frustration. I decided that I wanted to trade my car in on something else. I Purchased my car from Boerne Dodge (used). I bought a extended warranty through Apex, and I also bought credit life and disability (I didn't remember that one). I paid $3000 for the warranty, $665.06 for the life, and $1397.60 for the disability. I originally emailed Apex to cancel the warranty. They said that I needed to have the dealership cancel it all. I got in touch with Mark at Boerne Dodge, and gave him all the info that he needed. I sent a second email, asking if he had received everything. He said ""got it...Thanks"". During a phone conversation he had stated that it would take 6-8 weeks to process my refund, which was going to be somewhere in the $3000+ range. I emailed Apex back and asked them if this was correct, they stated that is the standard time frame that they quote when cancelling service. They also said to email them, in a week to make sure everything was processing. I did not email the following week as it was the 4th of July week. I emailed (Apex)later the following week, asking for a status. They replied that they had not received any requests for it. Apex said they would contact Boerne Dodge and see what was going on. They responded that someone should be in contact with me. I gave it a few days, and I never received a call. I also tried calling again, and was told the person I needed to speak with was out. I emailed back to Apex and gave them this info. They emailed me again last week saying that they are looking into it. I have not heard anything back. I also emailed the dealer again....still nothing. It was supposed to take 6-8 weeks....I am starting week 6 now, and I have nothing as of yet. These cancellations are pro-rated as well.....the longer it takes, the less I get back.",1.0
388,"July 23, 2013","I came to Boerne Dodge at the recommendation of a friend that had bought several vehicles there and was told to contact Mr. Paul Caciola. Paul listened to me when I explained what I wanted and took his time and located a Brand New Ram 1500 Laramie. I am very happy with the absolute ease of the purchase and how well Paul handled everything. 
I will make sure I send anyone looking for a new vehicle to Paul and this dealership.
Thank you very much
Jake Koss
Junction, Texas",5.0
389,"July 10, 2013","This was absolutely the best vehicle purchasing experience we ever had.  Joe went out of his way to be accomodating.   I will be recommending anyone who is even thinking about buying a car to come to Boerne, even if they live in San Antonio like I do.  It is well worth the drive.  Everyone there did a great job on this flawless purchase!",5.0
390,"June 24, 2013","Loved the small town feel of this place.  Paul was very friendly, knowledgable and helpful!  I found eaxactly what I was looking for and completed my purchase in about an hour.",5.0
391,"June 24, 2013",Paul was very easy to work with and made the buying process smooth and easy. Paul was straight forward and really worked with me to get me the best price.,5.0
392,"May 20, 2013",Anthony is a great salesman to work with. He went above and beyond to help us get the car we wanted. Thank you again for all of the help. We recommend Anthony and The Boerne Dealership to those looking for a good car with an honest salesman such as Anthony. ,5.0
393,"May 13, 2013",I have dealt with this sales person for several vehicles. I find that his knowledge of the product is masterful. He is the main reason I deal with Boerne Dodge Chrysler. ,5.0
394,"May 13, 2013","I was very impressed with the service, and they were the only dealership that would special order my truck. I would recommend this dealer to others. My  truck will be the second vehicle that I've purchased and if this goes as smooth as my first, I will be coming back for two more vehicles for my son and daughter.",5.0
395,"May 10, 2013",Joe V. is a wonderful person. Very driven in the overall satisfaction of the customer. I asked for more business cards for future referrals. Great salesman and genuine to the core. Thank you  Joe.,5.0
396,"May 09, 2013",I had a wonderful experience purchasing a vehicle with Paul.  He answered all questions I had in regards to my Dodge Ram.  His vehicle knowledge and attentive customer service was top notch. Paul made this buying experience easy and not time consuming to meet my busy work schedule. I strongly recommend him as well as the dealership all together for your next purchase.,5.0
397,"April 26, 2013",Paul was a pleasure to work with.  He made the car buying experience so easy. He was very knowledgable on the car I bought and I have really enjoyed my new Jeep Wrangler over the past month. I will definitely recommend Paul and this dealership to my friends.,5.0
398,"April 23, 2013","  I am very pleased to have dealt with this salesperson because of his honesty and integrety.. there aree very few sales people who possess the knowlege that he had at his fingertips during our transaction. I will be sure to deal here in the future. incidently, both my nephew and I purchased new vehicles. ",5.0
399,"April 17, 2013",I went to Boerne Dodge looking for a Challenger R/T and not only did I find one but I had the best experience at a dealership EVER! Everyone and I mean EVERYONE was friendly. Very knowledgeable and I am so satisfied with my purchase. I am very glad I purchased from Boerne Dodge! Thank God for nice people!!! And thanks for a great deal!,5.0
400,"April 16, 2013","This is my second vehicle from this dealership in the last six months and we LOVE it.  Leroy was great and very patient with us.  We had a budget to stick too, but he was able to work with Brandon in finance to get us where we were comfortable.  I have always wanted a Challenger with a six speed transmission, and now I have it.  That makes two HEMI's in our family!!  Thanks to Mickey in the Internet department for locating the car for me as well.  I would HIGHLY recomend this dealership to anyone in the market for a new or used vehicle.  We will be back in six months to get something for my daughter.",5.0
401,"March 11, 2013","Joe was super friendly and really worked with us to get us not only an amazing Truck but to also stay in our budget. I have never been to a dealership were I have felt no pressure to buy, but also to be well taken care of. Joe Valadez is a top notch person not just a sales man. Thanks again Joe and when I am ready to buy another car for my wife we will start our search with you.

Thanks
The Montez's",4.8
402,"March 07, 2013","This is not my first time buying a new vehicle from this dealer and we keep coming back to them because we like the team of people who are working here. I have worked with several people on the sales team, but my experience is always the same: friendly people, great customer service and you don't feel like you are being pressured into anything (which I feel I can't always say for other dealers).
If you are looking for a Dodge, Chrysler, Jeep or even a used vehicle, I would highly recommend you to call or visit them before you make your final decision.   ",5.0
403,"February 07, 2013","I had an unbelievable experience; the salespeople, Paul Caciola especially, were a pleasure to work with. He was knowledgeable and very patient with my incessant questions. He did whatever he could to make the deal work and sold me an awesome truck, which I love. I am enjoying it and I am certain I made the right choice with selecting this truck.   ",5.0
404,"January 27, 2013","Paul and the rest of the workers at Boerne DRJC are very kind, diligent, and hard-working. Paul found me the perfect truck the first time I came there. He explained to me every feature (both good and bad) about the truck. When confront with questions about other trucks (Toyota/Ford/ext.) he kindly told why Rams were better and where the other trucks were better. Unlike the salesman at ford, Paul was never overly demeaning towards other trucks. He also backed up his statements with facts. When it came to the sale he told us that they would work with me on the price. we came to a very fair agreement very quickly without much hassle. I highly recommend anyone to pay them a visit before making a final decision. I know that when my sons will need trucks my first stop will be here. ",5.0
405,"January 20, 2013",Paul has always been extremely nice and very helpful. The fiance department has always been really nice also.  I feel like we are always treated like family when we go to see Paul.  I highly recommend Paul and Boerne Dodge.,5.0
406,"January 10, 2013","This is the fourth new vehicle I have purchased in my life and the best experience I have ever had.

From start to end this team was engaged and working in everyone's best interest to get the deal closed in the most friction free way possible.

The whole process was seamless and I couldn't be happier with my new Dodge Ram.

Thank you for the excellent customer service!!! 

I will refer anyone I know to this dealer moving forward!

Best Regards,
Dennis

",5.0
407,"January 04, 2013","Got a great deal on a Durango. They went all put to find what we wanted. Had a little problem with my phone number, but it worked out in the end. I'll be back when I need a truck.",5.0
408,"December 24, 2012","Our salesman, Vinnie Constantino was amazing.  He had us test drive a truck that my daughter was really interested in, compare to several others on the lot, take her cureent vehicle as a trade, help arrange financing and we drove home in a new vehicle we only ""intended to look at"" the very same day.  This vehicle was for my daughter.  We were able to get her on her own note (without me as a co-signer) at a 6% lower rate than a local bank we have done business with for over 20 years.  Your finance manager who I am truly sorry I don't remember his name was also amazing.  He explained everything to my daughter and even sold her an extended warranty, which I never purchase on my vehicles.  I will recommend Boerne Dodge to all my family, friends and associates in the insurance industry.  Thank you for a very pleasant experience.",5.0
409,"December 22, 2012","
Paul was a very good sales rep, he knew a lot about the vehicle I was purchasing and didn't pressure me in to buying. More interested In getting the right truck for me, I will be sending more people your way!!",5.0
