,Date,Reviews,Ratings
32,"June 04, 2015","I called and spoke to Dion (The Liar) about a 4runner I wanted to buy. I asked whether it was still available. I did not want to drag my family several towns over if there was no way to look at it. He said ""I know for a fact it is because it was just finished being detailed and were not able to show it to others while it was being worked on."" We drove to the site and asked to look at it. He looked around and dragged us to another lot finally giving up and saying ""it is locked in this building"". I told him I was unhappy, and the whole reason I called ahead was to avoid this type of situation. This I find discourteous and unprofessional but still made a point to wake up early the next day (I work nights) upon opening and here is where it gets really bad.. I arrived and spoke to another salesperson. He also said it was available and went to go retrieve it. I noticed he grabbed Dion the liar on the way out of the building and they disappeared for a while. When they got back they said they would have to find out if it was ready to be showed (this was why I had called in the first place). I was standing outside and Dion the liar came swaggering out the door saying ""I told you"" to which I cut him off and said I prefer not to work with you after you lied to me. He puffed up and got in my face and said it was my fault for not calling him back (I called once, I should not have to call back and say i am leaving now). I tried to tell him why what he did was rude and disrespectful, but instead of listening he puffed up more and acted like he was going to hit me, so I said I am done talking to you, I need to the speak with a manager. After some waiting, the ""manager"" came over and did not even want to hear what happened. He did not even let me speak before saying ""we do not want to sell you a car"". I was very taken aback. I had never been treated so rudely before and could not beleive what was happening. I can only guess that Dion once again lied, this time about what I wanted to discuss with management. I drove my car across the street to the main 'new car' dealership and asked to speak with a manager there. I explained the situation and told him I could not believe the way I was being treated. I never once lost my cool or was disrespectful to the staff. He asked me to wait in the waiting area for a minute while he made some calls.. When he called me back over, he said ""the 4runner was never available.""

Please take my warning seriously and avoid these guy's like the plague. If they seem nice and courteous they are probably lying their xxxxx off in order to take advantage of you in some way. They are discourteous liars and probably thieves too.

W",1.0
33,"March 09, 2015","
As of this moment I would say stay clear of this dealership. Reason being management has no issue with lying to you while looking you in the eye. Keith, a sales manager, presented with a fairly straightforward question was unable to find it in himself to be honest. When repeatedly asked who the General Manager of the dealership was (I already knew it wasnt him) he repeatedly claimed that it was himself. This conversation was recorded. I have since left him a VM giving him the chance to prove that he and is dealership can indeed be trusted. We shall see what he chooses to do. In the event that he conts down the path of zero customer service and lying to his customers, I will then post the a detailed account of my shopping experience. FYI the real General Manager's first name is Scott.

Also as of right now stay clear of Don Phillips. Sales man with no back bone or integrity. When told his text messages would be made public...proving just what kind of customer service he offers...this is his response ""I have check in to this and have the legal right to not give you permission to post my personal info and text on social media. So I am using that right to say do not post my personal info and text on social media."" Whatcha got to hide Don? First off Don, you dont have a right to tell me not to post it. You were texting in the capacity of conducting businesses. Not protected unless stated at the onset of our communication. Check your facts. Again...if in the end neither Keith nor Don decide to put the customer first and start being honest. I will then post a very detailed outline of what these two have put me and my credit through. Time will tell what kind of men they are.",1.0
34,"January 12, 2015","1. The tablet dashboard display kept dying and had to be replaced
2. The SERVICE AIRBAG light kept coming on, and had to be serviced three times in one year.
3. The battery had to be replaced at 13K miles
4. My 1st Inspection at 14,355 mi has failed 4 times and there is no end in sight. I contacted the manufacturer a week ago...no one has phoned back.

This DODGE DART LIMITED EDITION is a lemon and I feel like Dodge Service is not helping me, just eating up all my time, mileage, and gas.  HELP!",2.6
35,"September 30, 2012",My husband and I were looking for a truck to pull a fifth wheel with. We did our research on trucks and knew a Dodge was right for us.  We found great inventory with Mac Haik Georgetown and went in for a test drive. We worked with James White and he was immediately friendly and helpful.  He answered all of our questions and was very knowledgeable of the 3500.  We also had help from Jose Martinez who was willing to work with us and ended up making us a great deal.  Everything ran really smoothly and everyone from the finance dept (who were great!) to the front desk were attentive and overall really welcoming.  I would definitely recommend this dealer to anyone.  Felt great to drive away with a beautiful new truck.  ,5.0
36,"September 12, 2012","Absolutely one of the best car buying experience if not the best I've ever had. My Internet Relations contact John Dotson introduced my salesman, Matt Fasthorse , whom was very patience & showed me a couple of Jeeps in order to let me get exactly what I was looking for. The negotiation process was smooth, thanks to General Sales Manager Chris Carstens. The finance piece was excellent as well thanks to Pierce Brown.  I recommend buying from this dealership!! I strongly recommend you ask for Matt. Be surprised to meet a very polite, courteous young man who is eager to help! ",5.0
37,"August 22, 2012","This was the worst experience of my life. Not only did that hugely inflate my parent to throw in extras I stated I was not interested in, they tried to force me to sign. They literally would not return my car keys until I made a deal. 2 weeks after walking out on them, I found out they had sent my credit to 8 banks and created 8 new inquiries. This dropped my score 40 points! They were doing this still 2 weeks after I told them I was not buying. And when asked if there would be multiple inquiries, they bold face lied to me and said it would only be one initial credit pull and no more. They have basically ruined my credit, tried to force me to sign at a payment I can't afford, and when they realized I was no longer a sale they stopped returning phone calls. Even when I called to ask why they are still pulling my credit. They are scam artists and cheats. Oh smd their prices are massively inflated anyways. They will say they no longer have a less expensive vwhicle so they can throw you into a model 5k more expensive. Then you look on the lot and the less expensive model is there. NEVER EVER GO HERE!!! ",1.0
38,"August 19, 2012","Don’t waste your time, just stay away.
I had been looking around for a 2012 challenger for a while and had found one in the paper at Mac Haik. When I got there it was no longer there(I know dealers only have one listed in the paper at the sales price and when its gone its gone. No big deal I get). So I was talking to the sales person about what I was wanting and at what price I need to be at. He told me that there was nothing on the lot that they could do at that price (still not big deal). I gave him my info and told him to call me if something came along. So about a week later I get a call that they have a car in at my price, unfortunately I was not able to come in due to being out of town.  2 weeks after that I get another call that they still have the car at my price and his sales manager is looking to move some cars this weekend (normal car salesmen speech). So I call and set up a time to come in. so I get there take and take the car out, get in it and the seatbelt doesn’t work nor does the entry button (stuff they can fix but still). After that we sat down to start the paper work, he hands me a piece of paper with the price and its over $4000 more than what we had agreed on (the only reason I had come in) also higher than the price listed online. I tell him that is not the price we talked about; he says “oh what price did I tell you again”. Goes and comes back with his sales manager, to tell me that there is no way that they can do that, so if I wanted the car I would have to pay more. Save yourself some time and don’t go to Mac Haik.
",1.5
39,"October 14, 2011","I didn't buy a car here, but I will when I get ready to make my decision.  I told them up front that I wasn't buying a car that day, and they treated me just as well if not better than if I had a check in my hand.  I was looking at the new Jeep Grand Cherokee and my sales person, Kayla, seemed to know just about everything there was to know about them.  I was rather impressed.  She was like a talking brochure and very nice.  On my way out the manager, Mike (?), introduced himself and asked if I had gotten all of the information I needed to help me make a decision later on.  I thought that was pretty cool.  He didn't try to hard sell me anything, which I appreciated.  He asked me at the end if I had a good shopping experience to share it with the 'internet community', which I thought was neat.  I've never been much of a product or service reviewer, but since they were so nice to me, I thought I could at least write this, even though I didn't buy anything.  I will definitely be back :)",5.0
40,"June 21, 2011","Finalizing the paper work for the car went horribly wrong when i noticed the mileage on the car was not what the sales person told me. An extra 1000 miles was on the car. I was not happy and at the end of a long day at the dealership- did they really expect me to accept this? Wondering if i should sign my papers the sales lady said that she would throw in 4 free oil changes. Reluctantly and still not happy i signed the paperwork. Yes about 8pm i finally got to go home with my car. Now 2yrs later i am still mad about the whole situation since i have gone into the dealership to receive my oil changes and every time they say that i do not have credit for them. I am so angry and feel like they ripped me off again. They told me i had and expiration on the oil changes.This is not true because i was not told this at the signing of the papers. Plus, the free oil changes was a -promise- from them for lying  to me on the mileage and it was hand written into my contract.
I will never buy a car from them again. Next time I am taking my contract in to them. Now the third time -really just give me what you promised to me.I bought your car. Guess since i signed the papers and drove off the lot they do not care about keeping there word. 
The sales and repair shop guys have told me different stories every time. I do not believe it is their fault-they are always nice to me.It is the company i am mad at. Not sure what to do now. except -to tell everyone not to buy from them.",3.2
