,Date,Reviews,Ratings
0,"June 12, 2020","My experience with this dealership was absolutely WONDERFUL! Ryan, my salesman was “more” than all over it-he made it happen! And Nick, I the finance department was right with him. I unconditionally would recommend Mike Brown Chevrolet and everyone I dealt with.
I also can’t not mention Duane and his lovely wife who delivered my vehicle to Georgetown, TX.!",5.0
1,"May 24, 2020",Wendell Gray has been my service advisor for about 2 years and I always go to him because he will shoot straight with me as to what I need or don't need for my Escape.  His integrity is important to me.,4.8
2,"May 15, 2020","I stopped at Mike Brown in search of a new Ranger pickup.  I found what I was looking for and when a salesman finally showed up, I requested a price.  I was informed the salesman that Ford priced vehicles based upon the purchaser's location (really) so I provided the requested info and the salesman went off and returned with a price of $24,500 and told me this was a dealer demo vehicle with a few miles on it.  I requested a look inside and off he went again to get some keys (I guess I am the only one that wants to look inside a car before buying it...lol)  A review of the vehicle showed a few things to vehicle required to suit me, sideboards, sprayed bed liner, and a trailer hitch.  We agreed the three items would be added and I would pay $625 (half of the additional items) and the sales manager told me face-to-face that we had a deal.  I drove 40 miles home and got my old truck I was using for trade in and my wife to follow to bring me home.  When I arrived, the vehicle had risen in price by EIGHT THOUSAND DOLLARS!  At this point, I'm flabbergasted...what?...how?  Then I learned I just thought I understood English...I had made an EIGHT THOUSAND DOLLAR misunderstanding.  They were trying to jack up the price and I did not want it that bad.  Only common courtesy prevents me from telling you what I think of them.  Avoid this place…just a normal used car tactics at a new car dealership.",1.3
3,"May 14, 2020","Been with MB Ford 15 yrs, 4 vehicles purchased and serviced regularly there over that time. Nearly always been good work and great service, save for a few years back when the caps on engine oil and other fluids under the bonnet got left off after service and discovered at home a few days later. Had words with the then service supervisor. Never a problem since. Will keep returning to MB Ford in Granbury for new vehicles and routine servicing.  Liked that they washed the truck this time. Nice touch.",5.0
4,"April 30, 2020","We purchased our pre-owned Lincoln Navigator about a year ago.  We bought the extended warranty.  We had a few items that needed attention.  The service department gave great friendly, professional service.  When the parts came in we received same day service.  We’re very happy with the repairs being completed correctly and in a timely manner.",5.0
5,"April 07, 2020",I had a wonderful experience I told them what I wanted and they got it for me . I love my new truck!!! Cindy was the greatest I do not remember the man that did the finance but he was awesome to .,5.0
6,"March 24, 2020",Great Service as always. Cindy was terrific and kept in contact to let my wife know when our truck was ready. Thank you for your assistance. ,5.0
7,"February 27, 2020",Charlie Mann did a great job. The service was fast and they showed me things on the check out that I need to look at. Thanks for a fast friendly service experience. ,5.0
8,"February 13, 2020",A good experience from start to finish. The team went to work and put together the kind of deal I wanted to see and expedited it without hassle. ,4.8
9,"January 20, 2020",Julie was a pleasure too work with on helping me purchase my pickup without being able too come see it ! She worked with my son on this too help me as well! She is very nice lady and  the couple that delivered my pickup too me 5 hours away we also very sweet! Great experience for me and Julie was there every step of the way! Tnank you so much hun! ,5.0
10,"January 16, 2020","Great dealership 
Ask for Julie Rose- fantastic salesperson 
Bought my last 8 vehicles from a different ford dealership- this is now my go to dealership 👍👍",5.0
11,"December 04, 2019",I would like to this time to thank Doyle Maynard and Jim Solomon at Mike Brown Ford for taking care of my issue that I had ,4.0
12,"September 24, 2019",I purchased a new car from Mike Brown Ford.  Jeremy Parks was our salesman.  Jeremy helped us find the perfect car for our needs and delivered a very attractive offer.  The paperwork was a breeze and we left that day in our new Ford Edge.  ,5.0
13,"July 29, 2019","A few months ago I took my car in for a rattle.  It sat there three days (while I was scrounging up transportation to work) and they never worked on it.  When I said I couldn't wait anymore, they said I could come get it.  I tried again a few weeks later - just an oil change.  They actually told me my air filter needed replacing. Little did they know I had it replaced a month before when I got my car inspected.  Who would actually do this? And today - tried to make an appointment for service for a real problem affecting the use of my car and was told they are two weeks out. When I said I can't wait two weeks - she said she'd let the lady handling my appointment request know I would be going somewhere else.  Got into David McDavid today. I have tried and tried with this place because of the convenient location to my home.  I'm done.  Go somewhere else - they show no concern for their customers.  Makes me sad - in early 2018 they were fantastic.",1.0
14,"February 06, 2019",Juan and the whole staff at Mike Brown are absolutely wonderful to work with. They always give 110% and go out of their way to make sure that you get the vehicle you’re looking for. This was my first time buying a vehicle and they worked around my work schedule and helped me find the exact car I was looking for. My parents have bought multiple cars from Juan and we always recommend him to our friends and family.,5.0
15,"January 28, 2019","We had worked with Juan to purchase a King Ranch one ton dually in  the fall,great service so we decide to purchase a new Jeep with the sale company and same sale person..if someone treats you good you want to go back..",5.0
16,"January 16, 2019","I was looking for a specific Ram truck in my price range which I found at Mike Brown in Granbury, as I was looking at reviews online I noticed Juan Meraz would show up quit often so I requested to work with him on my buying process. From the time I arrived to the dealership Juan greeted me with a smile and made the  whole process easy and fast I would highly recommend Juan and the entire Mike Brown team when you are shopping for your next car, I will be definitely be buying my next vehicle from Juan. Thank you for the great service!",5.0
17,"January 04, 2019","Found the car I wanted on cars.com and the salesman, Juan Meraz at Mike Brown.Jeep. Arrived at the dealership at 9am & drove out with a new Rubicon at noon. That included a great test drive, simple & reasonable trade negotiation and very good delivery
Explanation of the vehicle. We enjoyed the process enough to return to the dealership & purchase a second vehicle later in the afternoon, a 2019 Explorer  A great salesman is hard to find. Juan’s follow up and professionalism is second to none!",5.0
18,"December 28, 2018","Yesterday I bought my very first car and had an OUTSTANDING experience. With the help of the salesman, Craig Hoffman, I found my dream car and could not be happier. Craig was a tremendous help and made sure I was taken care of, from test-driving the cars to all of the paperwork, he made it a very easy and enjoyable process.",5.0
19,"December 23, 2018",Cindy provided me great service and communication before my visit and while I was there. Bought a great car in under an hour!  Thanks Cindy!,5.0
20,"December 17, 2018",Took my car in to get the oil changed and the young man found a nail in my tire. I was very thankful for the information. They did above and beyond. Thank you guys and girls. ,5.0
21,"December 06, 2018","I’ve been buying new vehicles from Mike Brown Ford for over 10 years. 
I can say this dealership has never been high pressure to sale you  Paul my vehicle sales associate is very knowledgeable about the product he sales. 
They used simple sales tactics 
You pick out the vehicle you desire. 
You take out on a test drive. 
The present you a price 
You do a little negotiation. 
Both parties agreed on the price 
You go into finance office  sign paperwork and down payment. 
You are offered options in financing and add ons.  You say yes or no and your done no hassle to buy extras. 
This is an enjoyable dealership to do business with 

",5.0
22,"December 01, 2018","Mike Brown Ford was a huge help for my daughters first car. Miss Cindy was very helpful from the get go, not only got to know myself but my daughter as well and her wants and needs for her first vehicle. She went above and beyond thru the whole process in which we are very grateful. Ty who we signed the papers with was awesome as well got us in and out in minutes!  Very hard to find sometimes but I have to say I will for sure send family and friends to Mike Brown Ford in Granbury. A huge shout out to Miss Cindy I feel like we’ve walked away with a friend as well from this awesome car buying experience. ",5.0
23,"November 19, 2018","We went in to look into trading our previously bought, from mike brown, Santa Fe in for a truck and they went above and beyond to help us get that done!! Left in a new vehicle in just a couple of hours!! Very satisfied",5.0
24,"November 15, 2018","We recently bought a brand new pickup from this dealership. We have had to take it back 3 times since we received it (mind you - this is a BRAND NEW pickup.) It has been the same problem over and over, without resolution. I am never one to complain, but this has been absolutely ridiculous. The most recent issue lead them to tell us it was ""bad gas"" and therefore the warranty will not cover it, even though the presentation is EXACTLY similar to the 2 previous episodes. Very upset with the quality of service provided and extremely disappointed in the staff. I just want to let others know so that they do not get stuck in this awful situation like we have been.       ",1.0
25,"September 20, 2018",I had the most wonderful experience working with Cindy my family has been going to her for years! We absolutely love! She has been our go to girl for any new vehicles she gets the best prices for the cars that we want. I reccomend going to Cindy at Mike brown Ford in Granbury because she knows how to make you feel welcome at mike brown she knows exactly what she is talking about what the best deals on the lot are. ,5.0
26,"September 20, 2018","My husband made an appointment to see a pre-owned car on Saturday.  While we were on our way he received a call 
To check if we were on our way .  When we arrived Juan Meraz was outside waiting to greet us . 

Now I was not in a good mood as did not want to drive this far for a car ( 40 minutes ) but I must tell you that the friendly and welcoming way Everyone especially Juan ( our sales person
)  treated us made up for the drive .

From the moment we walked in and all through the process of purchasing this car , we received first class treatment just like we were buying their most expensive car there !   They were VERY accommodating with some of the things we needed fixed on the car .  Juan made arrangements for me to bring the car back on Wednesday to get those items taken care of and he gave me a very nice loaner car .

He had all the paperwork ready for this and even met me at the service area . He kept telling me if there's anything else we can do for you please call me anytime .

Today when I went to pick up my car he was there waiting for me and he went to get my car for me while I waited in the nice air conditioned office .

My husband said that he even received an email from Mike Brown telling him to be sure to let them know if they can do anything else for us .

I have to say I have not bought a car at a dealer in over 16 years but this experience has surpassed any we have had in our auto buying experiences .  

Everyone we met here at Mike Brown auto had a genuine interest in making sure we had the best experience possible and they very much succeeded !

I highly recommend them and it was definitely worth the drive .

I hope I don't need a car again soon but if I do this is the place we will come back to without hesitation .

You don't need to go to Fort Worth or anywhere else .

There are not enough stars in your rating system to give them especially Juan Meraz . While our paperwork was being done he chatted with my husband and I like we knew each other for years .

He is so friendly and caring .  He's not pushy and made sure that we were happy with our purchase .  

So go see Juan if you need a car !  I guarantee you will have the best experience and you will drive away happy ! 
 
",5.0
27,"September 18, 2018",Everyone was very friendly and helpful. They were very professional throughout the whole process. Best car buying experience by far!!  I will definitely go back for my next purchase!!,4.8
28,"August 25, 2018",This dealership is fantastic! Jeff Keeling was our salesman and he’s the best! He’s a great guy and made us feel right at home. Everyone we met was very friendly and helpful. Great customer service! Thanks guys! ,5.0
29,"August 18, 2018",Kyle was great to work with and has continued to follow up and make sure we were satisfied with our purchase. He was patient kind and made the process easy for us. Would highly recommend. ,5.0
30,"August 08, 2018","Had a great experience at Mike Brown Ford buying my new F250 thanks to a well qualified and detailed young salesman named “Kyle”.  He was always true to his word, punctual, courteous, friendly, and kept all promises and “deals” as he and the dealership stated. His follow up has been excellent and made this whole experience pleasurable for me. ",4.8
31,"August 08, 2018",Kyle went above and beyond to get me the right deal on a F-350 superduty. I work out of town and he was able to make everything happen over the phone. I showed up the next day and signed for my pickup. Couldn’t be more please with how the whole deal was made super easy and simple. I highly recommend Kyle and the entire mike brown auto group team. I look forward to doing more business with him and maybe mike brown in the future. ,5.0
32,"August 08, 2018",I bought my first car here and everyone that helped me was great! They answered ALL of my dumb questions with a smile on their face. They were very attentive of my needs and wants and they were even kind enough to make follow up calls to make sure everything was running smoothly. In my book they went above and beyond for just one customer. I was extremely satisfied!,5.0
33,"August 08, 2018","Fast and pain free, Kyle made sure everything we needed was taken care of. Very knowledgeable about the vehicles and fords in general, would highly recommend him.",5.0
34,"August 07, 2018",Cindy and the other staff members at Mike Brown were very friendly and went out of their way to help us buy our new car. ,5.0
35,"August 05, 2018",Our experience was wonderful! The staff went over the top to help meet our needs. We will be returning here for our next vehicle purchase in the future. ,5.0
36,"August 01, 2018","Great customer service, Cindy Gavin was very helpful and was not pushy at all. She truly wanted to help me find the right truck for me. I got a great deal and I'm happy! I highly recommend this place.",5.0
37,"July 25, 2018","I am very pleased with our experience of purchasing a vehicle through this dealership.....Again.
I say “Again” because this is our 4th vehicle within a year. Wife, son, daughter and now myself....all own a vehicle from Mike Brown Ford.
Cindy was awesome and helped in every way possible to ensure we were completely satisfied.  Jeff was very helpful as well.  I appreciate everything and will definitely be back when it’s time for another vehicle in our family.
Mike",5.0
38,"July 22, 2018",Cindy Gavin is an exceptional sales woman and i was very pleased with the deal she got for me to get into this truck.  I will definitely recommended Cindy and Mike Brown Ford to anyone who asks where they should look for a vehicle. ,5.0
39,"July 20, 2018","Our salesman Danny Gray 🏆and SM- Johnathan Kilgore R exceptional people. We asked for 3 specifics/they delivered! Great inventory/variety/classy/professional
Cheers!
Lynn",5.0
40,"July 17, 2018",We drove almost an hour to meet with Cindy Gavin to purchase our Ford Edge.  We were very pleased with their attention to detail and the friendliness of the people at this dealership.  We will definitely recommend Cindy as well as Mike Brown Ford to our friends and family.,5.0
41,"July 16, 2018",I would recommend this dealership to anyone. I live three hours away and made the drive to see them. My sales rep Cindy was great! If your looking for a new vehicle look here.,5.0
42,"July 15, 2018","My husband and I bought a 2018 Ford F150 from Michael Whitfield in May. We were in a bind and Mike went right to work making things happen for us.
We came back Saturday looking for a car and again, Mike went right to work for us.
We bought a 2018 Ford Focus Hatchback!
We got a great deal on both vehicles. Thank you Mike for making things happen!
Shout out to the finance guys, Sal and Ty. 
You guys are awesome!",5.0
43,"July 09, 2018",Came in originally to buy a part the day before and got side tracked looking at a new car. Jeremy approached us with a friendly no pressure attitude to help us if we wanted it. We knew we were probably not going to buy a new car but he was so nice we came back to Mike Brown Ford to look at the used lot options since we had to come back for a $4 part the next day. Easiest and fastest car purchase we have ever experienced! Jeff was upfront and made buying a car hassle and frustration free! From the beginning of our search on the lot with Jeff all the way to Ty in financing and finishing up with Cindy (Jeff had a funeral to attend) we just couldn’t have asked for a better experience! We were in and out in less than 2 hours total including looking and test driving multiple times. And there was no shady back and forth about the price because they started with their best price on the Taurus we were interested in and the offer for our trade in from Doyle which was also super friendly! We will definitely come back here for our next car purchase! ,5.0
44,"July 02, 2018",This is my second car I’ve bought here and I’ve always had a great experience. Paul is wonderful and I would recommend him to anyone I know or meet.  ,5.0
45,"June 30, 2018","Because of the inet I already knew what I was looking for. My salesperson, Jeff was really helpful without being high pressure. 
The financial manager Ty was effeicient and knowledgeable. 
The whole process was great! I will recommend Mike Brown Auto Group. Best vehicle buying experience today!",5.0
46,"June 29, 2018","These folks are honest, reasonable and worked hard to get me the best deal possible! I’ll never buy from anyone else! They jumped through hoops to get me behind the wheel of my new truck!",5.0
47,"June 29, 2018","Thank you Rodney for all your help. The whole crew at Mike Brown was great to work with, they made the entire process easy and fast. ",4.8
48,"June 28, 2018",What a fantastic buying experience. Worked with Craig Hoffman and he was a pro. Response to my text and questions was fantastic. He found just what I wanted at the price is was looking for. From test drive to out the door with signed paperwork was under two hours. Best car buying experience ever!,5.0
49,"June 28, 2018","As someone who dislikes the fact that we have to grind through the haggling and headache of buying through a dealer rather than just buying a car ""off the shelf"", I can truly say that this was a great experience beginning to end. Cindy Gavin was a phenomenal sales associate and provided answers, thoughtful insight, and assistance every step of the way. She was very familiar with Ford trucks, as she owns them herself, and was able to provide me with tips, tricks, and a great extended test drive through several different types of terrain. Although I dislike the haggling that comes with car buying in general, I was able to work with Doyle to come to an agreement on price and trade in values. They will push, you just push right back until you find a middle ground. It's just the nature of dealerships and it's understandable. And I didn't have to threaten to walk out to get something reasonable. 

All that to say yes. Yes, this place is worth the drive and blows the big name DFW chains out of the water. I will definitely be purchasing my next vehicle at Mike Brown. ",5.0
50,"June 26, 2018",Easy fast and affordable! Will be a lifelong customer! Michael goes above and beyond to get you what you want and delivered to you ASAP!,5.0
51,"June 26, 2018","I could not be happier with my experience at Mike Brown Ford. We were treated with first class service from our great salesman, Michael Whitfield. He was very prompt when working with us and found exactly what we were looking for in a vehicle. Would definitely recommend him to anyone looking to get a new vehicle. ",5.0
52,"June 26, 2018",Michael Whitfield was a excellent salesman and made they whole process run smooth and thought outside of the box with trying to meet what we were looking for. 10/10 recommendation from me when looking to acquire a new vehicle from thus dealership. They care more about what you are looking for and making the customer happy than trying to get you in a car and get commission off you. ,5.0
53,"June 25, 2018","Rodney is a great salesman, my husband and I enjoyed our time spent with him. We were well taken care of and I love my new ride. Thank you so much for your help Rodney!!!
Tammy and Clint Brashire",5.0
54,"June 18, 2018","Took our 2017 focus in for second time(1st time 7 months prior), George Barclay  in the service took care of us.  Never in our history of dealing with service dept.  of dealerships have we experienced such  outstanding treatment. George was attentive, explained everything that would be done,  how,  why,   when it would new ready,  etc, etc. He made our stay(wait) very pleasant.  When we returned to pick up our vehicle a couple days later, George explained everything that was done,  and any other questions we had. 
We would like to say to Mike brown Ford that mr. Barclay is an asset to the company,  great people skills, knowledgeable in his field.; knows how to treat customers,  not like just a number. He is what quality service treatment is,  thank you for having this gentleman in your employment. ",5.0
55,"June 15, 2018","Craig Hoffman was extremely patient with my 17 yr old daughter Taryn and myself from start to finish. Never once did we feel that Craig was just concerned about getting a sale. Ty in finance answered all my questions with a smile as well as patients with my many questions. I have to say, it was nice leaving after our car purchase not feeling exhausted...  One of my favorite parts was seeing Craig sit in that Ford Focus with Taryn for over 30 minutes explaining the features, programming stuff, and giving her his business card to keep in her car Incase of emergencies or maintenance issues. 
We will differently return to Mike Brown Ford in the future for our putchases. Thank you Craig!",5.0
56,"June 14, 2018",The salesman were outstanding! Nice and respectable but on the other hand the financial agent was very unprofessional. My experience was great until I walked into his office. He actually told me that he didn’t have time to mess with me.  This was very disrespectful to a return customer!,4.8
57,"June 14, 2018",I was please with the vehicle that I revived and the customer support was good. I had a follow up visit with Rodney and he has done a great job with helping me.i would recommend Rodney and mike brown highly.,3.6
58,"June 14, 2018","This is our 5TH VEHICLE to purchase from Jeff Keeling and have never been disappointed! His knowledge, years of experience and superior customer service adds up to a perfect car buying experience!",5.0
59,"June 13, 2018",People were very friendly and welcoming.  Rodney was my salesman and was very helpful throughout the entire process.  I live in San Antonio and made the drive to Granbury and it was well worth my time and effort!!.  I highly recommend buying from them no matter how far away you live.. ,5.0
60,"June 05, 2018",Everyone at Mike Brown dealership was extremely friendly and knowledgeable. All of my questions were answered  Rodney Howard was a great salesman and helped me all the way through until the deal was completed. ,5.0
61,"June 01, 2018",Had an awesome experience thanks to experts at Mike Brown Auto group. A car buying experience that was hassle free and quick. I would highly recommend this dealership to anyone and I would highly recommend letting Rodney “Hot Rod” Howard be your sales consultant. Honest and very hard working to make this all happen. I’ll definitely be back in the future ,5.0
