,Date,Reviews,Ratings
62,"August 01, 2017","Because upon arrival I was greeted with friendly   faces and polite sale person ,and my purchase of a dodge 1500 Ram through the finance department personal was very clear and explainable.",5.0
63,"August 01, 2017",Thank you Michelle Romero for helping us select the best vehicle for our needs. Love the attention and professionalism and excellent customer service. We got a Transit Connect and Michelle showed me every style and explain the difference of each vehicle. We will return next year for our second company vehicle. Must defiantly. ,5.0
64,"July 31, 2017",Great service from service writer David Nguyen.  He did everything possible to help me with explorer.  even tho I bought the Premium warranty my repairs to my Airconditioning was not covered .  David went above the call of duty to try and help me and for that I am thankful.,4.6
65,"July 27, 2017",Everyone is very friendly.  Totally enjoy working with David Nguyen.  David looks out for his customers and keeps them informed with status of repairs.  I normally wait so he is also keeping me updated on time issues as well.  I so missed David late last year when he was out having knee surgery.,4.6
66,"July 19, 2017",David Nguyen kept me updated on progress being made on my car and he answered every call I placed to him. He took time to explain things in words I could understand 😃,5.0
67,"July 12, 2017","My vehicle was due for new tires. I purchased them from the dealer on the Buy 3 get 1 free special. Irvin made sure everything was taken care of. He is a very excellent, trustworthy, and honest Service Advisor. It's Excellent Service Advisors like him and the excellent service he provides is what keeps me bring my vehicle back. Any time I have a issue or basic regular service, he addresses it and gets if resolved/completed. Thank you Irvin.",4.8
68,"July 04, 2017","This review is for the service department. I've taken my Ford Explorer here several times for service and have had a great experience. I want to single out Brian for his excellent customer service.  They make things very easy, even shuttled me to work and back, and you can schedule appointments online or bring in your vehicle same day if need be. Highly recommend",5.0
69,"July 03, 2017","Thank you for your services this is A good quality 
Services thank you for your business,and thank you again 
See you Next time 100%",5.0
70,"May 12, 2017",Hector and Adel at Sterling McCall did everything they could to get me the lowest price on a new F-150. I went to about 5 other dealerships and they beat everybody by about $3k! I will buy from here again and I will recommend everybody buy either new OR used from here! Thank you! ,5.0
71,"May 11, 2017","Ann for customer service call to ask if ebreting was good, and I like that ""what I call customer service.Thank you for everything that yall have done for me.",4.4
72,"April 27, 2017","I was referred by a friend to take my Ford Explorer 2010 Sport Trac to Sterling McCall Ford. I was instructed to discuss my issue with Wally...the GM of the dealership.
 Inspite of his demanding schedule, Wally listened attentively and made sure I was taken care of by members of the service department. Kudos to Jimmy, Ryan, and Bryan. Never have I experienced such hospitality at a dealership. A variety of food, was on hand, for those waiting on repairs and the unexpected free massage. 
I highly recommend Sterling McCall Ford to anyone who wants quality service. Wally has gone above and beyond for me. The experience has exceeded my expectations.",4.4
73,"March 15, 2017","I was invited by the internet manager this morning to come test drive a car that she assured me was in stock. I ubered it to the dealership (not cheap!) right away. Turns out she lied and the car was not there, as it had been sent to auction awhile back. They wasted my time and my money getting there. 

This is a Very unprofessional dealership and I question their ethics as well. Don't bother. There is plenty of competition her in Houston. ",1.0
74,"March 01, 2017",So very happy with my visit...Price is good timing everything went well definitely recommend this place. Irvin was very informative and I appreciated his knowledge ,5.0
75,"September 05, 2016","2 weeks ago I purchased a new Mustang GT from Sterling McCall. Overall the experience could not of bee any better. My salesman, Paul DIamanti came highly recomended.  He was right! They did not have the exact car I wanted on the lot. Paul went above and beyond and drove all the way to Dickinson to get me the one that I wanted.  When you put the level of exsperience and serivce Paul provided, along with a great price you rightfully gain a very happy customer!",4.8
76,"July 27, 2016","Saw an add today and replied to the dealership for info.  They called me 5 minutes later and asked if I was available to see the car today.  I drove 45 minutes from humble to see and drive the car, only to be told it wasn't there and when they did get it, it needed new airbags and touch up work.  They wasted an hour and a half of my time.",1.6
77,"July 12, 2016","It took 5 hours to just do a diagnostic on my 2008 f-150. All their technicians were young kid, just out of school. During the 5 hours waiting, total 6 drivers were complain about the A/C, break, engine overheat, and etc that were still not been solved after 3 visits.",1.6
78,"July 02, 2016",This is the 3rd vehicle we have purchased from Paul and we appreciate his professional and straight forward salesmanship.  We will continue to purchase from him.  ,5.0
79,"June 30, 2016","BROUGHT MY MUSTANG IN FOR A RECALL AND WARRANTY WORK.  ALL OF THE SERVICE WAS DONE PROMPTLY, AND ALL THE PROBLEMS WERE FIXED (THREE SEPARATE ISSUES) CORRECTLY.   THE COST WAS NOMINAL.  I WAS VERY SURPRISED, PLUS THE CAR WAS WASHED AND CLEANED!!!   WOW!!!!!!!!!!!!!!
",5.0
80,"March 05, 2016","I Would Give Sterling  McCall Dealership A 5 Star Rating Because Of The Salesman,Which Was John O'Donnell That  Sat Down And Talked With Me About Purchasing My First Vehicle And Also Mentioning To Me About The First Time Byers Plan, And I Figured I Was Going To Drive Off With A Truck ,But After We Talked About The Prices We Soon Found Out That A Truck Was Way Out Of My Budget ,Which I Completely Understand , And He Told Me ""I'm Going To Get You In A Vehicle You Can Afford,Not In A Vehicle You Cant Afford So He Started Showing Me The New Cars He Had ,Wich  I Could Afford ,So After Looking At Certain Cars I Found One That I Really Liked Which  Was A 2016 Ford Focus ,And Which Is Also A Gas Saver ,I Am Completely Satisfied With The Car I Purchased.
Thanks To The FinanceDepartment
Thanks John O'Donnell ",5.0
81,"March 01, 2016","I have taken my 2014 FX4 to the dealership twice for normal service and a few warranty items. The service was excellent and the service manager, Mike Davis, went out his way to great me and make sure I was satisfied with everything.

With service like that I plan to continue to bring my truck for future services.",5.0
82,"January 17, 2016","Would never recommend anyone to give their business to this dealership, these people are scammers. They do false advertisement to just get the customer in the door and later refuse to honor what they have advertised. Today (1/16/2016 around 7 pm) I was going to close the deal on a new F150 Lariat at Helfman Ford when I saw their listing on Cars.com offering the same truck at a better price. I rushed to their dealership, the first thing I did was show their listings on cars.com to the sales person and asked him if they are offering the Ford F150 Lariat for the same advertised prices and he told me YES and they have a large inventory of them. After wasting multiple hours of my time at 9:30 pm they refused to honor their advertised price and discounts/rebates. When I showed the Manager multiple listings from Sterling McCall Ford on cars.com, he refused to honor the price saying the listings were system glitches. Not one, not two but all listings? what a joke. Just to make my experience worst the Manager had a bad attitude and a rude tone. He also claimed that Ford directly lists their inventory on Cars.com, which luckily his sales person corrected him on and told him that they list their cars themselves on cars.com. I was not bargaining on the price of the Truck, all I asked was they should honor the price they have listed for multiple F150 Lariat Trucks on cars.com, which any reputable business would have done. I think they purposely delayed me so that I couldn't even go back to Helfman Ford, as Helfman closed at 9 pm. 
At this point I was ready to pay them the same price I was paying at Helfman Ford for the same truck as it was a Saturday and I really wanted to close the deal and drive out in a new truck, but they were asking for $3000 more than what Helfman Ford, Autonation and other Ford dealerships (within 30 miles) are selling for. 
I just wanted to share this so people are aware their they do false advertisement and one would only waste time going to their dealership. They are just trying to cheat people and they should be reported. I am going to file a complain with Ford Motor Company as well.

P.S Read other reviews below as well, others also had the same experience.",1.0
83,"December 27, 2015","THEY STEAL!
Took my car in for an airbag light on Christmas eve. Turned out it was just a loose cable. However, it took 2 and a half hours for them to find this. Okay, not a big deal as long as it gets fixed. The only thing I had in there was my gym bag full of sweaty clothes and my prescription sunglasses I have to wear while driving that were tucked away in my gym bag because it was a dark rainy day. I didn't think anything of it because who would want my sweaty clothes? I actually trusted them to just not unzip my bag altogether. BIG mistake. When I got home I noticed rust all over the back of my drivers seat as well as my gym bag. Obviously they had gone through it and taken the only thing of value, my glasses. Spare change was also taken out of cup holders and center console. I immediately called and spoke to the service advisor who had helped me Yuny Yau and after explaining my situation he just hung up on me. I immediately called again and again explaining what had happened but anyone who answered gave me the run around asking me to hold until disconnecting my call or saying they would look into it and call me back or flat out hang up on me this continued until closing time and it being Christmas eve didn't take long. I guess I should've taken my bag out instead of making the mistake of trusting these ""professionals"" not to go through a bag of dirty clothes, ESPECIALLY on Christmas eve. So if you go here, clean out your entire car because they won't hesitate to take anything they can.",1.0
84,"November 06, 2015","Fantastic service by everyone involved. My sale rep Humphrey even delivered the car to my house. I can say enough about the service.

Thank you!",5.0
85,"October 20, 2015","GREAT SERVICE!!   Humphrey (sales) and Ben (service mgr) were awesome!!  Great service, great price and great follow-up service when I needed a few things fixed. Free loaner car service for major needs. I have no complaints!!  There is no such thing as the perfect car dealership, but..they come pretty close!!  Great job Sterling McCall Ford!!",5.0
86,"September 01, 2015","Bought an F150 super crew in December of 2013. Just found out I don't have a wheel lock key when I tried to get a tire repaired. I made 4 attempts to contact customer service but no one gets back with me. Always the same thing - give them the VIN#, phone #, and email address but no gets back with me. Never again.
",1.0
87,"August 11, 2015",My service was awesome!!! Dawn Pajak serviced my vehicle and she was extremely friendly. I will come back for service and send all my friends!!,5.0
88,"July 29, 2015","I had the pleasure of buying my first vehicle from Sterling McCall Ford last weekend. Paul Diamanti made the process so easy and fun. I appreciate him so much for making my first car buying experience a great memory. I would highly recommend him and the GSM, Delano. Delano and Paul are MASTERS at their jobs. They didn't play the numbers game with me, they were just 2 genuine people helping me get the car I wanted. They gave me an excellent deal and I will always go back! Sterling McCall is the best!!! I car shopped for over 2 months and went to every Ford dealership in the Houston area and then 45 miles out, even looked in Austin! Nothing beat Sterling McCall, Paul, or Delano! Thank y'all so much :) I will be back for sure. ",5.0
89,"June 24, 2015","i made a honest review and it somehows it  dissapears. i ivisited there around early june and was given the run around. i asked a price for a truck and was waiting more than an hour to get a price. they said it was brand new and the truck had 600 miles which isnt alot but its not brand new. also i i have a fico score of 820 and was told i can only get a rate for that truck at 6.5%. who ever said adel is the man probably works for him, i can care less but just my opinion. you know how to get a hold of me. salam. 
",1.0
90,"June 24, 2015","I can't say enough good things about Adel Altaie. What a great experience. He is very professional and really cared about my buying decision. He is very helpful, patient, and energetic without being pushy. I highly recommend Adel and rememeber to look for the man in the cowboy hat!",5.0
91,"June 12, 2015","We purchased a 2013 Ford Fusion in July of 2013. There is a trim piece that separates the two panes of glass on each door. Apparently, Ford is aware this piece is designed poorly and needs replacement. When we picked up the vehicle they committed to fixing it before delivery. They did not. First service call to repair the piece ended in a sob story about no having the piece in stock, but they assured us they would call when available. They did not. Second service call to repair the piece same story, but again they assured us they would call when available. They did not. We now have the vehicle in for the third time, same story ""trim department is really backed up, and probably won't be able to fix it, you will need to schedule another appointment for that"". Additionally, they encourage online service scheduling, this is a joke, the service representatives claim to not have access to the registration record, and thus you have to represent all the information again.",1.4
92,"April 18, 2015","We enjoyed our first time buying at Sterling McCall, today 4/17/2015.  The staff was helpfull, Paul Diamanti super friendly, extremely knowledgeable, and not pushy.  We would highly recommend Paul.",5.0
93,"April 08, 2015","This dealer's service department  offers excellent, timely service. They provide transparent billing and are willing to educate the consumer about the pros and cons of each repair option without being overly biased towards what makes them the most money. This is unique in today’s automobile environment. ",4.8
94,"February 25, 2015","I just want to compliment Ben for the great service and follow up to keep me post with the status of my Car 

I think Ben provide the best service I ever received from a Car dealer. 

Thanks allot for everything ! He when Above and Beyond

Apennisi",5.0
95,"February 11, 2015",Mohanad Al Sahaf is a very nice man! Have a great time and experience with him and this dealer! Hope can do it again in the future.,5.0
96,"February 09, 2015",Adel and Ben in service were great to deal with.  I bought a truck from them in mid-January.  I'm happy with my purchase and I am happy with the way they treated and worked with me.  It was a much better experience than I expected!  Thanks.,4.6
97,"February 08, 2015","Paul diamanté was a top notch salesman. He was very professional and got us what we wanted. It was a pleasure to buy my truck from him. And I don't say that often about car salesman. Sorry nothin personal. But top notch service and he was a pleasure to deal with. 
Rhonda briggs",5.0
98,"February 02, 2015","This was my first time buying from a dealership and financing a car. I got there at 5 PM  and left around 7:30. I got a great price for a used 2013 Ford Focus. Mohanad was the sales rep I dealt with. He was friendly, not to aggressive on the sale, and pretty well versed with the features of the car. Once the deal got to finance, I did a bit of waiting for all the paperwork and for the finance manager to try and sell me extended warranties and and interior coating and whatnot. He was a bit pushy but still relatively nice. After signing everything and paying the down payment, I had to do a bit of waiting for my car to get out of the car wash and for the fuel to be put in it. After that, I got my keys and drove off. Pretty smooth transaction with a relatively long (for me) wait time, great experience overall.",4.4
99,"January 30, 2015","I just purchased a used car from Sterling McCall.  The salesman, David Pool, was very helpful, friendly and patient with all of my questions.  Very professional and I would highly recommend David and Sterling McCall.",4.2
100,"January 30, 2015","I came into Sterling McCall Ford in need of trading in my vehicle and to purchase a brand new Ford, as I was walking up to the door, Adel Altaie promptly greeted me and my family with great customer service. Adel helped me get the right truck and worked with me when it came to monthly payments that I could afford. He was an awesome salesman who did not hound us, but instead, helped us. I loved every my experience on Saturday especially at 8AM!!",5.0
101,"January 28, 2015","I found a used car I was interested in through autotrader.  Sent a quick email to see if the car was available to look at and test drive.  Kelton showed me the car and we took it for a spin around the area.  Kelton provided me with a carfax report for the vehicle and ran a few different scenarios that I requested to see what the monthly payments would be.  It was a low stress and enjoyable day.  No bull, just straightforward business deal.  ",5.0
102,"January 17, 2015","Mohanad Al Sahaf is the true hero of this story!  What started as a hybrid battery service (which would prove too costly) became a search for the perfect used SUV for me.  Mohanad and his peers gave me a generous offer on the cost of my broken down trade-in, and suffered through my difficulty in finding ""the right buy.""  

Traditionally, I'm a truly skeptical buyer, and I'm plagued by my indecision when it comes to large purchases.  When it became clear that this location did not have a used vehicle on the lot to satisfy my ""picky-ness,""  Mohanad stepped up!  

Mohanad humbly and selflessly spent a better part of two days with me in his office, searching vehicle after vehicle throughout Sterling McCall's numerous locations online.  Whenever we found a contender, Mohanad would selflessly travel near or far (even as far as KINGWOOD) to show me a vehicle.  After several tries, Mohanad brought me my low mileage Honda CRV and, after a week of ownership, I couldn't be happier!!!!!  

If you're on the edge between service and purchasing, please let Mohanad and his peers at Sterling McCall Ford help show you your options.  You won't be disappointed!!!!!",4.6
103,"January 10, 2015","I spoke with Delano over the phone about needing a car. I told him what my needs were and the price range I was looking at. I told him my car preference and he found just what I was looking for, with one exception, it was better than what I asked for.

Listen, I could go on and on and on about the great service I received but, the real deal is that this dealership is NO JOKE! They are for real. GREAT customer service and PROFESSIONALS through and through. Two thumbs up and a high five to Delano and Tosh, TRUE professionals. I HIGHLY recommend this dealership and sales team.

To the dealership and all the personnel, including the support staff you never get to see,  who made my experience pleasant...... THANKS!!! ",4.8
104,"January 08, 2015",Mr. Loera provided and excellent service during my experience in the service department. I did not have any appointment that day but had time to put my car to service and he welcomed my request. My car was serviced exactly as the time he had provided. He went out of his way to provide documentations that I requested and explained everything in detailed. He provided me assurance. He is a GEM. I would recommend their service department. ,4.4
105,"January 07, 2015",Had a very breezy experience here! Mary is so friendly and makes buying a car less tiring and more cheerful! :) She helped find me a new car based on my specifications and it fit like an old glove. Thanks Mary & Sterling McCall!,5.0
106,"January 07, 2015","I HAD AN AMAZING EXPERIENCE AT STERLING MCCALL FORD. THEY DIDN'T EVEN HAVE WHAT I WAS LOOKING FOR BUT WENT TO THE TROUBLE TO FIND IT FOR ME. IT IS EXACTLY WHAT I WANTED . I WILL DEFINITELY BE BACK NEXT TIME. THANKS DELANO AND MELISSA.
",5.0
107,"January 06, 2015",I was very happy with my experience. I came in looking for a good deal and everybody was extremely friendly and welcoming. I will certainly recommend.,5.0
108,"January 05, 2015","I went to Sterling McCall expecting to only browse the cars on the used lot. I came out two days later with a 2013 Ford Focus SE, no down payment and shockingly low payments. it was amazing. From the moment I stepped on the lot I was taken great care of. Humphrey and Aymen are wonderful at what they do. I only waited about 45 minutes to an hour to drive off with my new car. It was no problem for me waiting, because mr. Humphrey made that time so fun, entertaining and hilarious the conversation was great and I thank you for the amazing amazing amazing service that you gave! I will definitely go back to Humphrey for my next car! ??????",5.0
109,"January 04, 2015","In over 20years of purchasing trucks Sterling McCall Ford has provided the best overall customer service and satisfaction from GM Mr.Palmer who made sure everything ran smoothly and efficiently. Even when the truck I wanted was out of stock he went above and beyond to locate and have the truck on his site for purchase within 24 hours. 

My salesman Mr.Logan provided me with excellent service A class guy.

Sterling McCall was able to get me the best price intown,very professional, very satisfied with the again A class experience. Highly recommended Sterling McCall Ford for there honesty and integrity. 

Will definitely buy from them on my next truck purchase.

Herman",5.0
110,"January 04, 2015",Mr.Delano Palmer went above and beyond for me and my family...I can't say thank you enough for his awesome service he provided for us. We got everything we wanted and more.,5.0
111,"December 17, 2014",Purchased a Ford pickup truck from Logan and he was outstanding. Great attitude and customer service. was very honest and not pushy. Finance manager Travis was awesome and very informative. This is our second purchase from Sterling McCall Ford and we will not go anywhere else. Everyone was very welcoming and the GM was very friendly and made sure we were taken care of from beginning to end. Thank you Guys!!!,5.0
112,"October 06, 2014","We all know how dealers can be... rude, high priced, drive your car around, and so on. 

This dealership really seems to be trying to NOT be any of those. They have made significant changes in their collision/auto body shop office and the rude attitude is gone and the new law of the land is professionalism. 

As for oil changes and auto inspections, I choose to get them here because they are price competitive and can do a routine inspection for things you actually need instead of trying to find things to jack up sales like other shops.   And, recently I have been receiving a hand wash car wash free after they are done with the work. I don't see anyone else doing that. I also like that I can receive a free shuttle ride to downtown and back when I need to leave the vehicle there - though sometimes the shuttle isn't convenient with pickup times due to my work schedule, it is nonetheless a free shuttle service.

I have been through the ugly times and since 2010 when I started going there, they have been getting better and better. I will always remain vigilant and call out any crap, but so far, of complaints that I had made in the past, changes were made and the shop improved with the corrective changes they made.  The car business isn't one that I would call friendly, or honest, but so far, I have been impressed with the changes made. I realize that things can go wrong, but when they do, how they are now handling things has been a huge improvement and shows that they really are trying to improve.  ",4.8
