,Date,Reviews,Ratings
62,"May 30, 2018","From the beginning to the very end, we had the absolute best salesman and overall great service. These guys at Mime Brown are easy to talk to and very knowledgeable.  Our salesman, Rodney Howard, took it upon himself to look up different websites and printing out some stuff we needed for my daughter that is going to need a handicap accessible van. Seriously just an overall good experience. A special shoutout to Jonathon Kilgore for hooking us up with Rodney!  Thank you Mike Brown.  I will definitely be referring people to your dealership!! 

Sincerely,

Leisha Mitchell",5.0
63,"May 29, 2018",Rodney Howard treated me with the upmost respect and Honesty. I would highly recommend Rodney and mike brown auto group to anyone. I will definitely be back to see hot rod!,5.0
64,"May 24, 2018","My husband and I have bought dozens of cars between the two of us and this was the first time we weren’t spoken ‘at’ but rather listened ‘to’. Rodney and Danny know how to listen and get things done. They’re gentlemen and care about their customers. We left feeling we made a great deal, thanks guys! ",5.0
65,"May 24, 2018",Rodney is the guy you need to see for a great deal. He really cares about his clients abbed wants to make sure he puts you in the right car for your needs. He is very caring and genuine! Definitely will be buying my next vehicle from Rodney.,5.0
66,"May 24, 2018","Excellent!! Couldn't be happier or pleased, professional all the way!! Juan is my man! Thank You! I would recommend the dealership to everyone! Happy!",5.0
67,"May 23, 2018","I purchased my very first car in my name today, a 2018 Ford Explorer. I knew exactly what I wanted and how much I wanted to spend. Mike Whitfield was an amazing salesman. He wasn’t pushy at all and helped me get the best deal possible. I also really appreciate the finance guy, Ty I believe was his name. He wasn’t pushy at all with the extended warranties. I am from the metroplex, and the dealerships there are awful compared to the amazing customer service I received at Mike Brown Ford. They have made customers for life. ",5.0
68,"May 17, 2018",Just purchased a 2018 Mustang for my son. The dealership made everything so easy and worked extensively with me to customize our vehicle.  The purchase process could not have been better. Juan arranged a loaner for me twice while some additions were being made to the car. ,5.0
69,"May 16, 2018",Juan helped me so much trying to find the perfect car and did it. He is awesome and recommend him to any one looking for a vehicle. ,5.0
70,"May 14, 2018",Juan made my car buying experience so awesome! He made sure that all my questions about the car were answered and showed me how everything works. He truly cares about his customers and it shows. Wouldn't have wanted to get my first car from any other dealer in town. ,5.0
71,"May 12, 2018",Mike Brown auto is a great place to do business with.  I’ve been doing business with them ever sense they opened the doors at the old Hooks dealership.  I’ve always got a good deal and have been treated fair.  That being said the last purchase I made on 4-18 was amazing. Juan at the Ford dealership worked very hard making this deal come together while I was out of state. Juan handled it all over the phone so all we had to do was drive back make the trade and I was back on the road. This transaction reminded me of when I used to buy from Jole Rogers.  Keep up the great work Juan your a valuable asset to Mike Brown auto group you would make a great manager.  ,5.0
72,"May 09, 2018","What a great experience. We have both been looking for pickups for several months and couldn’t find exactly what we wanted (and we were getting really tired of salesman trying to sell us something we knew we didn’t want.) Michael Whitfield with Mike Brown Ford was highly recommended.  What a God send.  He got us exactly what we wanted. He went above and beyond to make my wish come true with a special color and install a B&W gooseneck hitch (this is the brand of companion fifth wheel we have).  To summarize; we got exactly what we wanted in a timely matter, good prices and a very fair trade in value. The entire experience was so enjoyable and fun. Thank you Michael Whitfield.   We will be back!",4.8
73,"May 07, 2018","This is the third pickup I have purchased from Mike Brown Ford. I keep going back because of the way I am treated. Craig does everything possible to get me the best deals to be had. I have worked with Craig before on buying a pickup, and I will continue to work with him in the future!",5.0
74,"May 06, 2018", The dealership is great they actually contacted me I’m a dodge man myself I really like died but the mike brown  ford house showed me that they really cared and wanted to sell me a vehicle and they sold me a good one for the first time in my life,4.8
75,"May 05, 2018","The Escape is the second vehicle that Marie and I have purchased from Craig.  As with the 2016 F250, he took very good care of us.  He answered all of our questions and made the buying experience very pleasant.  He was very professional during the process and followed up after the sale.  When we purchase another vehicle, we will definitely visit with Craig again. ",5.0
76,"May 01, 2018",Michael Whitfield makes the experience of buying a new vehicle enjoyable. He is an honest and knowledgeable salesman. I would definitely purchase another vehicle from him. ,5.0
77,"April 29, 2018","We went in looking for a specific vehicle, unfortunately it had already been sold. Rodney helped us look for other vehicles in our price range and we had several options. They gave me a GREAT offer on my trade in and price on our new vehicle. After going to see one more vehicle at another dealership and seeing their lack of professionalism compared to Mike Brown Ford, we left and called up Rodney. By the time I got back the paperwork and new car were about ready, I signed and left in our new vehicle in record time. Thanks Rodney and Mike Brown Ford!",5.0
78,"April 29, 2018","The salesman was strait forward, honest, with no typical rip you off games! I got a Great truck for much less than other dealerships offered. He searched until he found just what i wanted. Its the second truck we have bought from him in less than one year. We will buy from these guys again!!! Our salesman i Michael Whitfield.",5.0
79,"April 28, 2018","Needed a new work truck and Mike set us up with exactly what we needed , it will work great for us . We will for sure be back in the future ",4.8
80,"April 28, 2018", Rodney in used car sales was fabulous. I specific additions to my work truck and got them done exactly as I wanted at the price I wanted. The dealership kept me informed throughout the process and even called me back once because they thought my call wasn't picked up in the department I had asked for.,4.6
81,"April 28, 2018","We were out of state customers looking for a specific vehicle. Our salesman, Mike West, was extremely responsive and accommodating to our requests & questions. Buying a vehicle sight unseen can be tricky but it was made easy with quick responses & pictures as we went along. The negotiation process was painless and we were very happy with the outcome. Mike went above & beyond to fulfill a special request for the rims to be replaced and coordinated the process for us.
We would happily refer anyone to Mike Brown Ford.",5.0
82,"April 27, 2018",This is the 4th vehicle my family has bought from Rodney at Mike Brown and we couldn’t be happier!! He takes the time to get to know you and has a very contagious happiness!! He will do whatever you ask of him even if it takes him 3 hours in the cold. I just want to say thank you so much to Rodney and Mike Brown for taking care of your customers!! ,5.0
83,"April 27, 2018",Good people and a great deal! Cindy Bowen helped me find the perfect car that fit in my budget. I will definitely recommend Mike Brown and will certainly buy my next vehicle from a Cindy again.,5.0
84,"April 25, 2018","We went to the dealership and met with Kyle Phillips and he was awesome! Answered every question and wanted to know what we were looking for. Sold us the oldest vehicle on a Dodge lot next door. He never turned us over to someone else. He hung in there and is truly a nice guy and I will definitely buy another vehicle from him. Mike Brown, you truly have an ace in the hole with Kyle Phillips!",5.0
85,"April 25, 2018","This is the second purchase I have made with Rodney at Mike Brown, He is a humble straight shooter, He has personally gone out of his way to assure satisfaction after the sale, called me several times to insure satisfaction. I would recommend Rodney and Mike Brown dealerships to anyone looking to purchase new or used transportation, It has been a absolute pleasure dealing with this Dealership..",5.0
86,"April 24, 2018",Juan was very helpful as soon as we stepped on the lot! He answered all my questions and wasn’t pushy... very happy with my purchase! Thank you!,5.0
87,"April 23, 2018",Juan knew exactly what I was wanting and was great at finding a car for me. I am very happy with the car I got. ,5.0
88,"April 21, 2018","This is our 4th vechile to purchase from Rodney, he is one of a kind and truly cares about his customers. That is very important to us which is the reason we keep coming back. ",5.0
89,"April 21, 2018","Very friendly and knowledgeable associate (Cindy). Made me feel very comfortable, no pressuring me for a decision right away. I walked away having to think or sleep on before making a decision. ",5.0
90,"April 20, 2018","We went looking for a used suv at Mike Brown Ford. Their sales associate, Cindy Bowen was so helpful and knowledgeable! We will definitely be back.",4.8
91,"April 17, 2018",We have used mike brown five separate times now purchasing vehicles. We would not go anywhere else. The guys at mike brown make the buying experience painless. I would highly recommend them wheather you are buying new or used cars. ,5.0
92,"April 17, 2018",My first time buying a car from a dealership and it was an all around great experience. Took a lot less time then I thought. Would come back. ,5.0
93,"April 17, 2018",Best car buying experience my husband and I have ever had! Mike and the team were super sweet and helpful and took the time to explain everything to us and answer all of our questions! They had us in our new car and on our way quick and easy! We will be back!,5.0
94,"April 16, 2018","I am so thankful to have made my first ""big girl"" purchase with Mike Brown Ford!! Jeff and Cindy were so kind and helpful! Thank y'all so much!",5.0
95,"April 16, 2018",Mike Whitfield went above and beyond to get us a great truck!! Mike has always worked hard to get us what we wanted in a new vehicle. ,5.0
96,"April 16, 2018","Rodney “Hot Rod” made my experience very easy and not complicated. I have bought a car from him in past and the experience was the same, easy going. ",5.0
97,"April 14, 2018",Matt was so helpful and did what he could to get my deal done.  I'd recommend him to anyone looking for their next car.  Incredibly happy with my certified mustang Gt! ,5.0
98,"April 13, 2018",I had a great experience at this dealership.  No pressure from the salesman and he really made sure we found the right vehicle.  And closing was quick and easy.  ,5.0
99,"April 13, 2018","Working with this dealership and Mike Whitfield was such a positive experience.
I would highly recommend anyone looking for a good honest experience buying a car or truck to this dealer.",5.0
100,"April 13, 2018",10th vehicle purchase from Michael Whitfield @Mike Brown Ford. Both for personal and our business fleet for Streeter Electric. He is always helpful and goes the extra step to keep his customers happy and coming back. ,4.8
101,"April 13, 2018",Every face meets and greets you with a smile made the entire thing a lot easier and comfortable. I will definitely be back again . Juan Meraz will be always be our go to guy when it comes to a vehicle . ,5.0
102,"April 12, 2018",We have purchased several vehicles through Jeff Keeling and he’s personalble and on top of things. Jeff makes sure not only his part of the deal runs smooth but that all do for his clients. Great salesman! ,5.0
103,"April 12, 2018",Cindy is fantastic and so very helpful. Tell her what you want and she does everything she can to get you it at the best price possible ,5.0
104,"April 11, 2018",This is the second truck I’ve bought from Michael Whitfield at mike brown and he is excellent at what he does. Very thoughtful of everything and thorough. Will only buy from mike brown and Michael Whitfield ,5.0
105,"April 11, 2018",Excellent customer service and great selection of vehicles to test drive. Mr. Keeling was very knowledgeable and went through each vehicle extensively to make sure we knew how each feature worked on every vehicle. ,5.0
106,"April 11, 2018",Jeff Keeling makes the buying process so easy! His level of experience and the personal service he provides far exceeds any other car buying experience I've had!,5.0
107,"April 11, 2018",Juan is a wonderful representative for Mike Brown. It was a cold day to be shopping for a vehicle but that did not stop him from helping us to find what we wanted. We love our car and we are so happy that Juan was so patient and answered all of our questions and offered extra guidance. Thanks again Juan. ,5.0
108,"April 11, 2018","Me and my husband have gone through cindy to get all of our vehicles. She has helped us not only pick out vehicles we love, but made sure they where in our price range. She was also great with our daughter. We will definetly be using her for any future vehicle purchase.",5.0
109,"April 11, 2018",I would highly recommend Cindy Bowen . She was our sales lady . We will use her again anytime  we need another vehicle. Thank you Cindy for being so caring about our needs.,5.0
110,"April 10, 2018",I highly recommend this dealership for purchasing your new vehicle. Great selection of vehicles and friendly staff. My sales rep Cindy Bowen provided me with all the help i needed in finding the right vehicle for me. ,5.0
111,"April 10, 2018",I saw what I wanted online and was able to work with Cindy over the phone to secure the purchase of the vehicle I wanted with no problems. This is not the first nor the last time I go to Cindy for my used car needs. She was extremely helpful every time. Thank you Cindy.,5.0
112,"April 10, 2018","I highly recommend this dealership, by far the best experience I’ve had to date purchasing a vehicle, Juan was great!Ty in Finance was great! They went above and beyond to help. ",5.0
113,"April 10, 2018",Juan at Mike Brown ford has been awesome helping us buy vehicles. We’ve  bought 5 cars from here. Juan is very helpful and trustworthy! ,4.6
114,"April 10, 2018","Last year was my first time purchasing my very first vehicle, I bought a pre-owned 2014 Jeep Cherokee. Juan Meraz was my car salesman, He made buying a car such an easy & wonderful experience. This was my first time purchasing anything without my parents co signing which made it even more nerve wracking. But Juan came in on his day off to sell me my dream vehicle, which I thought showed tremendous customer service. He had everything already set up for a smooth transaction. Upon driving the vehicle home I notice a few small Scratches, Juan had taken time to get those bluffed out. He had everything taken care of even on his day off. He turned what could've been a nightmare (being a first time car owner) into a good experience also giving me the best price possible. Juan was extremely professional and very considerate on what I wanted. I will definitely be doing business again, if I need anything in the future (soon) I definitely would make the trip to Granbury. Thanks for everything you helped with during this transaction, Juan! ",5.0
115,"April 10, 2018","Juan meraz at Mike Brown helped me get into my dream car!!! He made my car buying experience great, making sure that i left in the exact car that I wanted and stayed in my price range! I highly recommend his service to anyone looking to purchase a vehicle. You will feel totally comfortable and it's service with a smile.  I have no doubt that he will help you the way he helped me! ",5.0
116,"April 10, 2018",The service there was amazing. Everybody there was nice and patient. Thanks to Juan Meraz he really dicussed to me about all the vehicles and was really patient with me on my choice of vehicle. He helped me out a lot and I’m glad I went to him. If anybody needs help go to Juan Meraz!!,5.0
117,"April 10, 2018","I have purchased 3 vehicles from Cindy Bowen!  She has always been so professional and knowledgeable.  If I had questions before the purchase about any vehicle, shebwas always there to answer them.  She is easy to work and makes me want to continue to com back to Mke Brown!  THANK YOU CINDY for all your car buying guidance!",5.0
118,"April 10, 2018","While having my wife's Edge serviced, we decided to look at trucks. We were planning to buy a travel trailer and needed to know towing capabilities etc. of certain models. Kyle Phillips was the young man who assisted us that day. We informed him we were on a fact finding mission and that it would be at least a month before we'd be able to commit to anything. Kyle and I traded info and over the course of the next 5 weeks kept in contact by phone or email. When it got closer to our being ready to buy I sent Kyle a list of what I wanted. He said he had a couple he thought I'd like. The first one he showed us had everything we wanted and more but at a price that was right.

Kyle was professional and friendly as well as very knowledgeable about all things Ford. He assisted in choosing a tonneau cover and made arrangements for its installation. Kyle is an incredible young man with bright future ahead of him. Since the purchase, he has called to follow up on any questions I might have or issues. The entire staff was very courteous and helpful but Kyle stands out.
I recommend him highly.  

Of course I had hoped that Kyle would have gifted the truck to me because of my winning personality, but alas, I know he and the dealership have to make a living. But he still gets high praise,  my deep appreciation and recommendation to friends. Thanks.

Rev. Billy D Strayhorn",5.0
119,"April 08, 2018","I have been going to this dealership since my junior year, of course with my parents. This is the 3rd car I have gotten from them. They have great service! Always offering wonderful things, such as drinks and hopefully food. 
I recommend Rodney AKA Hor Rod! He has done such great things for me and my family! God bless! ??",5.0
120,"April 08, 2018",This was our second vehicle purchase and once again awesome experience. Troy Young is on top of every question and does not give you the run around. Awesome job.  Thanks Troy and Mike brown ,5.0
121,"April 07, 2018",This was by far one of the easiest purchases I have ever been involved with. Between Troy and Rodney they were very professional. I would definitely recommend either one of these guys and this dealership ,5.0
122,"April 02, 2018",Best car service I’ve had in a long time. I deftianly recommend Rodney as a car sales men. Very good! Very friendly!! Excactly service!! ,5.0
123,"March 30, 2018",Troy was absolutely amazing made buying a car so easy definitely plan to go back again when we’re ready to buy us another vehicle ,5.0
124,"March 28, 2018","We appreciate so much the willingness of Rodney to help us get the perfect vehicle for our family and for Chad being so kind to help us get the best deal possible. We appreciate Joe, very much also, for being so patient and willing to help throughout our very long process. You all were so patient when it came to dealing with our child (who was anything but cooperative through the process). It was such a great experience and I will recommend Rodney to EVERYONE and will definitely be back in the future to work with him again! Thanks guys!",5.0
125,"March 22, 2018",Rodney is a great guy. Very helpful. Went in to buy parts for my truck drove off in a Jeep. Thanks Rodney I really appreciate your help. You were really easy to work with and made me feel at home. You didn’t judge me by 1st appearance with my old ragged grease and oil stained clothes. ,5.0
126,"March 16, 2018",These guys worked very hard to make sure we had the truck we wanted for a payment we were comfortable with. Thank you for caring about your customers! ,4.8
127,"March 16, 2018",Rodney is great and we had a wonderful experience. I appreciate Rodney’s enthusiasm and straight forward approach. I will definitely refer my friends to him and Mike Brown dealerships.,5.0
128,"March 16, 2018",Friendly and reasonable salesman picked a pickup for myself and my wife when we were looking for something else. Troy made an excellent choice from picking out of whole lot and it was an easy process of purchasing it. No cheating on the paperwork. A honest dealership we ever been to in a long time. ,5.0
129,"March 11, 2018",We had a great experience with the purchase of our vehicle. We highly recommend Troy at Mike Brown auto when looking for a new or used vehicle. He was very informative and made sure all of our questions were answered before making our purchase! ,5.0
130,"March 10, 2018",The White family just became part of the Mike Brown family. I’m blessed to have partnered with Rodney and Kevin for our new truck! ,5.0
131,"March 08, 2018","We had the best sevice. Everyone was very nice and very informative. We would recommend Mike Brown auto to anyone. We will be back.
Thank you",5.0
132,"March 01, 2018","We almost got a car here, I  made an offer, the offer was accepted, they got all the paper work ready and decided to have them run my credit to see if could qualify for better APR and just never heard back from anyone and a day later, I get an email that they sold to someone else. Very poor ethics and claim to be genuine and family owned. You don't agree to make a sale and get all the documents prepared and ready to go to turn around and sale to someone else. I will NEVER do business with this place. ",2.0
133,"March 01, 2018",Kyle was great in helping walk me through all of the questions that I had as a first time car buyer. He was patient with my little to no knowledge as well as with my dad who knows a great deal. He was extremely knowledgable and if he didn't know the answer to one of my questions he would call me by the end of the day with an answer. I would highly recommend him and this dealership!,5.0
134,"February 26, 2018",This place was great they were patient with finding me something that was feasible with my budget they were all very friendly and found the right car that fit all my needs ,4.8
135,"February 25, 2018",Michael Wes extremely helpful and made my purchase quick and easy. He also answered and returned calls quickly. Will definitely be a returning customer in the future.,5.0
136,"February 20, 2018",My car buying experience was the best yet! There was no pressure and everything went so smooth. Thank you Mike Brown Ford and Michael Whitfield for helping me find the perfect vehicle! ,5.0
137,"February 16, 2018","My sister purchased a new Hyundai Santa Fe SUV from Mike Brown Hyundai in 2013 and highly recommended the Santa Fe model and this dealership, so I went to Mike Brown Hyundai this week (2/13/18) to purchase a pre-owned 2014 Hyundai Santa Fe SUV. I was very pleased with the sales experience and especially the kind helpfulness of the sales associate, Michael Garr. I am also very pleased with the SUV.",5.0
138,"January 01, 2018","I appreciated working with Michael Whitfield. I traded both my vehicles toward a 2018 Ford Excape which handles like a dream. I love my new car.
",5.0
139,"November 29, 2017",We absolutely love Craig Hoffman and will deal with no other sales person. And Ty in finance works very hard to get you the best rate.,5.0
140,"September 08, 2017",Awesome to deal with and they even trade both our trucks in for new vehicles and saved us over 500 a month.  No hassle from sales department.  The parts dept added all of my accessories at high level of quad well. ,5.0
141,"April 06, 2017","After a couple of months, at least, they had to replace something called a TCU so my car could sync wither the Ford Pass.  Took a while to figure out what was wrong, but once found the cause , ordered the part needing replaced, it now works perfectly!  Can't remember the techs name, but he was great. ",5.0
142,"December 30, 2016","Micheal Whitfield was excellent the easiest purchase ever, Ty in finance office was excellent as well. Micheal has earned my future business, and i buy a lot of vehicles.",5.0
143,"December 21, 2016","These guy were very professional, knowledgeable and friendly. I love my car! I will be recommending them to all my friends! Thank you Mike Brown Ford.",5.0
144,"September 07, 2016","As soon as I came thru the doors at Mike Brown Ford I was greeted with friendliness and a hand shake by Paul. Seriously, you don't get that type of service anymore starting out folks! Paul asked me ""How could he help me and what type of vehicle are you looking for? Paul was no pushy salesman and was patient thru out my search for the truck I was looking for and was very knowledgeable of the different type trucks he was showing me. Fuel mileage, Engine size, towing limits, characteristics of the truck and wide array of features, etc... Not only was Paul helpful but the entire staff of sales people to Joe the finance manager were friendly and helped me with any questions I might have while I was there.
 I purchased a brand new 2016 Ford 150 XLT and it is by far the BEST TRUCK I have ever owned! When its time to get another truck I am going back to Mike Brown Ford in Granbury. Tx.",4.6
