,Date,Reviews,Ratings
0,"June 04, 2020","When people want the sales they are aggressive ,  but lack of response after the sales, Ford dealership on US 59 is horrible!!!! Calls are never returned or texted with answers!!! Sterling Mc Call sales need work !!!",2.0
1,"May 29, 2020","I believe in Buyer Beware.  Buyers need to do their due diligence and Sellers don’t need to disclose everything they think or know is wrong with the vehicle.  BUT they do need to answer questions honestly when asked and paperwork that is part of the transaction needs to be truthful and correct.

I purchased a used Ford Expedition from Sterling McCall “As-Is” which means that Sterling McCall is under no obligation to fix things once the transaction is complete and the vehicle leaves the lot.  This is not however a license to engage in fraud, which is what they did…read on!

The first thing I asked after the test drive was “Has the vehicle been inspected?”  I was told that is had been inspected.  Specifically, the Salesman said “We don’t put vehicles on our lot unless we inspect it first. Sir!”  It is in quotes because that is what he said.  I requested a copy of the report and moved to the next step, financing.  

The Finance Manager handed me a document that he told me was the inspection report for the vehicle.  I reviewed the document carefully and it showed that the vehicle had been thoroughly inspected by the dealership.  All the major systems, including AC were checked as functional.  I asked for a copy of the report and was told by the Finance Manager that it would be provided as part of the file associated with the sale of the vehicle.  Specifically, the Finance Manager said “Of course, of course, no problem, I’ll add it to the file.”

Well, I found out later that he did not add it to the file, and I did not notice that the Inspection Report was not part of the documents I received at closing because I did not recheck the file before I left.  My bad, I guess.

Over the next couple of days I noticed there were a few issues with the vehicle, like the AC was not cooling.  I also noticed that the passenger seat squeaked when driving.  I moved the seat and saw that the bolts that hold the seat in place were not fully tightened to the floorboard.  In fact, they were barely threaded.

I had the AC checked by my mechanic because I thought it might just be low on Freon which is an easy fix.  I was told by 2 mechanics (just to make sure) that parts were missing.  Based on this information, the only conclusion you can reach is that there is that the dealership never inspected the AC prior to the sale and the inspection report was forged.  This is not a case of “It must have broke after you left…”  The unit could not work in it's current state of missing parts.

Full disclosure again, it was cool the day I test drove the vehicle and I relied on the inspection report as full disclosure of the condition of the vehicle to close the sale.

I returned to the dealership and was told that they could not fix any of the items (there were a few others) because they were not safety related issues.  The bolts being loose on the passenger seat are not a safety issue.  Really?  Wanna go for a ride??

I told the General Sales Manager that I was given a copy of the inspection report for the vehicle and all major systems, including the AC, were checked as functioning.  Before even discussing any of the issues I had mentioned, she asked for the Inspection Report.  It was almost too quickly, like she knew something I did not.  Sure enough when I checked the file there was no inspection report.

I met with the Salesperson and finally the Finance manager involved in the original transaction.  They both claimed that they had no idea which document I was referring too and that their vehicles only receive a safety inspection.

I realized at that moment that they had a system in place to defraud people so why frustrate myself asking for an honest answer from dishonest people.

There is a pattern and practice at Sterling McCall to lie to customers by providing documentation that the used vehicles are fully inspected when in fact they are not.
 
I learned my lesson.  Get every vehicle independently inspected because people lie.  And spend your money with someone who values honest dealing.  Sterling McCall does not.",1.4
2,"April 15, 2020",I have no complaints! I had a problem with my trick! I took it in to Drew. He found out what the problem was and fixed it! I have no complaints he did a good job in a timely manner! I recommend him! He’s awesome!,5.0
3,"February 22, 2020","Went there yesterday 2/21/2020 after seeing a great deal online. I clicked the “schedule my test drive.” Ahmed texted me and said it was ready to look at. When I get there, they “can’t find it” but do I want to look at something else. I asked if I can get the same price on another one but they say the price is only available on the one they can’t find.

SCAM, Bait and switch scam. 

Don’t waste your time with this dealership and especially don’t waste your time with Ahmed. 

VIN #: 1FTEW1E43KFD14005
Stock #: KFD14005
Status: In Stock
",1.0
4,"December 04, 2019","My experience with Ford and now Sterling McCall has been nothing short of horrible. Not only have there been 3 recalls on my car but when I dropped my vehicle off to get the recall work done , I was told that now I have to come up with an additional $500+ to fix something that is a result of the horrible vehicle Ford created.  I will never purchase a Ford again and the people that work in the service department are complicate in their actions. Not only did they string me along for 3 days before the news was broken , they then extended the work an extra day(so far).  Stay clear of this establishment if you want fair treatment.  UPDATE , sitting in the lobby they have now told me that my transmission recall work and now my warranty do not cover all of the work done on my vehicle and now they want $800 and lowering it to $500 would be ""helping"" me out.  The service agent of the day(Jerry Quick) is now saying if I put a negative review online they definitely make me pay the higher amount that I did not agree to. Do not deal with this company unless you are willing to fight them to do the right thing.  Horrible dealership service experience.  Jerry Quick was today's service advisor, my 3rd in 3 days and they have all told me something different.",1.0
5,"November 02, 2019","I’ve never dealt with such an unethical car dealership as Sterling McCall Ford. I truly thought this would be the easiest sale they had all week.  I already knew the vehicle I wanted, which they had in stock.  I submitted my “accelerated” financing application online, provided them with the information for a $500 deposit so I could make sure they held it for me for a few days. First bad feeling was when I asked if they could provide me with the pricing to ensure they would honor their internet sales price.  They said they couldn’t because it was the end of the month and when I came in at the beginning of the next month they could change.  I brushed it off and still moved forward. My husband and I arrived today and we got our second bad feeling.  They had moved the vehicle I wanted to the showroom floor and they wouldn’t move it outside so I could drive it.  They wanted me to speak to financing first.   When the finance guy came out with the numbers, the payment was literally $250 more a month than the internet pricing that was quoted AFTER they ran my credit.  After much debate, including some very shady pricing (at one point he claimed we’d have to pay a local sales tax, which is NOT true) we chewed them down within $20 of what we wanted to pay - but get this, they still would not allow us to drive the vehicle until financing had been completed.  Outrageous!  We walked!",1.0
6,"October 29, 2019",Coming for oil change  and battery test . First battery ok then when finished with oil change .   Vehicle will not start now I need a battery Advertise says battery 99 to 129 now 184,1.0
7,"October 18, 2019","First off, This has no reflection on the Salesperson I was working with. But the sale's manager. After spending 6 weeks comparing 2018 F150 XLT's , It was clear I had a real good idea what I wanted in a 2 year old NEW TRUCK. 

I arrived at the dealership one hour before opening, just to make sure the F150 XLT 5.0lt 4x4 was on the lot. The salesperson I was working with arrived. We test drove the truck and I made an offer of 33.500.00.  this was based off of the real window sticker, not the made up window sticker placed inside the truck, the dealership showed on their website the MSRP was 51,210.00, (really this was the Total Before Discounts price of the F150) with a dealer discount of 11,550.00,  the real window sticker I downloaded off their webpage showed a MSRP of 49,210.00. 

Again after 6 weeks of comparing 2018 F150 XLT's I also had a real good idea of the discounts being offer by the dealer within 100 miles of Houston. These discounts being offered where from 16.000.00 to 20.000.00 off MSRP. And my offer of 33.500.00 was based on the advertised discount flashing on the Great big sign in the front of the Dealership saying. 15.888.00 off all 2018 F150 XLT. (A get them in the door sign)

Here is where it gets to the interesting part. My Salesperson when back to the sales manager with my offer, and came back with an out the door price of 46,000.00.  I informed my Salesperson this wasn't going to work. Next was the sales manager. 

The sales manager came in and my first question was where are you getting and MSRP of 51,210.00, that is when he started with, This is our internet price. Then I pulled out my copy of the window sticker and showed him the listed MSRP. And then I heard this. Those discounts are optional for the dealership to use or not. At that point I was getting ready to head out the door. But I decided to stick around for a little longer. I then asked about the discount of 11,550.00. Again I heard this is the internet discount. I then told him about the dealership not 15 miles down the road that was offering 20,000.00 off the 2018 F150's, He wanted me to show him the dealership offering this discount. So I did and and when he seen the discount, He went back to, The 11,550.00 is our internet discount. So I moved on the the next item on the cost breakdown. The Spray on Bed Liner that was installed by the Dealership, Bed Liner cost. 794.00. I just said. REALLY. The dealer installed cost sheet I found in the console of this F150 stated the cost of the spray in bed liner was 499.00. The sales manager asked what do you think the cost of the bed liner is worth. I told him maybe 200.00. He changed to bed liner cost from 794.00 to 200.00. 

Then I asked about all these little fee's, These are Federal and States fees that have to be charged. The only good price on the price breakdown was the Doc Fee. This is where I got up. turned around and told the Salesperson Thanks you, for working with me by phone and email for the last 2 weeks. 

I really think the sales manager need to sit down and read Texas House Bill 3621. And he also needs to understand that people now do their homework when buying a new car or truck. 

Added note: Two hours after waking out of Sterling McCall Ford Houston, I was on my way home in a 2018 F150 XLT with 4 miles on the odometer, full warranty and a out the door price of 33,524.21

",1.0
8,"July 29, 2019",Service light it was very nice and helpful and always. The salesman who had told me that he would give me the first service free backed out on it and claim he never said that,1.0
9,"January 19, 2019","I truly recommend this dealership they really stand behind their word, they honor warranty services never make any excuses. They took my car in with a check engine light on and took care of all issues it had and did not charge a dime. ",5.0
10,"August 07, 2018","I would like to thank Mr. Frank Pierce and Mr, Ali Alpai for being very patient with me and my hot temper. They worked very hard to make sure i was totally happy with our deal. Then Toyota Financial Services gave me the wrong information and i made a fool of myself calling and being short with the financial manager, Thank you all for being good people. And i would gladly do business with Sterling McCall again...after i pay this one off of coarse....John",4.8
11,"April 29, 2018",Peter my salesman worked continuously to find the car and deal I wanted. He was so patient and professional. Everyone else was very courteous and patient. ,5.0
12,"March 22, 2018",Very disappointed. Been a customer for more than 10 years. Service director won’t even have the respect to return a phone call to address a relatively small matter.  I certainly won’t purchase a car or have service done at this dealership ever again!,1.6
13,"January 16, 2018","David Nguyen was great, he explained everything in detail that was wrong with my car and worked with me to get the most important fixed first.  I highly recommend Sterling McCall Ford.",5.0
14,"January 13, 2018","I’ve been to this location, once before and my experience was the same .. the people who work here are very friendly, knowledgeable and proficient, if you want your great service then this is the place to go.",5.0
15,"January 02, 2018",Irvin was very helpful and demonstrated overall understanding of my limited time.  He was fast and thorough and returned my call in a more than expedited time frame.,5.0
16,"December 29, 2017",If anyone ever goes to this location ask for David Wynn in the service dept. and  tell him ShaRhonda sent you. He  has taken care of me with the up most integrity for the past 5 years! He’s a very nice and knowledgeable man. I literally have a dealership across the street for me and drive an hour only because of him.,5.0
17,"December 23, 2017","Have been going to Sterling McCall Ford service since I bought it there. Professional,attentive to what you need and hospitable. Looking forward to taking my truck there until I buy my next truck from them. ",4.2
18,"December 20, 2017",Got a tune-up on 2010 F-150. Happy with the service and knowledgeable service advisors. Truck was finished on time and clean. Look forward to continued good service. ,5.0
19,"December 20, 2017",I had an appointment at 8 a.m. to rotate tires and change oil. I was there for 3 hrs. I understand sometimes things can get hectic with customers but that is way too long for an oil change. Have no problem with dealership because that’s where I bought my truck from.,4.0
20,"December 18, 2017","I had an excellent service visit. Everyone was nice and very friendly! Especially for a 7am service appointment. I was pleasantly surprised by how frequent the shuttle was. They kept checking on everyone in the waiting room and switched out cookies for fresh ones. If you had a question they would answer or find out. When they finished with my car I was expecting the long list I seem to always get with service. Things need immediate repairs and what not. That want the case. Yes their were a few items that were brought to my attention but I wasn't pressured into it, in fact they were nice and said that they were not needed today but we're recommended soon before my next service. They even washed my car!!! 😊 Best service visit I've ever had here!! I look forward to my next visit!!!",5.0
21,"December 03, 2017","The service is great and friendly, but the prices of what needs to be done are not that friendly. I enjoy the professionalism of my ford representative, but, as I said, prices are too much. This was a simple oil change and basic service and I ended paying more than $500.00",4.4
22,"November 30, 2017","I was a walk in for just an oil change. I knew I needed tires but anticipated that I would need to order them. David alerted me that they are in stock so I opted to purchase and have them installed that day. I waited around for my car. They offered me a shuttle ride to any where I wanted to go, more than once, very considerate.",5.0
23,"November 17, 2017","Friendly staff and very enthusiastic with their service and very accomodating, if you need something they are very glad to help and assist you to make you feel comfortable. 2 thumbs up",5.0
24,"November 15, 2017","Had an amazing time there very friendly personnel
It was easy to get what I really wanted to get without the hassle. The Financing department also was very informative Overa I really recommend This dealer ",5.0
25,"November 11, 2017","Excellent service, true to their word, specially Mari Hill, Mario, and Adel, they were clear in their explanations, and most of all very patient with my Father and I who were at first skeptical about the vehicle",5.0
26,"November 10, 2017","Great and quick service. Friendly staff, great quality not to mention reasonable price. I decided to take my vehicle for an oil change aa well as  the cabin filter. I thought I would be there all day. I was impressed on how quick I was out of there.",5.0
27,"November 07, 2017","Great quality of work services 
Got everything fix that was needed 
Costumer services was awesome 
Didn't take that long to get it fix 
Will be back for future services ",5.0
28,"November 03, 2017","Salesman was experienced and made the process easy and fast. He did not have the car on the lot, but he found what we wsnted and got it for us.",5.0
29,"November 02, 2017","Best place to buy a car , will recommend Ammar from the sales and Adel one off the best guys that's work there , great deal .",5.0
30,"October 27, 2017",This is a great dealership. It's run very well. I've used them for service for the past 6 years and decided to buy my new truck from them. The sales experience was just as good. I will be back. ,5.0
31,"October 22, 2017",David gives us excellent service with a thorough check of all systems. He found we needed to realign and gave us premium synthetic oil. We always come to David because he is the best.,5.0
32,"October 19, 2017","Wally, David and Rose went above and beyond their responsibilities to help deploy my 2 Subaru vehicles that were transferred from Danves, MA
Wally allowed his employees to Help me with the inspection of both vehicles and made it possible to Help me bring both vehicles to my house!!
I would like to Recognize Them For Helping with the Deployment of My Vehicles!!  They are wonderful people to conduct business with!!  I was so Blessed to have them help me!!  Much Gratitude and Apprecitiation to all that helped me!!  I A Carbajal",5.0
33,"October 11, 2017",Luis was easy to get ahold of and always does great customer service. The repair was quick and not as expensive as I first thought. ,4.8
34,"October 11, 2017","Car runs great
 I gpt my car back in record time. I will be back with great expectatipns. The service showed a lot of experience.",5.0
35,"October 09, 2017","Dealt with Rose, great service writer. Friendly,  open and honest and made the process simple. I will definitely bring my truck back as long as i get to work with her. ",5.0
36,"October 09, 2017","Very professional and timely service. Brian brought me in over the phone and had me out in 2 hours, without a scheduled appointment.  I didn't have time for the free car wash, Brian gave me a chit for another time at my convenience.  Ford has always treated me good, this outfit is no exception. I will go back. 
Will Pierce",5.0
37,"October 06, 2017","Only issue was the wait to get into finance possibly due to on going construction. No issues once in finance or person. Maybe adding more finance people heard other people complain about the wait as Well
",4.6
38,"October 05, 2017","I’m from southeast Texas and lost my car during hurricane Harvey, I had looked everywhere for a new vehicle so I had to head to Houston to find something. I found a vehicle I loved and sterling Mccal ford helped me greatly and got me into the vehicle I wanted. ",5.0
39,"October 05, 2017", By far the best salesman has patience and time to go through everything excellent workmanship a lot of dealer should have sales men like paul ,5.0
40,"October 01, 2017","Mgr Bobby Rosales and salesman Paul Diamanti delivered superior service throughout the entire experience. xxxxxxto both of them. We highly recommend the dealership to anyone looking for a professional, relaxed buying experience.",5.0
41,"September 24, 2017","Had a very positive experience with selecting and purchasing a new vehicle. Paul was very patient and provided many different options for me to choose from. I would not hesitate to return to this dealership to purchase another vehicle if I needed to. At no point did I feel pressured into a purchase, this made me feel more comfortable with my decision. ",5.0
42,"September 22, 2017","The dealership is under construction; however, the service center is clean and organized.  I appreciate the service reps assistance and will continue to use for future service.",4.8
43,"September 15, 2017","Service was great. I didn't wait too long and got my car cleaned. Can't beat that!! Staff was friendly and answered all my questions, thank you.",5.0
44,"September 15, 2017","Yes, this place is under construction but the service center is organized, clean and enough staff on to help. I needed a new battery, even without an appointment they took my car right in! Bryan Foster and Eric Macias are who helped me, they were more than fantastic! They didn't rush me or seemed too busy. They were very knowledgeable, precise, friendly and most of I actually learned a few things about my vehicle warranty that I didn't know before! They even got their ford shuttle scheduled for me for drop off and pick up! Even the shuttle driver Stefan was very friendly ! Thank you for all your help!",5.0
45,"September 15, 2017",Sterling McCall Ford did a great job assisting my company with our Ford F150. Engine was rebuilt and runs great. Will use for future  sales & service.,4.8
46,"September 14, 2017","Ali A was excellent and very knowledgeable about Escape I wanted and took all the time necessary to explain options and answer my and my wife's questions.
Overall, my wife and I had a very enjoyable time purchasing this Escape

Ali A gets an A+, and I would not give this rating to my prior 15 new car purchases",5.0
47,"September 13, 2017",I scheduled an appointment and they got me in very quickly. The communication was very good throughout the process. When I arrived to pick up my truck I was greeted promptly and the truck was ready to go. ,5.0
48,"September 12, 2017","Outstanding service and repair of my exhaust sensor, which had shut down my diesel F250 super duty truck. David was very professional and his mechanic assigned to repair my truck, did an outstanding job. ",4.8
49,"September 09, 2017","The customer service was excellent. The whole team were very helpful. Luis had some concern about the way my vehicle starts with hesitation and after restarting it, I  have the same concern. It does seem like  battery has the same level of power as the one that was originally in the vehicle. There was no hesitation with the previous battery.  ",4.2
50,"September 01, 2017","Came in for a Tire rotation and oil change. Good service, fast and nice people. 
Will bring vehicle back for future maintainance and work needed. ",5.0
51,"September 01, 2017","Friendly, honest fair. Paul presented a car that matched my desire. Paul delt with me fairly and honestly. He was fast and detailed Throughout the transaction ",5.0
52,"August 31, 2017",I just had service done on a 2006 Ford Escaoe Hybrid. My service advisor is David Nguyen. I want to highly recommend David as one of the best service advisors in the business. David not only takes care of all your service need but keeps you well informed of the problem by explaining in detail the problem as well as the parts and labor required in the repair of the diagnostic problem. ,5.0
53,"August 31, 2017",They fixed my air conditioner under warranty which was a major undertaking. The Ford finally replaced recalled air bag. They provided a free loaner while the vehicle was being repaired,5.0
54,"August 28, 2017","Great dealership.  Convience location.
David is great service rep to assist you and to take care of  your car problem.
Loyal customer for long time.

👍👍👍👍👍",5.0
55,"August 26, 2017",Extremely courteous from beginning to end.  Waiting area was very clean and accommodating.  The service writer kept me updated as to estimated time of service completion.,5.0
56,"August 21, 2017",JC was an exceptional salesman. He made the car buying process a breeze and I now have a new car that I love! Best experience!,5.0
57,"August 16, 2017","Because of de good service , and good follow up , friendly and good quality work .plus I get the best quality service that I ever have I definitely recommend it ",5.0
58,"August 15, 2017",I brought my vehicle to Bryan foster completely dismantled by another shop. Bryan did everything possible to accommodate me and my vehicle . He is awesome and very knowledgeable. I definitely have a new mehanic for my new baby (car) !!,5.0
59,"August 10, 2017","Great service, good person and very good customer service, appreciated all attention in my case, very respect and helper, thanks for all. Good day man.",5.0
60,"August 08, 2017",I bought my F150 here and from the moment I walked in to enquirer about it to every single time I bring it for a service they treat me like family and are pay attention to every detail of my truck and explain every thing to me. ,5.0
61,"August 04, 2017"," I was looking to bye a Ford Explorer but, not anymore Hector the sales rep that's assisted me was awful he won't work with you at all and his rude. ",1.0
