,Date,Reviews,Ratings
271,"June 03, 2011","I was referred to Hondo of Clear Lake by my uncle. I wasn't sure what kind of car I was going to buy but Taaha helped me out quite a bit. He's really honest and he definitely didn't try to just ""sell"" me a car. He knew what he was talking about. I'm glad I went I wouldn't regret it. Taaha will definitely help you out.",5.0
272,"June 03, 2011",Best dealership experience I've ever had. Taaha knows what customer service really is. He followed up like he said he would and did his best to make sure everything was completed in a timely and professional manner. I recommend him to anyone interested in buying a car.,5.0
273,"June 03, 2011",Best experience I've ever had with a dealership. Very friendly and really knows his stuff to be able to assist me in my first car ever. He was able to give me a good price and estimate for my financial needs. I am very pleased and will be back in the future.,5.0
274,"June 03, 2011","awsome guy, i always ask for him. Nice guy who sold me a 2009 honda accord lx. I shopped around and everything but the price just was not right else where. He told me that he could help me and he did so i have gone back to him and just bought another car",5.0
275,"June 03, 2011","This dealership provided outstanding service to me when I was looking to purchase a vehicle. Not only did they have a good lineup of cars but they also provided outstanding customer service. The person that helped me was Mr. Taaha Baig, and I greatly appreciate the time that he took in helping me to find the right car for me. I have referred my friends to him so that he could help them find the perfect car for them. ",5.0
276,"June 03, 2011",Taaha is a great salesman! I came into the dealership just to have a look and ended up leaving with a car! He was very knowledgeable and very friendly. I am very thankful I got to work with him. He exceeded all my expectations and pointed me in a direction that I wanted to go. I wasn't completely sure if I was going to be able to afford the car but he gave me a great price! I'll never go to another salesman again!,5.0
277,"June 03, 2011","I bought a car from Taaha and he was extremely helpful. Also, on top of that he was very respectful and understanding. Some employees at other dealerships seemed like they kept trying to rush us and I wasn't very fond of that. On the other hand, Taaha was patient and made sure the car was right for me.",5.0
278,"June 03, 2011",Taaha knew exactly what he was talking about. very knowledgeable on his work and great customer service skills. This nice young gentleman showed me around many cars and helped me decide on what vehicle will best suit me and my lifestyle.  I dont think ill be going to another dealer besides Tahaa.,5.0
279,"June 03, 2011","When was I was dealing with Taaha he was very attentive to me and my needs. Once I told him, what I wanted in the ride, he showed me exactly what I needed. Easy to deal with, very friendly. He did not try to take advantage of me just because I didnt know about cars. He explained me in details of how each packaged work and what would be best for my daily needs and will also help me protect myself while I am on the road. I would reccomend him a 100 times over.",5.0
280,"June 03, 2011","Great experience, the salesman was very helpful through the entire process of my car purchase. He would accommodate all of my needs rather than trying to sell me the more expensive car. I think the customer service alone from him would be reason enough for me to purchase my second car at the same dealer.",5.0
281,"June 03, 2011","Was looking for a new car, a friend told me about Hondo of Clear Lake, so I decided to check it out. The dealership was really nice, the staff seemed very friendly. Before even walking into the dealership, i was approached by a salesman. My salesman was Mr.Baig, he was not only helpful and courteous but very knowledgable about cars. At first i did not really know what i wanted, but after going through a few test drives and getting a run-down of the various features of the car, i walked out with a brand new car. I honestly did not expect it to go so well, but Mr. Baig was very professional and friendly enough to give me his time to show me to which car best suited me. I definitley recommend this dealership, not just because of the nice cars but the kind and friendly staff. Thank you.",5.0
282,"June 02, 2011","Very helpful. He got me everything I asked for. He made my purchase very easy and enjoyable. Highly recommend this dealership and ask for Taaha when you stop in.He helped me pick out the right car and showed me all the features. I got a great deal on my new Honda. I highly recommend him to anyone. 
",5.0
283,"June 02, 2011",HE WAS VERY HELPFUL WITH MY NEEDS. WENT OUT OF HIS WAY TO MEET MY EXPECTATIONS. MY FIANCE IS LOOKING FOR ANOTHER CAR SO IM GOING TO COME WITH AND GET THE SAME CAR!! I LOVE THE CAR IT RUNS AWESOME JUST AS I WAS TOLD AND THE PERFORMANCE IS GREAT! DEFINITELY GOING TO RECOMMEND TAAHA.,5.0
284,"June 02, 2011","Mr. Adrian Reeves
3300 Cummins Street apt 2337
Houston, Texas 77027


I'm writing to give a big thank you to my salesperson Jeremy DelaRosa. Let me begin by saying that I've purchased several cars in my life and it's not my favorite thing to do. On June 1, 2011 I visited Honda of Clearlake and purchased a 2008 Jetta. Jeremy was extremely professional, but most of all he listened carefully to what I said and he EXECUTED FLAWLESSLY! Jeremy made my car purchase an extremely pleasant one and I truly appreciate his efforts. Jeremy did what I know sales is all about, which is building relationships with his customers. Thank you Jeremy, you represent Honda of Clearlake well.

Adrian Reeves
A very satisfied customer!",5.0
285,"June 02, 2011",My father was looking for a brand new car and i recommended him to honda knowing how great Mr. Taaha Baig is and we came before closing time and showed my father the car he understood he would like as his choice.  The next day we came closed up the deal and he gave it to us for a great price and explained all the features to the family in detail and mentioned we could call him anytime if we had any questions or concerns.  My father has loved the car and recommended that this was the best dealership compared to other car dealerships and Mr. Taaha Baig was the right man to talk to.,5.0
286,"June 02, 2011","I went into Honda not knowing anything about cars, all I knew is that I wanted a new car. When I went in, a Mr.Taaha Baig showed me many different options and helped me find the right car for me. I looked at all different types of Honda until I found the right one. Mr.Taaha was very patient and gave me the best deal. Id definitely recommend Mr.Taaha to anyone who is looking for the best deal and a reliable salesman.",5.0
287,"June 01, 2011","I entered the dealership expecting to walk out with a brand new Honda, guess what I did! Experience was great, why? Everything was done on time, there was not much negotiating going on (Good thing), they approved me of what I was looking into the range of for a new car. very friendly environment, was greeted and properly helped, asked a lot of questions, got great answers back, I knew he knew what he was talking about by the way he answered the questions without hesitation! One of the best dealerships i've been to so far, will def recommend everyone to go. I will see Mr baig, again for my wifes car! ",5.0
288,"June 01, 2011",Taaha was an exceptional salesman. He made my purchase very easy and enjoyable. Highly recommend this dealership and ask for Taaha when you stop in. Best salesman i have ever dealt with! He helped me pick out the right car and showed me all the features and benefits of owning a honda. If you are a local and in the market for a new vehicle dont hesitate to call or go in and ask for Mr. Taaha Baig.,5.0
289,"May 31, 2011","My husband's car was totaled by another driver, so we were forced to find a replacement.  We were sure that we would not be able to buy a new Pilot, but Geovanni and Honda of Clear Lake gave us such a great deal that it just did not make sense to buy a used one.  I worked with Geovanni over the phone and only met him on the day when my car was ready for pick up.  He was very clear throughout the whole process - negotiating the deal, ordering the vehicle, informing us of when the car would arrive to the dealership, adding the roof rack accessory, letting us know when the car would be ready for pickup.  We always knew what was going on.  He was a pleasure to meet and the deal just could not be beat.  Geovanni turned an unfortunate experience into one with a positive final outcome.  We would recommend him without reservation.  THANKS GEOVANNI!!!",5.0
290,"May 30, 2011","visit last week to clear deep lake and got on atendidda by geo suarez excellent seller, was kind enough to Mostar d model car that I liked the options that had equal to ayudadrme with financing and paperwork for my car. q I recommend deep and has excellent staff and geo as a seller.
",5.0
291,"May 28, 2011","I was looking for a new vehicle...stopped into Honda of Clear Lake and was greeted by salesperson Patrick Monroe. He was not only helpful but courteous and very knowledgeable. Nice showroom too! I will be coming back soon and highly recommend Honda-CL and Patrick to all my friends. 
",5.0
292,"May 27, 2011","Jordan Lerbs is a friendly, knowledgeable salesman. He takes a low key approach which I really liked. He gave me the time I needed to look at all of the models and to make my selection.  I would recommend Jordan Lerbs to other friends and/or family who are looking to buy a Honda.",4.8
293,"May 26, 2011",Honda Clear Lake took very good care of us when we purchased our car recently.  Jordan Lerbs was great to deal with.  He treated us respectfully and listened to our needs.  He matched us with a great vehicle.  He love the car and have a new place to go for careful service.,5.0
294,"May 26, 2011","This being my first new car purchase, I was a little nervous however I was quickly put at ease. Jordan was knowledgeable and polite, he turned car buying into a very pleasant experience and the decision was much easier to make with his assistance.  I would definitely return when our family needs a new vehicle.",4.6
295,"May 26, 2011","I was skeptical of purchasing a new car, but after I met Jordan he quickly put me at ease.  He helped me find the perfect car and for a great price.  I am quite stubborn I can admit and he was extremely patient with me.  He helped me test drive several cars until I found the one I liked.  I would recommend Jordan and Honda Clear Lake to anyone on the market for a new car.

**Extremely satisfied customer**",5.0
296,"May 26, 2011","I was very impressed with the knowledge and service that our salesman gave us. He was friendly and very professional in his approach when we entered the dealership and guided us carefully through the entire process. I love my car and will definitely return to Honda CLear Lake. Great experience- especially since I was dreading the purchase of another car :)

Thank you!",5.0
297,"May 25, 2011",My husband bought a care about 2 months ago at this dealership and the service was great and the place was clean.They didn't make us feel that our children were unwelcomed either which was great.The car salesman Shawn was very informed of all the vehicles in the used department which made it easier for us.Overall a great experience.,5.0
298,"May 24, 2011","Shawn was the most awesome salesman. He was very professionl, got my mother a fantastic deal on her car and I highly recommend him! She knew she wanted a Honda and which model. He found exactly what she wanted in the color she wanted, with the accessories she wanted. The price was right. It was quite possibly the most pleasureable car buying experience I've encounterd!",5.0
299,"May 24, 2011","My experience in service has always been excellent.  Required work is explained in detail and is always completed professionally and on time.  Carlos Herrera is one of the reasons I returned to Honda of Clear Lake to buy a new car.  Samir in Fleet sales is the other reason I bought a second new Honda from this dealer.  He is fair, professional and a pleasure to deal with.",5.0
300,"May 24, 2011","We had been to several dealerships before stopping at Honda of Clear Lake. Immediately we noticed the difference. When we got there we were greeted by one of the salesman, Patrick, who sat down with us before we even went to look at cars. He asked us many questions to determine which vehicle was right for us. When he showed us a car it was the one that matched are needs the best and we did not spend time looking at things that were not important to us. I felt like he was not just trying to sell me something  but cared about our situation, needs, and budget. The entire process went very smoothly and was much less stressful then the other dealerships made it seem. No hassles and good people. I would recommend Patrick and Honda of Clear Lake to all of my friends. ",5.0
301,"May 24, 2011","I came in looking for an economical car, and Mr. Monroe did a thorough checklist of the items I wanted that came standard on the vehicle all the way down to colors I wanted. We checked out some used cars as well. He is an awesome salesman!! Go check him out!!",5.0
302,"May 23, 2011","Mr. Day help me get information I needed to decide what kind of vehicle I should consider as far as price, gas and etc.
He was wonderful, he was nice and all around an informative person. He help narrow down my search of what I want.
Because of his patience I was able to better understand what I want.",5.0
303,"May 23, 2011","I recently went to Honda Clear Lake to purchase a new vehicle. My experience was great, everyone was very friendly. Shawn is an amazing salesman and very professional! He explained everything so I could understand and told me all of my option such as safety features, financing,gas mileage and additional options. I will definately come back for my future vehicle needs.",5.0
304,"May 23, 2011",I had a very good car buying experience. My sales guy was very knowlegeable and helpful! Honda of Clear Lake has an awesome staff. I will recommend anyone that I know that is looking to purchase a car to go to Clear Lake Honda...Thank you! I love my car and so does everyone else!!!,5.0
305,"May 23, 2011",When I first arrived at the dealership I was greeted by a great salesman by the name of Shawn Day. It was pleasant to deal with someone who was very knowledgeable about Honda. Mr. Day had every answer to all my questions and it was truly great visit. I will continue to drive Honda and will gladly recommend this dealership to all my friends who might be needing a car in their future. Thanks again for helping!,5.0
306,"May 23, 2011","Excellent customer care, excellent service, Excellent prices,A Very Organized place
, I recommend this seller and this dealer to everyone, 100% professional service.
This seller does not wasted your time at the moment to make bussiness with you.
100 points from my side.",5.0
307,"May 23, 2011",Shawn is a wonderful salesman and from now on I will only buy cars from him! I have never met a more honest and polite salesman! He answered every question I had and did not beat around the bush. I would most definitely recommend him as a salesman! Thanks so much!,5.0
308,"May 23, 2011",Patrick Monroe was very courteous and helpful. He took the time to answer all of my questions and concerns. I have owned Honda's for the last past 9 years and it is the only car I will ever buy. Just want to thank Patrick and Honda of Clear Lake for all of their help over the years! Keep up the good work!,5.0
309,"May 23, 2011","Had a really good purchase at Honda of Clear Lake. Wonderful and polite sales staff.They all seem to be really happy. I got the Oil Changes for life which is a good thing to have since the price of oil Changes daily. Overall was happy with my salesman, Patrick Monroe",5.0
310,"May 23, 2011","Overall we had a great experience at honda clear lake, especially with our sales consultant Geovanni Suarez he exceeded our expectations he was super friendly, had great knowledge about the products and was very clear. In general the deal went through really smoothly and within a reasonable amount of time. We will come back as soon as we need a new vehicle in the family and we will recommend honda clear lake to everybody we know.",5.0
311,"May 23, 2011","Dear Sir/Madem .
 I was at your loctation last week . and i find some of good cars and i will be back  next week to buy one of car which i realy liked,
I realy like your service and sales man was realy helpful. 
Hope c u next week.
I will cal and make apointment before i come. i hope i will c seme sales man",5.0
312,"May 22, 2011","I was there to buy a Car.Soon I get there I met Najeeb I told him what I am looking
he showed me all car to see if i like any of them But I was looking cash car for my son for only $ 6000.00.And I was looking Toyota Corolla.
I was very happy with him and his service.
I told him I will come back next week to see if you any car in my range.",5.0
313,"May 21, 2011","Patrick Monroe is a great Salesman. He really knows his product. Not that Honda does not sell its self, but he really makes sure that you are aware of all the safety and standard features that Honda offers. I have purchased three cars from him and will continue to as long as he is there.",5.0
314,"May 19, 2011","Carlos Herrera has been my main contact in the Service Department since buying my Accord from Honda of Clear Lake in 2006.  Friendly and knowledgeable with strong customer service skills he has kept me informed of any/all issues with both of my cars and is a trusted resource. Carlos is an excellent asset to Honda of Clear Lake.

Joanilys Perez is a welcomed site at the cashier desk.  Friendly and always smiling, she's a great resource for the dealership. ",4.8
315,"May 13, 2011","I have been a customer since purchase of my first Honda, a 2006 CRV.  My first experience with working with Bennett.  The sales process was straight forward and comfortable. Since 2006, Orey is Honda of Clear Lake to me.  Every issue I have had has been addressed with integrity and fairness.  When Orey has been out, Glenn has always been there to guide me. ",5.0
316,"May 11, 2011","I have nothing but praise for the Service department at Honda of Clear Lake. Everyone is very friendly. You are greeted when you get there, offered refreshments and the work is done quickly and efficiently. I am currently leasing a Honda Accord. The Honda was not leased from Honda Clear Lake however the service department treats you just like they would any of their very own customers. They are great!  

I would like to say that I have never purchased a vehicle at Honda Clear Lake, but if the sales department is anything like the service department it should be a good experience. ",5.0
317,"May 09, 2011","From the time I submitted my credit app I had nothing but a positive experience.  Shawn Day was the person I chose to deal with and he was Great!  He really went above and beyond to make sure that I was able to get into a car and he made the whole experience easy for me.  I have already recommended my Friends and Family to this dealership and let them know what a positive experience I had.  I will def. remember you all when it's time to purchase another vehicle.  

Thank you,

Karlah
",5.0
318,"May 01, 2011","I went to this dealership looking for a deal on 2 used vehicles, an accord and a civic. I expected to receive a good price because I was buying 2. The dealership does have a large selection of used vehicles which made it easier to find the ones with the criteria I wanted. After selecting the vehicles, test driving, thoroughly examining the carfax,and a little negotiating we agreed on a price that would work for both of us. I was also using voucher/grants for 2 used vehicles that I was replacing by buying the 2 new ones. The staff was knowledgeable about the program I was using and they did all of the necessary paperwork with ease. After closing I left with both vehicles having a detailed cleaning and a full tank of gas. The staff were professional and I had an overall good experience.   ",5.0
319,"April 30, 2011","The work done is fine and seemed to be executed as we agreed on when I brought in the car for service. I also had the impression that the contact person was knowledgable about the status of the car and could promptly inform me about the type of the maintenance that neeeded to be done and also include additional requests and concerns from my part. 

The service and the opportunity to obtain a loaner car and return when suitable for me was excellent. Also, I appreciated the timely feedback on the repair process.",5.0
320,"April 30, 2011","I am very upset with the way that this dealerships conducts business. I saw a vehicle listed on line through Auto Trader. The vehicle was a 2004 Honda Crv listed at $8,994. I called the dealer ship and tried to speak to the online sales manager Tuan Van Le who listed the vehcile. I was never able to speak to him. I ended up speaking with a salesman who names I do not recall and he verified that the vehicle was still there and also verified the listed price. I drove about 30 minutes to the location and spoke with a salesman named Big Al and told him that I wanted to purchase the vehicle. I test drove the vehicle and when I came back I was told by by Big Al that there was a typo and that the vehicle is $11,995. I was furious because I had a feeling something like this would happen. I went to speak to the internet sales manager Tuan Van Le who was very rude. He showed me the Clear Lake of Honda dealership web site that stated best price over $8,994 would be considered. Tuan Van Le had went to the page and added the wording. I still had the Auto Trader site page open on my phone from the night before. The Auto Trader clearly stated the price was $8,994. Tuan Van Le kept telling me why was I switching things around. As i kept questing him he had nothing to say and asked me to leave several times. It took all the faith of god for me not to reach across the desk a slap his slant eyes straight. The guy was very rude and disrespectful. I strongly recommend that you avoid this dealership if all possible. Good luck on finding a vehicle!!!    ",1.0
321,"April 19, 2011","I went to buy used honda accord lx 2009. The sales person was ok but the sales manager (most likely his name is Donny Slaughter) was very rude. They were asking around $18400.00 +TTL and asked my about my price. I liked the car but i cannot go over $16000.00 but I offered them $16500.00 drive out and signed a paper with that price. The sales person went to talked to the manager and after a while the manager came with that paper teared in two piece and talked to me very rudely and said i am giving them disrespectful price and they will not sell the car on that price. As a customer i have every right to say the price i believe is reasonable for me. If they cannot match the price they can just simple say that nicely and could offer me some other car in that price range. instead of that, that so called manager behaved rudely. This kind of behavior is not acceptable at all. I will never go back to this dealer again. Very Very bad customer service.",1.0
322,"January 07, 2011","This is the WORST dealership you can run into. All they cared about is your money. Once they sale the car to you, they treat you like sh*t!!! 

When I bought my  car, there is a problem with the windshield. They promised to fix the windowsheild within a week. After I purchased the car, I called them SIX times to ask them to fix my car and everyttime they said they will call me back but they NEVER did.  

Finally, I get a confirmation from them after I called them the SEVEN TIME. And it took them forever to fix my car.

The people were soooo rude after they sold the car to you. The sales person who sold the car to me wont even say hi when i brought my car to fix. ",1.0
323,"January 03, 2011","Scott Campbell is a liar. For 3 weeks tried to buy a used car from him. All I got was the run around.Then the day before I am heading to the dealership to purchase the car i wanted, I called and found out they sold it to someone else. Guess I am glad I didn't waste my gas on them. Scott Campbell and Honda of Clear Lake can KISS MY BUTT! People, if you are smart you would shop somewhere else. I hope your sales tatics put you out business!",1.4
324,"December 31, 2010","These people in the finance department are extremely rude! They are not helpful at all and they do not explain anything at all! I would NOT recommend these people to anyone! If you try and call them you never get a call back. It took me over a month to receive my signing paperwork on my car and when I went in to ask about my paperwork after a month they said that they had sent it out the day before I actually signed the papers. The people in the finance department are ridiculous! NEVER WILL I EVER GO BACK AND BUY A CAR FROM THEM! I have had my car over 6 months and still have no received all of my refunds that I did the first week of having my car.
THEY ARE HORRIBLE!",1.0
325,"December 30, 2010","My wife and I went to just test drive a Honda, and she was very taken with one of the Honda CRVs. We met with Sam, and he was very knowledgeable, and worked with us to see that we received a very reasonable deal. 

Raheel was the person who we dealt with to set up the loan and sign all of the papers. He was very thorough and efficient, and made it as painless as possible.

I would highly recommend both of these individuals and the dealership in general. 

About as pleasant and hassle free as buying a new car can be.",5.0
