,Date,Reviews,Ratings
84,"April 30, 2019",Mrs Stephanie made my buying  experience very easy and exciting! I walked in told her my budget and she showed me everything I was interested in! I found the car I love and would totally recommend her and Community Honda! Everyone there had great customer service! From the time to walking in till leaving with my new Honda Civic Mrs Stephanie made sure not only did I get the car I wanted but made sure I know everything about it and how to use everything inside! ,5.0
85,"April 28, 2019","Brooke’s was very helpful giving me information and patient when I needed time to consider my options.
Full tank of gas and setting the radio for me were nice bonuses  ",4.8
86,"April 27, 2019",Best experience we have had in shopping for cars. Thanks to Mark Hebert for education about our Crv. Will be happy to recommend him to our family and friends.,5.0
87,"April 24, 2019","Mark Hebert was so patient during my purchasing process.  He never pushed me and allowed me all the time to think about my decision. He understood all of my concerns and did everything he could to address them. Colby, the manager, went above and beyond to meet my every expectation. He worked hard to get me the deal I had envisioned. I will definitely be recommending this dealership to anyone looking for a new car!!  ",5.0
88,"April 22, 2019",From the moment I walked through the door they were very welcoming and patient. Stephanie went above and beyond helping us. Even days after the purchase was made she texted to make sure we were loving it! ,5.0
89,"April 22, 2019",This new dealership is way better than Moss ever was and JPT will ever be when it comes to dealing on both new vehicles and trades.,5.0
90,"April 22, 2019",Chassica was amazing. Made the whole experience of buying a car easy and understandable. She is a great asset to the company. Her Boss even did the happy dance with me on the showroom floor!,5.0
91,"December 01, 2017","The people at Community Honda go out of their way to make your visit pleasant.They are patient and knowledgeable.And everyone is very friendly.

",5.0
92,"November 01, 2017","we needed help with a new battery & he helped us with the process.  very pleasant  and Knowledgeable. My daughter helped with the process 7 was pleased with the service.
",5.0
93,"October 29, 2017","Never owned or even thought about owning a Honda until I walked in & James Morgan was very informative & attentive.  He listened, understood & met my needs.",5.0
94,"October 27, 2017","We went in late to inquire about a bad battery and received excellent customer service from the manager Chris. He came out of his office to personally assist us, because I was on crutches from a recent fall. He took care of the battery and several other issues such as spare keys, dome bulbs and touch up paint, all before they closed for the day. Chris sets the example for Customer Service for the store. ",5.0
95,"October 25, 2017",My experience at Honda Community was great.  Someone contacted immediately when I requested an appointment.  I was assisted promptly when I arrived at Honda and a Sales Associate guided me to choose the right Honda car for me.  ,4.8
96,"October 22, 2017","They do a professional job.  Listen to customers, then contact when they know the problem for sure, before proceeding.  They also keep up with past maintenance and follow up to check if service is adequate.",5.0
97,"October 22, 2017","I have purchased several Hondas from Community Honda and I have always received a great deal.  I am also a customer who prefers to have the scheduled maintenance services performed at the dealership since they are Honda experts.  I am always treated as if I am the only customer they are attending to, and their prices for the services are very reasonable.  The Service Manager, Cris Torres, and my Service Advisor/Assistant Service Manager Lee Ehrlich always greets my by name and ensures my Accord Touring receives top-notch treatment.  These guys have earned a customer for life.",5.0
98,"October 19, 2017","Just purchased my 3rd CR-V.  I love the new one.  James Morgan was very patient with me during my initial Indecision about colors!  When I arrived to test drive my car, he had it ready for me with the pro package already added on.  He explained everything very well and made it a fun and exciting experience!  Anna was great during the financial portion.  Brittany came out to introduce herself.  She was great to work with when I was setting up appointments.  All in all, everyone was very friendly and treated me like I am part of a big Honda family.",5.0
99,"October 16, 2017","My review was a experience that I will recommend too whom may be interested in buying a Honda. Community Honda, had a great selection on the  vehicle that I was looking for. And for a great price I walked out in a brand new Honda Acord. ",5.0
100,"October 13, 2017",Greg was knowledgeable and professional. He runs me through the buying process very efficient. He matched a car that we agreed by email with Joi. The finance officer was also courteous and professional. I really like Community Honda. ,5.0
101,"October 07, 2017","Purchased tire, mounted, balanced, and installed. Took a while, but all in all it worked out. There were several others receiving service as well so the time was to be expected. ",4.0
102,"October 05, 2017","I was there around 10:00 and left around 11:00 and they were very courteous and professional. The quality of work is very good.
",5.0
103,"October 04, 2017",PLEASANT EXPERIENCE. FINANCE GUY WAS GREAT. SALESMAN WAS GOOD. HIS JOKES WERE CORNEY. HE DIDN'T KNOW A PILOT EX MODEL DID NOT COME WITH A SUN ROOF. HE WAS OK TO WORK WITH.,5.0
104,"October 04, 2017",Gregory was very helpful in finding the car I wanted and working with me on the price. I would definitely recommend Community Honda to friends and family.,5.0
105,"September 30, 2017",Baytown Honda really make sure that me and my vechical are well taken care of & good service .. the service department always make sure I'm satisfied with my vechical after maintanance is finish,4.0
106,"September 29, 2017","
I came for my first change oil. From very easy appointment set up online to the actual oil exchange, my experience was excellent. They were done even before I finished my free coffee. Hats off to my service consultant, JAMES.",5.0
107,"September 28, 2017",Wonderful customer service!  Polite and professional. Best dealership around!  Highly recommend for any model/make.  They let you know up front what you need and don't pressure you to do more than needed. ,5.0
108,"September 28, 2017","Honda went the extra mile.  They were able to get my APR interest down lower than my credit union. Enjoying my vehicle very much.  The salesman, Greg and Anna Clark were very helpful. Definitely would recommend Community Honda.",5.0
109,"September 26, 2017","Customer service was awesome with all the team, they all work well together.  Made sure I was taken care of in a timely matter and was transported home to make my other appointments..
",5.0
110,"September 25, 2017","Art has always made us feel welcome and valued at your dealership.  In the midst of all that goes in to bringing in so many vehicles after the hurricane, he made us feel like a priority.  He had a beautiful vehicle ready for us to test drive, made the process simple and Mr. Parker followed it up by a no pressure, informative explanation of warranties and gap plans.  We are very happy to be part of the Community Honda family.",5.0
111,"September 14, 2017","I had a wonderful experience at Community Honda and I believe that was mainly because of our sales associate, Vy Hoang. He was with us every step of the way and he helped us with all of our questions.",5.0
112,"September 14, 2017",We were impressed with the way our salesman worked for us in the price and helped us find the vehicle we wanted with everything we wanted on it. We had a very good experience here.,5.0
113,"September 12, 2017","I brought my car in for a recall.  I had an appointment for 11:00 and Carlos took my car in immediately.  He also told me that it would take one hour to an hour and a half to complete the work.  They were done in one hour.  After the work was done, Carlos explained exactly what was done.  All that I spoke to were courteous and helpful.  The waiting area is comfortable with drinks and snacks provided if one chooses to partake.  All in all, a very good experience.  ",5.0
114,"September 10, 2017",Service was great. For being real busy I was out within a reasonable time. I would recommend this dealership to my friends for service. Employees were real nice ,5.0
115,"September 07, 2017",Each employee and the entire environment was customer oriented! The waiting area was clean and customer oriented. Other customers were relaxed and patient! Great visit!! My tech was a female!! And a female soldier was among those getting their cars serviced. Overall an interesting morning!!,5.0
116,"August 26, 2017","Excellent services great personality quick and efficient service highly satisfied with the prompt very friendly service and price is very affordable

Thank you  
Brenda Paez ",5.0
117,"August 24, 2017","I just love the experience you get when you go to Community Honda. It feels like a warm family environment you are greeted with a warm welcome from Lee, Chris , and all the Honda service team and assisted promptly.  I needed large repairs on my pilot and my Sevice representive Lee listened attentively, made recommendations on other items for my safely, and was able to get my car as good as new as fast as he could. Lee continues to impress me with his great customer service, positive and helpful attitude, and a person you can always depend on.  Lee is one of the reasons I will always keep coming back to community Honda not just for service but to buy my future cars.  Thank you for the above exceptional service experience!",5.0
118,"August 20, 2017","I had my oil changed at Community Honda.  They are very friendly.  I dropped it off and they called me when the service was completed.  I am not sure if the price is competitive with non-Honda oil change services, but I do appreciate the customer service.",5.0
119,"August 18, 2017",I have been very pleased with thus dealership and individual personnel who gave assisted me    I would recommend Community to my family and friends in the purchase of vehicles.  Good people!,5.0
120,"August 18, 2017",Friendly customer service.  I was greeted quickly and service was preformed in a reasonable amount of time.  Cost was fair and the waiting area was clean and cool.,5.0
121,"August 12, 2017","I use the service department frequently for my Honda Civic & have always been very pleased. This time I was looking at used vehicles on the internet and decided to go check them out. Adam Alford helped me from beginning to end. He patiently brought several of the vehicles to me to drive. No matter what vehicle that I drove, Adam was very knowledgeable about every car. Finally, he brought a Certified Pre-owned 2015 Honda CRV to show me & to drive & I knew it was what I was looking for. Between Adam & the financier I drove out with the vehicle, a car note I can afford, and the opportunity to continue using the service department. Thanks for all of your help Adam.",5.0
122,"July 15, 2017","My experience at Community Honda was very pleasant. My salesman Efrain Ruiz is such a people person, so friendly and helpful. I'm very happy with the purchase I made and the service I received. I would recommend this dealership to anyone in the market to purchase a vehicle, a Honda in particular.

Jennifer ",4.3
123,"June 03, 2017","No pressure, no hassle, professional yet personal and a great deal!  Tracy made our purchase a plesant  experience!  We drove away in our new Odyssey the same afternoon. ",5.0
124,"June 02, 2017",Walked in and walked out in no time. I had a trade in and received a good amount for my trade. Easy to work with and they made sure I got the payment I wanted. ,5.0
125,"May 13, 2017","I'm happy I was able to leave with the car I wanted without a deposit and perfect monthly payments, couldn't ask for more!",5.0
126,"May 10, 2017","Everyone I needed to work with at Community Honda made me feel as if I was the most important buyer they had ever met. Hannah, Art, Khan, Dan, and Diana were fantastic and very professional. Thank you all for everything you did to make buying my car enjoyable, plus making a super deal on a CRV,  my favorite car ",5.0
127,"April 27, 2017",All the people that helped us that day were very nice and helpful. We also brought the Pilot back & had running boards installed & everyone there was very nice & helpful.,5.0
128,"April 25, 2017","This is a family owned dealership.  Vy Hoang, our car salesman, was very helpful and honest.  We had told him what we had expected and he helped us lease two cars, haggle-free.  It took my husband and I less than 20 minutes to come to an agreement with Vy after meeting him.  He was honest and a genuinely good person.  Bill Briscoe,  the finance manager, was just as nice.  This was the best dealership experience I have ever had.  ",5.0
129,"March 30, 2017",First time I can say this was an enjoyable car buy! I was helped by Art and Adam. Both which were extremely helpful and not pressuring me into buying a car. They made the process super easy and quick! Dan from finance was very honest and made ever effort to make the deal happen! I would definitely tell anybody buying a new car to go to Community Honda! Plus who wouldn't want a Honda?! I love my new Honda and I'm very happy with my choice! ,5.0
130,"March 20, 2017","I went in looking for my son's first car knowing that Honda's are very dependable. Community had just the right car available and understood my concerns that safety was priority one. A great price was negotiated and needless to say, my son loves his first car that I know will last for many years to come. ",5.0
131,"March 10, 2017","Wanted to buy my wife a car after her accident, went to several dealerships that were nearby but could not find a good deal. Went to Community Honda and the staff did an excellent job taking care of my needs and making a great deal and was in and out in a very reasonable time. Thanks guys for being there for me and my wife!!!!",5.0
132,"January 30, 2017","I go to this dealer for oil changes and maintenance on my car. The staff is always very professional and prompt. I've never had a issue and I would highly recommended this dealer. Make sure to ask for Chris, he's been there for a long time and is very helpful. ",5.0
133,"October 24, 2016",I picked up my 2012 Homda Coupe today. I want to thank Vy and Lee for their kindness and making me feel very important. Ask for Vy if you need a new vehicle. He is a wonderful person to have on your side. Thanks Vy!!!,5.0
134,"July 29, 2016","I went to get an oil change and decided to look at the new Ridgeline.  Mr. Hunter spoke to me and asked if he could help me. I had a 3 year old with me and he was very friendly and patient with both of us. He never complained when I had to stop and take care of her. He was very professional, yet caring.  ",5.0
135,"June 25, 2016",My experience with Art Moreno and Community Honda was execellent and a quick decision to purchas my new 2017 Honda Ridgeline RTL-E. I want to compliment how clean the dealership is  and how professional every one treated us here. Thanks again Art Moreno !!!,5.0
136,"June 25, 2016",Just bought a CR-V at Community Honda. Everyone was so nice and helpful. Rastik and Bill in Sales were great and I got a good deal. David in Finance was so nice and helpful. Thanks everyone!,5.0
137,"June 16, 2016","Absolutely LOVE my new CR-V Touring from Community Honda in Baytown. Quick and easy car buying process. Friendly and courteous staff. Thank You, Thank You, Thank You, Art!",5.0
138,"June 11, 2016","The salesman was polite, patient and courteous. The finance person was friendly and efficient. The facilities were clean. The salesperson was also very accommodating. I don't like to buy cars but this was not an unpleasant experience.",5.0
139,"May 30, 2016",Buena atencion por parte de Vy el vendedor que me atendio y fue directo al preciio del automovil sin hacerme perder tiempo ayuda rapida y honesta,4.6
140,"May 28, 2016","Garrett & Art took care of me with ease .. Treated me like family .. Definitely recommend my family & friends .,look forward to having a dealer I can rely on ",5.0
141,"May 26, 2016","I had a real bad experience at this dealeship on saturday with vy hoang the sales guy we had already sign all papework we need it a buyers order and we were going to take back to our bank. Not happy with that they had tbe nerve to call us a lil later after leaving there dealership that they had a another buyet for vehicle and they were selling it. The paper work we did meant NOTHING.
THEY PROMISE A SPARE KEY FOR VEHICLE AND DID NOT GET ONE...
DO NOT GO THEY HAVE BAD CUSTOMER SERVICE!!!!!#




",1.0
142,"May 24, 2016","Salsman Ty Hoang was hard to work with and would not want to work out a deal on my vehicle he fooled me by asking for all my information which he said was just for his records and ran my credit without my consent. Secondly Lee in finance department kept on insisting to do in house financing I decided  not too and received  and signed my buyers order on my way home I recieved a nasty  phone call from Mr. Ty Hoang telling me someone else was interested  in the vehicle and was no longer going to sell it to me that my buyers order I signed was nothing  
I really  needed  the vehicle  so I ended up buying it but I really don't  recommend them",1.0
143,"May 21, 2016",Community made the car buying process quick and pleasant! The customer service was beyond compare to any other dealer.  I would recommend them to anyone! ,5.0
144,"December 07, 2015","Kevin Pruett was our sales person.  He was very exceptional.  We were treated very professionally.  He helped us find the vehicle that best suited our needs.  We will not hesitate to recommend him to our friends.  
Jon and Judy Kruger",5.0
145,"November 02, 2015",We wanted to buy a new car and turned out to be the worst experience ever with the salesman who kept changing prices on the cars and trade in. He didn't seem interested in selling us a car.,1.0
146,"May 28, 2015","I have been to too many dealerships and car lots but not once have I met a great salesman like Bolivar. He actually listened to my situation unlike other places just wanting your money. If I hit the lottery, I'm coming back to take care of you my friend Bolivar. Best regards, Jamarcus M.",4.6
147,"May 12, 2015",. An alignment was done after driving car for test drive. They really didn't want to give me a loaner car to drive while car waiting to be serviced. They couldn't service the car the same day bought. Picked up car with water spots... No one to dry car. Really?,3.8
148,"May 11, 2015","Bob,  the salesperson, Tim, the Sales Manager, and the 'Finance Guy' were great. My mom and I had a great experience. They were patient with us....we did our homework. We drove an hour an a half to come here and did not regret it. Pleasant service.",5.0
149,"April 27, 2015",I worked with salesman Hatem Shahwan and from the start his customer customer service went above and beyond my expectations. Community Hona has great deals and everyone worked together to ensure that I had the best Honda experience ever! I definitely recommend Community Honda to anyone looking for great deals and exceptional customer service!,5.0
150,"April 22, 2015",I called community Honda to get a quote for my timing belt and kit to be repaired I got a quote of 649.00 with the coupon they had. Chris told me he could do the maintenance the next day. I show up next day and go home to wait on their call. At 3:30 in the afternoon. I got a call from Chris saying a sensor on my car just fell apart and I would need to replace it. Point here is it wasn't broken when I dropped my car off for repairs and Community Honda expected me to spend 300 more dollars for their mistake! They held my car hostage! I had to pay this to get my car back. I will never go back or recommend to any friends or family to use this dealership! Horrible experience!,1.0
151,"April 16, 2015",I came in to just get info I thought my credit wasn't at where it was supposed to be but mr Boliver Allmon gave me all the Advice possible and helped me I definitely recommend him he works to help the client and that's what matters ,5.0
152,"April 14, 2015","My review mimics the below guy.  I got an internet quote from Kristen on a CR-V, was told by Shelby she could see the car on the lot, and so I went cash in hand to purchase the car.  It did not exist, and Glover said he would not honor the price (I had the printed email from Kristen who had left by 5:30), and Glover went on to say he had not sold a Touring CR-V since November (this was March).  These guys have a problem with the truth.  I cannot recommend Community for any function based on my experience.  Stay clear of these cowboys.",1.5
153,"April 14, 2015",I was in and out. The people were very easy to work with and helped me to explore all of my options. In the end I got the car that I wanted at the price I was asking for.,5.0
154,"April 13, 2015","Parts were broken in a timing belt replacement, i.e. Crankshaft pulley. And a section of timing belt gasket missing. Community Honda worked hard to satisfy my concerns in the end. I appreciate their efforts. ",3.0
155,"April 09, 2015","Internet pricing Not honored by Glover @ community honda.   It was a wasted of our time to drive to Baytown to purchase a car.  Upon arrival, Mr. Glover greeted us and then he sent us to a sales person.  I told him that I had already discussed pricing over the internet with Kristen.  I gave him the quote and then he went over to discuss with the manager.  He came back and said this pricing was not valid.  He asked me for the email that had the quote but I did not have it.  They were able to confirm that I was discussing pricing with Kristen and the drive out price she gave me but they did NOT honor the price.  My husband and I were so embarrassed and humiliated by the staff because they made it seem like we were lying.   We have purchased several Honda throughout the years but never had this kind of treatment.  When I returned home, I was very upset but I still needed to buy a car.  I got on the internet again, this time with a Mazda dealer and they quoted a drive out price.  I went to purchase the car and the price remained the same as the quote over the internet.  They did not ask us to provide an email with the quote because THEY stand by their internet pricing.  It was a quick and simple purchase like car buying should be.  ",1.0
156,"March 18, 2015","First of all thanks to Lindsay Hardy for putting ads on internet. Very helpful.Thanks to Kevin for showing me the 2014 Honda, which we love so much. Thanks to Boliver for helping us through the process. Awesome teamwork.  Five stars to the whole team. My daughter loves the sunroof on our new car. Can't wait until summer. We are very happy with quality of service we received.  We highly recommend Community Honda.  We love our 100,000 mile warranty!",5.0
157,"March 05, 2015","I was new to the area and decided to purchase a car at Community Honda. Kevin Pruett was the salesperson who worked with me; he was extremely helpful for the entire process. He was patient as I test drove the car I was looking at, and was not difficult to negotiate with in terms of price. Be sure to ask for Kevin during your visit to Community Honda. ",5.0
158,"March 05, 2015",Kevin Pruett got me a great deal on my trade in & a great deal on my Honda! I can thank him enough!!! Great Job Kevin,5.0
159,"February 18, 2015"," I love, Love, LOVE my CRV-EX L. It has everything I want in a car. I drive 60 a day to and from work so it has great gas mileage. It has saved me so much money at the pump. I can get pretty close to 450 miles to a tank, which holds 15.3 gal. of gasoline. One of the most exciting features on my car is the blind-spot camera, which I use all the time. It takes the fear out of changing lanes in our heavy traffic situations. 

This is my second Honda from Community Honda. Thanks to Kevin and Boliver, who answered all the questions I had, I was able to get the car I wanted at a reasonable price, and with all the bells and whistles. They walked me through setting up my Navigation system, my blue-tooth, and any other things I needed help with. The whole team at Community Honda from Sales, to Finance, to the Service Maintenance Dept. treated me like family. Customer service is a big deal to me and Community Honda surpassed all my expectations. Yes, yes, yes, it the the place to purchase your next car, and I will recommend this dealership to others.",5.0
160,"February 09, 2015",My wife and I looked all of the dealerships around Houston area to get the 'right' price on Honda CR-V. We finally got it through Community Honda two weeks ago! Boliver helped us through this process as well as their finance team. They drove few miles to pick up our check and drop off what was missing on driver's seat. Great customer service!,5.0
161,"February 01, 2015","We had a great and short experience buying our new car.  Boliver Allman was our primary salesperson and helped us with every step.  The  team and Community Honda works well together and make you feel very welcome.

Thanks to all of them,

LWM",5.0
