,Date,Reviews,Ratings
172,"July 21, 2012","With all these 5 star reviews it seems these people write their own reviews. My experience with the service department was horrible. There is an overall disinterest in helping customers. Having people wait around for no reason seems to be the slogan. I purchased my vehicle from this dealership and was pleased with the overall purchase. I spent  two hours for the service department to tell me the check engine light was due to a gas cap leak.    They told that they would need to keep my 2 week old car for a day to leak test the system.  Because they did not have a loaner available I scheduled a time to come back when they would have one available.  When i arrived they had me wait another 2 hours to rediagnose the gas cap error.  I then was stuck into a civic which was dirty smelly and loud.  I dropped the car off Tuesday morning and it was not ready until late Friday.  When i arrived it took 20 minutes of waiting while no less than 5 employees milled about talking to each other for to finally go looking for Jason.  I find him standing around with 3 garage guys shooting the breeze and he pointedly avoids me.  I complain to Troy who says all the right words but could not care less.  This will the last company car i purchase from these guys.  I guess they dislike cash purchases.
 
",2.0
173,"July 19, 2012",I brought in my 2000 prelude because i was exsperincing multiple misfires on all cylinders i was at the point to were i was ganna sell the car if it couldnt be fixed. so as a last resort i took it to my local dealer and had them run a inspection on it within the next day they called me telling me exacly whats wrong and was working on my car as soon as i said yes they had my car in and out before i even had to go to work. im happy i took it to them car runs completly fine and i was able to get my inspection done on the spot ( was Driving on a inspection 2 months out . Thanks Eddie Guillory for helping me and answering all my questions on the spot whenever i needed.,5.0
174,"July 05, 2012",Eddie Guillory is a great service provider and understands what a customer needs.  He was able to answer on my questions and answered many even before I asked.,5.0
175,"July 02, 2012","I was expecting to wait 2-3 hours for my service, but was finished in a little over an hour in spite of the fact that I had work done that was not scheduled.",4.8
176,"June 30, 2012","Bought a new Odyssey (04) from this dealer and had it serviced here since. Eddie Guillory has been my service advisor of choice ever since I met him. He is always very professional, courteous, friendly, knowledgable, and prompt. On my last visit, I called@11:45am took the car in and was out by 12:15! Great service!!",5.0
177,"June 30, 2012","I had complaints about some experiences with the service personnel which I took to the service manager, Glenn Gregory. He has gone out of his way to address these issues and cause me to feel confident in Honda of Clear Lake once again. I am comfortable knowing that if I have concerns in the future, Mr. Gregory will listen, investigate, and act. ",5.0
178,"June 26, 2012",Once again Clear Lake Honda came to the rescue. Eddie Guillory and his service staff checked a slight noise in my steering column and it is now fixed and working great. It is always a pleasure to do business with the service department at Clear Lake Honda. We went for a test drive before I left to make sure all was well.  Thank you Clear Lake Honda! ,5.0
179,"June 18, 2012",Eddie fit us in on a Friday afternoon for scheduled maintenance and got us out by closing. He took us on a test drive afterward to evaluate a possible problem and gave good advice on alternative resolutions. As always he was very courteous and conscientous. ,5.0
180,"June 18, 2012",Service was great. I wish that the tech clould have diagnosed the problem without having to update softwate and then charging me for the update to help him do the job I took my car in for.,5.0
181,"June 08, 2012","  In '06 I bought a new Honda Ridgeline from Honda of Clear Lake and purchased an extended maintenance contract at that time.  In all this time I have dealt with one Service Advisor, Orey Hebert.  In over 50 years of driving, I have owned many cars and dealt with many service advisors, but have never been as pleased with any of them as I am with Mr. Hebert.  He always goes the ""extra mile"" - taking time to listen and to explain what needs to be done . I really like my Honda and a large part of that is because of your service dept.
Jim A.",4.8
182,"June 07, 2012","I purchased a car from them in 2008 and feel like I was ripped off by this dealership.
They added $2k to the sticker price of the car and made me sign a piece of paper from the manager, saying the car was a hot item and they are applying a surcharge. Well I am an idiot and signed it. Needless to say the car didn't get the mileage it was suppose to, according to them ""I wasn't driving the car right"", which I was not told there was a proper way to drive the vehicle upon purchasing and if I knew that I wouldn't have wanted the car. I've had regular oil changes there over the years and their work is ok at best, one instance they didn't put the under carriage back on properly and it fell down and pulled down some of my bumper with it while driving down the freeway. When I took it in for repair they charged me to fix the bumber and did a bad job as one of the clips were still broken, and I often had to ""punch"" the side of the bumper back in.

So here I am 4 years later, and I traded the car in at a GREAT dealership this time. When I called Honda of Clear Lake for a refund of insurance that I had purchased the finance manager asked ""why didn't you come back here to get a car?"", I responded that I felt like they screwed me over on my last car and left me severely upside down. His response to that was ""oh ok""!. Seriously??!! Horrible customer service is all I have to say.",1.4
183,"June 01, 2012","I have a 2009 Honda Accord. The steering column needed to be replaced. The gentlemen at Clear Lake Honda contacted Honda and explained the situation and arranged to have my steering column replaced at no cost to me. The staff at Clear Lake Honda are always wonderful. I  also purchased the lifetime oil change from this dealership - it is a very good deal. I would highly recommend this dealership to anyone! Their service after the sale is exceptional - even if you did not lease/purchase your Honda at Clear Lake Honda. I know from experience, 
because I leased my Honda from Gillman Nissan/Honda in Fort Bend. Gillman lost a customer forever (after my family purchased 4 cars from them) and Clear Lake Honda gained one.",5.0
184,"May 29, 2012",Eddie was very professional and took care of the problem with my vehicle.  The turn-around time was amazing.  I really appreciated the friendly service and will be back whenever I need service again.  Thanks.,5.0
185,"May 20, 2012","Very good service,Eddie was able to get me in on short notice the same day.No where but Honda of Clear Lake for all my service work.  ",5.0
186,"May 06, 2012","Great service at Clear Lake Honda thanks to our service advisor Eddie Guillory! We bring all our three Hondas to him. Eddie is knowledgeable, honest, courteous and helpful. He takes the time to listen and check any area of concern we have and takes the trouble to explain. We’ve dealt with many mechanics and service advisors over the years and he is one of the best. Thanks Honda!",5.0
187,"May 06, 2012","I took my CRV in for recall work.  My only complaint is that the service advisor estimated that it would take 1 hr and 15 minutes and in reality it took about 2 hours and 15 minutes.  If I had known it would take that long, I would have made arrangements for someone to pick me up so I wouldn't have to spend over 2 hours waiting at the dealership.",4.8
188,"April 29, 2012","Service was top notch from Orey Hebert, as always.  He always seems to take personal care of my car whenever I bring it in to Clear Lake Honda.",5.0
189,"April 28, 2012","We live in Clear Lake and used the internet to shop the price after we found the car we were looking for.  All dealerships around would call and followup with us to see what they could do to earn your business.  Well Clear Lake was very hands off and I thought that's great they are not getting aggressive to get the deal.  So we proceeded to call our sales person to get the price and car we wanted.  First I emailed all the specifics and did not hear anything from the sales person.  A day went by and I thought well I will call, sales persons phone was turned off and left a message in the morning around 9 am.  It was around 1:30 and I had not heard anything and so I called again and explained to the sales person we were ready to buy the car they had showed us.  I asked if they had seen my email and they said no they don't even check email.  Now I am getting mad, because if you do not check email do not put this on your card.  So I thought I am really working hard to place my business with Honda Clear Lake and thought there were 2 other dealers David McDavid and Russell and Smith Honda that were trying to get my business.  So I went to Russell and Smith and worked with Ali the Internet Manager.  Ali was AWESOME.  I have bought some cars, but I tell you what Ali made our experience pleasant and worth while.  No Haggle, very friendly, and he knew EVERYTHING about the Honda Pilot, and explained all the features about the Pilot.  He was great. Go Visit Russell & Smith.  Looking at Dealerrater for the firs time no wonder they are Ranked #1.  They know how to make the buying experience pleasant, informative, and they truly will do what it takes to earn your business.  ",1.0
190,"April 27, 2012","This is my 3rd or 4th Honda vehicle, three of which were purchased at Clear Lake.  I ended up not liking the Ridgeline so, traded it for my new Pilot.  I am very happy with the Pilot and have always been very satisfied with the service.  It is excellent.",5.0
191,"April 22, 2012","The service department always shows the most professional courtesy, service and follow-up service when required. I will not take my Accord anywhere else, even for the yearly inspection. I trust they will make my service experience a total satisfactory experience.",5.0
192,"April 21, 2012",Orey Roberts is my service advisor.  He is always helpful and courteous in my interactions with him.  I appreciate having one person I can call and to whom I can speak when I need something for my vehicle.  Please share with him my gratitude for the service he provides.,5.0
193,"April 18, 2012","Troy treats customer like a family. I am very pleased with his service. He has worked my vehicle and know about my vehicle very well so I dont even need to explain in details. if something goes wrong.
thank you,",5.0
194,"April 09, 2012","  Mr. Guillory was very helpful, friendly, and knowledgeable.  He fixed everything that was needed on my 2001 Honda CRV. I feel confident that it is in tip top shape for the road. Also, it was washed and detailed like new when I pick my car up.",5.0
195,"April 04, 2012","They did not change oil when that was the reason I took the car includig routine maintenance. They are always trying to find things to do and charge for it. When we called them back about not changing the oil after we took the car home, they started questioning us instead of acknoledging their mistake. They tired to make it appear as if it was our fault. When I asked my husband to talk to the manager, who also intially tried to make it appear as if oil change is not part of routine maintenance, then asked us to go back (30 min drive to get to this dealership for us one way)and they would do it at quick lube change station.

When I got there, whole new quetions started. I asked them to call the manager and ask him, but they would not do it. It was so aggravating. I had to start out all over again fending accusation that may be the oil did not need changing!!

This past week our second car had oil llight get on when we were out of town and when we cheked, there was no oil at all. We had done oil change in december and prior to that in August 2011 in that car. We had to take it to oil changing place and no leak was found. Now I am wodering if those two times oil was really cahnged in this car at the this dealership or they just put the sticker. 

I will not take my cars back here and will not buy a new car at this dealership either.",1.0
196,"March 31, 2012","I was very pleased to work with Orey and he explained the service procedures associated with maintaining the car in warranty and made my first visit a pleasant one.  I intend to work with him as my Service Advisor in the future.

The oil was changed as requested, the service was quick, and the car was appropriately maintained in a clean condition.",5.0
197,"March 28, 2012","We have always received excellent service at this dealership.  Eddie is always very professional, friendly and prompt.
The facility is clean and the staff is friendly and helpful",5.0
198,"March 23, 2012","BUYER BEWARE!! I contacted Scott Campbell, internet sales manager at HONDA OF CLEAR LAKE. He offered to sell me a 2009 Honda Civic with 3k miles for $14000. I ran a carfax and the MILES HAD BEEN ROLLED BACK. When I informed him his reply was ""It's still the cheapest car within 500 miles. Maybe I should look for a car with more miles""
VIN #2HGFA16379H340576

He said I should not drive there but lifeflight myself there for a deal that good. I think people need to lifeflight themselves away from Clear Lake Honda to avoid getting ripped off. Instead of apologizing and having concern he was rude, like it was myfault that my carfax showed the mileage changed approx 25k miles when Honda bought it back.

I came to the dealer with credit approval from my credit union. I thought this place was reputable and I had faith of getting a quality car but I guess all car businesses are the same no matter where you go.",1.0
199,"March 20, 2012","Took in Pilot for oil change. Purchased Pilot from this dealer. Discussed other recommended service with with service rep Joe Robinson. Very satisfied with his explanation/comments, had service work completed. All pricing explained. Work done quickly, no problems.  ",5.0
200,"March 19, 2012","I received awesome service, customized to my vehicle.  I purchased my Honda at Clear Lake and will definitely make my next purchase there since the staff and care they give to the customers is exceptional! Great job guys!!!",5.0
201,"March 10, 2012","I just bought my new Civic Coupe with them today. It was a pleasant experience. I really enjoyed working with Doug Dahlstrand and his manager, Bennett Johnson. They have been helpful, straight forward and very cool with a demanding customer (like me, i know I am). Doug even made extra efforts to make all arrangements ahead of time to save my time at the dealership. I look forward to having the similar level of service at Customer Services later. Strongly recommend the team of Ben and Doug when you buy with Honda of Clear Lake.",5.0
202,"March 05, 2012",I have always had a pleasant experience with the service department. I have bought 1 new car from this dealership also and had a good experience back in 1999. The service department has either given me a loaner car or shuttled me home when needed. They communicate well also.,4.8
203,"March 01, 2012","I had a great experience with Honda of Clear Lake and especially Eddie Guillory.  Eddie was extremely professional, courtious and knowledgable.  I have an older model (1999) civic which I brougt in for service.  Eddie took great care of me beginning with my phone call to schedule service, through the entire process, until my vehicle was completed. My vehicle was thoroughly inspected, then Eddie sent me an e-mail with all the findings, explaination of service and an action plan to correct issues found. He then discussed the repairs needed with me over the phone, for which I agreed to, ordered the parts and alerted me via e-mail when the parts arrived. He arranged for me to have a loaner vehicle, which was greatly appreciated!  On top of the great customer service, my vehicle was repaired correctly!  I now have peace of mind, knowing that my vehicle is in tip-top-shape! Excellent customer service - I would recommend Honda of Clear Lake to everyone!",5.0
204,"February 28, 2012","Unscupulous behavior. Lying to get you in their business, misleading, no integrity or moral character. HTey lied abou t what they would pay us for a used vehicle to get us in the business, mislead us for 3 weeks, promised a price was good for 60 days. We went in to sell our deceased mother's car. THey Told us we had to have the title changed into my name to sell the car and then once we did and we went back ot the to close the deal. they told us they could only pay a much lower amount, in fact $2,500 less thatn wha they told us was good for 60 days. They are scam artists, liars, and  can't be trusted. We lost 2 sales on the car because we had to wait on a title they told us had to be changed which in fact did not have to be done, according to the Brazoria County Title office. 
We have bought our last 3 cars here because of their sales person A.J., how is wonderful and delivers excellent customer service. He has integrity, good moral character and is honest. But due to the way we were treated we will never step foot in their dealership again and I will not recommend the dealer ever again as we have been doing for the last 7-8 years since our first visit.",1.0
205,"February 27, 2012","Joe was very helpful. When the car could not be ready on time, he quickly arranged for a longer car. Thanks for making it a good experience.",5.0
206,"February 20, 2012",Service was begun by the technician at the scheduled time and in a timely maner. Clean shop area. Great customer service from the service advisor.,5.0
207,"February 18, 2012",I always recieve excellent service when coming to Honda of Clear Lake. The staff are always helpful and I never feels as though i'm being taken advantage of. Great service at affordable pricing.,5.0
208,"February 14, 2012","The service was polite, efficient,and done well. The oil change was completed in half an hour.  There were problems that needed correcting.  This was explained to me, and I gave approval.  The corrections were made quickly,and efficiently.  I appreciated the fact that they parked the car as close as possible so I didn't have to go far in the rain.",5.0
209,"February 12, 2012","
Awesome customer service. Quick oil change. I was in and out in 30min. Tony in the service dept is great! Very knowledgable and helpful. Thankfully I got the lifetime oil change with the purchase of my vehicle. So i dont have to deal with anyone else on my servicing of my vehicle. Thanks Tony!",5.0
210,"February 07, 2012","This place left me in a miserable mood, it's dirty, dingy, and unprofessional offices make it feel subpar. It's staff is even worse.  Kimberly finance basically lied to get me to go in just so I can speak to an arrogant and irritating salesman who would look at me like I was stupid.  Don't go here and expect to be treated with respect.",1.6
211,"February 04, 2012",Sensitive to helping me get my car fixed and provided a loaner while it was being fixed.  Great service from everyone at this dealership. I would recommend that you try them if you are not happy with another Honda dealer,5.0
212,"February 04, 2012",Eddy Guillory was very helpful and respectful to my wife and I he made sure we were as comfortable as possible and had us in and out immediately.,5.0
213,"January 17, 2012","Eddie's extremely professional, courteous and helpful. My car needed major maintenance and had a recall issue that needed to be corrected. He's very thorough. The loaner was ready for me when I arrived and the work was completed in a timely manner.",4.8
214,"January 15, 2012",I was impressed with Jason's professionalism and keeping me updated with regards to  the repair of my car.  Iw will definitely ask for him at my next visit.,4.4
215,"January 12, 2012","Very arrogant &amp; condescending mgrs esp towards women. They DO NOT DISCLOSE ALL THE FACTS and will try to steal your money at every turn, we were robbed of $399 & possibly more!  BEWARE - ESP WOMEN!",2.0
216,"January 09, 2012",Eddie Guillory is a conscientious and excellent service consultant.  I love the detailed Personal Vehicle Printout sheet given out by Mr. Guillory.  It offers a complete easy-to-read and understandable  report that enabled me to make an educated decision for my vehicle's service needs.   Thank You.,5.0
217,"January 04, 2012",I have always received Excellent Service from Honda of Clear Lake!  Everyone is so friendly and helpful.  They always take their time to explain repairs and recommend any future repairs.  Most people refuse to go to dealerships for repairs because of prices but with the staff at Clear Lake Honda they always offer coupons and other alternatives to save money.  Service Staff like Honda of Clear Lake will always make me choose them over any other repair shop because of their professionalism and knowledge.,5.0
218,"January 03, 2012","I'm happy with the service I received at Clearlake Honda November 2011.  I had an oil leak repaired on My Honda Accord 192,000 miles old.  I had it repaired at two other shop and they were unsuccessful.  Took it to Honda after two attempts Honda was able to successfully stop the bad leak. Thanks to Eddie Gillory for his professional assistance along the way.  I'm one happy customer of Clearlake Honda.   ",5.0
219,"January 02, 2012",Tony gave me great personal service - explaining all of the services that would be performed on my car and informing me of the need of a battery before proceeding with the change.,5.0
220,"December 27, 2011","I have always had  positive experiences with Honda of Clearlake since I first stepped into their showroom in 2007.  Each person from the salesman to the service person has been professional, knowledgable, and helpful.  My last experience was the same.
 
The last time I went in was for an oil change.  Mr. Robinson told me I needed more extensive service done at 26,000 miles.  The package was too expensive for my December budget so he told me the most necessary was the fluids change; the rest could be done a little later.  This was so helpful and definetly good customer service.  I really appreciated it.

I hope this enough information to allow you to recognize my rating.

Thank you,
Edna Hamilton
 ",5.0
