,Date,Reviews,Ratings
0,"May 05, 2020","I can’t say enough great things about Honda Cars of Rockwall. If you are looking for friendly staff, look no further than Rockwall Honda.",5.0
1,"June 05, 2019","Car was supposed have me and my sister name on it 
2017 civic
Got behind on note 
Got a call from sales manager telling me to call Honda financial and not to tell them I had car 
But to tell them I'm just a financial help to my sister
 Whole deal was bad
Called Honda financial 
They told me they would have never did a deal like that
And why did they only put my sister loan since I'm the one that had the car and was paying for it

I will never recommend this company to anyone ",1.0
2,"May 10, 2019","Dont use them!  Find another dealership for your car purchase!

We have been in contact with them for a few days about the purchase of a used vehicle that we have been searching for.  For days, we have been in touch by email and phone and everything seemed good to go for us to fly in to test drive and purchase (we were flying in from Colorado).  After speaking with Jim and Matt all week, we booked a $400 flight to Texas late Thursday night after speaking with them one last time.  Friday afternoon, we were told that this vehicle was getting work done at a Jeep dealership.  This information was known to them all along, but they never bothered to tell us.  We are now out the $400 for the flight and now all we can do is our best that nobody else makes the mistake of doing business at this dealership.

Also, all week this vehicle was listed on multiples sites (including their own site) at the same price, but as soon as they knew were were coming in to take a look, the price mysteriously went up $1,000 Friday morning.  

Don't think that this dealership is different than any other used car dealership and do your best to stay away!  whatever we can do to help others not make a bad mistake.",1.0
3,"February 24, 2019",Ben Teaney is a liar!!! Do not trust him!! He tells you want you want to hear to get you in the dealership. Then he goes back on the deal that he says his manager agreeded to. I drive along way and he passes me off to another salesman. I talked to him 3 times that morning to be assured of the deal. Because it wasn't in writing he acts like I'M the one lying!!! Do not go to this dealership!!,1.0
4,"January 02, 2019",The salesman who helped me get a great deal was Luis . The dealership honored the price they advertised. But it was Luis who was very professional and helped make the whole experience well worth the drive. ,4.8
5,"November 08, 2018","Glen Tate was my Salesman he went above and beyond to get me in my 2014 Honda Accord fully loaded at a great price also . Mr. frazier was excellent also . 
They both were very informative and help i had a few hoccups and didnt think i could buy from there but Glen Tate assurd me i could and these guys made it happen. My family loves Honda's and npw we have 3 in our drive way . Thank you so much Mr. Tate for going that xtra mile .certified honda ",4.8
6,"October 17, 2018","They are not genuine in sales and services. The account department does not know what they  are doing. They don't have qualifications. Poor explanation and the assistant accounts manager is very rude. She tell you one thing and later on denies. The services department is not qualified. I took my car for the first service, they messed up with alignment. I had to spend more to fix it somewhere else. Be careful buyers.",1.0
7,"August 10, 2018","Impressive dealer inventory, great customer service from Kim Carter, made us feel comfortable every step of the way! Would highly recommend! Sheryl Walsh in finance was very friendly and helpful also! ",5.0
8,"July 20, 2018","I bought a 2010 Ford F-150 supercrew 4x4 back in April. Started off with a horrible car buying experience. Had been discussing things with a salesman over the phone and set up an appointment to come in and look at the vehicle, show my trade in, and go through the process. Salesman was not there when I arrived like promised. Had to start the process over with a whole new salesman. So had to go through all the run around on price again. Was told the truck was 20k at first even though the first salesman had already quoted me a price at 18.5k and I had showed the text so we could start the negotiations at that point. During this time a huge hail storm comes through Rockwall. We leave shortly after not coming to terms on price of the truck. I receive an email a week later about reduced prices on the whole car lot cause of the hail damage to most vehicles, including the truck I was looking at. Then I receive a call from the original salesman that the truck has been reduced and now they could get me down to my monthly payments I wanted to be at. I ask about the hail damage and yes it has some on the hood and roof so the truck had been discounted but also they would be fixing it even after the sale since damage happened before the sale on the lot. Went ahead and let them run the numbers and send my info to the bank for approval. Told them I would not be trading my car in so I would have no negative equity to roll over on the new truck so that way that my payment could be lower. So agreed to a price over the phone and told the truck was ready and that I just needed to come sign the papers and it was good. Also told that once again the hail damage would be fixed. Show up and salesman once again tells me you don’t have to put anything down and all is good. Then I go to finance office to sign paper work and I’m asked how I’d like the pay the $500 I was told I needed to put down. I just told them I didn’t want the truck then if that was the case cause I was told I had a deal in place and was ready to go. So then they worked it back out so I would put nothing down. So signing paperwork with just myself on the loan and once again assured the damage would be fixed and they would give me a call and set up an appt and give loaner car. Receive a call a few days later that now I need myself and wife on the loan so we need to come back and redo paperwork. So we do. Then a couple days later I’m told the paper was messed up and that dates were wrong so they send the salesman to my house to have us sign paperwork. So I set up an appt with the salesman to meet at my house to sign. Which he shows up before me and just has my wife sign my name to paperwork then leaves before I can get there. Then call him and I’m reassured he’d be calling me next week to set up an appt to bring the truck In and get my loaner car so the hail damage can be fixed. No call, no return call from the voicemail I left him. So I go to pick up my plates and talk to another salesman and he says he’s aware and that my name is on the list and they are bringing in 5 cars at a time to fix due to having to give out loaner cars and that they’d be getting in touch with me to have it fixed. Fast forward to today and I call after emails to the dealership with no reply or anything. A salesman calls me back that remembers talking to me and is trying to be some what helpful but is trying to tell me that the hail damage repair guys are not at the dealership anymore and that my time window basically is done and it can’t be fixed now. He did also say he would try to contact general manager to see if they could still take care of it or estimate it and pay for it to be fixed at another shop. Which it what I’d prefer after this treatment I’ve received so far. The salesman that sold me my car and finance guy no longer work there either. So basically I was lost in the cracks or whatever they want to call it and now they don’t want to hold up their end of the deal. I also purchased a warranty with my truck to which now I pray nothing does happen to it cause they will probably try to screw me over there too. I know buying a new vehicle is never easy but I wouldn’t not recommend you ever even step foot on this lot to even talk cars with anyone after my experience. I’ve bought a few cars from Rockwall ford and Rockwall dodge and I’d highly recommend just going there and dealing with a dealership with some integrity and that will live up to their words. ",1.4
9,"April 04, 2018","Our experience with Honda Cars of Rockwall was very pleasant and delightful one, no pressure just a satisfactory  transaction. We commend Will Huerta for a job well done.",5.0
10,"April 02, 2018","This review is more for their finance department rather than the sales or service.  I purchased a vehicle in 2015 and traded that for another one in 2017.  They were supposed to send my gap insurance refund back.  I sent them all the documentation that they needed (as they instructed), waiting for months and never got my check.  I had to call them several times, and spoke with one their finance rep named Nancy.  Initially she told everything is in order and I should get my check.  Waited for another 3 weeks and still no check.  Called them back , and Nancy answers the phone again, and this time she tells me she has not clue what's going on and I need to contact their accounting department.  Not to mention she was rude and kept talking over me and discrediting me over the phone.  I spoke with their fiance director John Martinez and explained to him that I just needed my money back, and he told me the same thing that they don't deal with that and I need to call the accounting.  I was like why didn't you say this thing they first time I ever called your department!!  I just thought they were not open about this and the department and its personnel did a poor job at handling the situation.  They are very efficient at getting their money from you but not so good at sending you the refund you need.  I will not purchase any more vehicle from them again.",1.0
11,"April 01, 2018",We had a great experience buying our new 2018 Honda Pilot. Jim Bywater did an excellent job showing us what we asked for. Kevin Bonds in finance also was easy to work with. Overall one of our best car buying experiences. ,5.0
12,"March 30, 2018",It’s bright friendly service.  Sales people that will understand your needs And work with you in getting the right Vehicle for you. There is no high-pressure sales.,5.0
13,"March 29, 2018","From the front door on your fist visit, Everyone is helpful and genuine.  My questions were answered either with a phone call, email or text.  Top rate dealership and staff!",5.0
14,"March 19, 2018","They respected our request not to be ""hounded"" once we went in or an initial test drive but communicated information as we requested it. Even though they didn't have my desired car in inventory, they were able to acquire it by trade with another dealer. Even the finance guy was great. Furthermore, I love my new car.",5.0
15,"March 18, 2018",Every employee we came in contact with was very polite and kind. My wife & I were confident they all did every thing they were capable of doing. ,5.0
16,"March 16, 2018",Sales associate knew his product and provided very good details of the 2018 CRV we purchased. This is the second Honda I have bought from this dealer and I would recommend them to my friends.,5.0
17,"March 08, 2018",The dealership was great.  Ben our salesman worked with us and only showed us vehicles in our budget.  The entire process from start to finish was good.,5.0
18,"March 06, 2018","Jim was very knowledable on the specsifications of each car, and understood what my goal was.  He went above and beyod to search for the specific car I wanted, when the oirginal car delivery looked like it was going to be delayed. He even had the caar delivered so that I could surprise my daughter with it.  The business person i worked with was very proficient, and did not waiste my time trying to seel me everything under the sun.  I would definately buy from Honda of Rockwall again!",5.0
19,"February 27, 2018","Justin my sales rep was very nice, professional, and made the card buying experience a pleasure.  I love my Civic!  The all around environment of Honda of Rockwall was friendly and full of energy!",5.0
20,"February 25, 2018","Our sales rep Kim made sure any and all questions were answered.  The sales manager had honest and helpful advice.  Finally, the finance rep got a very attractive rate that worked very well for us.",5.0
21,"February 25, 2018","Brandy was great,no pressure, she felt honest and sincere. My 3rd CVR and my second CVR from Rockwall Honda  
I’ve already referred Stacy and Danna Chapman for s new Honda CRV ",5.0
22,"February 24, 2018","Horrible experience, the advertised price is not what you get.  They get you in and then add $600 of dealer add ones.
Then at closing the car was advertised as a Certified PreOwned, they said the price did not include the CPO, it was extra.  Salesman never said it was extra only told us the benefits.
YOU are why car salesmen/ dealerships get such bad reputations.  If you are going to charge more,  advertise it.  Horrible, wrong!",1.0
23,"February 24, 2018","I am extremely disappointed in this dealership!  I have dealt with many people and dealerships in my life and have never seen such rude and inconsiderate people!  I did a pre-purchase on a car on Thursday night. I wanted to take it to our mechanic to get it checked to be sure it was a good safe car since I have 3 children. The mechanic told us about 900 dollars worth of work that needed to be done on the car. We tried to call the pre-owned director Nabeel Alghussain on Friday and left 3 different messages in which the last person assured he would call at 10 today Saturday. He never called so my husband and I both called today several times and no one would put us through to him. In the meantime my husband spoke with someone named Ryan who said he was also a pre-owned director. He stated he could do whatever we needed Nabeel for. He told my husband he could sell it without fixing these issues and that he believed his guys over our independent mechanic anyway. Finally, Nabeel did call me back and stated I would have to wait until he had time to deal with it. The people who were at the dealership were more important. So my husband went us there so we could also be important in their eyes!  He asked for Nabeel when he got there and they sent out the original sales guy who just got us the keys to our trade in and switched cars back!!!!  Then my husband asked to speak to the manager John Fraiser who in my mind should have been involved long before now and he was nice and said that nothing should have been handled the way it was so I am glad that he at least admitted how this should not have happened!  However, beware if you are looking for a pre-owned car they have actually stated they would sell this broken car that needs work done to someone else with no problem!  That’s the kind of service you are getting!  They don’t care at all about the people only the deal!  Very, very, very disappointed!  I would never want anyone to be treated like we were and I would never want to be sold a car that I immediately needed to get fixed!  What a sad place!  I can’t imagine wanting a deal so bad I put people in danger with a car that needs to be fixed!  I would steer clear of this place!!!!",1.4
24,"February 24, 2018","I made my appointment online; however, WillHuerta called me and made sure I did not get lost by giving me directions to the dealership. Will helped me to acquire my new Honda Ridgeline. I enjoyed talking to Will. He was very helpful at all times. 

Thank you, Will Huerta, for your dedication, honesty, and friendliness. 
  ",5.0
25,"February 23, 2018",Wade was honest and up front from the start.  We knew what we wanted and there was no hassle or back and forth like you find at many other dealerships. We love our HR-V and had a great experience during the entire sales process. Honda of Rockwall gave us the best price and the best customer service - they even called to follow up a few days later to make sure everything was going well and that we were happy with our purchase.,5.0
26,"February 23, 2018",The service was A1. I shopped here first before the other 5 dealers around the DFW but Honda of rockwall gave me the best deal and offer for my trade in form the start so there was only one dealer to come back to at the end.,5.0
27,"February 19, 2018","Thank you Jim Rutelonis for all your support and know how of the vehicle. You made our purchasing experience very memorable.

Thank you,
Donny S.",5.0
28,"February 09, 2018",Easiest car buying experience ever! Super friendly & no pressure! I LOVE my new car! Both Jim’s are very knowledgeable & helped teach me the way my new car works with all the electronics & new technology!,5.0
29,"February 07, 2018",Skyler was a fantastic salesman and was great at answering all questions. The sales manager and financier that we worked with were also extremely knowledgeable and polite. ,5.0
30,"February 04, 2018","I purchased a new Honda CR-V. Honda cars for Rockwall offered the best price and the while buying experience was smooth. There were a few minor hiccups with my financing, by the dealer was very flexible and accommodated my situation. Highly recommended.",5.0
31,"February 04, 2018","I contacted your dealership and ""met"" Tanner over the phone.
I shared my selection and my price point, a few must-have's.  Because of my need for cloth seating, I had to forego the navigation and moonroof; however, my basics were included on my selection.
Within a few minutes we had agreed on a mutually favorable car/price.

I came in to your showroom and met Tanner and Jim; both very helpful, professional, educational and made the experience efficient.
Jim went with me for the test drive and was very knowledgeable about all the features new to me (apple car play/etc tutorials).
The actual buy was two-part process; your team knew I had time constraints and worked to get me in/out and ease.
When I voiced any concern(s), both Jim and Tanner were able to share solutions
Because I was alone when I purchased the Pilot, your Honda dealership ""housed"" my car for 24hrs and upon return, my car was pulled around front for easy accessibility.
I brought a church friend with me to help drive back my car to Dallas.
I told your staff that my church prayer partners had been praying and they/Honda of Rockwall was certainly ""an answer to many prayers""!

I certainly feel it was like meeting friends who were wanting to help me get a car not car salespeople wanting to just make a sale.
Your team made a friend and they sold me a car!
They've assured if any problems or concerns to call or come back and they will make sure I'm happy.

I will be back.  I will tell my friends and family about this outstanding car experience with these two find gentlemen :)",5.0
32,"February 03, 2018",Salesman help me transition from a lease to a purchase smoothly. Helped me get a price I could live with. Had the car I wanted.,5.0
33,"January 31, 2018","I got a mailing about an offer to trade in for a newer model, and I highly recommend doing it!  Brandy and Cody Johnson were very professional, pleasant, and helpful, and we walked away with a great new car (2017 Honda Pilot EX-L- love the improvements over the 2016).  ",5.0
34,"January 21, 2018","I wanted a CRV in Sandstorm.  Of course there were not that many; two (2) in Texas.  My sales person, Jim Bywater, made absolutely sure I got what I wanted at the quoted price..  It was a pleasurable experience with no drama...just satisfaction.  Jim is a great sales person and Lorenzo Washington in Finance is by far the best Finance person I've had the pleasure of dealing with. If you want a great experience make sure you check out Honda of Rockwall. ",5.0
35,"January 20, 2018",Everyone that I came in contact with was very welcoming and friendly. Through the whole process I never felt lost. Everything was explained in terms that was understandable to me. I would use the dealership again as well as refer them too. ,5.0
36,"January 19, 2018","I would recommend Rockwall Honda to my friends and family due to the friendly service that I received.  My salesman, Kim Carter was very helpful and knowledgeable about the vehicle that I chose to purchase.",4.8
37,"January 18, 2018","I am writing to you to express my appreciation for the excellent customer service which I received from your company on my last visit January 6, 2018. The staff was extremely warm, accommodating.& very helpful.
I would like to thank your company personnel in the Sales Consultant department, Denise Hulsey took care of all my questions & concerns. She was able to relate & connect with me. She has a great rapport with everyone she meets. I was impressed with her knowledge of as a Sales Consultant & she was very organized. She is an excellent asset to your company.


Regards,
Debbie Morales",4.6
38,"January 17, 2018","Brandi was excellent, she was the 3rd sales person that I've worked with in that dealership and I have to say that she was the best, great customer services and friendly. Brandi and the financial guys made my purchase possible. Thumbs up for them!",5.0
39,"January 13, 2018",It was a pleasure working with Luis my salesman in the purchase of my new car. Very informative and helpful. It was the easiest car purchase that I have made ever. ,5.0
40,"January 06, 2018",I had a 10/10 experience with Honda Cars of Rockwall. They went above and beyond in my vehicle purchase. I will be back in the future. ,5.0
41,"January 05, 2018","Kim Carter was great to work with.  We did an exploratory search, before Christmas, on line for Odyssey with expectation to purchase in 2-3 months.  Kim contacted s my phone and email and we said we would come by after Christmas.   We surprised ourselves by making a purchase that day. / Only negative was primarily us.  We came before lunch, made decision to purchase, we’re paying cash, and had to wait about 40 minutes to complete purchase with Finance.",4.8
42,"January 05, 2018","We got a new HRV (which is an amazing car) from Jim Rutelonis.  We've been dealing with Jim for 15 years and I would never use anyone else to buy a new car.  He is honest and keeps his word.  If you need a new Honda see Jim at Honda of Rockwall, you won't regret it.",5.0
43,"January 03, 2018","Friendly service, easy purchase. Staff welcoming and knowledgeable of products. Jim R. was great to work with. Second Honda Pilot I have purchased, love it!",4.6
44,"January 03, 2018",I had an excellent experience working with Bryan Bauer. He wasn't pushy and let me decide at my on pace. Kept in touch by text without rushing me for a decision. When I did decide I got a good price on the CR-V that I wanted.,5.0
45,"December 28, 2017",My wife and I bought our first car together from here and had a wonderful and pleasurable experience. Nicholas Popplewell was our sales associate. He was extremely helpful and pleasant to work with. He went above and beyond to make sure all of our needs were met with no pressure!! If you are looking for a dealership to buy from this is the place! We recommend Nicholas to everyone who wants a great experience when purchasing your next vehicle!!,5.0
46,"December 16, 2017",Very upfront and didn’t BS me. He answered all of our questions accurately. Worked hard to get me the exact car and color I wanted even though the dealership didn’t have it in stock. ,4.8
47,"December 13, 2017",We have driven from San Antonio to Rockwall to purchase 2 vehicles from Jim Rutelonis. He is excellent at meeting our needs and communicating with us! I? would highly recommend him to anyone looking for a Honda! ,5.0
48,"December 13, 2017","Courtney, my sales rep was knowledgeable and helpful throughout the entire process.  His expertise and customer service skills made me feel at ease as I considered what my best option was.  Please be sure to thank Courtney on my behalf.  He is an excellent representation of Honda Cars of Rockwall.  I will definitely recommend Honda Cars of Rockwall to my friends and family members because of his efforts. Please reach out to me if you have any questions.

Sincerely,,

Stephen Summers",5.0
49,"December 09, 2017",The overall experience was excellent. Bryan Bauer was accommodating and attempted to make the experience pleasant. I would recommend this particular dealership to my family and associates,5.0
50,"December 08, 2017","We had very specific ideas about which car we wanted: a new blue Honda Accord EX-L. However, the new 2018 model has been redesigned so that it no longer appealed to us. So we looked at the CR-V, and it turned out to be just right. However, no blue 2018 EX-L with Navigation could be found. We waited a few days, and Chris found one, and we bought it. 
I have bought a number of cars over the years ( I am now 78 years old. ). It is always a frustratingly slow process. However, Chris Clemente made a real difference, and Honda Cars of Rockwall is now my favorite dealer.",5.0
51,"December 06, 2017","We were under a time constraint, and everyone worked with us in a quick, efficient, and friendly manner.  It was overall an excellent experience.  Thanks!",5.0
52,"November 23, 2017",Contacted Costco for a Honda dealership. No arguing over price. Explained Costco program and pricing. Showed me CRV in requested color and I drove it and bought it. ,5.0
53,"November 15, 2017",Kim really helped me get my new 2018 Honda Accord. Kim was there every step of the way and made sure I was comfortable with my purchase. Go to the honda dealership in rockwall ask for KIM!!!!,5.0
54,"November 02, 2017",Kim was awesome! We will definitely buy more cars from Honda in the future. Service was excellent. This was the best car buying experience I have ever had. Thanks Rockwall Honda!,5.0
55,"November 01, 2017","Best experience ever buying a car.  Kiara gave me ballpark numbers before I had to come in to the dealer.  I was already financed, but they beat my bank.",5.0
