,Date,Reviews,Ratings
56,"October 29, 2017","Everyone was very nice, and courtesy. Ben and Chris were very nice. Christian helped me out as well. Thanks for everything. Had a great experience",4.8
57,"October 27, 2017","I talk to John Frazier over the phone and Emails for about 3 days and once  we agree on the price of the Pilot ta I want it ,I  Went to dealership Pick the color and it tuck about 1 1/2 hours to do paper work . 
",5.0
58,"October 26, 2017",Everything I had questions got handled and got to drive a new freshly cleaned si. Great Dealership to come see and great customer service. I loved the aroma ,5.0
59,"October 23, 2017","I found the car I was looking for via intranet, sent my request for information about the car and the response was very quick. arrived at dealership negotiated price and closed deal. The I have purchased many automobiles and by far this was the best experience I have ever had. No hard sell, no extra BS offered. I will use this dealership again.
Andrew Kalldin
Rowlett",5.0
60,"October 21, 2017","Honda buying experience was very professional.
Excellent facility.
Highly recommend it!,,

Tanner did a great job of explaining all the new features of this vehicle..",5.0
61,"October 13, 2017","I had a great experience at Honda...OC was the best..at one time I was going to leave but OC worked it until he was able to give me what I wanted.  The guy that did the financial part ,( can't remember his name) he was just as awesome as OC. I am 58 years old and this was my first brand new car I have ever bought and it was a great day October 5th ,2017.  Thanks to all of you.
Donna Glover
",5.0
62,"October 02, 2017","I have bought many cars in the past, and frankly are tired of pressure deals, and ""behind the curtain"" discussions.  All I expect is a good price, no pressure, and appropriate valuation of my trade-in.  This exactly what I got.  Plan to use them for further car-buying. ",5.0
63,"September 30, 2017","Great sales, service and finane people.  Took time, explained things, answered questions truthfully. 
Made an otherwise expensive day less painful. 
Very detail.oriented as well.",5.0
64,"September 22, 2017",I buy a new car every year regardless of the mileage. I bought a new CRV that was great Jeff Lasater is a high class salesman and easy to talk to. I love my car and would buy another one at this dealership,5.0
65,"September 22, 2017","I was excited to be buying a new car and apprehensive at the same time knowing how long some sales can take at a car dealership.  This was not one of those long, drawn out deals.  They showed me what I was looking for, I signed the papers and that was that.  Pretty quick and easy.  This dealership made me feel very welcome and certainly gave me their full attention.  I was pleased with the entire transaction and have shared my experience with friends.  Jim was great and John made sure everything was exactly how I wanted it to be.  You go guys, you rocked this sale.",5.0
66,"September 21, 2017","First new car buying experience in 20 years.  The ""haggle"" is never enjoyable but the staff was polite.  The vehicle of course is awesome, which is why there isnt a lot of wiggle room in pricing.  Overall, we have begun a multi-year relationship and look forward to a stress-free experience.",4.7
67,"September 21, 2017",I knew exactly what I wanted and the sales team delivered at a good price. Financing found an even better deal than what I had been pre-approved at my bank. I was in and out within a few hours with a new SUV that practically drives itself.,5.0
68,"September 13, 2017",A first.. stress free auto buying experience.. Jim Ruteloni a great sales rep from selecting the vehicle right for us to the detail shared when we took possession.  Chris Collyer the financial services manager explained everything to us.. very professional team!!!!,5.0
69,"September 08, 2017",The staff was friendly and helpful. I got a good deal on my car and a lot of extras. I'm happy with my purchase. ,5.0
70,"September 07, 2017","Kiara was  knowledgeable about Honda cars with an air of confidence.  She was organized in her method of negotiating the sales price of my new Honda.  She has a calm methodology in her presentation style and had a sensitivity to this buyer's demeanor.  She is the first female that has ever sold me a vehicle and the overall experience was remarkable!

Rachel Kwarteng   ",4.5
71,"September 07, 2017",Would definitely recommend Honda cars of Rockwall.  Very friendly staff.  Staff was helpful every step of the way and extremely patient and willing to answer all questions.,5.0
72,"September 06, 2017","Salesperson was very efficient, listened to what I wanted and provided me with a quick trade in and  drive out price. Pleased with the experience.",5.0
73,"August 29, 2017","I LOVED THE HONDA 2017, ITS A NICE CAR AND GOOD DEAL. THEY TREATED ME VERY WELL. SO, I REALLY RECOMMEND THIS DEALER, IF YOU WANT TO GET THE BEST PRICE. THEY WORK ON THAT.",5.0
74,"August 27, 2017",Terry at Honda Cars of Rockwall was one of the best sales associates I have ever met.  He made my purchase of my new Civic SI the easiest and quickest experience I have ever had.  The finance team worked hard to get me a fair APR on financing and even beat my bank by .30 pts. This is the 6th Honda I have purchased and 5 of them were at Rusty Wallis. After this experience I will never go back to them.  Sticking with Honda Cars of Rockwall.  Oh by the way the Service Department guys are fantastic. We have used them for our 2012 Pilot which we will be able to keep around for a long time with their knowledge and skills.,4.8
75,"August 20, 2017","From the moment I walked it, it was an easy process.  Each individual I dealt with this easy to talk to and easy to deal with.  They were willing to work to my needs. Well Done!",5.0
76,"August 18, 2017","This is the 3rd new car purchased from Honda Cars of Rockwall in two years. As always the expertise, willingness to meet my needs, and courtesy shown by John, Jim and Chris was exemplary. In each case I was able to handle the entire transaction through emails, phone calls, and one visit to finalize the details and pick up the car. This is the way a dealership remains successful in 2017. ",5.0
77,"August 12, 2017",Marvin and Tim worked with me to get close to my target price. Bet worked to get me the best finance deal available. I would highly recommend Honda Cars if Rockwall !,5.0
78,"August 11, 2017","Jim Rutelonis was professional, extremely knowledgeable, and such a pleasure to work with. He was very honest, kind, and helpful! We have a special needs child that has a handicap stroller and he took the time to help us measure the cargo space to see if it would fit.  I would, and already have, recommend him and your dealership to anyone! This is my fourth Honda I have owned in a row.  Look forward to buying the fifth from him sometime down the road! ",5.0
79,"August 10, 2017",We made an appointment and got approved over the phone... went at out appt time and got in and out.. No pushing you around just to get a sale awesome experience all the way around will definitely be my first stop when I need another car.. I highly recommend this dealer,5.0
80,"August 07, 2017",Jim was very helpful in setting me up with my new car.  He also went through all the car settings so I was able to drive away with confidence.  Thanks Jim!,5.0
81,"August 06, 2017",Thank You Kim Carter and Lee Hamilton. You Guys are the Best. Treated me like an old friend. Very good experience in purchasing my first Honda.,5.0
82,"August 05, 2017","We had a great experience from the viewing to the actual pick up! Terry was very knowledgeable of the key features in the vehicle. I was impressed by the detailed education that he provided on Honda vehicles. The tour of the facility was the first I've ever experienced. It's always good to know about the service dept for later and the coffee :)
",5.0
83,"August 04, 2017",Hector was more than helpful in my going from purchasing a car to getting a lease. He was knowledgeable of the car and was able to answer my questions I'm glad I was able to work with him.  ,5.0
84,"July 28, 2017","This is my first car purchase outside the usual American can industry and I am very, very happy with my purchase.  The auto purchase was incredibly smooth, painless and fastest I have ever experienced in my life.  My sales rep, Jeff Laster, made the whole sales experience friendly, no pressure, helpful at every turn and was very knowledgeable about Honda vehicles and their counterparts which  made my selection even easier.  Chris Shaw in Finance was extremely helpful, friendly and knows his business.  Have recommended model and dealership to others already.  Honda Cars of Rockwall can be proud of the dealership and how it treats its customers with courtesy and respect.",5.0
85,"July 19, 2017",This was the best sales experience I have ever had at a dealership.  Every discussion was above board and honest without any pressure tactics.  We will be back!,5.0
86,"July 08, 2017","We had a fantastic first-time purchase experience at this Honda dealership.  Jim Rutelonis was our sales rep and he was no frills, no pressure, just the facts, and helped us tremendously with our lease.  You often hear of bad experiences with pushy or high-pressure sales people - not here.  Thank you for the great experience at Honda Cars of Rockwall with Jim.",5.0
87,"July 05, 2017","This is my third car that I have purchased at Honda Cars Of Rockwall. They make it as painless as possible . Kiara was a great salesperson, and really listened to what I wanted! They did not try to pressure me into something I didn't want! ",5.0
88,"June 29, 2017","Tanner and Vince were amazing through the process.  Quick and simple.  Best experience buying a car ever! From the up front pricing and willing to remove some certain dealer add-ons to the quick and easy finance options.

",5.0
89,"June 28, 2017","You can't find a more hospitable and easy going team than at Honda Cars of Rockwall. Calsie & Vincent went above and beyond the call of duty to ensure I not only got the best price, but the best experience out of the entire DFW Metroplex! Usually buying a new car can be stressful and tense, but I had nothing but a great time working with these guys. If you're in the market for a new, or even used car, its worth your time to check this place out! Honda Cars of Rockwall, you rocked my world!",5.0
90,"June 23, 2017","Very nice place to buy a car, and very smooth buying experiance, from management, sales staff, and finance. Very nice show rooms, and they listen to you to find the car fit your needs.",5.0
91,"June 05, 2017","Our Salesman, Will, was awesome! He was very eager to please and pleasant to work with. Also, Chris was very efficient throughout the whole purchasing process.  We appreciate both of them very much in helping us in making the car buying experience a great one! Rockwall Honda Rocks!!! ",5.0
92,"June 02, 2017","She did very good work , explained everything very well and helped us a lot in the whole process, we are very pleased with her work, after she told us everything about the car, technology, questions technical etc.etc. so good job for Kiara.",4.6
93,"June 01, 2017","Jeff, our salesman, was very attentive and helpful without the pressure. We were looking at the top end of the accord line and pricing was very important. We feel we got a very fair deal and happy with the car so far, and believe we will stay happy. After all, we are going from a 2014 to a 2017 and the changes in the car are very nice.",5.0
94,"May 30, 2017","My husband began communicating with Terry over email. We went in the dealership told them what all I wanted and the color and they did everything in there power to get me the car I wanted. We had to wait about a week in order to get exactly what I wanted. They put us in a  rental until my car came in. They were very courteous. They answered all my questions and even help me set my phone up to the radio. 
I would recommend this dealership to anyone who is looking for a Honda!",5.0
95,"May 29, 2017",I began communicating with Jeff Laster via email.  From the beginning he was straightforward and respectful.  When it came time to buy Jeff and everyone else involved in the sale were extremely professional and thorough.  One of the best car buying experiences I've had. ,5.0
96,"May 28, 2017","I am pleased with customer interactions at Honda Cars of Rockwall and how easy they made it for me, No trade. No financing. No wife opinions to accommodate.. My Yorkie 100% agreed with me. I am excited about the 2017 CR–V Touring with 1.5 and all the tech tools. ",4.6
97,"May 26, 2017","my experience
 with the dealership was stellar especially my salesman Chandler. He said he was a new hire but his knowledge and professionalism did not show it. I ultimately purchased a 2012 Infinity QX56 and was so very impressed with the overall team at the dealership that I came back the next
day and leased a 2017 Honda Accord. EX-L . I give my highest marks again to Chandler and Terry
in the Leasing Department. My wife and I proudly drive our new cars around and our family and friends 
ask us where we purchased them and we proudly say Honda Cars of Rockwell.    
",5.0
98,"February 16, 2017","They have all the ""ratings"" from several car buying services. Truecar, USAA, Costco, and the like. I dealt with Chris Wilhaus. What a joke. They'll only sell you car with $3000+ of dealer option accessories. Buyer beware! They're SCAMMERS!",1.0
99,"October 17, 2016","BEWARE!! First, let me explain that we have used Honda Cars of Rockwall dealership's service department numerous times in the past 3 years, spending thousands of dollars on car repairs. So, decided to purchased a used car for our children from them. Before we picked up the car, we paid to have a new set of 4 - 60,000 mile tires installed on it, as clearly printed on our sales invoice. Promptly the car was driven out of state and delivered it to our kids for their use while attending college. We simply trusted that the dealership had given us the tires WE PAID for. Recently, I discovered that the tires they put on the car were the lowest quality 40,000 mile tires available, which have now been discontinued!! Our kids have driven only 20,000 miles criss crossing the country, and the tires are at a 2 and must be replaced before winter snows begin. I understand the warranty for the tire itself is an issue to take up with the manufacturer; HOWEVER, the fact that Honda Cars of Rockwall installed a lower quality tire than what we clearly asked for and paid for, this is my issue with the dealership!

 I spoke with 4 different employees at the dealership, over the course of 10 days,  trying to work out a fair resolution for them BETRAYING our trust and making us feel SCAMED!! They originally offered us $56 as appeasement. After further discussion and the managers getting involved with the case, they simply said the dealership was unwilling to do anything to rectify their deception and violation of our trust, the trust of their client!

So here is the REAL issue for all of you reading this review, you are obviously searching for a dealership that you can trust. A dealership that you believe will actually perform the entire service or sell you the exact product that you pay for. Because I am not a mechanic and can not verify such things for myself, I will no longer trust Honda Cars of Rockwall with any of our future car services or purchases. Additionally,  I freely share this experience with all of my friends, associates, family members and on any internet outlet available. My goal is simply to  warn everyone to BEWARE, and to find a dealership that will be loyal to their customers. ",1.4
100,"August 12, 2016","A bit disappointed with new vehicle purchase. Was told by salesperson vehicle trim could have a moonroof. When finally arrived, two weeks layer, no moonroof. Felt deceived. ",3.0
101,"February 20, 2016",I agreed to pay for a car and they provided a car. I bought a 2014 Honda accord for $20000. It seems to be a decent car. ,5.0
102,"August 17, 2015",Richard Branch was great! He made us feel very comfortable and not pressured. He was very friendly and extremely knowledgeable. We came with lots of question and he was able to answer everyone! ,4.8
103,"August 14, 2015",Renea Milton was super helpful and willing to answer all my questions! Her knowledge and willingness to go out of her way to make sure all my needs were meet were superior! If you in the market for a vehicle this is the place and salesperson! ,5.0
104,"August 10, 2015","I bought a 2013 Nissan Sentra from this company a month ago. Car was clean and my wife needed a car that was reliable so I didn't want to get one older than 2 years. The price seemed fail at 12,800. I worked with the salesman negotiating the terms of the sale, they had ""dealership fees"" which was a grand total of $1,600. I figured it was new tires, oil, detail work, gas etc even though I thought it was the ""price of doing business"" for them, I agreed to pay it anyways against my better judgement. After paying for the extended warranty  we went to pick up the car to drive it home and they hadn't even put gas in it?! Frustrated at this point, I decided to chalk it up to a greedy car company (I know I know) and went on with it. My wife drove the car home (about an hour drive) and when she got the car home she complained that it was driving funny I took the car out to test her complaints one evening and found that a headlight was misaligned and the car did shake at ~60MPH and would drift to the right, the transmission seemed to slip gears too (not a mechanic). Alignment and a simple headlight fix right? Nothing to write home about as the company said that the car was inspected and they swore that nothing was wrong with the car. The sales person even said it went through their certification process and found nothing to be wrong. We took the car to the dealership, they said the alignment was fine and that all it needed was new tires, not being a mechanic I believed them as I do understand tires can be out of balance and cause the same symptoms. They also said they checked the transmission and found nothing wrong and we got the car back. The alignment issues appeared to be fixed so we thought that was the last of the problems. The following weekend my wife went to Longview (about a 2 hour drive) to visit a friend and when she got there the car was making a very loud knocking noise. Scared and with our 7 year old I told her to take the car up to the Nissan dealership to have it checked out as I did not want them to be stranded in the middle of nowhere without cell coverage. At the Nissan dealership they said that the transmission was the problem and that they would need to replace it, so they gave my wife a rental for the week until the repairs are completed. I called Honda Cars of Rockwall and spoke to both the Sales Manager and the Service Manager and asked them specifically how they could miss something like the transmission both during the initial inspection through their ""certification"" process and after we brought it in complaining of symptoms of the transmission. The Sales Manager then tells me how he use to work for the Nissan group that we dropped the car off with and begins to talk bad about them. How unprofessional can someone be? You sold the car, you should stand behind what you sell. Maybe I am old school but does ethics mean nothing anymore? A week after we dropped it off at the Nissan dealership we had to drive 4 hours to pick the car up (2 hours one way). On the way home, we noticed a rattling noise when we were near the house. We decided to take the car back to Nissan in Frisco and as I write this it has been there in Frisco for 3 days as they diagnose the problem. I talked to the sales manager Rob or Rod who said he would ""look into it"" and call me back, I am still waiting on that call. This company has proven to me that customer's are not important and have done nothing to try and resolve this issue. In the first month of owning a car from this dealership I have driven rental cars more than the car I haven't even made the first payment. Please do not think this is an isolated event, read the other negative reviews and STAY AWAY",1.0
105,"June 22, 2015","I went to Honda of Rockwall to see about trading my 2014 Honda Pilot as the payment just became more than we could afford.  When I initially emailed, a Sales person (I will call him Matt) emailed me back several times a day, called me several times a day telling me how he cold help me.  He kept telling me he needed to see my Pilot, so I had my Son and wife bring it to him.  He told them directly that he would email me.  From that point forward Matt never ever responded to another email or phone call that I made to him.  He probably found there was nothing he could do, but never even had the courtesy to call or at least email me to tell me he was wrong to lie to me about being able to help and that there was nothing he could do.  He chose to simply ignore me, I wasn't worth his time anymore.  It wasn't until I called my finance manager at Honda and told him about Matt that I finally received an email telling nothing could be done.
Sales people like Matt have should not be in this sales business at all.  He gives cars sales people the reputation they have.
As long as Honda of Rockwall employs people like Matt, I will never buy from this dealership and wouldn't recommend it to anyone.",1.0
106,"May 20, 2015","I have been a Toyota buyer for years and the level of service at Honda of Rockwall made me proud to join the Honda family! It was the easiest experience I have had in years and they delivered on every promise and well exceeded expectations. Very little back and forth and they treated me as an educated buyer each step of the way. I would highly recommend the salesperson, Cart, to anyone looking for a solid fair deal and a ton of knowledge. He was phenomenal and I will be sending anyone I know to see him. The sales manager John was also incredibly patient and fair and looking to make deals based on how the customer wants vs the olden days of the car business where is was their way or the highway. Keep it up guys!!! You made my new accord experience outstanding and I will always appreciate the time you took!!!",5.0
107,"December 11, 2013","This dealership is a really good one. I spend my time writing this review although I did not buy the car there for the reason to be mentioned below.

John and Stephen are very honest and friendly salespersons. They gave me an upfront price which was one of the best two offers I got. I trusted them and I felt comfortable to work with them through the car buying process.  

It was difficulty for me to justify my choice of another dealership in stead of Rockwall. But I had to make the choice based on the very little difference in prices ,as I promised to both of the dealerships at the beginning, and the location of the dealerships. 

In addition to its upfront pricing, Rockwall has state of the art facility and first class service. Everyone there are very nice and they make you feel at home. I would recommend this dealership to everyone who asks me, and I will also consider this dealership for my next Honda car buy.",5.0
108,"November 24, 2013","We had a great experience at Honda Cars of Rockwall!  We founds exactly the car we were looking for at a very fair price.  Because it was older (2007), it didn't come with a warranty.  Unfortunately, less than a week after we bought it, the transmission went caput.  Honda Cars COULD have said ""sorry about your bad luck.""  BUT, not only did they fix it at no cost to us, they gave us a loaner car to drive while we waited!  Now we have exactly the car we want with a completely rebuilt transmission.  Our experience couldn't have been any better.  Sales associates Dawn and Justin were fun to work with and service manager Dan Tran was aweome!  Thank you Honda Cars of Rockwall!  ",5.0
