,Date,Reviews,Ratings
0,"March 06, 2020","Poor workmanship in the service center. $5,700. was spent and the “technician” left off bolts, improper gasket sealing, and a return trip to fix it so they could try to rip me off some more. Now I have some new rattles, oil leak still there but not nearly as bad, and where the heck are my valve stem covers? I will order another set from NFL website. I am a woman who has no problem getting a little grease under my acrylic nails, and businesses like Clear Lake Honda is why. My vehicle is my office, and I spent a lot of money making sure my office is able to continue going down the road (vehicle maintenance). This place will not be seeing me or my office again. Of course, in years past my office has been a Toyota, a Nissan, and a couple of Hyundai’s.  I heard wonderful things about the Honda CRV when it was time to buy another vehicle. It probably was a good vehicle, when I purchased it. Pretty sure it won’t be from here on out. Expensive lesson learned. Save yourself, go somewhere else to have ANY work done. ",1.0
1,"February 20, 2020",Thank you car salesman Nurun Alam for all the help and support you worked with me on purchasing my 2018 Honda Accord. It was a good experience I had. ,5.0
2,"February 19, 2020","
I wish I can rate 0 stars but everyone still nice except “Internet Manager name is Steve Bramlett”
I went to dealership today to buy the Honda Odyssey 2020. We looking online and he supported to help us. But when we came and deal with him just 2 times he sooo such and sooo rude to us. Telling customer waste his time? Is it manages of sellman can say? Some “rude” words but I can’t tell... 
If anyone think to buy new car please stay away this manager name... seriously.",1.0
3,"September 05, 2019",Mark was great! Mark was so laid back yet he was very personable and knowledgeable of each vehicle we asked him about.  We never felt pressured and in the end he sold us our new van when we originally went in to look at a used one! 😃,5.0
4,"August 09, 2019","I recently purchased a used car for my son, and the management made this the worst car buying experience in my life. First off, I have to compliment the sales associates, Andre Adolph and Rochan Morgan, for truly assisting me in and my son in this process. They worked effectively as a team to close the deal, and they took a genuine interest in my son. Andre even contacted me weeks after I purchased the car to check on my son after having a surgical procedure. Also, Blaine Lushute was very kind, warm, and considerate during the closing/financing. These gentlemen are the ONLY REASON I went through with this purchase. However, the manager, David MCDuffie, was the most inconsiderate, arrogant, discourteous and disrespectful person I have ever come across in sales. He is also dishonest. He reneged on an agreement to make a minor repair, blamed the ordeal on the sales associate, and actually told me, ""If you are finding cars at other locations, maybe you should buy one there."" I have never been so repulsed at a sales associate in my life. The only reason I opted to purchase the car from this location is how hard the sales associates worked to close the deal, and how Mr. Lushute swooped in and cleaned up the mess made by Mr. McDuffie. I honestly can't say if I would recommend this dealership or not because they truly have some good people working there, but some, I'm not sure why. I also just read some older reviews, and other customers have made the same complaints. Why is he still able to treat customers in this manner?  Had I had a different sales manager, I likely would be writing a completely different review. My son likes his car, but the stress we went through to get it was much more than I ever expected to endure. ",1.8
5,"August 05, 2019",Mark worked very hard for me to see that I found the right vehicle and financing to meet my current needs.  He even delivered the car to my home when I said I would need to find a friend to bring me to pick it up.,5.0
6,"July 22, 2019",Though I don’t work for this dealership anymore I’m sure that somewhere out there there may be a better Honda dealership but at Honda of Clear Lake you get honesty and integrity. Some of the best technicians in southeast Texas where you know these guys are going to fix it right the first time. ,4.8
7,"July 02, 2019","While waiting for diagnostics to be completed on my wife’s Honda CRV, which was quickly determined to be a defective battery, we inquired about newer CRV’s. Sales agent brought one around for our inspection and deal was done professionally, courteously and pleasantly. Wife and I had an enjoyable and “no stress” experience from start to finish and drove out smiling behind the wheel of a new car. Job well done, Team Honda!  Things like this have us looking forward to our golden anniversary coming up later this year.
Richard Mann",5.0
8,"June 05, 2019","This is a review for the Service Department and Carlos Shelton.

What should have been a routine 45 minute oil-change turned into an all day affair where my car was broken - not once - but twice by the mechanics. Then instead of an apology when they finally fixed what they had broken, they tried to bill ME for the parts they had broken in their negligence. 

I brought my car in at 8:20 in the morning for an oil-change. I was then told by Carlos Shelton that my car needed two new air filters and ball joint boots. I asked how long this would take because I had a busy day planned, and he told me 45 minutes. I said okay. The cost would have been around $300.

After an hour, Carlos comes back to tell me they were unable to change the boots unless I was willing to pay $1,000 now. I declined, paid for my filters that were changed, and started to drive away. A mechanic had to physically stop me from driving away and explained that they had damaged my car and it was now unsafe to drive. Carlos was happy to let me leave, however, regardless of my safety. When the mechanic kept reinforcing to Carlos that it was unsafe, he begrudgingly agreed to get his manager so they could fix what they had damaged. I was then told it would be another hour. So I waited.

Carlos came back after another hour showing me some damaged part that was now broken in an attempt to fix what they had originally damaged. He said my newly broken part wasn't in stock and couldn't be here until after 2:00. He offered to shuttle me home. I was then told by the shuttle driver that he was supposed to hurry, not make me wait, and be kind to me because they ""had totally messed up my car."" 

Once home, I was never called for an update, so around 4:00, I finally called Carlos who informed me that my car was now ready for pick up. No apology, mind you. I explained I needed to wait for my husband to get home from work so I would have a way there. We arrived at the service center at about 5:45. Carlos had gone home. I was presented with a bill for the parts they had damaged. When they got Carlos on the phone he said he would not release my car until I paid. I asked to speak to a manager, and was told they had all gone home. It was only 6 pm. They don't close until 9 pm., but apparently absolutely no manager was on duty. (I find this hard to believe.) Carlos said I could pay now and have my car, or I could wait until the morning in order to speak to someone about getting my car - that they had broken twice - and were now holding hostage- back in to my possession. 

Instead of an apology, I received a bill and hostility. I was shocked. I was shocked to the point that it seemed surreal that this was really happening. After finding another service representative and being told again that no managers were on duty (how can that be, really?) - I explained the situation, showed him my receipts for paying for what I had consented to, and having several names of employees who could vouch for the fact that my car had been damaged repeatedly by them - he finally gave me my keys and told me I could go. I cried the whole way home.

Still no apology. It has been two days. No call from the Service Center or Carlos to try to make this right. It is clear Honda has no respect for it's customers. I have had a Civic, an Accord, and an Element from this dealership. Never again. I was shocked when I saw this dealership had a one star rating on several sites. But the one star is well-earned and deserved. Avoid this place, unless you want to pay for their mistakes and possibly drive home in a vehicle that may compromise your and your family's safety. They could care less about ethics or your well-being, as long as they make their commission.",1.4
9,"May 22, 2019","This dealership adds in-house costs to new cars through their addendums.  These dealer add-ons increase the price way over their value. After the sale, someone cut the addendum off our sticker so that we wouldn't even know what we paid extra for.  The addendum was laminated to the sticker,so it was a deliberate attempt to deceive when someone took a pair of scissors and cut the addendum off and kept it.",1.0
10,"April 15, 2019",I bought Honda Accord them they didn't give me Military Discount. Especially Finance department was very awful. They didn't finance me with Honda and had with the other  banks with higher APR to get commission. They came up with different coverages that you don't need. They try to reap you up from every possible way. They will  try to add the coverage that is already covered by manufactures warranty. I referred one of my friend to buy Honda Accord from them just because Hondas being a good car but didn't give a referral. Very upset with this dealer,1.4
11,"February 09, 2019",Do not go to this dealership!  They lie and cheat you out of every cent they can!  They tried to rip me off and sell my loan with no warranty on a brand new car!  BEWARE!!! If I could give them a negative rating I would!,1.0
12,"February 06, 2019","Buyers beware. The sales people me and my wife encountered and the extent that they will go to in an attempt to decieve by omission is sickening the sales manager bennet johnson is a lier he uses calling card tactics to lure folks in to clearlake honda then once there flips on you and of course its more money in the dealers favor we left i told my wife he would call before we got home and he did. My wife is deaf / hearing impaired and also an amazing lady that only tried to deal in good faith and not only did that dealership get caught trying to wrap up their dirty scam they interupted my wife at her place of employeement and tried to co cover up their serious scam .they sent their finance guy to finish off and cover up their scam gone wrong. They thought they were gonna get away with charging us 18,780.37 for a 39 month extended warranty that covers little of nothing . has anyone ever heard of such nonsence and to boot thats for a brand new hrv that has a bumper to bumper warranty for the entirety of the 36 month lease. So 36 mo.lease on a brand new hrv. And a 39 mo. Extended warranty that is 100% unnecessary for 18,780.37 .and then they financed 26880.14 total. They were supposed to give us 12,000 credit on our 2016 honda fit which they are still advertising on their web site for 15 grand .days after we picked it up .they took our first payment on the hrv the day we picked it up almost 2 weeks ago and we still dont have our money back .the sales mgr. Bennet johnson burned up my phone for days with his pleading text .folks beware of this dealership and their 18,780.37 / 39 months extended warranty on their already covered bumper to bumper floor planed Honda's as well i could go on but this certainly paints a true story of deception by omission and rediculas lies and hassle beyond the norm .i can only warn people of the schemes and scams taking place their as they relate to us me and my wife .BUYER BEWARE. AMEN.",1.0
13,"February 05, 2019","DO NOT GO to Honda of Clear Lake any more !!!
Terrible experience today.  I sent in my new pilot for service yesterday and checked out this morning, when i got the car, found tire was flat (later found a big screw into), and muddy on tire and doors,  etc.  i asked for tire replacement, they not admitted it is their responsibility.  only agreed to patch tire.",1.4
14,"January 31, 2019","This deslership’s service department is friendly, accommodating a last minute oils change at rush hour, and providing fast service. I will definitely go here for all service needs in the future. ",5.0
15,"January 20, 2019","I came in as a repeat buyer. I previously owned and bought a brand new accord from clear lake Honda. I’ve had two brand new cars since then and wanted to trade my one yr old ford SUV in for an accord. 
I came in, test drive and found the car i wanted. They plugged my trade in into their system and offered me below KBB and would not budge. I owed about what they should give me for it.  Upset i left. I paid 6k towards my ford and dropped the loan down 6k. Went back exactly three months later and tried again. Because i didn’t want to go upside on my loan. Guess what. They offered me $7,500.00 less than the first trade in offer!!!! Said it was due to mileage. I drive a normal amount to and from work which is close to my home. No possible way they charge that much for mileage. The GM was very rude, snide and cocky. He could see how upset i was. My husband said for us to go eat and talk about it. The GM commented on how expensive he restaurant we were going to!!! I will never ever buy from here. They do not care about repeat business just try to rip you off any way they can. ",1.2
16,"January 15, 2019","Anytime I call for appointment to Tony Sandoval, he takes care of everything.  This time,I needed a fast State Inspection and Jennifer Ellis made it happen.  I'm treated so well in the service center and so is my Honda.  Thanks!",5.0
17,"December 31, 2018","The staff is really friendly.  So many people wanting to help get you in. Love the new location, but traffic can be really awful.  Can't help it.",5.0
18,"December 05, 2018","I've read a bunch of reviews here and on other sites and I gotta tell you....don't go to any dealership unprepared. They are in business to make a profit, as they should. Almost every comment I've read about how somebody got ""ripped off"" could have been prevented if the person had done some homework. To that end, I did my research and knew exactly what I wanted. Steve Bramlett and Brandon Burke were my initial email and phone contacts. I also called and emailed several dealers in the Houston area and no one would do what Clear Lake Honda did. Brandon in particular busted his butt to get my wife and I exactly what we wanted, and at a more than fair price. And since we paid cash, Angel in Finance spent a total of 10 minutes with us filling out title paperwork and taking our cashier's check. That's it. No hard sell, no pressure. We also met briefly with Bennet, I believe a GM. I have never been treated with more respect and transparency than at this dealership, I highly recommend them. ",5.0
19,"November 18, 2018","Today, My father, my sister and I went to buy an Accord Sport  at this location and the way that they are doing business is not very honest.  The front line personal needs to be more ethic and think in the value of the customer. The first salesman "" Jesus""  that we met in the parking lot was very welcoming and tried to help us as much as he could, however, he was already with another customer and he had to send us another person who could help us. The other salesman who approached us made us feel that we were there only to see and not to buy. When we asked  him about a car that its was shown in the website for $24636, he responded that those cars did not include accessories or extra features and maybe we would need to request the car directly from the manufacturer. We understood and we requested him to see if he could search in the dealer inventory  the car that we were looking for, and he replied: ‘well if you are going to buy  we can see if we can negotiate and see what we have”. (We know that there is people who only goes to the dealerships to see , but you need to treat all your customers as they are your only buyers and if they are requesting you to check your inventory just do it , don’t condition). After re affirmed that we were buyers, the salesman’s attitude changed and showed us what we were looking for.
After that, my sister loved the car and the salesman gave us a price for $24636 written in a white paper and “pre-approved” by finance. Obviously not including, taxes, title, and the additional costs. When we went to sign the final documents, I requested to read the final disclosure  as my father and sister only signed  without checking, and I noticed that the Car Cash price cost that it was documented was $27600 approx. not $24636 as we were told. I asked this advisor why and he made several excuses in different opportunities, as interest included, additional warranty included, gap, taxes, etc, However, they were disclosed  and added in the same document in the bottom part. I reviewed this document for about an hour, repeating him that the price negotiated was not in the actual document. That if the interest was included why it was twice,etc. At the end, I told him “ I know how to read the costs in the disclosures because I have an MBA” could you please explain me why the price is not shown? So, he changed the Car cash price cost and he replied, “we as dealerships we paid taxes and additional costs. I will deal with it”.  If you as a car dealership can’t give the prices that you are offering , don’t tell your customer that you will giving  them a price when at the end you will be charging whatever you want to unsuspected customers.  *We bought the car because we like it not because of the service received.

-Deshonestidad-
My hermana le encanto el Acord sport y despues de ir con el vendedor firmo un papel en donde el de finanzas aprovaba el costo final del carro en $24632, obviamente sin incluir taxes, garantias,etc.  
Cuando fuimos a firmar los ultimos documentos requeri revisarlos ya que mi papa y mi hermana solo habian firmado por firmar y no habian checado si el precio que habian dicho habia sido respetado. Cuando lei los documentos me di cuenta que el precio del carro lo habian puesto en mas de $27000 dolares y no $24632 como habian dicho. Le pregunte al de finanzas el porque y el ponia diferentes excusas como taxes, garantias, gap, intereses,etc. Lo que el no sabia es que podia entender el documento financier y la informacion que daba no concordaba con lo que estaba en el papel. Despues de una hora de estarle diciendo de que el precio del carro no concordaba con el precio que habian dicho, le dije se como leer el document de costos porque tengo una maestria en finanzas, me puedes decir porque no esta el precio acordado? Y el respondio; “ nosotros como agencias tenemos muchos costos, ya yo me encargare”
  Si van a comprar un auto y les dan un precio por favor vean que este precio este en el documento. NO SE DEJEN ENGANAR. En ese documento final va a venir el precio del auto mas las taxas, garantias, gap, etc.",1.2
20,"October 27, 2018","First off I sell new vehicles and used vehicles, I put an online credit application in for a used 15 civic here, I was told I had to put down 1500$ before they would submit my loan to a bank which is false because how would you know what I have to put down if the bank didn't tell you. They wouldn't tell me an interest rate or how much the total amount financed is, I do this everyday people and if you know how much money down I need you know my interest rate. The cost of the vehicle was 12,500 but the payments were 308 for 72 months with 1500 down. That is absurd. When the numbers don't add up it means you're getting ripped off. Thanks Tyrone & Rahil for not selling me a car.",1.2
21,"October 24, 2018",Fast and easy. Highly recommend. The best part was they worked with my schedual and budget.  They made a stressful situation smooth and easy. Thanks!,5.0
22,"October 08, 2018",Service is excellent. Mr.Pete is a very nice person. He is very friendly. We leave in Southwest area We always go Clearlake Honda only for Mr.Pete. There service is excellent.,5.0
23,"September 18, 2018",They told me the price of the car was because of a pro pack that they added on. And went back too put it on they said they took it off the price of car. They never lowered price and never put accessories on. Will never go back for service or to buy a car. Do yourself a favor and never go there.,1.0
24,"September 03, 2018","Honda of clear lake.  

I have had my new 2019 Ridgeline RTLT for 5 weeks. Got the extended warranties and maintenance plan.  The doors auto lock 75% of time.  They could not replicate problem after opening & closing door a few times , so it's my problem, not Honda's right??  They wouldn't do anything to try to fix this security issue.  I'm not knowledgeable about stuff like this, but I think maybe they could have tried to check battery in fob or maybe reprogram key fob, exchange for a new fob.  If they won't do anything/zip/nothing/zero to try to correct this.  Makes me doubt my future service and maintenance with Honda.   ",1.0
25,"July 30, 2018",Tontamente firme sin revisar el contrato y me percaté después que no respetaron el precio acordado después de horas de negociación para q al final me dieran el precio que se les dio la gana ,1.0
26,"July 09, 2018","This place is full of THIEVES, I went to get an oil change this morning, when I returned to my car I noticed that $200 dollars were missing from my car. I've been trying to get an answer but all I get is them saying that they will call me back. DO NOT GO HERE. I came here for a simple oil change and ended up getting robbed. Go somewhere else for all of your car need this place is a scam.",1.0
27,"June 20, 2018",I was very clear with my salesperson that I was coming from over an hour away to buy a car that I viewed online. I asked him to check the car and make sure everything was good because it was such a long drive out. I drive all the way to this dealership and this is the condition of the Odessey that they were trying to sell me. It is in HORRIBLE condition. I ask to speak to the manager and got David McDuffy. He was very rude to myself and when my husband called in to talk to him on my behalf he ended up hanging up on him. I would never recommend this dealership!,1.0
28,"June 07, 2018","I bought a 2018 CR-V EX coming in on the next shipment. I got the exact vehicle I want. I want to HIGHLY recommend the sales associate I worked with, Touny Crowe. Touny is very professional and very pleasant to work with. His goal is getting you just the vehicle you want, not just a vehicle. He is well educated and carries on an interesting conversation regardless of the subject. This is my second vehicle purchase from him and if it doesn't last the remainder of my lifetime I'll be back to see him again. Touny Crowe, HIGHLY recommended.",5.0
29,"March 15, 2018","I had been to many dealerships around League City & Cleae Lake Area. Each dealership had pressured myself into purchasing a car. However Honda Dealership in Clear Lake never onced made me feel pressured to purchase a car. I never intended to purchase a Honda but after the test drive I was sold!. The overall experience was very professional, the purchasing was simple, and the staff was greatly professional. I LOVE my Honda!",5.0
30,"March 09, 2018",I went in with a particular car I wanted and a budget I needed to stay in and Mark Capel worked with me and made it happen and made the process quick and painless!  Everyone I encountered while I was there was friendly and helpful.  I was so impressed I actually went back the next day with my husband and he purchased a vehicle from Mark!  I will return in the future for my car needs and will be referring my friends to this dealership but more specifically to Mark for future car purchases!,5.0
31,"January 31, 2018",I got a bank to finiance my car and was told that everything was taken care of went up there and was told I needed a down payment or a co-signer if I got a co-signer I would be able to get the car with $0 down so I did and drove back up there just for them to tell me I need to put $1500 down they gave me the run around and could never keep to their word I would not trust them ,1.4
32,"October 19, 2017",My salesman Tyrone P. Went above and beyond to help me get a car. I have had some set backs and needed a 2nd chance. He and his team sold me a car that I always wanted and found financing for me. I recommend anyone to give them a try. You are more than a customer to them. You are family.,5.0
