,Date,Reviews,Ratings
0,"June 06, 2020","When I arrived at Community Honda for my car service, Carlos was the service man that assisted me. He even remembered me from when I had last come in for service.  He told me about how long it would take and sure enough he came and got me when car was ready within the two hours as he told me. Carlos is very helpful, knowledgeable, kind and courteous. That makes customers feel good when the serviceman remembers them. It makes you want to go back and it gives you a good feeling about the service. I would say Carlos is truly an asset to Community Honda.",5.0
1,"May 23, 2020","Best service advisor Mr.James and well trained technicians he explained me the whole process of engine coolant function and was very knowledgeable I will certainly recommend community honda service department to my friends and colleagues 
Thanks",5.0
2,"May 07, 2020",Experience was Great 👍🏻 i love this car ! Service was Great by the dealership staff ! Thanks Community Honda 😀 Staff is very helping & polite 👍🏻 I will recommend my family & Friends 😃,5.0
3,"May 01, 2020","oil change and filter, ck out dash board reading a certain no. code, your service person who works on vehicle needs to make sure they clear dash of all readings and put it back to normal, shouldn't have to look at some other item on there thank   you",3.8
4,"April 25, 2020","My experience was great Tracy and the finance Dept. Made this the easiest and pleasant car buying Experience I have every had buying a car  from another country for my wife in Baytown, This is our second purchase from Comunity Honda, the next purchase will be from Comunity Honda Thanks'",5.0
5,"March 19, 2020","I have always been pleased with the service provided when I purchased my first vehicle from community back in 2011.  The knowledge of the sales people impressed me back then.  As I purchased my 2020 HRV, I received the same professional help and am sure that I will also receive the same when I bring in my HRV for servicing. ",5.0
6,"March 12, 2020","The team was friendly & efficient to get me in & out quickly.  Id dropped my car off, picked up a rental and they kept me informed of what was going on with my car. ",4.8
7,"March 11, 2020",They was able to exceed my expectations and more.. I will definitely recommend them. They gave me ever option to choose from. I appreciate them so very much! ,5.0
8,"February 23, 2020","Very fast in and very fast out, while representative Garcia kept me posted as to the status of my vehicle and also notified me of what I needed to do when I come back for my next service. ",5.0
9,"January 31, 2020","Please read this:
On September 28 2019 Gerald Bailey sold my wife (I was not there) a 2012 Cadillac SRX for 16000 cash. I thought this was high but the check was already signed and the deal was done. Fast forward to today I have a different dealer tell me they won’t buy it nor will any other dealership due to a damage report, we can only trade it in. We were, my wife was never told about a damage report nor given a carfax. Now I have a manger of Community Honda telling me they don’t have to disclose a carfax report, I thought that was bs, but unfortunately for us, he is right. We never knew this. We are now stuck with a vehicle that we paid 16k cash for that will get no where close to that, due to the damage report. Please, if you are reading this, ask for a carfax report. I never knew how important it was until now. That being said, do NOT purchase from this dealership. What has been done here is beyond me, and the manger Ever, I believe was his name was absolutely no help. Told me he did not have to disclose the information cause it could be “false” and had a complete Is what it Is demeanor. I will never sure business with them again, I hope you don’t and hope someone is able to help me legally with this situation, cause this seems so wrong and illegal. Thanks for reading our issue with Community Honda.",1.0
10,"January 15, 2020",In n out in short amt of time. My normal service guy was busy so another one stepped in and service was good as usual,5.0
11,"January 10, 2020",I dropped my car off in the early afternoon and it was ready to pick up the same day. I can always trust James in Service to have a discount coupon and answers to  any questions that I might have. ,5.0
12,"January 07, 2020",I was seen on time and the maintenance was completed in the time frame  as described. Happy to be serviced at this convenient location. Thank you.,4.6
13,"January 07, 2020","They were thorough, quick as possible, and informed of other additional things that may be needed without any pushiness at all.  Good job team Honda!",4.8
14,"December 18, 2019",Great customer service advisors and a pleasant experience. Each time I have came to the dealership they have been able to help me and be professional but have a warm and welcoming spirit. ,5.0
15,"November 22, 2019","Knew what we wanted and Liz delivered. Liz made this the best car buying experience ever! We were looking for a new 2019 Civic LX birthday gift for our daughter. She wanted black on black and to our surprise they had only 1 left, perfect! We were done with financing, washed, full tank of gas and rolling down I-10 West all within 3 hrs. No need to negotiate, we asked for a specific price and that was it! Like butter :) How awesome is that, we will be back for sure. Beyond satisfied!",5.0
16,"November 17, 2019","We had visited several other dealerships in the area,  but none of them were as friendly or accommodating as this dealership. At Community Honda we had, from the very beginning, an appointment with our salesman. From there, we got confirmations, phone calls, and messages checking to see if we needed anything. Our sales person personally called me to introduce himself. Kamerin was most informed about the car we were interested in. He walked us through the process of trading our car and purchasing our Honda CR-V. It was all worth the forty mile drive!",5.0
17,"November 15, 2019","Excellent service. Dead battery in 2017 Accord - they had someone to me to jump my car within 30 minutes, gave me a ride to/from dealership while battery was being replaced, and had car washed. No fuss, no hassle, just fixed. ",5.0
18,"October 21, 2019","Professional and let me know what was needed and time required.  Parts required not in stock but ordered for next day arrival.  Advised that grill and front wheel and dinner fender needed to be removed for access to remove and install new compressor. I told them I could wait until Monday to pick up vehicle and get job done right.
",3.8
19,"October 15, 2019",Excellent service. Very friendly. Provided rates for additional services recommended services. I would recommend this dealership and their excellent service and will return in the future for all of my service needs.,5.0
20,"October 15, 2019",THE EMPLOYEES ARE ALL VERY FRIENDLY AND I WAS IN AND OUT IN NO TIME AT ALL.  AN ALL POINTS INSPECTION WAS ALSO DONE DURING THE STATE INSPECTION.,5.0
21,"October 04, 2019",Gregory Hunter and the Community Honda did everything in their power to make a deal. I would definitely come back and refer family and friends.,5.0
22,"September 27, 2019","Greg Hunter and Jean DuPont were extremely patient, professional, informative, and worked with me to provide a deal that worked for everyone. Tracy Schmersal did a great job of detailing my newly purchased vehicle and made sure that I was fully satisfied with the job.",5.0
23,"September 26, 2019","I’ve been going to Community Honda since 2013, and have always had excellent service. Everyone greets me with a friendly hello and a smile. ",5.0
24,"September 16, 2019","Went by this location as it was close to our house to test drive a new Honda.  Let the salesperson know that we were not buying on that day, but just starting to look.  Had a pleasant experience, and came back a couple of weeks later to purchase.  Easy to deal with, not a high pressure sale.",5.0
25,"September 05, 2019",I highly recommend Community Honda. The service is excellent. Employees in the service center are very helpful and friendly and they keep you informed. Great job!,5.0
26,"August 26, 2019","I needed to get quite a few things done for my car, due to its proximity to 100K miles, and fortunately I came here and got everything done. I’ve never really had any issues, and I always leave confident in the work done on my vehicle",5.0
27,"July 31, 2019","I used to laugh at the Honda commercial slogan, “The Car That Sells Itself” , however, last year I bought new a 2018 Honda Accord Hybrid Touring edition. I’m so glad I did, the slogan is an understatement, I love the car, it’s spectacular. From this point on I’m a die hard Honda man. I took my car for routine maintenance over at Community Honda, the do a fabulous job and take well care of my car. I also want to acknowledge my service rep James Chesser, this guy deserves a raise and promotion, I’ve never seen a harder working individual who takes personal interest in both myself and my car, he treats my car as if it was his own and he does a spectacular job, he won’t leave work until the job is done well, even if he has to stay late on a weekend. James makes my visit to the dealership most pleasant, I even look forward to going there. I can’t wait until the next revision of the Accord Hybrid comes out so I can trade up. Community has my business! I also want to recognize Kysta  Nichols and Roxanne Villanueva for their excellent work, Kysta always follows up with a phone call to make sure the work was done to my satisfaction and that I had a great experience while at the dealership. I’m looking forward to my next new car purchase at Community Honda.",5.0
28,"July 30, 2019","Excellent work, greeted right away and recalls were taken care of promptly thanks again. I came in for 2 air bag recalls and 1 headlamp wiring recall. ",5.0
29,"July 29, 2019","I purchased a Civic for my daughter at the Lafayette Louisiana location. Very enjoyable experience, friendly sales staff. I will be back here for my future purchases.",5.0
30,"July 25, 2019","Very professional, kind, make you feel welcome, keep you well informed, work is done on time as told, reasonable prices , only necessary work is done,  clean comfortable waiting area",5.0
31,"July 25, 2019",We came in just wanting to look at a used Honda pilot and ended up getting a new one because the sales team was so willing to work with us. It was an excellent experience.,5.0
32,"July 25, 2019","I highly recommend purchasing a vehicle from Community Honda.  Everyone was friendly and eager to help!  My salesman, Brooks Richard, was very knowledgeable and went out of his way to make sure I had a great experience!",5.0
33,"July 24, 2019","Mr. Fulton was very professional and thorough. He gave detailed information and was patient when questions were asked. In addition, he was diligent about following up to make sure we were satisfied with our purchase.",5.0
34,"July 23, 2019",A year after purchasing a used car and interior cleaning package from Community Honda of Baytown I find out I can’t transfer my interior cleaning package to my local Honda dealer that is just 20 miles away from Baytown because it is not a Honda product. My car has been at my local dealer for 7 hours now trying to resolve this issue. At least a dozen phone calls have fallen on deaf ears at Community Honda. They sure like to sell you a car and their interior cleaning package but stay away from them! After the sale you are on your own. Worst customer service I have ever seen!,1.0
35,"July 22, 2019",My car buying experience was great. The staff was very friendly and made the process easy and fun! I would recommend buying a car from community Honda to anyone looking!,4.8
36,"July 21, 2019","Maintenance: oil change and tire rotation.. Ms. Racel is my service advisor.. She is always pleasant.  She keeps me informed, as I wait, as to the progress of the services being performed. She is an assist to the service department at Community Honda.",5.0
37,"July 17, 2019",It exceeded my expectations. No appointment necessary. They took me right away. Only took about 20 minutes. Almost seems like a fluke that things went so smoothly. I hope it’s that easy next time! 😀,5.0
38,"July 17, 2019","Loved that they didn’t waste my time. They moved quickly to get the sale processed. They had the vehicle I wanted clean and ready when I got there waiting for me. 
Other than the initial sales guy Joel Boni trying to slip in a stocking fee in on my initial quote, the sale was a Great experience. ",5.0
39,"July 16, 2019",Community Honda service department is awesome.  Ms. Rachel and her team go above and beyond to meet my needs. The wait time was very short. ,5.0
40,"July 16, 2019",My experience at Community Honda was fantastic and I would absolutely recommend this dealership to anyone. Jerry was exceptional and very knowledgeable and helpful. He made the long process easy and enjoyable and I am confident in my purchase! Thank you Community Honda!,5.0
41,"July 15, 2019",Overall great service visit. Friendly and very helpful staff that made my visit go as smooth as possible. The waiting time was short and my vehicle was taken care of.,5.0
42,"July 15, 2019","Great service was provided, as always, by Charity Phillips.  We were well and timely informed on any and all updates relating to our vehicle.  Ms. Charity has always been excellent every time we do bring our vehicle to Honda, so kind and friendly.  And we most definitely can rest assured that our vehicle will be tended in a timely manner.",5.0
43,"July 14, 2019",I was very satisfied with the way my transaction was dealt with. I would definitely recommend my friends and family to deal with this dealership.,5.0
44,"July 12, 2019","I connected with my salesman right away. Jimmy Blalock was very personable, efficient and did not keep me waiting very long as he worked out our negotiations. I appreciate his professionalism and knowledge of the Honda vehicle I was looking at.  I do plan to recommend him if given the opportunity!",5.0
45,"July 11, 2019",Rachel remembered me from the previous time I had to have my car serviced. She’s always willing to help me. She reassured me everything will be taken care of and called me and kept me update with the status of my car.,5.0
46,"July 11, 2019","This is for Community Honda of Lafayette.  The website won't let me change the dealership.  The car buying process was great.  My sales team of Nicole, Brandon, and Shane were patient and helpful while not being over bearing or pushy.  The finance guy Terry was very knowledgeable and willing to answer all of my questions while never making me feel rushed.  The only reason I didn't give 5 stars was due to the detailing of the car.  While it appeared clean at first glance, the inside of the doors jams still had some dust from the car sitting on the lot.  While not a deal breaker, and not the fault of the sales/finance teams, it still left me a little underwhelmed.  I would certainly recommend this dealership to others!  ",4.6
47,"July 11, 2019",I have been using Community Honda Service Department for over 7 years and have always had great customer service. It is what keeps me going back!,5.0
48,"July 10, 2019",Nicole was great to work with! Would definitely recommend her as a sales person to anyone looking to get a vehicle from Community Honda Lafayette,5.0
49,"July 09, 2019","
I was excited that I did not have to wait a long time  the service was fast and the personnel was friendly and courteous to  me",5.0
50,"July 09, 2019",Excellent customer service.  Was greeted in timely manner with a smile. Keep informed of progress. Explain what was going on with vehicle and best course of action.,5.0
51,"July 05, 2019","Your sales staff is very busy so getting the return email from a different person asking what more you could do to sell the vehicle was critical to getting a deal with me, because Nissan was texting as well.  Having to wait 2 hours to meet with the financial analyst after making an appointment was a bit much.  I know that end-of-June/July is a very busy time. Maybe putting a down payment to hold the vehicle to kickoff cleaning/inspection with an actual financial appointment would be better. We left after closing time and the car did not have its final inspection nor cleaning, so had to return for both inspection and license plate.  Luckily, I live only 15 miles away!!!  Having a dealership near Teurling's High School was a big reason why we chose a Honda plus Elly who is only 16 said the safety features made her feel really safe and its easy/comfortable to drive, so after the test drive, she said to scratch all other vehicles off the list!!! Thank You for making my girl so happy.  Putting the RED bow on the vehicle with a picture and teaching her all the features prior to leaving was a very special moment for our family.",4.8
52,"July 03, 2019",Great friendly staff and fair price. They are happy to help me  and love the free popcorn. Short wait times and even washed my vehicle. ,5.0
53,"July 03, 2019","Rachel always works hard to get us in and out in a timely fashion, always a pleasure working with her. Keep up the great work ",5.0
54,"June 28, 2019",I took my Honda Pilot in because the check engine light came on. James was exceptional in getting it checked out and fixed very quickly. ,5.0
55,"June 27, 2019"," This was my first time buying a vehicle and it went very smoothly. Kelly was extremely friendly and welcoming. She answered all of my questions and even explained all of the features that my new vehicle has. Even though I was at the dealership until late at night signing all of the papers, she stayed to give me a quick breakdown of my car. The whole staff is extremely friendly and I will definitely recommend this dealership and vehicle brand to anyone I know looking for a new vehicle.",5.0
56,"June 26, 2019","Everyone we dealt with was very friendly.  They were super busy that day, but never made us feel rushed.  Got my new vehicle that day!  Very happy with my purchase and with Community Honda.",4.8
57,"June 26, 2019","Excellent customer service, very knowledgable of vehicle and answered all questions, able to make a great deal and provide our family with a family vehicle we will utilize for years.",5.0
58,"June 24, 2019","Majority of dealerships make you feel pressured into buying a vehicle. Community Honda was VERY friendly, professional and got everything done in a timely manner. Travis, our salesman, was honest, humble and wonderful! Colby, the manager, greeted us as we walked into the door, Travis had told him about us wanting an HRV. Bri, was very honest and precise about everything when it came down to warranties, the do’s and dont’s, policies, too! The three of the them together made me feel safe when buying a car. I never once felt pressured or ‘hassled’. I definitely recommend Community Honda!!! ",4.8
59,"June 24, 2019",they knew what I needed and they handled it promptly! They were courteous and informative and kept me informed through every step of my service.,5.0
60,"June 23, 2019","From the moment I walked through the door, I knew I was at the right place. The entire staff was super friendly. Chassity Vincent is  awesome! She seemed more like a friend than a salesperson. I have never had so much fun buying a new car!",5.0
61,"June 22, 2019","I went into the dealership not thinking things would work out for me, but Brooks Richard got it done and I drove home in my new vehicle! Totally ecstatic, First big girl purchase. They made things very quick and were all extremely polite! ",5.0
62,"June 20, 2019","Ask for Kelly at Certified Honda in Lafayette, Louisiana. She will make sure to find a vehicle that fits your budget, your family, and will keep you safe on the road. No pressure sale. Thank you Kelly",5.0
63,"June 20, 2019","Fulton was very helpful and polite.  He Made sure all our question were answered.  He checked on the progress of our new purchase several times.  We did however have a long wait to get in with finance. 
Charity is by far the BEST Service Advisor I have ever had the pleasure of working with. She keeps you informed and calls back when you leave her a message.",4.8
64,"June 20, 2019",Great staff and experience. They were very thorough with explaining everything about the car. Brooke’s Richard was our salesman and he did a great job. ,5.0
65,"June 19, 2019",The service was done quickly and professionally.  I had a recall for an air-bag.  The air-bag was fixed and a complementary check revealed that my break pads needed to be replaced.,4.8
66,"June 16, 2019","We got an oil change, the service was very fast. My husband was in and out in no time!  Everyone was friendly and the service was not costly at all!",5.0
67,"June 15, 2019",This dealership has always provided top notch service with great attitude. The service reps know who I am when I call and treat me with respect and courtesy.,5.0
68,"June 14, 2019","Brookes Richard set me up with an appointment to have the splash guards installed and a key fob programmed to my 2019 Honda Accord Sport. My accessories were put on and programmed in a timely manner, everyone was very friendly. Brookes even put my license plate on my car while I was there! ",5.0
69,"June 14, 2019","Your service personnel are exceptional. Rachel always is prompt , knowledgeable, , and is truly a caring professional. Will buy another Honda.   The service staff has always been very dependable. ",5.0
70,"June 12, 2019","The entire staff at Community Honda of Lafayette were so kind. I drove 3 hours to this particular Honda dealership. Travis and Jerry made purchasing my vehicle such a wonderful  experience, at an affordable price. I have recommended them to friends/family looking to purchase a vehicle in the near future. I will definitely be back!",5.0
71,"June 12, 2019",I had such a great experience buying my first brand new car. Stephanie was so patient with me. I could tell she really cared about me getting the vehicle of my interest. She was helpful in every aspect. I am #TeamHonda & #TeamStephanie for life. I am going to refer all of my family and friends to her. ,5.0
72,"June 09, 2019","Easy to work with. My salesman was friendly. This is the second time I have bought at this dealership. Also, I referred a friend and she bought also.",4.8
73,"June 08, 2019","Everyone at Community Honda was very informative, helpful, and friendly. They take the time to make sure you know all the details about the vehicle you are purchasing. I never felt pressured to buy a vehicle, and everything was reasonably priced. Fulton Hicks and Terry Sam made my first buying experience a positive one. I would highly recommend Community Honda and Fulton to anyone that is in the process of buying a new vehicle. ",5.0
74,"June 01, 2019",Customer service was awesome... Very informative and thorough... Didn’t spend my day there I was actually able to get out and enjoy my new car,5.0
75,"May 30, 2019","I had a great experience. Travis even drove 3 hours away to help me. He was kind, and knowledgeable about my vehicle. He knew every detail about my car and found the exact one i wanted. I will definitely be returning for my next vehicle. Everyone there made sure we were comfortable. Offered us food, drinks, whatever we needed while we waited. Very pleased!! ",5.0
76,"May 26, 2019","We purchased a new Honda Civic for my daughter who is going off to college.  Hassle Free, Awesome experience!!  Jerry helped us find the perfect car for our daughter.  ",5.0
77,"May 25, 2019","I purchased a 2019 Honda Accord Sport from Community Honda in Lafayette. Brookes Richard was my sales consultant, he went above and beyond getting me a great deal on the car I wanted. Brookes made the car buying experience fast, fun, and easy!! He truly cares about his customers! I highly recommend Brookes Richard to anyone who is looking for a new car. ",5.0
78,"May 20, 2019","I purchased a Honda Pilot from Community Honda in Lafayette, La and it was an amazing and fun experience. I walked in scared of buying a new car and walked out happy and comfortable with my decision. The service was great the staff stayed late to be sure I was squared away before leaving. Travis Theall was a blast and one of the other workers gave me great advice on products that keep the car clean with kids. I would buy another vehicle from Community Honda and Travis in a heart beat! ",5.0
79,"May 19, 2019",Brandon and Brooks were a pleasure to work with. I couldn’t be happy with their level of customer service and patience. Brie from finance also made the last step super quick. ,5.0
80,"May 05, 2019","Sales and credit personnel knowledgeable regarding respective jobs. Always have good service. This is my eighth Honda purchase! Entire process went very smoothly, no problems.",5.0
81,"May 04, 2019",This dealership is a great one . Very Kindly people to work with . Fulton was my salesman  and I would recommend him to every body out there looking for a vehicle. Thank you  Colby for your assistance as well.,5.0
82,"May 04, 2019",I can truly say that the staff went above and beyond to unite me with my dream car for a great price! Thanks Community Honda!,5.0
83,"May 03, 2019",I loved this place and all the people who helped put me in my brand new car! Would definitely recommend to anyone looking for a car service was awesome.,5.0
