,Date,Reviews,Ratings
75,"September 17, 2015","Great servive and great staffs and I would highly recommend everyone to go to this dealership.

I personally had good exeperince and also had a very good deal",4.8
76,"September 16, 2015","All personnel we had contact with during the transaction were knowledgable, professional, friendly, and courteous.

It was a busy Saturday, yet, we were served promptly and the entire visit and purchase were complete in two hours.",5.0
77,"September 16, 2015","I had a great experience with my sales person Albert B. And TJ in financing. I was there no more than three hours waiting with my toddler and finalizing my paperwork. Also, drove off the lot with my pre-owned vehicle same day. This second purchase went smoothly and I highly recommend them. ",5.0
78,"September 13, 2015",Craig was great! He made my first car buying experience amazing! I was completely familiar with the car before I left the lot! Craig couldn't have made anything more smoother.,5.0
79,"September 12, 2015",Everyone was amazing there! Two purchases so far and I will always come back! They work on prices and make sure you walk out happy! ,4.8
80,"September 10, 2015","I went in just to ""look"" around as I was wanting a new car. To my surprise I was shown one that I loved right away and after going through paperwork, I was able to get it! Definitely wasn't expecting to be able to get one yet but they made it happen!",4.8
81,"September 07, 2015","very good experience. also very friendly and knowledgeable staff. I would recommend them to others. it was a lengthy process, but I appreciate not feeling rushed. ",4.8
82,"September 07, 2015","Had a really good experience with Touny Crowe as the sales rep interface here. He was low key, non-pressuring, and wanted to get us the best experience he could. I give him 5 stars as he went above and beyond, and even when there were miscommunications he pressed forward with working options and ways to make things happen. I take off a star for the middle-man tactic that the dealership itself used once we started the $ negotiations. That woman was rude, used factually incorrect information, and basically told us that ""you can't trust TrueCar.com or any other website that gives sales pricing information"". We walked out after our experience with her, and when we came back and got to the same point on a different day, they other middle-man just didn't care and said ""sorry we can't do the deal"" so we walked out again. I had exact quotes from 8 different dealers with their best prices, and he rejected them saying ""you can't trust these"". Anyways, once Touny found out things fell apart, he worked with his managers and calculated a price that worked for everyone and we are very happy with our purchase now. Again - great experience with Touny, less than stellar experience with the middle-men (women). Also had a great experience with the Finance rep who was not pushy at all, but did make sure we knew exactly what we were passing on or accepting, along with detailing the various costs and payments, along with timing.",4.0
83,"September 06, 2015",The car dealer's name was Lee Creech. He was most helpful in my finding and getting the car I decided on. He stayed at the dealership long past their closing time. He was most knowledgeable about the car and he was able to show me many options about the servicing of the car.,5.0
84,"September 06, 2015",I live in Dallas Tx and I traveled 300 mile to Houston to get my car from Honda of clear lake and worked with John Girgis he give me an amazing deal so I get my car from him and all deal work is done within 2 Hours and I came back Dallas thanks to John Girgis for helping me to get everything done I recommend John Girgis to all my friends and relatives ,5.0
85,"September 05, 2015","Thank you for your time and hospitality this weekend, John. You made the car buying experience easy for my mom. Safe travels! Thank you again!",4.8
86,"September 05, 2015","Thanks to John, I purchased the car that I wanted for a GREAT price!  I will definitely refer my friends and family to John and to Honda of Clear Lake.  I give them a gold star for customer service.  John, the managers, and the financing officer were very pleasant and attentive.  They worked with me so that I walked away with the car I wanted at a price I could afford.  Most importantly, the entire process lasted less than 2 hours!  This is the best car buying experience I have ever had.  Thank you to everyone involved. ",5.0
87,"September 03, 2015","The sales consultant, Albert Bahena was great!!!!!!  he was very nice and knew what he was doing. Very great service, super helpful and friendly:) also very patient ",5.0
88,"September 01, 2015",We came to Honda not expecting to leave with a car the same day. I'm currently a manager at the Nike Factory Store and when I recieve great service it should be recognized. John Gorgis was very patient and helpful. He gave us an amazing deal we just couldn't pass up. Transitioning to the financial manager we continued to recieve premium customer service. Wiem Head was super friendly and very informative. I would recommend this dealership and John to my friends and family. ,5.0
89,"August 29, 2015",Anyone I worked with was very thorough and great to work with. David made sure he went through every detail of the vehicle we wanted to purchase. He wanted to make sure we new how to operate every part of the car. We left very happy and satisfied!,5.0
90,"August 28, 2015","Dustin Smith, our sales guy, was super helpful and very friendly. He was patient with us as we made our decision on which car to buy. It wasn't quite the price we wanted but Dustin's honesty and knowledge made it a very worthwhile purchase!",4.6
91,"August 28, 2015","Purchased a new Honda Pilot and was given excellent service.  This was my third Honda of Clear Lake Lease. The Salesman, Eric Cornelius, was very knowledgeable and helpful and made the experience go very smoothly.  I love my new Honda and know it will be a joy to own.  Thanks Eric for sharing your knowledge and teaching me about all the bells and whistles of my new car!!",5.0
92,"August 28, 2015","
As soon as I got there I got asked if I need it help by Joselyn Suarez.
She was the one who helped me in the whole process of getting a car, she showed me patiently all the cars I was interested in, told me about them and let me drive them before I made a decision, which took my around 4 days.
I can't deny the customer service they have at Honda of Clear Lake is exceptional,  everyone was friendly and  willing to help you, even the employees that knew I was being helped by Joselyn offered my coffee or any other thing I wanted/needed. They are really patient with your decision and they'll be there until you make your final decision.",5.0
93,"August 25, 2015",I wanted to Thank Justin McDonald my internet Sales Manager and David Kieu the great service I received.  I love my new crv. Happy Happy.,5.0
94,"August 25, 2015","Honda of Clear Lake has supplied a total of five cars for my family in the last twenty years. I had looked around at other dealerships and brands, but kept coming back to Honda of Clear Lake. This location has the best customer service I have ever experienced. Ben, the current manager, was just a salesman when I first bought a car in 1996 (I think. But he was definitely working at this location already.). I am pleased to say that to this day customer service is still a priority for them. Craig Baker, the salesman of my latest car, handled the entire process smoothly without any hassles. The people here honor the quotes they give and make me feel like a part of their family whenever I come. I am definitely coming back when I need a new car.",5.0
95,"August 24, 2015","DUSTIN SMITH WAS REALLY AWSOME! HIS KNOWLEDGE OH HIS PRODUCT IS WHAT MADE ME BUY FROM HONDA CLEAR LAKE. FAST FRIENDLY SERVICE. WILL COMEBACK!
PAT",4.4
96,"August 21, 2015","Third new car from Clear Lake Honda.  Good experience through sales, management, finance, and delivery.  Car is perfect for it's purpose of two people running around Houston..  From deciding to get a new car, comparing dealership offers, getting financing, negotiating, finishing paperwork, to completed delivery was only 6 hours.",5.0
97,"August 18, 2015","I was worried that this car buying experience would take all day and be full of stressful back-and-forth negotiations. However, we were taken right to our salesman, Dave Flores, quickly and was shown right to the car I was looking for. Dave knew everything about the car and went over all the features during the test drive and, quite honestly, I didn't need to look any further. I got the car I wanted for the price I was looking for. ",5.0
98,"August 14, 2015",Albert was awesome. He was patient when I decided to change to a different car the last minute. Also great deals on pre owned cars.,5.0
99,"August 11, 2015",Craig Baker helped us and he was really great! He is very knowledgeable about Honda cars as well as he took us through the features and made sure we had all answers to our questions.  Vijay was our first contact there and he helped us get the car we wanted for a good price. Great team!,5.0
100,"August 05, 2015","My experience with Honda of Clear lake was great! My sales rep, Dustin Smith, was very helpful and patient with me. It was a two day process for me but he was there every step of the way. He worked with me on the price and got me exactly what I needed! I'm very pleased with my first car and how easy Dustin made it for me. I will be returning to Honda of Clearlake for my next car purchase and I always recommend Honda of Clearlake for anybody looking for new or used car!! ",5.0
101,"August 01, 2015",Needed a car was very scared to go in so I searched on line asked for the info and it was sent right away and got 2 follow up emails and a finance app and filled it out and Dustin Smith told me to come in he  got the deal I wanted on a 2012 Honda Accord. So thank you Dustin Smith you are AWESOME ?? we love are car.,5.0
102,"July 30, 2015","Dustin helped me out purchasing my car worked with the price with me and helped me do all the paper work over phone calls or emails and worked with my credit union on financing.

Took me on a test drive on the car that I was interested in  and respected me as a customer. He didn't try and sell me a car I didn't want.

No high pressure sales tactics and was honest about selling a car. I would recommend anyone to visit Dustin for used cars ",4.8
103,"July 30, 2015",We had a great experience buying our new Pilot. Dustin Smith was our salesman and worked hard to get us a great deal. He was knowledgable about the vehicle and not pushy or overbearing! He took his time to go through and explain all the features and show me how to set my stuff up after we purchased. We recommend asking for him if you are looking at Clear Lake Honda. We would buy from them again! ,5.0
104,"July 30, 2015",From the moment I walked into the dealership to the time I left the employees were very helpful and nice. It was a  good experience. ,5.0
105,"July 29, 2015","I got a great deal and also Craig did a great job explaining everything about the car very friendly .,  I am very pleased I will recommend anyone to shop there",5.0
106,"July 29, 2015",I bought my Honda Accord from here. I worked with Dustin Smith. He was super friendly. He was very helpful and knowledgeable. Wiem was the lady who helped us in finance. She was able to get me to my target payment quickly and efficiently. I will be back when I am ready for another vehicle!,5.0
107,"July 28, 2015","I didn't want to go to this dealership at first even though it's closer to my house. However, the dealership / salesman made me an offer I thought was too good to be true. You know how that goes. However, this time my experience was different than it was 3 years ago (when I walked out). Different salesman, different experience and different, much better vehicle. How different, you may ask? I would recommend this dealership to you, to my religious community and to myself again when I need to lease another vehicle. I want to lease the same model. By the way, the 2015 Honda Accord is fun, powerful and cool-looking vehicle. I highly recommend it.",5.0
108,"July 28, 2015","Alberto was fantastic to work with from the moment he approached me. I ""updated"" my 2011 Honda Accord with over 100k miles on it to a 2013 Honda Accord with a little over 35k miles. I was given top dollar for my 2011 (thank you, Gio). I highly recommend this dealership, especially Alberto as a salesperson.

Cheers~",4.6
109,"July 27, 2015","Craig was absolutely amazing! I highly recommend him if your looking for great vehicle and phenomenal customer service. I not only got a great deal on my brand new Honda Accord EX-L V6, I received the absolute best experience. Craig really listened to what I wanted and immediately showed me the perfect car that fit my needs. Craig doesn't just sell cars he sells an unforgettable experience as well. He has followed up with me on numerous occasions to make sure I'm comfortable in my new ride. Honda of clear lake is known for exceptional service, Craig however excelled my expectations. I will most definitely forever recommend Craig and Honda of clear lake. ",5.0
110,"July 27, 2015","Dustin Smith sold us a Pre-owned Honda Accord and he made it a really good experience for us! He was very helpful, friendly, and competent! ",4.8
111,"July 26, 2015","I have always had a great buying experience at Clear Lake Honda.  My salesman, Craig Baker was the best salesman I've ever dealt with.  I've purchased 3 different Pilots from Clear Lake Honda and while my experience was good, Craig Baker was the best.  He was attentive without being pushy and took care of all details of the experience.  He was always pleasant, prompt and honest.  ",5.0
112,"July 25, 2015","We were making a quick weekend trip to Houston to purchase a car for our daughter. We found a car on the internet, contacted the dealership and found them to be very helpful and accomodating so that we could see and test drive the vehicle in a timely manner. They made the car buying experience easy and pleasant.",5.0
113,"July 25, 2015",I was treated with respect and Albert worked with me to get a great deal. The car was clean and had half a tank of gas.,5.0
114,"July 24, 2015","When I arrived at Honda Clear Lake, I had an appointment set with Craig Baker. We had discussed a few vehicles on the phone the day before, so he was nice enough to have them pulled up to the front for me. As I asked him questions, many questions, about my possible purchase, he replied with everything I needed to know. To say the least, he was extremely knowledgeable. Craig Baker was the first genuinely nice car salesman I've met. Being in the car selling business before, I've grown aware of how dealerships try to rip you off. This dealership was the polar opposite of that. Everyone Craig introduced me to was happy and friendly. I didn't have to go through the hassle of negotiating down the price and at the end of it all, I drove off the lot in my brand new 2015 Honda Civic. I'm in Love with this vehicle and this dealership. I will always return to this dealership to buy my next Honda, regardless of where I live.",5.0
115,"July 24, 2015",I greatly appreciate 2015 FIT's good performance and a considerate staff. I'm going to buy another one for my wife from this location and from him. ,4.6
116,"July 24, 2015",Recently bought my car at Clear Lake Honda. Great experience! The team was very knowledgeable and helpful. Jocelyn was great! She answer all the questions I had and was very patient. ,5.0
117,"July 22, 2015",I purchased a 2014 Honda Civic from Honda of Clearlake I had a great experience at this dealership.  Johnny  Argueta was my salesman he was very knowledgeable. ,5.0
118,"July 22, 2015",I have an amazing experience. Thanks' to Jocelyn Suarez for her attention and her excellent customer service. In general all of the Honda Clear Lake crew were very helpful and patient with me and my husband since it took us a little long to make a decision.,4.8
119,"July 22, 2015",I just purchased my 8th Honda at Clearlake Honda. As always such a great team and efforts to make your visit great and smooth. Donny and Bennet are the best!! ,5.0
120,"July 22, 2015","JUST WATNED TO THANK DONNY FOR GREAT SALESMANSHIP AND CUSTOMER SERVICE WHEN I PURCHASED MY NEW HONDA ON SATURDAY 7-18-15.  MY CAR WAS ON THE SHOWROOM FLOOR WHEN I FELL IN LOVE WITH IT.  MY PREVIOUS CAR, WHICH I ASLO PURCHASED FROM HONDA OF CLEARLAKE, WAS IN THE SAME SPOT ON THE SHOWROOM FLOOR WHEN I PURCHASED IT IN 2011.  I TOLD DONNY, THIS MUST BE A SIGN I SHOULD GET MY NEW CAR....LOL!

THANKS AGAIN AND GOD BLESS!!!
KEVIN FULLILOVE",5.0
121,"July 21, 2015", Thanks Joselyn for your great help in buying my 2013 PILOT. excellent customer service I definitely recommend Joselyn Suarez as sales person at this dealer.,4.8
122,"July 21, 2015","I like to start by telling everybody that dealing with Honda of Clear Lake was a great experience for us, starting with Joselyn Suarez who showed us a new Honda HRV, she was very knowledgeable and patient, she made our purchase experience different, she helped us made the right decision. Everybody was very helpful, especially Joselyn, she is a great salesperson. I definitely recommend Honda of Clear Lake if you want to have a great experience.",5.0
123,"July 21, 2015","I recently purchased a 2015 CRV and I love it. We have purchased 4 Honda's from Honda of Clearlake.  Donny Slaughter, with the sales department is awesome. He has always been knowledgeable about the cars and does a great job throughout the process. Love my Honda!",5.0
124,"July 21, 2015",We didn't plan on buying at the first Honda dealership we visited. Craig Baker made us feel right at home. We were very happy with our purchase at this location and would definitely recommend this dealership to others that are looking for great price and a stress free car buying experience. ,5.0
125,"July 20, 2015",Happy with the car.  Craig showed us all the new special accessories and advancements on the vehicle.  This is our 6th Honda and we are happy with it on the whole. ,5.0
126,"July 20, 2015","I recently purchashed a 2015 Honda Civic from this location. The process was made quick and painless by our knowledgeable sales person, Lee Creech. I love my purchase and would definitely recommend this location to others in the market for a new vehicle. I look forward to utilizing this dealership and salesperson again in the future.",5.0
127,"July 20, 2015","I stopped into the dealership just to look around.  I met with Craig Baker and was made such a good offer for my 2012 CR-V that I went ahead and bought a 2015.  This is my third straight car from Honda of Clear Lake, and I have promoted this dealership to my friends.  Craig surpassed all my expectations and introduced me to all the people I needed to meet to make the purchase just perfect.  Everyone at the dealership made me  feel at home, and gave me their cards and asked me to call if I had any questions on anything......",5.0
128,"July 17, 2015","I recently purchased a 2015 Honda Accord. Everyone was friendly,attentive,patient, and informative, and straight forward. I was glad it didn't take too much time or days to make this deal.Hopefully, the service and maintence is up to par. Awesome guys.",4.0
129,"July 13, 2015","My husband and I traded in 2 vehicles and purchased a previously owned 2014 RAV4 from Honda of Clear Lake. Johnny, our salesperson was very professional and a pleasure to work with. He gave us a great deal on both our trade-ins and the new vehicle. We will be using this dealership again and will ask for Johnny.  ",5.0
130,"June 04, 2015",Went in pre approved from my credit union and they slipped a credit app. In the paper work. They came back with figures that were 8000 dollars off after trying to sell me a warranty I did not want. They added my trade in value instead of taking it off the price and argued with me like it was my fault. Stay away from this place.,1.0
131,"May 31, 2015","I drove 1.5 hours in the rain with flood warnings to be told by a sales rep that she would not go out in the rain and risk her life to show me a vehicle. After filling out a loan application online I was informed I was pre approved for a 25,000.00 loan. Before I left I ask to speak with the manger, Geovanni did not offer to show me the vehicle I was interested in either.  I left immediately, while on our way home I filled a complaint with The Better Business Bureau, don't waist your time at this dealer I would not tell my worst enemy to go there. I will be contacting the Honda Corporation, I am sure they would like know how Honda of Clear Lake is representing them.  ",1.0
132,"May 26, 2015","I will say Gustavo was an amazing salesman. He would NOT take no for an answer, which is why he is in the business he's in. 

Once I ""bought"" the car the whole thing went DOWNHILL! Note! I traded them s Honda. Their service department sucks! James R. Has a memory of s rock and would not honor my warranty because QUOTE ""I forgot to put it in the notes... But I know we spoke about this issue"". He has no use to be where he is. 

Angel sold me the car for a steal, but I got ripped off with gap insurance for $600! Where as my credit union was $295. They let me leave, after I signed the contracts without a copy, when I requested it. I had to call to get it! TWICE! STILL haven't gotten my plates and they are expired. Just... *sigh* I wish everyone would or could be as good as Gustavo. He's so quick. Was there for me every step of the way, but after he sold the car the others were just ... Rough!",4.0
133,"May 20, 2015","I would not recommend this place to anybody.  All they do is look out for themselves and have pretty bad customer service.  I was discussing a Honda Odyssey with them and hashed out a deal over the internet with their internet salesman.  He started the paperwork and got the car ready.  I then called to make sure we were good to go and tell him I was on my way.  I put my pregnant wife and 3 kids in the car (yeah, there is a reason I am buying an Odyssey), and drove through traffic for 45 minutes to get there.  When I got there, what do you know, the car was sold to some other people who just happened to swoop in and get it.  I called right before I left dude!  I don't think it would have happened that quickly.  They could have called me or something.  The salesman tried to start showing me the car, I don't know thinking I would buy another car from them or something, yeah right.  The most disappointing thing was there was no apology or sympathy.  The salesman acted like I was the one being understanding because this other couple came in and offered more.  I thought we had a deal, but whatever.  Will never come here again and recommend others to not waist their time.",1.0
134,"March 01, 2015","Don't waste your time, we came to see and buy a specific car. Justin McDonald and his friend Dustin said they had it and promised a really competitive price. We arrived and they wanted us to try another car because the one we want is ""locked out"". We looked at the inventory,  they did not even have it! Their excuse: they just sold it... right. They were very unprofessional,  impolite. I would rather pay a couple hundred dollars more on the car than give them my business. ",1.0
135,"June 30, 2014",Eddie and Ted in the service dept. makes sure that they tell me what is going on with my car and lets me know what I am looking  at in the lifetime of the car and it's parts.  I trust them and rely on their knowledge since my husband can no longer look or tell me what is going on.  Thank you  Clear Lake Honda.,5.0
