,Date,Reviews,Ratings
94,"March 21, 2019",I can always rely on Charles Smith and the service technicians at Westside Kia to keep my KIA Sedona in top mechanical condition.  I can trust them to do necessary service and keeping me informed thereof.,5.0
95,"March 10, 2019","I let my car for oil change and State inspection. The service department did a great job. Chuck, Kevin and the service team did a great job. Thanks ",5.0
96,"March 09, 2019","Purchased a new 2019 Sorento on Feb 28. I had noted an amber warning light that I could not readily identify. It was the Directional Headlights which weren't working. I brought in the car at 5PM March 7 - close to quitting time and even though the car was brand new, there was some initial reluctance to take care of the problem unless I made an appointment for the following week (!).
Make a long story short, Rick Hall (Sales Mgr) saw me and as soon as he knew what the problem was made sure the directional headlight motor was replaced right then! 
I couldn't be happier with the quick repair service that was provided and Rick's help in resolving the problem.
",5.0
97,"March 03, 2019","I've been looking at replacing a ten yr old Mazda CX7 and had pretty much zeroed in on a Sorento SXL. I test drove one in January but was checking other possible SUV's.
Finally decided to go to Westside based on their website inventory.
Unfortunately, three of them were demos and one was new, but wrong interior.
Then Rick said what about the showroom model? That worked and we very quickly came ot a price agreement. Got a fair trade in for the CX7.
The really nice thing is how quickly we finalized the deal, got an overview of all the features (and there are a LOT!) and drove home.
Came back the following morning to get tires inflated to proper pressure.
Everyone was friendly and accommodating. 
I hope this continues during ownership of the SUV.",4.8
98,"February 23, 2019",The people working there are friendly and professional !we didn’t waist any time with unnecessary conversations and subjects’.Thank you very much for being so helpful !I would love to recommend this dealership:,5.0
99,"February 22, 2019",By far the best experience purchasing a vehicle.  We were in and out quickly.  7th vehicle our family has purchased from Rick in the last 6 or 7 months.  Would definitely recommend to anyone!,5.0
100,"February 18, 2019","Great service. I appreciate the time, attention, and quality. Sebastian communicates well and had the vehicle done on time. This is a top rate facility.",5.0
101,"February 03, 2019","I went here with my son to buy his first car, and the sales staff we extremely helpful. They had the car we wanted, and honored the price we had gotten on the internet before arriving. They even beat a competitive offer by $400 without knowing. I highly recommend this dealership.",5.0
102,"January 23, 2019","Your review helps others Learn about great local dealerships And service centers Please be as descriptive as possible, Answering “why” You have given the rating ",1.0
103,"January 22, 2019","Even I made appointment 1 week ago, I waited for 3hrs 25min for balance tires & change engine oil. Even service guy kept saying ended soon with wearing earpiece. ",1.0
104,"January 14, 2019","There have been three separate instances where they have not followed through with what they said. The my told me they would fix the cracks on the car that I was buying preowned, it took several weeks of me calling to ask them when can I come in for them to finally call me. I waited for an hour and a half and then the manager said the chips were too big to fix so they’d pay for the windshield. Now more than a month later, constantly trying to get in contact with the windshield company I find out that they told the company they are not paying for it. They are very sneaky. Even when I was buying the car I asked what the TTL was and if there was anymore fees and my salesman said “no that’s the final price, nothing more.” And then when I’m about to sign the paper and I see over $500 added of stuff they never told me about. There is a lady whose the owners daughter and she is very very VERY rude. 0/10 recommend. Please don’t go to this place. ",1.4
105,"January 12, 2019","I always use Chuck Smith to handle my service requirements. He will never let you down. Fast, efficient, friendly service everytime.  I have never been disappointed.",5.0
106,"January 07, 2019",The service was excellent. There was pop corn hot and ready to eat in the waiting area. My car was washed and swept out to complete the service.,5.0
107,"January 06, 2019","Have purchase  cars from Westside Kia and have always had great treatment and found
them to always be very helpful. Also the service department is very good. will recommend this dealership to all my friend and relatives",5.0
108,"January 06, 2019",The sales agent walked me though the entire purchases process and explained the procedures and length of time need to complete. Update dated we were is the purchase process consistently. Made sure to explain the features on the car I purchased.,4.8
109,"January 05, 2019","Henry our salesperson was great! Enjoyed our time with Henry! I was not interested in the Kia Soul. My husband wanted me to test drive and I really liked it. I was interested in the Hyundai Tuscan. Did not expect to buy that day, but was very impressed with the car!!!",5.0
110,"December 31, 2018","Loved my experience here! Buying my Soul was so easy! My husband I went to Fredy Kia that morning and DID NOT get a good vibe, then we went to Westside and felt right at home. No lying or dirty tricks, just gave us what we wanted.  Thank you to Sherman & Dillon for everything, you are such good people. Love Westside Kia! I will definitely be recommending you guys to everyone I know. You guys have my business for life!",5.0
111,"December 30, 2018","Agreed to a price and changed it at the finance manager!  Horrible and completely dishonest.
Took complete advantage ! DO NOT USE ! 
No excuse for what they did - I wish I had a tape record or a camera to show how dishonest they were.",1.6
112,"December 17, 2018","I loved the professionalism on this Kia.
The seller Antonio was very nice to explain everything. The manager is very good too.
I loved the car I got yesterday. It is so cool!
Thanks a lot for make me so glad.",5.0
113,"December 07, 2018","Whether you're leasing or buying, the experience can be stressful and scary. Antonio made the process less so and dare I say that I actually had fun! It was a very pleasant experience and I'd definitely recommend Westside Kia. Ask for Antonio! ",5.0
114,"December 07, 2018","No one else but Westside Kia has service my 2009 Kia Borrego. Service has always been prompt at a fair price. The last service performed was a four wheel alignment because of tire excessive tire wear. Not bad for 73,000 miles.",5.0
115,"December 06, 2018","Westside Kia was really really accommodating , helpful and kind they really made me happy I’m so pleased with Westside Kia and Rick Hall was outstanding he knew what I wanted and  made it happen!!!!",5.0
116,"December 05, 2018","I had my car towed in to the shop.  I was called by Mark Adler saying the car has arrived.  Later I was called by Mark again that it was in the shop and being worked on.  Finally, Mark called and said the service was completed.  When I did pick my car up they had washed it and it was up front ready to go.
Great job you guys!!!!",5.0
117,"December 04, 2018","Service was done in a fast efficient manner. Waiting facility was clean, comfortable.  Staff very accommodating and friendly.  I would recommend this service location to anyone.",5.0
118,"December 02, 2018","Rick did a great job getting me what he tried to sell me the first time! Love the Sorrento EX V-6.
Enjoy this vehicle so much!!",4.8
119,"November 29, 2018","Just purchased a Isuzu truck from Rick and he was very professional, had all the answers that I need and he worked with me to get a body swap on my schedule and delivered the truck on time! Very happy.",5.0
120,"November 28, 2018","I first went to the dealership from a recommendation my sister gave me after her recent purchase. I loved my charger and at first I felt that nothing will ever make me part from it. My sister told me that I needed to go see David because he was simply amazing and will do everything to help you find what you were looking for. I met David and we talked cars. I’m the type of person that knows cats and I have a need for speed! However, in my mind I was thinking Kia, ugh I don’t know about that. David showed me their newest edition at their dealership, the Kia stinger. My first impression was, “wow! This was made by Kia”. It intrigued me to listen more. David was very knowledgeable about the features and the type of engine. I took the car for a test drive and I was immediately sold! David didn’t pressure me into making a purchase. I also test drive the premium stinger and David senses that I wasn’t happy with that car. He told me don’t worry I know the GT1 made you happy, let’s see what we can do for you. Long story short David, Rick and the owner made me feel as if I were family. They were attentive to my needs and I am ecstatic that I purchased my 2019 Kia Stinger GT1! Everyday I wake up pleased and excited to drive my car!  Thank you all for the excellent customer service that you all gave me!!",5.0
121,"November 28, 2018",Rick and his team have sold us 4 cars now and every transaction has been quick and easy. I would recommend Rick and Westside KIA to anyone. ,4.8
122,"November 27, 2018",They were all so helpful and made the process so easy and quick and gave us great deals .our sales guy Henry was very nice and helpful.  The whole dealership made us feel welcomed and at home ,5.0
123,"November 26, 2018","I was very impressed with the treatment I received from your staff.  I would highly recommend this dealership to others.  Actually I have recommended the dealership.  Everyone that I interacted with was very kind, friendly and professional.  I've never had this type of car shopping experience.  Thanks to everyone.",5.0
124,"November 20, 2018",Rick and Dylan were fantastic to work with.  I gave them my price point and they beat it.  I've worked with other local kia dealers and haven't had nearly the same experience.  Please go seek Rick when you can.,5.0
125,"November 17, 2018","My husband and I were in the market for a new vehicle so we decided to dedicate a week of visiting many different dealerships.  Finally we narrowed our choices down to Kia, Nissan, and Toyota.  We enjoyed the vehicles of each manufacturer but were blown away by the level of client satisfaction we received at Westside Kia!  Sherman immediately kept our interest with his vast knowledge of all things Kia.  
Everyone at westside made us and our children feel like family!  From the great music playing over the speakers to the fresh popcorn they served us we immediately knew that Kia was the dealership for us.  In particular a member of the leadsership team, Rick Hall, took a personal interest in ensuring our every car buying need was met!  Because of our interaction with Rick we will send all of our family and friends to Westside Kia.  Thanks again to the entire team! ",5.0
126,"November 11, 2018",Sherman was great. I felt very comfortable with him and my decision. He did a great job. I love my new car. I will definitely be back. ,5.0
127,"November 08, 2018","My recent experience at Westside Kia was outstanding.  This was My third purchase from this dealership. Rick is simply the best and David was amazing!
",4.8
128,"November 05, 2018","Kevin in the Service department is great. He is always so welcoming, friendly and always there to help me. A very professional person always a great experience.",5.0
129,"November 01, 2018","On this visit Sebastian arranged for my car's inspection to meet the deadline. Service was great as usual. They are always friendly and welcoming and provide great customer service. Deadline met! Thank you!
",5.0
130,"October 31, 2018",Rick and Tomas were a great team. They worked together to find the vehicle I was looking for and financing to fit my budget. My vehicle was ready for pick up as promised with all the features I was looking for. Thanks for all of your efforts in making this a great experience!,5.0
131,"October 29, 2018","He was very professionally and answered every question we asked about he car ( like car fax question, any recall on the car , Great job Mr. Page !!!!!!!!!!!!!!!!!!!!!!!! ",5.0
132,"October 24, 2018","Rick Hall treated us very professionally. Our truck was just as expected, no surprises! We highly recommend Rick for your next car or truck purchase.  Thanks Rick!",5.0
133,"October 15, 2018","I made an appointment, I arrived on time, I left with an oil change and a clean car. I always get friendly service from Chuck and the service from the service department is always excellent.",5.0
134,"October 11, 2018",Kevin personalises your visit. Even before you ask the question he already knows especially if your vehicle has a recall to be done. Thank you,5.0
135,"October 09, 2018",I received approval the very next day!!!! Rick Hall was like no other salesman I have ever dealt with.  He is professional and did an outstanding job.  Highly recommend this dealership and will most definitely return to do future business.  Thank you Westside Kia and Rick Hall for such an amazing experience.  ,5.0
136,"October 08, 2018",Always a good experience. Friendly place. Kevin Becker always takes care of my car and keeps me up-to-date on scheduled maintenance needed. He is a pleasure to do business with.,5.0
137,"October 04, 2018","Tomas Serna and Caitlin Auffenberg assisted me with the purchase of an extended warranty for my Sorento.  Both exhibited excellence in their knowledge, efficiency, customer service and were a pleasure to deal with.  ",4.8
138,"October 02, 2018","when I go to service I choose Chuck Smith he always takes care of me and my daughter, when I buy new card Fernando IS THE MAN",5.0
139,"October 02, 2018","We have visited many other Kia dealerships before we headed over to Westside Kia.  At Westside Kia, they treated with great customer services and they were quickly taking care of us.  Their internet manager, Que Spruill, made us feel like home.  We felt comfortable with Que because he was respectful and honest.  His quick action and customer service skill are great.  We ended up purchasing the Kia Sedona from this dealership, Westside Kia.  They have maximum five plus STARS from us.",5.0
140,"September 19, 2018","These guys are the best. No hassle what so ever. Made a car buying experience a dream!!!! The sales team listened to what my needs where, and I was driving away in my new car an hour later. ",5.0
141,"September 13, 2018",I love the new Kia Rio that I purchased from the wonderful people at Westside Kia.  This car has everything I want at a very affordable price.  Their excellent warranty and loyalty advantage program take all the stress out of purchasing a new car.         ,5.0
142,"September 13, 2018",My experience buying a new Kia Sorento was terrific.  We handled the entire negotiation through email so that we agreed to the car and price before I came into the dealership.  I have now purchased 3 Kia Sorentos from Westside Kia and have been very satisfied with the experience.  I will shop there in the future.,5.0
143,"September 11, 2018",I am very satisfied with the service I received at Westside Kia. I truly recommend it. Thanks Rick Hall for getting me in my new Kia Sorento.,5.0
144,"September 10, 2018",Simple oil change - work done as requested..  Service was done in a timely manner. All involved were friendly and helpful.  Waiting area clean and comfortable.,5.0
145,"September 09, 2018",Great service provided in a timely and courteous manner. Service manager also took the time to explain what would be needed at my next scheduled service in about 5K miles.,5.0
146,"September 08, 2018","Everyone that helped me with my purchase from Richard and Jason in sales to Tomas in financing were very knowlageable, helpful, and friendly. They worked to put me in a new car after mine was totalled and they made it a very easy process.",5.0
147,"September 04, 2018","Never in all my car buying years have I ever experienced such high level of respect, understanding and personal space/time as I did at Westside KIA I10 in Katy, Texas.
I felt valued by all of the sales personal there, especially by Rocky. He showed complete patience as he explained with his vast knowledge what my choice of vehicle entailed. 
Let me say I’m not one to be persuaded easily when it comes to spending money, but with the experts at KIA of Katy my experience was graceful. Given the fact that I did extensive research the teams erudite leads was most welcomed. 
Go see for yourself. You will be serviced with class. ",5.0
148,"September 04, 2018",Rick helped me find exactly what I wanted for the price I wanted. I was in and out of there within an hour and out with my new car.,5.0
149,"September 03, 2018","The staff of Westside Kia made the at times arduous task of buying a used car more pleasant than can be expected. We were looking for a used car for our son and needed a loan for him. The sales staff, particularly David were very accommodating and provided us with many options. The loans staff and management were friendly and helped make the process of buying a car one of the best we have experienced. Thanks to all.",5.0
150,"September 03, 2018",Purchase was fast and easy. We were explained the different finance options available to us. Would definitely buy another car from them and recommend to family and friends.,4.6
151,"September 02, 2018","Fast and friendly purchase with straight forward answers to all my questions and concerns. Best price for my trade without going back and forward. Definitely recommend Westside and Rick Hall, will buy again!",4.8
152,"September 02, 2018","During a long search for a grandkid hauler,  I visited many dealers  - some good, some not so much.  The Sedona SXL fit the bill finally and I shot an internet quote request for my trade and got an prompt email from Rick Hall in return asking for some info on my trade.  On a friendly phone call to him we discussed some options and he shot me a great price over the phone including a better than average bid on the trade.  I came down the next day, drove the Sedona, liked it and made the deal as we discussed on the phone.  No surprises, no $$$ add-ons or other arm-twisting, just the same  simple deal on the same vehicle we discussed on the phone.  He even sweetened the pot a bit by throwing in a trailer hitch.  The paperwork went fast and smooth and after that, Rick spent considerable time with us showing us around the formidable technology of the SXL, got the phones paired, the nav set up etc..  and got us on our way.  A straight up, straightforward deal all around.  If you're in the market for a Kia, I'd put them first on your list.  Highly recommended.",5.0
153,"September 02, 2018","The sales people were friendly,  not so pushy.  I was pretty relaxed and comfortable the whole time I was there.  The area was very clean both inside and out and the bathroom as well. I would highly recommend this place to friends and family. ",4.8
154,"September 01, 2018","The car is beautiful, the prices are reasonable and the service was great here. I would definitely recommend this dealership to friends and family! Rockey and the entire team there made the buying experience an enjoyable one.",5.0
155,"August 31, 2018","I was actually looking for a different dealership when I ended up ""lost"" at Westside Kia. It turned out to be a pleasant surprise to find such nice folks and an easy car shopping and buying experience! Thanks, Richard and the gang, for helping get back on the road a happy lady!",5.0
156,"August 30, 2018",I have had several cars from Westside Kia and their service on my cars have always been the best.  My Service Advisor is Sebastian Reading Flores and he always goes the extra mile to give me complete and excellent service with a smile! If I have any car problems and I can't figure it out myself I call Kia Dealership and someone there has always  helped me to  get me on my way. Kia Dealership is the greatest dealership for supporting their clients and making sure they are taken care of.,5.0
157,"August 30, 2018","Rocky was great, very respectful of our time and helpful in finding the right Sorento for us.  Loving the 2019 Sorento so far.  More comfortable than expected.  Love the technology especially the back up camera, parking assistance, blind spot detection, and voice activated services.",4.5
158,"August 29, 2018",Our sales man Rocky was super freindly and outgoing. We were there for some time picking out the car and color and he was patient and helpful. Will be back to see Rocky when my daughter is ready to buy her car.,5.0
159,"August 28, 2018","My experience at Westside Kia were truly great.  I didn't at no time feel pressure.  This is my second purchase from Westside Kia and though being a previous owner of Kia car, lead me back to the Westside Kia.  After speaking to the sale person Bobby, he truly understood me and made purchasing my new car stress free.  Thank you Bobby. ",5.0
160,"August 24, 2018",Rick was awesome!  Helpful in getting the loan pushed thru. HIGHLY recommend.  Our family just bought 3 cars from him and will be buying another one in the next month.  ,5.0
161,"August 23, 2018","Very professional, excellent service, they’re really take a time to explain everything about financing..
One of the sales person was really generous with my 3 kids ( paying for a soda, he doesn’t want the money back 
Thank you so much
",5.0
162,"August 23, 2018",Thank u guys so much. Team did a really great job helping me out. I love my new 2019 Kia Optima. Will recommend anyone to this location! Thanks Mr. Johnson Rocky & Willie,5.0
163,"August 20, 2018","What an amazingly easy car shopping experience..i saw the car I liked on the website
Immediately there was someone available online to answer  my questions and set up an appt. With Leroy ,to see the car... you guys were flexible. I appreciated that. 
Leroy was very honest and friendly immediately.
He made sure all my concerns and questions were answered...with a smile...the process of buying my Sorento,including signing all the necessary  documents.and giving a fair deal on my trade in.i can't tell you how much I appreciate Leroy and everyone there. I have been to many dealerships ,trying to find the right car.but you guys Are the best.leroy has just made it so comfortable,  he almost made me feel like my daughter and I , were family.
I am very pleased with everyone there. I didn't feel pressured  and that really helped. 
Thanks ,Leroy.  You are awesome.
What a nice place and pleasant arhmoshere.
Thank you ,I love my sorento.
",5.0
164,"August 20, 2018","Great people to work with.  I got the car I wanted at the price that worked for me.
Great service.  This is the second car I have bought from Rick Hall.  I recommend him to everyone.",5.0
165,"August 19, 2018","When I got there (at the service desk) Chuck recognized me and did my paper work immediately. My car was on it's way being serviced within minutes. After the service was performed, Chuck had my car washed for free. I ALWAYS get GREAT treatment from the service team, and I got to use one of my $20.00 coupons from the coupon book. The team is always friendly and helpful.",5.0
166,"August 19, 2018","I have purchased many new vehicles over the years with mixed results on satisfaction.  Richard G. has been by far the easiest and best salesperson to ever work with.  His sales manager, Giancarlo, was also very accommodating with working on my trade in numbers and finance rate.  Miss Offenburg, in the finance department made signing the papers on my new car quick and easy.  I would highly recommend Richard G. at Westside Kia to anyine looking for a great experience in purchasing a new vehicle!  ",5.0
167,"August 18, 2018",I have purchased 3 vehicles from Westside Kia with the expert help of Rick Hall. Rick always gets the numbers where I need them to be and his customer service is outstanding. I am always pleased with Rick Hall and Westside Kia. ,5.0
168,"August 18, 2018","Richard Bongiovanni is knowledgeable, shows attention to customer specifications, and is courteous.  His professionalism made the purchase of our fourth Westside Kia a satisfying  experience.",5.0
169,"August 17, 2018",As soon as I arrived I was greeted and helped. The whole entire staff here are very friendly and extremely helpful. Highly recommend buying from them!,5.0
170,"August 13, 2018","Rick Hall knows how to take care of his customers. He is efficient and to the point.  He always find the perfect car to
Our family. ",5.0
171,"August 13, 2018","I went to look the sales person orlando was very friendly no push to buy he gimme his time to look
and the service was very friendly  I will recommend this dealer to every one this service made the sales
thank you very much for the service.",5.0
172,"August 13, 2018","Kia team helped me to the fullest made sure I was happy with my new used car. Sales guy Rick made my experience perfect he helped me 100% 
If I ever need another vehicle he will have my business for sure job well done Kia family! Thank you for my vehicle couldn’t have been happier with everything ",5.0
173,"August 12, 2018","Internet Sales Manager, Rick Hall, offered us the best deal anywhere. A quick test drive and the deal closed in under an hour. Excellent efficiency!",5.0
