,Date,Reviews,Ratings
32,"November 12, 2015","My experience with this Dealership was not as good as I would have hoped. I will say that the salesmen was very nice and helpful, but only to a point. Everything seemed good while in the process of picking out a vehicle. I was already interested in the Outlander ES, but he suggested and really tried to sell me on the sport. I was really interested in the ES, but he kept assuring me that the Sport was a better fit for my family, which was the focal point on get an SUV period. I took his advise and went with the smaller SUV, he gave me all of the information I needed and answered as much of my questions as he could. He then asked me if the price was fair for me to work with and i said yes because that was roughly what I was paying for my car and that my credit report would prove that, so it all sound like it was going well. Then we went on the test drive which left me feeling like we booth we're very sure that Outlander Sport was the right choice. Once inside we started to try and fill out all the paper work. they we're willing to use there bonus cash event deal to help pay my negative equity. Then he went through all the information with my wife and myself. As we were hashing out all the details he called my old dealer to get my cars info so they could pay what remained on it and tack it on to my new payment, which was ok because there bonus cash event would take care of most of it anyway. By this point I was like ""Oh wow i found a dealer that was willing to work with me"" but was I for a bit of a surprise. After some time the sales man comes back after checking up on some stuff ,with one of his managers. The manger then begins to tells me that my personal vehicle I bought from my dealer was not being reported and that my dealership had lied to me about doing so to help my credit, little did he know i had just looked at my credit report from Transunion, just a few day's earlier and saw that they were reporting it every month since i bought the car 2 years ago. Then he proceed to tell me my credit was really bad and that i could not be financed by anyone, which was odd because he then tried to tell me that they could work something out by getting me into a Mirage. At this point my wife got upset because she could tell they just wanted to make a sale instead of trying to work to sell us what we wanted. By this point I told him thank you for your time but I'm not interested because I need a bigger car than the Mirage for my family (which is also smaller than my car), he then began to tell me that he had a friend that worked for the credit bureau and could help to get my payments of the Mirage be even lower. This was an obvious attempt to hook me on a car i had no need or want for. The funny part is they put all the hard work to get me into the Mirage, why couldn't they work as hard to get me into the Outlander. My income could pay for my monthly payments easily.  I mean xxxx  I would of been fine with the payments and been content with being in debt to them for the car my family wanted and needed. 

That was my experience and I will be very hesitant to go back.I hope Mitsubishi looks into how many sales and costumers they are losing out on at this location in San Antonio. Mission Mitsubishi states ""We outsell every Mitsubishi dealer in the U.S...."" I highly doubt this location can stand behind this claim.            ",1.4
33,"November 05, 2015","Bought my car on 11/3 and Q was my salesman, Henry was our Finance man and Dina was our deliverywoman. What a great experience! They all worked so very hard to get me my brand new Lancer! Thank you again! ",4.6
34,"September 25, 2015",The salesman was nice...carlos cortez...but the finance guys Ruben and Ricardo were to annoying trying to force one to buy  guarantees... I went after a couple of days to cancel guarantees but they give me a hard time. I have gone several times to cancel and they are always busy...to this point i have not cancel guarantees. They hide...,1.3
35,"September 02, 2015","I went in with a hope and a prayer.  Eli did an excellent job in fighting for the payments I wanted and got me in a 2015 Lancer.  I was in and of the lot before 1pm. I can truly say that my Mission Mitsubishi experience was wonderful and if you need a vehicle,  go see Eli! ",4.8
36,"September 02, 2015","I purchased my 2015 Lancer GT from here and seemed to have a good experience on purchase day, that's where everything went wrong. I came back to for my first oil change and asked about paint chips across the hood of my car and what can be done about them because I had way too many to count (13 above the drivers headlight alone). They advised me it was from rocks and that they sent images to Mitsubishi and they weren't going to cover it under warranty. I leave and find a huge chunk of paint missing from a side skirt which was not there when I dropped off the car and called and they agreed to fix it (service dept is great with every aspect I've had to deal with them on) While there I spoke with a manager about the paint chips again and was under the assumption that they would fix that along with the large chunk of paint as it appears to be a bad paint job (rare but my luck would put me with that problem). I picked it up and paint chips are still across the hood, spoke with a different manager who couldn't help because he was not the manager I spoke with previously. I have not gone back since and have more paint chips, including ones down the side of my car now (obviously not from rocks on the highway) I plan on going for that when I get time (it's a 45 minute drive) as well as other issues. I have had such a horrible experience not just with the dealership but with Mitsubishi in general that I do not plan on buying another car from this manufacturer again. ",1.6
37,"August 28, 2015"," I own a 2015 Mitsubishi Mirage ES. Vehicle delivered from factory with no ability to align rear wheels.
Service department coordinated with corporate headquarters, had parts shipped, installed and performed alignment. Outstanding work.",5.0
38,"January 10, 2015","I have a Mitsubishi Eclipse 2007 and it was not turned on. In few hours, they found the problem and repaired it. They are absolutely expert. I thank Mission Mitsubishi and Ruben for their help. Ruben was professional, helpful, and responsible. Ruben also tried to give me good discounts. ",5.0
39,"December 04, 2014",I just completed the purchase process with this dealer. Purchased a 2015 Mirage with CVT. In all respects the process was painless and it is worth your time to check out Mission Mitsubishi.,5.0
40,"November 29, 2014","Advertised $4,500 cash back in addition to trade-in. Salesman said that it was $4,500 only for the trade in. Did not provide invoice upon request, would not entertain the thought of discussing the price until we applied for credit. Manager/salesman would not disclose full information in regards to financing or the standings of our credit. Excluded my wife by attempting to chat ""in private"" outside. After 2 hours of negotiations, we were informed that the vehicle we test-drove and agreed to buy was already sold. Manager and salesman walked away frustrated when we inquired why they were trying to sell us a vehicle that was already sold, stating ""no big deal, we've got 500 vehicles here""",1.6
41,"October 18, 2014","Our 2014 Mitsubishi Mirage was involved in a one car accident. The collision center did excellent work with the repair. The body shop manager, Mr. Ignacio Garcia, served us well.",5.0
42,"September 09, 2014","From driving onto the dealership, my purchase of my 2014 Mitsubishi Mirage has been exceptional. My friend had already puchased two from Mission and not one problem with either vehicle. She recommended them and especially Azzam that before I checked anywhere else, I went to Mission and Azzam before I decided on a new vehicle. Friendly helpful people everywhere. Service beyond the sale. Great customer service. My car is awsome: I've seen it reach 54 hwy miles /45 combined. I giggle everytime I pass a gas pump. ",5.0
43,"August 21, 2014","I loved my experience with James Izigarry, sales man.  He was pleasant and knowledgeable about the cars. The service was fast and effective  I appreciate their business and would recommend anyone to go and see them.  They worked diligently to get me in the car I wanted and were concerned with my satisfaction and happiness.  Thank you James to you and your Manager who guided me into making a very good decision.  I know I'll save over a period of time and in the end come out on top because of you and your efforts.  Please continue to do what you do, and that's provide an Excellent Customer Experience. ",4.8
44,"August 12, 2014","I began my negotiation via e-mail with Henry Rafiti, a sales associate on 08/02/2014. I met with him on 08/06/2014, took a test drive in a Sapphire Blue 2014 Mirage ES with CVT. We had an oral agreement on that day and signed the purchase documents on 08/07/2014. Delivery happened on 08/12/2014. The whole process was painless, and I highly recommend Mission Mitsubishi.",5.0
45,"April 10, 2014","I loved my experience! The customer service was just perfect, I enjoyed every second of it. I am 19 years of age so the price was a bit pricy but the benefits and wonderful advantages are a big win. I definitely recommend this to anyone looking for a great deal on a car!",4.4
46,"April 10, 2014","The Story:
First off, we had Tony P. as our salesman. He was great! Very friendly and honest. Now for the ""financing"" portion of the experience. Go to their website, check out their prices which are correct. No where on the site does it say there is a $3000+ fee for in house financing and a 24.99% interest rate. They also said the interest rate could range between 16% and 24%. Then was told, there's no budging on that, it's 24%. I understand that they take the risk in financing but when you call to ask about their in house, they don't tell you exact details until they have roped you into the dealer.  I called ahead of time, inquiring about the in house financing option. Of course they leave out important details, make you waste your time viewing the vehicle, driving it, driving to another lot and then drop the fine print on you when it was asked up front!

The finance rep Ceasar (should have been Napoleon) definitely not a people person. He has the it's a take it or leave it attitude. It's not what you say, its how you say it buddy! Joe the Manager was the same exact way.

Just from that aspect of deception, I would not deal with Mission Mitsubishi going through conventional financing or not, Wouldn't even deal with them if they came back now and said they would honor the internet pricing they have posted.

DriveTime is looking better and better by the minute! Now that's saying something!

The Outcome:
After this review was submitted, I received an email from Louis G. (Internet Manager)""I have read this email and I will make this right. will you please call me when you can so we can talk."" After speaking with Louis and expressing my view and feelings of how Ceasar treated me and my wife, the issue of this unexceptional individual was taken care of. Louis also asked me to bring my vehicle in for service, 27pt check, free of charge in exchange for taking this review down. The service was done on my vehicle but then I had more of a chance to speak with him one on one in his office. First, the vehicle we looked at was not available for in house financing, when we were told by our salesman and Ceasar that it was. The $3000+ ""fee"" could also not be taken off making this $13995 car $16995 and a 24.99% interest. Making the cost of this car almost DOUBLE of what the internet pricing is and what it's worth in reality over a 4 year period.

We gave this dealer the chance to ""make this right"" and honor their internet pricing and deception of the $3000+ ""fee"" tacked onto the in house financing option even though I said earlier that I wouldn't even do business with them regardless. After checking again with a different sales rep, I was told there are no additional fees, all you need are references, $1000 down for any of their hand chosen in house financing cars. This rep would not give any % on interest.

Now, I am greatful for the free service that was performed but nothing was made right. What would make this right? Honor your internet pricing without the hidden $3000+ fee. Oh, did I forget to mention that my down payment was going to be $3000? Kinda ironic how that ""fee"" is the same amount of my down payment.

Upon thinking about the whole situation, I didn't think it would do anyone (consumer) any justice to have this review taken down. I thought it would be better to keep the original content and then update it with the outcome I have added.

I hope this helps someone to avoid this dealer. I'm sure there are a lot of dealers out there like this, just so happens that this one got caught red handed.",2.5
47,"March 30, 2014","Went to the dealership just to look around for a car for my son. The car had to be black and under $10,000. They had a car that they just received that was perfect. We had to wait a bit for the car to be ready but it was definitely worth the wait. My son loves the car. Everything the dealership said they would take care of they did. Walter is just amazing. And thanks joe for helping us find this car. ",5.0
48,"March 19, 2014","Took my car to the service dept for an alignment the guy that assisted me Walter, was very attentive to my request he gave me a time that my car would be done and it was actually faster than that he also notice my key needed to be replaced so before anything he ask if I wanted to get a replacement I think he's a great worker looking out for the best of his customers would definitely recommend this dealership to anyone ",5.0
49,"October 13, 2013","Mission Mitsubishi helped me get in to a New Mitsubishi Outlander and lowered my payment !   Benson Honda told me I could not get in to a car and I had to wait..... but Joe C. and Louis G  handed me a new set of keys!   Thanks guys!  

You both made me fell great....... Thank you",5.0
50,"October 12, 2013",Very efficient and helpful. Received prompt attention and did not have to wait long. I am glad I purchased my Galant from Mission Mitsubishi. Their entire team is very helpful.,5.0
51,"October 12, 2013","We were in the market for another car and we stopped at Mission to check what they have, that is when Mr. Alnami approached us and offered his assistance, the nice thing about him he did not hustle us and pushed he was very professional and after few discussions to understands our needs he guided us to the car that was fit with our budget, the hole experience from A to Z was smooth . I mentioned  to my friends his name when they go to Mission Mitsubishi.    ",5.0
52,"October 12, 2013","mission Mitsubishi  is the best dealer if you think to buy a car, every thing from a to z was perfect, my sales azam was so helpful and nice, the managers their are so efficient and kind, this is my second car i bought from this great dealer. its my favorite place to buy my car",5.0
53,"October 11, 2013","Tahseen Abulihieh was honest from the beginning. The sales managers were honest, friendly and did not try to cheat us by low balling trade in value. They listened to us and did everything they could to give us everything we asked for.  ",5.0
54,"October 10, 2013","great dealer with the best customer care, my salesman was great, finance was so nice and efficient, service always great, i recommend this dealer for all my friends",5.0
55,"September 26, 2013","You will not find integrity at Mission.  We did not receive a vehicle we payed for for nearly a month, then the sales managers (louis) lied to placate us and did not keep their word.  Typical lying cheating sales people.  Its unfortunate.",2.0
56,"March 01, 2013","i called about my sons car that had an intermittent starting problem & was told it  sounded like a  fuel problem, so we had his car towed there.
when i spoke to them a few days later, i was told the car had 2 dead cylinders, may need a new engine and a new computer. i was told by another mechanic that it did NOT have 2 dead cylinders & told them i should not pay for the diagnostic since they could not tell me why it had the intermittent start . We had it towed to an honest shop for a second opinion & was told it DID NOT have 2 dead cylinders , need a new engind or a nrew computer that it had just "" jumped time "" & needed a new timing belt. Thank goodness I didnt let Mission do the work becasue i was told it would be at least $ 1,4oo on the dead cylinders ( to get started )  & no telling what they would have tried to charge on the other. I would NEVER go to Mission Mitsubishi again & would let everyone know how they run their business. I tried to resolve this by speaking to or sending a letter to the owner, not wanting to deal with anyone at the dealership, but was refused his info when I requested it. ",1.0
57,"August 03, 2012","BEWARE OF JOE ESCAMILLA HE IS A SCAMMER!!!!!  DON'T BUY ANY CAR THERE THE ARE A BUNCH OF IDIOTS STARTING WITH THE BIGGEST, JOE ESCAMILLA!",1.0
58,"July 15, 2012","saleman was very friendly , the dealership staff was a great experience working with them,  from 1 to 10 and 10 = great i give them a 13 plus.

Oscar j & barbara Ayala",5.0
59,"June 26, 2012","They really screwed us over with our car. Apparently because we are military they think they can screw us over with money. Our car is only worth 13,000 and we are paying 17,000 for it plus interest. We took it there for an inspection, and we told them that the headlight wasn't working and they pretty much called my husband a liar and didn't even check them. When we got home, my husband checked and lone and behold it wasn't working. So we had to take our money and buy new ones. I was really disappointed in them considering they say they take their military customers seriously and with pride. They surely didn't with us.",2.6
60,"April 23, 2012","After visiting several dealerships for the past two days we came up to Mission Mitsubishi. My wife had been turned down by everyone except Mission. We were very happy that she wasn't talked down too while trying to speak to a sales rep. The service, the talking to like a human was great. Understanding were my wife and I were coming from in order to see what we could work with, they understood. It was fantastic. I'm looking forward to seeing them again if and when I'm ready to trade in my current SUV.",5.0
61,"April 13, 2012","I came into the dealership looking to trade in my 2011 Mitsubishi Lancer and to purchase a bigger vehicle for the family since we will be having another baby very soon. Terry was very helpful right off the start. He asked us what we were looking for and showed me and my wife around. My wife ended up loving the 2012 Mitsubishi Outlander the most because it had everything she was looking for and it was the look that she wanted the most. It came with a lot of extras as well that just made purchasing the vehicle even better. The kids weren't liking the vehicle much at first, but after Terry showed us many features of it, the kids fell in love with the vehicle as well. We weren't sure how the prices were going to be, but after speaking with Terry about what range we were hoping for, he was able to help us stay below the budget that we were expecting. I would rate the overall experience as excellent. This is the second time I have been to the Mission Mitsubishi dealership in San Antonio and both times I have come into the dealership with something in mind and come out same day with what I was looking for. I will recommend it to friends that are in search of a vehicle.",5.0
62,"April 07, 2012","the worst experience in car buying in the last 25 years. These people at this dealership try to swindle you out of money you don't have. Mission will underappraise your tradein to make you pay a larger down payment. These people are very unprofessional in handling car loans. They constantly lie thru their teeth, and then make you look like the bad guy. On a scale of 1 to 10 with 1 being the worst, i wiould rate this dealership and staff a 0. i will never go there again. Instead i reccomend Gillman Mitsubishi. Very dissatisfied.",1.6
63,"February 19, 2012",absolutely fabulous listened to our horror story about Gillman promised my wife that would not happen and then followed through they had the same spyder she was looking for only in a different color and when they shook her hand on the deal 2 hours later she was driving her Birthday present home. A pleasure to deal with honest people with great integrity,5.0
64,"September 27, 2011",great professional serve.  lef gillman to come to Mission soley because of Louis Gonzalez service and professionalism. Will come back.  It is a pleasure to enter an establishment and immediatley get acknowledgeed and backed up with honest straight answers and great timely service.  Five star rating.,5.0
65,"September 13, 2011","Tom Villa-
 I have purchased other new vehicles from different dealerships in different cities and different states. I live in Austin, Texas and am not afraid to do business with a place that has excellent prices to go with outstanding customer service. These were the two reasons why I chose to purchase my new car from Mission Mitsubishi over places in Austin, Dallas, Houston, and Killeen. It is a great place with a comfortable atmosphere, and everybody there had good attitudes. Internet Manager Tom Villa was helpful and kept communication with me during this process. He was able to find the vehicle I wanted with the options included and at a competitive price. He did a great job representing Mission Mitsubishi and is the reason why I chose to make a transaction here.  

Overall experience was great. I would recommend this dealership to my friends, family, and anybody that reads this. Thanks Tom Villa!
",5.0
66,"September 12, 2011","Tom Villa was a very helpful and professional sales person,we were not pressured into purchasing a vehicle that we were not interested in; He is a very knowledgeable of his product(s). It really was nice to have someone like him to handle our business.",5.0
67,"September 08, 2011","I have purchased 3 vehicles from this dealer and from the same sales person(Tom Villa), all 3 times got the vehicle I wanted and recieved great service.",5.0
68,"September 08, 2011","Louis Gonzales was especially helpful, first putting me with a salesman, then explaining the features of my new Endeavor. When I returned the next week because I did not understand the workings of the Navigation System, he clearly instructed me on how to use it. Whenever I asked a question, I was always referred to Louis Gonzales as the technical expert. The final paperwork with the finance man also went smoothly and quickly.",5.0
69,"August 24, 2011","Actually we were just looking, but Aaron Sanchez came and convinced us that we could get a really good deal on a new Mitsubishi Lancer GTS.  The price was a little more than I expected to pay but finally agreed on a 60 month payment scheme.  We needed to leave or a little while on some business and he said ""Take the car.""  My wife said, no because we may not come to a deal.  ""He said no, everything is fine, just come back and sign the papers.""  My wife said, ""but the numbers are not going to change.""  Sanchez said, No.  Everything will be the same.  We went home and came back with the kids.

When we got back...well, we got stuck with the notorious Joe Gonzales.  He had me sign all these papers and then we got to the papers with the payment schedule...it was not 60 months...it was 75 months and it wasn't the payment we agreed to it was more.  The auto wound up costing thousands more than the agreed upon price...and not only that...Gonzales nearly through us out of his office when we said we're not going to make the deal. Very, very bad attitude that Gonzales..These people really thought I wouldn't read what they had done and would just take the increase.  Somebody ought to put these guys out of business because they are big liars and crooks.  Buyer Beware don't go into do business with these guys unless you want to pay more for a car that what they told you.

Warning!!!  Warning!!!  Danger!!!  Danger!!!!  Cut-throat Joe Gonzales makes the deal more costly than you thought...Better take my advice and think twice.",1.0
70,"August 20, 2011","THERE IS TOO ""MANY"" WORDS THAT CANNOT DESCRIBE MY SALE EXPERIENCE. To keep this short, OUTSTANDING!! Call Tom on Wendesday evening, talk with him a couple of time on Thursday. Thursday evening, the Rice family was leaving the dealership in our 2011 Outlander Sports. All within one hour of arriving at the dealership. 

There is ""only"" one thing that separate a ""A1"" salesperson from all the rest, and that is,""put other individuals before your own need"". Speaking from a ex Business Development Manager at Tom Benson Chevolet and working with Salesman's to Finance Managers. Tom could have easily told me to come in on Friday, but instead, he ask me one question. What time do you want to meet on Thursday? Thursday, was his day off. That right there tells you a lot about a saleperson. I will be back and I will tell everyone that I run into about my sale experience at Mission Mitsubishi.

Thank you Tom from the Rice Family (Jannet, Britney and Me-William).",5.0
