,Date,Reviews,Ratings
0,"November 24, 2018","Talk about lack of competence..Pathetic communication skills from the pre-owned department.   With all due respect, foundational English should be the basic table stakes.",1.0
1,"June 30, 2018","Abraham,Luis,and Q were so awesome. They worked great together to get me in a Mirage which I love! I would recommend this place to anyone.",5.0
2,"June 16, 2018","My  sales  person  was,   JAMES    IRIZARRY,     he   was  great  ,,,  no  pressure  , very  frendly   ,,  very  helpful ,,,,   followed  up after   sale  ......   Got  us  great  financing  .......HIGHLY  RECOMAND   JAMES IRIZARRY   ......   Steve  and  Janice     Dobbins   ",5.0
3,"June 05, 2018",When I sent in they knew my credit rating sucked. Tried qualify me for 2018 but instead having to get a 2012 fiat. Before I drove off told Ramsey make sure oil was changed everything was done. Within 2 weeks oil light came on. 5 weeks a.c. went out and they wouldn't fix no cost even though I haven't made my 2nd payment. Mgr was extremely rude on phone. Steve never returned my call and now I'm having check engine light come on and off. I was also told my first oil change would.be free. My car isn't the problem it's the service dept that is. And when your woman buying vehicle by yourself dont. I put 3;500 was also told I can upgrade in 6 months..,3.4
4,"April 30, 2018","Before I go into detail about my nightmare... I need to say that I absolutely LOVED working with Mustafa and Corey from the preowned car lot of Mission Mitsubishi. They definitely helped me and my spouse out with this whole thing. 

My spouse and I were qualified for an auto loan through Capital One but they only allowed up to go to certain dealerships with somewhat of a limit on what we could purchase. Since I just moved to Texas I definitely needed a reliable/safe car to get around... we found a 2012 VW beetle that I instantly fell in love with. We decided that was the car I wanted. Once we got to Mission Mitsubishi we were approached by a very kind and charismatic salesman. We met him over at the used side to test drive and little did we know... this is where the nightmare would start. 

We sat down in a little cubicle to crunch numbers and after almost an hour of waiting we had a paper in front of us with a list about things that were wrong with the car... or so we thought. We told them that we wanted to see the history of the car and next thing you know another salesman comes into with our original to shake our hands. We told them we wouldn’t shake their hand yet because we aren’t going to buy a car that is messed up. There was a small misunderstanding about the list... at the top of it the title was cut off. Apparently it was a list of common issues with used cars that (according to the second salesman) could NOT be sold so it wasn’t anything wrong with the car. We saw the history — it was spotless. That put our minds at ease. Back to the numbers we go! My spouse was feeling ill at this time (low blood sugar) and thankfully they had a vending machine with soda. We were sent to wait for finance for another hour. 

Finally the car was purchased and they were going to clean it up and fill up the tank for us. This took 2 almost 3 freaking hours. We didn’t know why. We were getting annoyed and while we waited we had the salesman try to sell us another car for my spouses Jeep. She liked the outlander so we figured you know what... why not? It’s a new car it can’t be bad and the credit score bump of “paying off” the Jeep would be nice.  While we were test driving the outlander we each had 5 hits against our credit scores. All from different places. Only ONE was Capital One. Which is where we said we are getting the loan through. We got back and we told them that we would like to talk numbers BEFORE any credit scores were checked again because the 4 extra hits weren’t appreciated. We couldn’t get the outlander. No big deal. We were basically pushed into a Mirage (which was fine my spouse drives a lot to work and back) and when we got back we said the same thing. No credit pulls. Just throwing out numbers as much as we could. By the time the salesman came back we had 12 credit pull notifications. TWELVE. Let that sink in... trading in for the 30 point bump was basically just covering the pulls. My spouses blood sugar started to drop again... we told them we needed the keys to BOTH vehicles to go because it was getting bad. 30 minutes later, “I did some more crunching!” And NO KEYS. Finally we stood up and went to walk and get our keys. She could have fainted in the dealership after we told them multiple times that we needed to go NOW.

When we got home we were trying to show our family the car and whenever my brother in law went to start it up... it didn’t start after a 30 minute drive. So we went to open the hood and the hood latch was broken. We called the dealership right away. We get our call returned the next morning, “We meant to tell you that it needed to be sent to VW to replace the latch! Bring it in sometime!” My thought? Okay... so you sent us home in a car where we had ZERO access to the brain and you magically forgot? Is this why you kept us there for 7 hours? To make sure the car started when we went to drive off the lot? 

The next morning the car started so we thought maybe that was a hiccup. Wishful thinking on our part. We parked after a 15 minute drive - DIDNT START AGAIN. We were stuck in the hot sun for an hour waiting for the car to start again so we could take it back. While we were waiting for it to start we noticed that there were screws in the cup holder... which made us look around. The splash guard under the Beetle was TAKEN OFF. We were done at this point. Know why? Because that’s how you FIX the hood latch. They broke it after we purchased the car and they decided to not tell us. 

We get to the dealership and the Beetle was taken away to VW. One week passed. We got our plates! No car. Before we hit 14 days... the Beetle was ready. We asked if it was fixed... actually fixed this time. “Absolutely! No problems. I promise.” Guess what happened the next day? It wouldn’t start. We took it back and this time we demanded to speak to managers. We wanted this fixed... NOW. At first the sales manager (Steven) came to talk to us and asked if we thought about a new car. My wife and I both LAUGHED asking how can we afford another new car when we just got a loan out for $13,000. He walked away. This is when we met Mustafa. He was AMAZING. He put us in a newer loaner that he covered himself. 4 days later our car was ready. It worked! Everything was fixed and it didn’t come out of our pocket. After 3 days of the car starting and running flawlessly we were very pleased... that is until the car died as I was trying to get onto I-35 and the truck behind me almost hit me. Mustafa and Corey met us that night to get us in a loaner. Mustafa told us to come back on Monday and we would get everything fixed (meaning me in a different car.) 

We brought breakfast for Mustafa and ourselves Monday morning... we were getting everything situated. I fell in love with a 2017 Lancer... paperwork started going through. I was so excited that this whole thing was going to be far behind us. Several of the salesmen on the used/preowned side of Mission said that they told our previous salesman to NOT... I repeat.. NOT sell us the Beetle when he came in to get the keys for the test drive. What the actual xxxx? We spent the morning laughing and having a blast with Corey... eventually we found out that we couldn’t get the Lancer because we were using the Beetle as a trade in and it HAD to be on a new car. No big deal... Corey let us look at Mirages. I was really bummed because the color choice was poor at the time. Red, silver, or blue... eventually Corey asked my favorite color. Next thing you know we are test driving a Plum/wine red (depending on the lighting) Mirage and I was in love. We told Corey that we wanted it and we left that evening in the car. 

When we got home we were getting the paperwork ready to be put up and we noticed there was a paper saying we had etched windows... we didn’t see that anywhere on the car yet we paid $500 for it. My wife called Corey that morning and he told us to bring it in whenever we wanted to have it done. We agreed to go in once the plates came in... however that dragged out forever and we finally caved this Wednesday to have it done. We walked in and had Corey paged, talked with a few familiar faces, and went to the service waiting area. Painless. 15-20 minutes after Corey brings us the keys and the tank was topped off. On our way we go! We stopped for food and I noticed how high up the etching was... concerned I looked at all the windows. Crooked, high up, and some of the numbers weren’t complete. That night I took pictures and contacted my insurance company. They told me that the etching was in fact too high. USAA told me this. It wasn’t a small insurance company. Today (Saturday the 28th) we went to pick up our plates and asked to speak to a manager. A service advisor put our plates on and we asked him where the location of the etching should be. He told us the lower corner. My wife uncovered the etching and he even said, “That could have been a lot lower and not crooked.” He continued to say that he has heard several complaints and concerns just like ours. 

We had yet another manager come out and speak to us because at this point we were wanting something done about it. We explained to him. He said it looked fine and that it was a personal preference... when I mentioned the insurance company he told us that there isn’t a reason why they should have said that so again is fine. I’m currently reaching out to USAA again because of this and the fact I feel like this manager was lying to us since he said he has NEVER had a complaint about etchings. Too bad a service advisor said otherwise. We asked to speak to someone else. That’s when we met Zach. We told him the WHOLE story like I’ve mentioned in this review and he offered us 3 years of free maintenance and if we weren’t pleased (I expressed my trust issues with this place after being lied to repeatedly and their service department screwing up the Beetle even more) he would personally pay out of pocket to give us the $500 back. We got it in writing and it’s currently stapled to the paper we got with the etching cost in my car. 

Overall? I will never go back to the dealership unless if I know that I can directly work with and ONLY with Mustafa or Corey. I will not recommend this dealership or service department to anyone regardless of the free maintenance on my Mirage. The only things I can truly say is that I’m SO glad this whole thing is behind us and that I hope like xxxx the service I get when I go in for maintenance doesn’t match other reviews on Yelp! when everyone talks about how rude the people were towards them. ",2.0
5,"March 16, 2018",I had the most knowledgeable sales rep Wally Gharib. He made the car buying process extremely pleasant. He was extremely knowledgeable and efficient and everything went seamless from beginning to end. Thank you Wally for your great service! Highly recommend him if you are in the market for a new car.,5.0
6,"January 26, 2018","So I just bought my 2015 Honda Accord from this dealership! Loved my sales guy James he was awesome ! But absolutely hated his manager ! Steve and the finance guy ! They are so pushy! And change there prices on you after 1 day !  And then they will text you every day with stupid quotes that they get from the internet to try and make you feel like they know you but they don’t since you only meet them for like 30 mins! If you don’t have to go here, don’t ! The only reason I went here was because the price of the car was a good deal but the whole experience sucked !! ",1.0
7,"December 15, 2017",The salesman was informed ahead of time of my credit score and the amount I had to put down. Originally was told I was approved but after picking up my car realized I was missing a key. Went back to get the key and was tricked into giving them the one key I had and told I was no longer approved. Next day they said they approved me under my sister and to pick up the car. 2 weeks later I received two different stories about not being approved again but Tyson promised he'd keep me in the car i just had to come in the owner promised we will work it out I mean I'd had the car almost a month now! Well the car got impounded and I called to tell them I'd bring it in after I picked it up. He said don't worry he could pick it up and it would be no problem. He even promised if he couldn't keep me in the car he'd return my down payment! Well when I returned to the dealership both Tyson and the owner are no where to be found but they sent me to the sales manager Louis and things got worse from there.  Louis made sure I knew he didn't like me or care to even try to help me and refused to give me my items from the car saying he would never have helped me any way but he couldn't control Tyson or the owner. After some rude nonchalant remarks from Louis I decided to take my leave and informed Louis that this was customer mistreatment and that I would post a review in all major sights if it wasn't corrected. This in turn made Louis say he would press criminal trespassing on me and I was never allowed there again (not that I wanted to be there but who throws a tantrum because of a bad review) whelp 2 days later Tyson finally appeared and so did my personal items but not only did he refuse to work out things with the car but kept my down payment and said since I said I would make a review he didn't care and refused to do anything. I also spoke with the tow lot who informed me the price to remove the care was 215 yet the dealership claims it was 498. All I know is i gave them all I had trusting the contracts we were signing and the words given to me. NEVER AGAIN. 500 down payment 200 insurance 50 on car accessories not to mention the full tank of gas I had just gotten,1.6
8,"December 15, 2017","They are so helpful here. If it is possible to get you into a vehicle they will absolutely do it. They went above and beyond for me. Ali was the one to find me a great car at a price I can afford. Everything that I asked for he was able to give me even when I didn't think it was possible. Go see him! They finance manager was also very helpful and the Delivery Specialist Dolores is very friendly and knowledgeable. They have consistently checked on me, making sure that my financing was approved and that I am happy with my car. ",4.8
9,"November 11, 2017",Great service really nice james helped me out soo much and he was able to get me into the vehicle i chose i was soo happy with how he handle my business very nice and i totallyy recommend james irizarry thank u mission mitsubishi,5.0
10,"November 08, 2017","Ramsey went out of his way to help me. He was very patient and friendly. I was turned down by other shops so I braced myself for another rejection. Oddly enough, he took the time to give me a chance. I never thought I would get a new car but he performed a miracle that day! 😁👍👍 I wanted a different car but he told me I could upgrade after six months. Overall, it is a great starter program to establish good credit history. Highly recommended to everyone, regardless of your history.",4.8
11,"July 15, 2017",They work greatly if you're in the military and the customer service is friendly. The mission team try's their best to get you in the car that fits you best financially!!,5.0
12,"July 04, 2017"," My experience was extremely uncomfortable.  I spoke to four different people and sat in an office for over an hour. I felt they were not letting me leave. Even after getting an approval, although I said in the beginning I was just looking at my options. I had to decline the offer because at that point I was so uncomfortable I didn't even want to be in business with them. ",1.2
13,"April 21, 2017","Steven Rodriguez made my car purchase extremely easy, I was undecided and he took the time to show me multiple vehicles and explain the differences between them, I would highly recommend seeing him for your next vehicle purchase!",4.8
14,"April 18, 2017",Ruben rodriguez not only advise me about the maintenance of my vehicles but goes beyond and suggested how can i save on my bill always very helpful and ready to take care my needs i had bought 3 cars there and i always look for his advise is rare to found somebody to trust in this business.,4.6
15,"April 06, 2017",I had three different reps. The first one quit randomly the other two never followed up with me they treated me like wasn't important. Than when I the rep out on it the agent had a attitude. I just ended tell them with draw my app. I should be treated with respect and the same way as any other client. ,1.6
16,"April 03, 2017","They added $4500 to the price they showed me on the paper the $4,500 junker bonus cash is a scam don't fall for it.",1.8
17,"March 27, 2017","I usually hate dealing with big dealership sales people, but when i got here it was instant customer service. I dealt with a extremely nice gentleman named Ramsi,and the minute we got there he was very interested in our needs and wants before even showing us a vehicle to ensure we got what we were looking for, he asked ahead of time problems that might come up with credit or credit history and then went above and beyond doing everything he could on his end to make sure we left with the vehicle we fell in love with and we did! Not to mention the manager came in to introduce himself to make sure everything was going good and to see if we needed water or coffee or anything! All around absolutely best experience at a car dealership! Process was fast n easy and excellent customer service! My grandkids even enjoyed the playroom and being able to not have to miss their favorite shows because we were there. I definitely recommend anyone looking for a vehicle go see ramsey at mission Mitsubishi!",5.0
18,"March 25, 2017","Today I had the best experience with the car salesman Azzam. Words cannot explain the joy I feel . I went this morning to get my car serviced not knowing that I would be coming out with a new car. Azzam and Henry went above and beyond for me . They are top notch in my book.Thank you Thank you 
 Sincerely Rhonda Roberts",5.0
19,"March 05, 2017",I bought a car from this dealer and I tried to tell the sales man that I did NOT want a little car. He told me that was all I could be approved for because of my credit. I knew my credit wasn't too hot because I was rebuilding it. He assured me that as long as I kept the car for 6 'moths and paid the payments on time that he could get me into the car I wanted. Which I knew didn't sound right because I would be upside down in the car at that time. But he gave me his word and promised me he would be able to get me out of the car. Well here I am 6 months later all payments have been ontime and I also always pay more than the actual payment needless to say I'm now stuck in this lil sardine can for a long time!!,1.0
20,"February 22, 2017","Rubin Rodriguez,who works as a service adviser gave outstanding service to me when i brought my auto in to be serviced.Rubin took time to take care of all my questions,and was very professional and gave his all when answering my questions..I hope the owners know what a great asset they have in Ruben.

Thank you Ruben

George Malkemus 2-22-17",5.0
21,"January 13, 2017","Helped my grandson buy his first new car. Already approved by our current credit union.  They would not give the $4500 discount if we did not finance thru them.  I asked if they used ALLY, they said yes.  I told them to hit my credit once with Ally.  They hit it twice with another company also, causing my credit rating to go down. Bought car on Dec.2, still don't have license plates on Jan 15. Got payments within our budget but their methods are very high pressure & shady.  Will never do business with them again.",1.5
22,"January 08, 2017","Have been surfing the web looking for my dream car for months. Almost new, low mileage, options, color, and price. A 2013 BMW M3 Competition in Mineral White. They had it. I called and spoke with Joe Centeno and we talked by phone several times  I finally jumped on a plane from El Paso.. They picked me up from the airport in San Antonio. Everything was ready when I got there. It was perfect, until the finance guy got really pushy about getting an extended warranty, when I clearly said I don't need or want it.  Other than that, they did everything promised. I highly recommend this dealership. I am extremely happy.   A+++",5.0
23,"October 30, 2016","Approved my sister congratulated by manager, when niece takes three buses to get vehicle they still congratulate and go over vehicle and hand over keys then they say the deal did not happened.. really!! Not good business at all. Either got the vehicle or you don't, not three days later.",1.2
24,"October 26, 2016","I'm not going to leave a long paragraph. Overall my visit went well and then terrible. I owe 2500 on my vehicle, they ""offer"" $4500 to u, however when it came to me, they claimed their bank still wanted a down payment of $1000. Then their finance guy with his attitude told me in a snarky manner "" i need you to focus on what i am saying"" ummm..NO SIR. I told you what my situation was, so offering me EXACTLY what I told you I wasn't going to do is going to help me.

I ended up going to Honda on I-10. I got a car with all the perks and amazing payments. ",1.8
25,"September 25, 2016","I have been buying new cars for almost fifty years. I went there to purchase another new car. These people use every high-pressure sales technique that I have ever seen. They take your keys to your trade in and won't give them back to you so that you can't leave. They ""double team"" you by bringing in the ""manager"" so that both he and the salesperson can pressure you. to buy the car. In the middle of the paper signing process they surprise you with a new charge that they never mentioned to you earlier. They promise you things like ""one year free service,"" but it is nowhere in the final contract so that is is your word against theirs. It's a typical fast-talking, sleazy car dealership. I feel that I was railroaded into buying a car because they just outlasted me. Don't go there alone unless you can be as pushy and obnoxious as they are.",1.2
26,"September 20, 2016","I just bought my outlander yesterday...And did not almost buy yhe car because of the finace departmet...They were horrible trying to sell me the maintneca package. And also the 4500 a ploy to get tou in since this is the first dealership..adds to the MSRP with an addtional 3,000 ( fabric scotch guard, paint protection, vin  engraving etc....
My sales person Bea and Stevon were okay ..While I am writng this I feel like taking the outlander back  because of the service I got.. I just do not trust them!!! And will be making a complaint to corporate.",2.0
27,"June 22, 2016","I did a trade in to get a mitsubishi outlander. Every question we had, got answered. Aaron, new what he was doing. Im truly blessed. I really recommend doing business with mission mitsubishi.",5.0
28,"June 14, 2016","Sales man Steve Rodregeiz was very nice. As far as two finance guys first one seemed to get upset because would not settle for higher payments than wanted to pay. Very pushy to the extent would not take no for an answer. When things was going his way got rude. Told him he was rude and he got outraged being called on it. Would not recommend anyone deal with such finance people at this dealership. Pushy, rude, and when told start screaming and throwing a fit, totally crazy experience. Will never deal with going back again.  ",1.0
29,"March 01, 2016",With this review I won't buy there. Shady tactics are scary. I'm glad I read the reviews. I'll shop around to ser whom won't LIE to me,1.8
30,"January 14, 2016","We bought the lancer right after thanksgiving, I fell in love with the car. The salesman was awesome at the time of the sale, and Dina was the best delivery person ever. The trouble started when we picked the car up. When we got home we noticed two small scratches above where the plate was attached. This was not there when we bought the car, and could only have been done by the service department when they attached the plate. I was heartbroken, this is my first new car and they gouged it. My husband contacted our salesman Roland Duran by email, he said they would fix it. I didn't want to take the car back, worried what else they may do. My husband never heard back from Roland. We have emailed about five times, no reply. I have two free oil changes, I'm not taking my car near them. This is the fifth Mitsubishi my husband has bought, first from this dealer. I will not recommend them, nor go back. As of today we have not received the plates for the car, and my husband says he has to go get them. He does not want to go to the dealer as he is very upset with them. I still love my lancer, but not happy with mission Mitsubishi.",3.2
31,"November 25, 2015","I bought a 2015 Mirage DE and it is superb! I really commend Ali Tahseen, sales professional for providing as a good deal. He is easy to talk to. He assisted us and answered our concerns nicely. I commend him for assisting us professionally. Warm and easy to talk to. He will not push you, he will answer your questions and he will let you decide on what you want to buy. Keep it up!",5.0
