,Date,Reviews,Ratings
0,"June 11, 2020","Negotiated and paid exactly what was quoted, pay attention to the details and you will be completely satisfied . Great inventory and plenty to choose from",5.0
1,"May 16, 2020","We came to this dealership on Saturday May 9.  The receptionist at the front was very friendly and explained that it might take a little bit to see a sales rep.  Not a problem.  We didn't make an appointment and were interested in test driving a vehicle if possible.  We eventually get Drey Pryor assigned to us.  He was belligerent and rude right out of the gate.  It was very apparent he wanted a guaranteed sale before wasting his time on us.  I'll spare you the details, but needless to say, we left and didn't come back.  We closed on a vehicle a week later at Don Davis Nissan.",1.0
2,"May 10, 2020","These negatives reviews are very real. Nasty bait and switch tactic, they will say anything to get you through the door. 
Expect to pay at least 4-$5000 in additional charges On top of the car price and taxe and licensing fees,  like cleaning, recondition fee and other bs. Plenty of dealerships in the sea. Stay away from this place ",1.0
3,"May 09, 2020","We went in on 5/9/2020 to look at Nissan Rogue Sports, which were being advertised at $17,700.  I'm not naive enough to think that $17,700 is the drive-away price, but the salesman we dealt with, Drey Pryor (sp?), told us that it was going to cost $26,000.  Are you kidding??

So they pulled the classic ""bait and switch"" which, by the way, is an actionable Deceptive Trade Practice in Texas.  But whatever, no hurt feelings.  I can brush off slimy sales practices and just head somewhere else without a care in the world.

What I CANNOT abide (and the real reason for my post) is how incredibly rude Drey was toward us.  He was aggressive, patronizing, and dismissive of any questions we asked.  He spent about 5 minutes talking to us, which was mostly him lecturing us about why we were naive to think the car would actually cost anything CLOSE to the advertised price.  He lectured us about waxing, ""scotch guard"" crap, refurbishing costs, etc.  

I repeatedly asked for a statement showing the drive-away price and the charges that would go into the price but he wouldn't accommodate us.

When we said we couldn't pay what he was demanding, he stormed off without even saying goodbye.  As soon as we finished saying the price was too high, he stood up and walked off, saying ""take care"" when his back was already to us.

Nissan of Rockwall: how do you employ someone like this???  I've never encountered someone so rude at a retail store before.  Shady and dishonest?  Sure.  But at the very least I expect common courtesy and civility while I'm being screwed.

DO NOT GO TO THIS DEALERSHIP.",1.0
4,"April 19, 2020","I brought me car in for warranty repair. I wasn't super happy with my car and decided to see if I could get in to something better.

Test drove a Rogue Spot and decided to see if we could make a deal. Since I was upside down and my car was in for service they weren't able to help me much on the trade. We were having trouble coming to a deal that would work and right before I left I ask if there were any other options. That is when the sales manager suggested and the sales person agreed I could do a voluntarily repossess on my current car.

I had never heard of this and they explained that it would be a default on my current loan and inform the lender I so not intend to continue payments.  Then I could just sign a new load on the new car without the trade. I asked about credit impact. They said it would be small but I would take a hit and I'd start rebuilding credit and be fine in a couple months. I had reservations but went a head. While I was waiting for the finance person I did some quick research. Turns out a voluntary repossession is only marginally better then just stopping parents on the loan. I could have been looking at a 300 point negative impact to my credit score. For the next 7 years I would have had a really hard time securing additional credit and I would probably never get a decent apr on a car loan again. Further it might have impacted my credit card spending limits. It was a very bad idea. When the finance guy came to get me I called off the deal just in the nick of time.

There is a clear training opportunity here. When I asked if there were any other options I should have been told ""I'm sorry sir I don't think we can make it work. Please keep us in mind if your financial situation changes. Thanks for coming in today and have a nice weekend"". Instead I was almost duped into a bad financial decision just so they could move a vehicle. I get its their job to sell cars, but knowing what I know now this is bad advice to be giving customers making large purchases like a car.

I hope this behavior is confined to the two sales people that I worked with and not the overall policy of the dealership. However I don't think I'll be doing business with Rockwall Nissan again.

Brightside I was able to go to another dealership on the other side of town where we were able to come to a situation that was beneficial for both me and them. I am now in a better loan with a better car that fits my needs. it's too Bad Rockwall lost out on that opportunity. I will not be advising anyone to work with them in the future.",1.0
5,"April 16, 2020","Chris Hornsby was knowledgeable, helpful, and professional. Showed us several vehicles. Communicated well throughout the process. Both he and Nick Nicholson in finance delivered for us a painless process.  Glad we went to Nissan of Rockwall.",5.0
6,"March 24, 2020","Terrible experience with the service department here and I will never return - for service or any vehicle purchases. I made an appointment for a Sat morning explaining that my vehicle needed to be diagnosed (it was making a weird noise, but was drivable). I was told that a tech might not be able to investigate until Monday. Fine. 1 week and $100 in rental car charges later, a tech still had not looked at the vehicle. Yet, each day, I was told they were “pretty sure they can get to it tomorrow”. By Thurs, the service dept stopped returning my calls or giving any updates. When I finally showed up asking for my keys, I was told the rep handling my vehicle didn’t work there anymore. I am sympathetic to a labor shortage, but the least they could have done was keep me updated And give realistic expectations. I ended up taking the vehicle to Christian Brothers. They were, honest, communicative and had my vehicle repaired within 24 hours. I will never use this service department at Nissan of Rockwall  again.
",1.0
7,"January 12, 2020",We purchased a Nissan Rogue in September and were assured the plated would be mailed. Now after not mailing and no contact our kid has been pulled over twice for expired plates. Called and internet manager told my wife it was up to her. She thought of course it is up to the customer to make sure Nissan of Rockwall does their job. She won’t shop here any more. They assured her they would be overnighted but failed again. I guess we will drive an hour an do the work for them again.,1.0
8,"September 30, 2019","Monday September 30, 2019
Let me start by saying how disappointed I am in Rockwall Nissan and how much I hate being lied to.  I called on Wednesday September 25, 2019 and spoke with a receptionist who connected me with the parts department.  I spoke with what I believe to be the manager of that department.  I advised him that I needed to find out how to update the navigation system on my 2015 Altima and was very unfamiliar with any of the systems since I drive a Ford F150.  This car was purchased for my daughter.  The manager said it was an easy process and for me to come by and he would update it for me at no cost.  So, on Monday September 30, 2019 I drove all the way from Forney Texas to Rockwall Nissan just to meet with this person.  Upon my arrival, “NO ONE” at the parts counter wanted to help me.  I stood there for 10+ minutes before I finally spoke up and asked one of the ladies for help and told them about my situation.  After another 10 minutes a bearded male came up to the counter and said it wasn’t him that I spoke with but the manager and he would ask him what I needed to do.  Within a few minutes the bearded male came back and said that the parts manager was not available to help and that I would need to go over to the service department.  Ok, so I was lied to by the parts manager, (evidentially he can’t help me after all or just doesn’t want to).  I then went to the service department and once again, had to stand around for another 10 minutes before a white male finally got tired of talking to another employee about the weather and current working conditions and he decided to see what I wanted, as if I were bothering him in some way.  When I informed him of why I was there, all he would tell me was that I needed to call this number and order a new SD card and would not help me any other way.
I say this to the owner(s) of Rockwall Nissan, I would start by conducting an investigation into the conduct of my employees and how they handle customer service.  This is the worst I have seen since the Bledsoe Dodge days.  If you have video and audio, please review it.  This started when I called and was told by the parts manager to come by and he would update it the map on the navigation system.  That was a lie!  You have to purchase an updated SD card from Nissan and have it shipped to your house at a cost of $149.00.  
I don’t appreciate being lied to or mislead in anyway and the employees did just that.  Let me go ahead and tell you that I will never come back to Rockwall Nissan for any reason.  You could have made a friend and customer by welcoming me when I first stepped through the door but instead, I was treated like a leper.   The employees lack training and accountable supervision.  Take a page from Christian Brothers Automotive.  Treat every customer the way you would want your mother or grandfather to be treated, “like family”, not like a leper.
Boyd Brock
",1.0
9,"May 31, 2019","I live in Gilbert, Arizona but just bought a 2019 Frontier Pro-4X from this dealership because I actually got a much better equipped truck for less money than any dealership in the Phoenix area could offer. I would especially like to note 3 great employees who all went over and above to complete this sale. Jett Reed (manager), Mike Passaro (sales), and (finance). The truck was transported to my home and I couldn't be happier from my first phone call to my last!",5.0
10,"May 23, 2019","I bought a 2018 Nissan Rogue with 2800 miles, they labeled it as new. I took it back the next day because it has some scratches, paint chips and swirls marks. They gave me a ""We owe you"" form, promising to take care of all the details. They had the car for a week, I went to pick it up today and the car looked worst than before. I asked to speak with the general manager, he was rude and disrespectful He asked the sale person to open the door, that they were done with me. He told me and my wife to take the car, leave and sue him. they treated us like trash. I asked to speak to the general manager and he pointed to the door and said leave. His name was Greg Amos (Sales manager).  They won't take responsibility for the car or the terrible repairs.",1.0
11,"March 13, 2019","Spent a total of 8 hours for car color I didn’t want,I figure if I’m making payments, I should be able to choose my color.
I was told the color I wanted wasnt in a 500 mile radius.
I found my color at Courtesy Nissan ,but it was too late.
I took the word of a salesman,big mistake.",2.0
12,"February 28, 2019","1. The advertised price is not the price. They publish the price of the vehicles on the internet but fail to disclose their 're-conditioning' fee of $1,495. The reconditioning is non-existent. I purchased a 'reconditioned' vehicle and later discovered it had a fog lamp bulb out, the dome light was out, and the car needed new brakes pads all the way around. A door tensioner was also broken / unattached.

2. Get everything in writing. I was promised new floor mats for my vehicle during the negotiating process. I specifically asked for OEM floor mats and not some xxx floor mats from Wal Mart / Auto Zone. Sales person Sarah Beuchert , who also goes by Olivia Brock, said 'no problem I have a contact that can get those at cost and will deliver to you.' Of course, following the sale I was told by both her and Sales Mgr Doug to go buy my own.

3. Plates - bought my car over a month ago and still no plates.

It does appear the new ownership is addressing some of the prior fraudulent business practices, expediting plates, etc.  and hopefully they have cleaned house of the unscrupulous sales people.

BUYER BEWARE!",1.2
13,"February 20, 2019","I schedule for a oil change and was told it should only take an hour. I waited THREE HOURS!!! I wouldn't have been so upset if I didnt have to return back to work but they made me late. ALSO every time I've had my oil changed I've always got a free car wash and vacuum but this time they didnt even bother to do it. very disappointed. They've always had great customer service, just upset I waited so long and didnt get a car wash.",4.5
14,"February 01, 2019","We have been through a High Pressure Sales before and vowed to never return to that Dealership so we were very glad to find Fenton of Rockwall. Our Sales agent, Kevin St. Louis was very helpful but did not pressure us in any way. He was respectful and helpful--he listened to us and treated us fairly.
Oliver also very professional and also did not pressure us in the decisions we made.  Bottom line, we are very pleased with our experience at Nissan of Rockwall!!",5.0
15,"January 31, 2019","I usually receive excellent service at Fenton Nissan.  Last Tuesday was terrible service.  Nothing was done to my vehicle, but we were there 2.5 hours.  It was very frustrating.  I was supposed to receive a call when my vehicle's needed part was received, but I haven't heard anything, and it's been over a week.  The part should have been received a week ago.  I'll give Fenton Nissan one more chance to treat me the way they used to.",1.3
16,"January 28, 2019",Everything went great. Vincent was very helpful and went above and beyond( he waited for me after the Service Department closed on Saturday) to make sure I got my truck back quickly.  Thankks for the great service.,5.0
17,"January 22, 2019","A stated tenet of Fenton Nissan Rockwall is to not waste a customers time. They don’t follow that tenet. After making an appointment for a simple oil change, apparently included with the purchase of a new vehicle, they seemed surprised that they were questioned as to why the vehicle had not been moved after two hours of waiting on a low traffic day for them. Employees are unable, or unwilling, to communicate and display an attitude of being put off at having to do their jobs. Do yourself a favor, shop elsewhere. Their demise is well earned. ",1.0
18,"January 22, 2019","Brakes making  a squealing sound & oil change. My svc rep Pat was very knowledgeable. He informed me would take a tad bit longer which I didn't mind. Found out yesterday, no longer offer military discounts ",5.0
19,"January 22, 2019",This was my first visit to Fenton Nissan. I will definitely be back. Pat was great. Kept me updated throughout the entire visit. Your service team is much more professional then other dealerships I have been too. ,5.0
20,"January 21, 2019","Okay so I really don’t like leaving poor reviews, and honestly they did everything I asked them to do. However the service here is sub par compared to the other Nissan dealerships I’ve worked with. Upon arriving I wasn’t even greeted, minus the fact I was standing right infront of two Nissan representatives. I just kind of stood there till finally someone said “someone will be right with you” I had scheduled an appt yet the wait was still going to be 2.5 hours (for an oil change and tire rotation..) I also asked them to look at a few other things (which in turn would make them more money because I know they had to be fixed) and I was told they absolutely wouldn’t have time to even look at what I was talking about. I am a loyal customer to Nissan and my last three cars of which I’ve purchased has been through Nissan. If they just paid a little more attention to their customers, this place would be a gold mine. However, due to the poor customer service and the unfortunate poor reviews, I’m afraid this might be the worst dealership I’ve ever been to. Do us rockwallians a favor a bring someone over from the Grapevine location and turn this place around!!! Now THAT is some great customer service :)",2.6
21,"January 19, 2019",I’m happy pretty much with everything. I just wish the wait wasn’t so long to get a diagnosis on some concerns I asked them to check on before I can be told if I should ask for someone to pick me up and then come back. i waited 5 hours and the same thing happened last time. Both times I wasn’t able to go to work. ,5.0
22,"January 18, 2019","I went in for oil change and tire rotation only one car in the bay. No one to help on service drive. Device manager on the phone never looked up and said I will be right with u.  Finally an older man ask me to write my name down and address and he would get my car in. I saw my car being out in the bay and up on the oil and tire rotation   
Watched it being taken down. And finally setvucf manager came over said it was done and onnit way out. 
I waited another 45 minutes for my car. 
Zero customers. It took 2 hours 
Very slow service no interaction with customers. I have better customer service skills than they do. 
",3.2
23,"January 18, 2019","The car was serviced just fine. After an earlier visit & dispute over out dated coupons on the web site and not honoring these prices- we returned for a complimentary oil change which was very nice. Although we were supposed to get a complimentary car was and vacuum - we only got the car wash- no vacuum at all. The website needs to be monitored and updated. Either remove 2 month old coupons or honor them. Plus, give the customer service stated ",3.4
24,"January 17, 2019",Service Department Staff (2) completely focused on administrative duties.  No acknowledgement or expectations to offering assistance. Felt as if I was an inconvenience. Below expectations,1.5
25,"January 17, 2019",Went in for the first oil and filter change on my KICKS. Everybody was very friendly and the whole process from the time I got there to the time I left was 50 minutes.,5.0
26,"January 11, 2019",I ve been there for my few month old car and Spend there 50 min and puncture tire was repaired.  Good Guys. Friendly Environment. Thank you.,4.2
27,"January 09, 2019",Kevin was awesome! There was no pressure just a relaxed fun buying experience!!! The vehicles are top notch. I love my new Murano! Highly recommended.,5.0
28,"January 08, 2019","It all started out great....But as in some cases of vehicle buying things promised or stated verbally don't always end up on paper. Which is what happened in my case. Yet if you tell me something is going to be I will be expecting that. But I will give the service department praise at this point in time,they have done well in taking care each time I have been to the dealership.
The young man in finance who took real good care of me and worked a real exceptional deal with Nissan on my behalf I will always be grateful to him.",4.2
29,"January 03, 2019","Car buying is always stressful; more so when life throws you a curveball and you're not expecting to make a purchase at the time. The guys at Fenton Nissan Rockwall eased the pain. I left feeling satisfied and happy with my purchase.  Did I get a great price? Not sure, but I got a great 2018 Rogue SL Platinum.  Salesman Hayms and Alex made sure I was comfortable during the process and Oliver in accounting took all my money! :)  What's not to love! ",4.2
30,"January 02, 2019","Purchased a 2018 Nissan Titan. After the salesman and I agreed on the deal, the Finance Dept. clerk, named Elvis, was very deceptive in his explanation of why he couldn't allow to financed our own vehicle. We bought the truck anyway and with-in 30 days re-financed it with our preferred source at 3% better. Wasted a lot of time listening to his BS.
 Have been in for 2 oil changes now, the first one one took 3-1/2 Hours, and we had scheduled ahead.
  The second oil change took 2 Hours, they allow you to see the mechanics at work, thru big glass windows, Management must never see what customers see, they are so SLOW....it is incredible that it takes so long... the Mechanics spend a lot of time talking to each other and laughing , while customers wait. Had apt for 8:00 AM to get in, I left at 10:05 AM... pretty poor..also, by the way, I was the only oil change during the entire 2 hour wait. and then   they left greasy handprints on my hood..  and there was no seat protectors laid on the seats and floor mats that most other dealers use.
NO  sense in pride of work...

",2.0
31,"December 31, 2018","From making the appointment to driving home from the dealership.....the only bright spot was the shuttle. And you need the shuttle when it takes over a day to do an oil change and diagnose a check engine light - not fix the check engine light, just check it and order the part. They had my car for 30 hours and I got an oil change and 3 Tires filled with air....🤷🏻??? I really don’t have words for this except I am so sorry I can’t reverse time and buy my car from A different dealership. 

This was a service visit, not a sales visit. ",1.0
32,"December 28, 2018",I had a great buying experience from start to finish. They had the exact vehicle I wanted and worked with me to get me the best price available. ,5.0
33,"December 28, 2018","Fast Friendly service department. Professional, Experienced Service Adviser Vernon Higgins, and Service Manager were very knowledgeable and helpful. Made sure we were compfortable and satisfied while we were there. Thanks fellas,good job.",5.0
34,"December 28, 2018",Getting an oil change takes about 3 hours. At least for me it did. Is this normal? Why does it take so l-o-n-g?,3.2
35,"December 27, 2018",I was in and out very quickly.  I got the price I wanted and I am very happy.  The internet had accurate pricing regarding the vehicle I bought. ,5.0
36,"December 27, 2018","Totally unsatisfied with service experience: After spending $1100 on getting my heater and air conditioning fan replaced and a practically new 2017 pathfinder, I found a coupon for $75 off the labor cost. Since I already paid they did not honor it! We also had an unpleasant experience when we purchased a used Nissan car-It was missing a spoiler and we still haven’t received it after a year. I’m not sure if will buy you another Nissan product  again Or use Fenton service center again.
 There must be something wrong with the Nissan Pathfinder fan because apparently I was the fifth person that week that had that part replaced. I could see if it was a 2015 or below model but to spend over $1000 on parts and service is ridiculous. 
The final straw was not honoring my $75 coupon.
Instead of feeling satisfied –I left there with a bad taste in my mouth! ",1.0
37,"December 27, 2018","I purchased a new NV200 in July 2018 and I was promised an upfit conversion kit. Here we are it’s almost the end of the year and no one at this dealership has followed up with me. I tried calling and the new car sales director total ignored me along with the sales manager!! They are giving me the run around. I called Nissan’s consumer affairs and they gave me the run around. They said I have to deal directly with the dealership. I replied I would but no one there cares to resolve this issue. Just a real bad experience with a Dealership. You would think the salesman would follow up with me, again he ignored me too! I would recommend finding a car at another dealership!!",2.0
38,"December 21, 2018","Service department went above and beyond my expectations!!!  Keep it up Team!!!!!  Phillip and his team are quick, courteous, friendly, and very knowledgeable.  They truly go the extra mile.",5.0
39,"December 20, 2018","Always feel taken care of!  Very prompt, professional and courteous service!  A very nice waiting area as well!! They are always helpful and make you feel right at home. ",5.0
