,Date,Reviews,Ratings
311,"July 15, 2018","
Managers arrested on the property.
Marital affairs exercised, encouraged and supported amongst employees and customers ON SITE.
Fraternization between management and salesmen.
Shady business practices....
This place is a zoo.  Buy a car in a more suitable, professional environment.

Read our review guidelines",1.0
312,"July 14, 2018",They gave me the car that I wanted and a great price! Jett was the best I have ever dealt with! Jett went over and beyond even after I bought the car.,4.8
313,"July 13, 2018","Everyone was very helpful. Service was fast and friendly. Del at checkout and Juan Palaclos in service were excellent!!! I have been to many dealerships over the years but this one tops them all. It is very nice to do business with courteous people.  



",5.0
314,"July 13, 2018",Got a pre owned vehicle with no owners manual ask several folks about it I several departments they just kept referring me to another still have no owners manual ,3.4
315,"July 12, 2018",Chris Shelton was very professional   Good repore with us.  Very up front an easy to deal with    Easy to chat with not a salesman but a professional ,4.8
316,"July 12, 2018","Awesome work, congratulations!! All the service and sale team are professionals, dedicated and ready to care of their customers finding the best options for their",5.0
317,"July 12, 2018","Very customer focused, did a great job in an acceptable time frame.  great communication with their customers, friendly and positive attitude.  Looks like they enjoy their job and want to be there.",5.0
318,"July 10, 2018","They made it so easy and painfree buying a new car.  Everyone was extremely helpful and friendly.  I have bought many, many cars and this was the best experience by far!",5.0
319,"July 10, 2018","We went to the Fenton Nissan of Rockwall and purchased a Sentra. Our salesman, Chris was helpful and friendly but made promises he could not keep in regards to work that needed to be done on the car. We got in writing that we wanted the scratches and dents fixed, a new battery, and the windows tinted on the car. After purchasing the car we left it at the dealership for a few days so they could tint the windows and replace the battery. We were told that we would need to set an appointment with Chris to have the car serviced at the onsite body shop for the dents. So we set the appointment with him for a week later at 8:00 in the morning. When we brought the car to the body shop for the appointment they said there was no appointment for us and that they would not be able to work on it at all that day. It was not possible for us to bring the car another day since we already drove an hour to drop it off for the day. So we told them we would be leaving the car with them and they needed to get the work done. We got multiple calls throughout the day about updates on our car being ""almost done"" and that it should be done by 6 that evening. When we called before heading up to the dealership to pick up the car we talked to many different people all unable to locate our car. They kept saying, ""I don't know. We can't find it anywhere on the lot."" Once we heard that we drove up there to check out the situation ourselves thinking, ""How can you have lost a car...a car we just bought?!"" When we got to the dealership the car was parked right at the front in customer parking, exactly where we had left it that morning. AND the car had not been touched. They had not done any of the work they said they had over the phone. The strange part is they went out of their way to call us with updates of things that had not been done. Our main issue with the dealership is that they will tell you whatever you want to hear true or untrue. We also still have not received the license plates after two months of making the purchase. My husband has called 5+ times asking when the new plates will be in, seeing as though the temporary plates will expire soon. Each phone call went something like, ""Oh they will be in by saturday, tuesday, next week etc."" Now the plates are expired and we still don't have out new ones. He called again and was told the plates were just submitted today by the Title Clerk- Hilda. Meaning- it could be another 3 or 4 weeks. The receptionist we spoke to Adia Kirks was very helpful and sent us an email with temporary plates and was honest with us about the situation. We asked her why the plates were not ordered months ago when we purchased the car, she said she didn't know. This dealership really will tell you anything just to get you to stop bothering them.",1.8
320,"July 10, 2018","Nice, clean and friendly dealership. Very knowledgeable staff. I would recommend this dealership to others. Andrew Hogan rocks as a car salesman ! I highly recommend him to talk to when you go to  buy a car at Fenton Nissan. He cares about YOU not just the sale. That is very important as a customer !!!",5.0
321,"July 10, 2018",Buying a car from Fenton was a very smooth experience. My salesman Justin was very knowledgeable about the vehicle I was buying. He was able to get me what I wanted within my budget and finance was able to finalize that deal. I really appreciate everything and I would highly recommend this dealership. ,5.0
322,"July 10, 2018","We walked in knowing what kind of car we wanted and how much we wanted to spend. Justin didn't try to sell us a different car, push us unto upgrades we didn't need or a higher monthly payment. He stuck to our budget, listed options we didn't know we had, and we ended up with a beautiful car. I'm already referring my friends!",5.0
323,"July 09, 2018",Ryan and justin ward wonderful. Ryan made sure that iwas happy and satisfied with my overt all purchase and service for the car i bought. Thank you to both Ryan and justin.  Kudos!! to fenton nissan. ,4.8
324,"July 09, 2018",Check engine light came on I had no appt I was taken care of very quickly speedy in and out very pleasant experience everything explained and gone over,5.0
325,"July 09, 2018","We scheduled an appointment for an alignment and oil change, and we arrived a few minutes late but Phillip still took us in and had our car serviced quickly.  Everyone was really nice and our kids enjoyed the breakfast snacks that were available.  Love coming here, even though we are about an hour and 45 minutes away, but its worth the drive.",5.0
326,"July 09, 2018",I have been dealing with Fenton Nissan since I moved back to Texas. They are friendly and knowledgeable and take good care of their customers,4.8
327,"July 09, 2018","I had a confirmed 7am appointment to have an oil change; I also asked to have a battery replaced in addition to this service when I checked in my vehicle.  Two hours later, my service rep had to find my vehicle and drive it to the service entrance.  I'm somewhat disappointed that this took so long to accomplish.",3.2
328,"July 06, 2018",Everybody was very nice and kind.  I was very satisfy with my visit.  I like to go there because the employees are very helpful.  Thank you very much.,5.0
329,"July 06, 2018",The service dept was ex the store manger would not talk to me or retrain my call this is on my last review I was not informed by the higher up about my problem or even for them to take a look at what went on the sales man has yet to talk to me he thinks it was a joke when I was there trying to strightem our,4.4
330,"July 05, 2018",My husband and I purchased a car at beginning of January. The sailing aspect of this experience could not be any more perfect. The follow up customer service after the sell is disappointing. I have yet to receive a detail worth referring. The 3rd of July i took my car in for an oil change and was turned away. Due to i had 4900 miles and needed 5000.  All the dealership had to do was communicate with a warranty company and have it pushed through. They refused to do any additional legwork.  Longer story shorter I want up going back that very evening to get the old change. Because I called the warranty company because I was on the phone for over 3 hours.,2.4
331,"July 05, 2018","I recently had my first oil change and 5,000 mile maintenance. The waiting area was very nice and I enjoyed watching tv and drinking coffee. It felt nice to relax and I was able to be entertained while waiting for my car to be serviced. I enjoy this dealership very much. I'm glad that I purchased my vehicle from them. I highly recommend them!",5.0
332,"July 05, 2018",Friendly people. Awesome facility. The car had some hail damage and they made sure it was taken care of. The service area is very nice. ,5.0
333,"July 04, 2018",All employees are awesome.  I enjoy the time I'm up waiting for service to be done. The dealership is always very clean and organized. ,5.0
334,"July 04, 2018",The purchase of a new vehicle went smooth and very friendly. This is the best new car experience that I have ever experienced. Everyone was very professional and courteous.,5.0
335,"July 04, 2018","Truck warranty ran out, so now trying to get things taken care of, ya want to gouge me with high pricing to keep my truck in top top shape. Can’t afford to bring him back to the dealership service dept.",4.2
336,"July 04, 2018",One of the easiest car purchases I've ever made. From earliest contact by internet to walking through the doors the experience was great.  I am very pleased with my 'new used' car. ,5.0
337,"July 03, 2018","I've purchased two cars from Fenton Nissan and have serviced both of them here as well, I've never had a bad experience with them everyone is very courteous and helpful. If I ever decide to buy another Nissan I'd come here first. Highly recommend them. ",5.0
338,"July 03, 2018",Olivia was great. She answered our questions and even gave us a great idea of how to get a spare tire at a good price. The car I got comes with a tire kit. ,5.0
339,"July 03, 2018","From the initial call, to the selection from the car mall, these guys go the distance to earn your business. They shoot it to you straight, & take care of you while you wait(With the fabulous soda fountain) I felt like I was dealing with honest individuals, who were truly looking out for me, trying to get us into the best fit for us! ",5.0
340,"July 03, 2018",Andrew was great to work with and made the experience painless. He was very attentive and made sure to answer all of our questions. Great customer service.,5.0
341,"July 03, 2018",Everyone was extremely helpful in getting us into the vehicle we wanted at the price we wanted. Extremely satisfied with our experience. Great focus on customer service!,5.0
342,"July 03, 2018","CAME IN BECAUSE MY BACKUP SENSOR WAS ACTING UP, BUT ALSO MY CAR WAS HAVING PROBLEMS STARTING.   WAS TOLD 150.00 TO PUT THE CAR ON THE MACHINE TO CHECK SENSOR.  I TOLD HIM THAT I THINK THE BATTERY IS MESSED UP.  SO THEY CHECK THAT FOR ME AT N/C.  SURE ENOUGH IT WAS THE BATTERY AFTER GETTING NEW BATTERY ELSEWHERE IT FIXED BOTH MY PROBLEMS.  I WOULD THINK THEY WOULD HAVE KNOWN IF THE BATTERY WAS BAD IT COULD MESS UP MY SENSOR READS.  VERY DISAPPOINTED FELT LIKE I WAS BEING CHARGED FOR SOMETHING I DID NOT NEED.      ",2.0
343,"July 03, 2018","excellent sales person, Chris.  dealership was clean, organized and very professional.  i would rate this experience with an AWESOME 10!!!  We love the SUV and the location is convenient to where we live in Forney. ",5.0
344,"July 03, 2018","I would highly recommend Justin Sivils. He was very professional and made the whole experience painless. Everything was handled as we had discussed, without any surprises, and was trouble free. They were able to make a deal no other dealers could or would.",5.0
345,"July 03, 2018","Wonderful experience, would highly recommend working with justin. They made it quick and hassle free. The prices were right and Justin was very knowledgeable about the car we bought. ",5.0
346,"July 03, 2018","Joseph and the staff at Fenton Nissan made my car trading experience as easy as pie.  Everyone was courteous, knowledgeable, and friendly.  So patient with every question we asked.  We are customers for life!!",4.6
347,"July 03, 2018","Overall pleased but feel the $1875 extra package you force your buyer to take should be a option or the internet pricing is truly false advertising you can’t walk out the door without it so it should reflect on what price the customer sees. Staff was great and we love the Rogue. 

After my initial thoughts I would like to add the dealership owes us floor mats and movie tickets and have yet to reach out to us or communicate in any form. ",4.2
348,"July 03, 2018","We came in to make a 2 car purchase which went seemlessly! We bought two 2018 Nissan sentras for our sons, one white and one black.",5.0
349,"July 02, 2018",Had a good experience dealing for a new car at this dealership. Other dealerships were not too eager to accept a 2 year old trade in and give me even the trade in value that Kelly Blue book showed. This dealership was eager to sell me a new car and went over and above for me. ,5.0
350,"July 02, 2018","Don’t know, they just do the jobs in order. Sales are friendly and patient with me because I am a deaf customer.Good Job !",5.0
351,"July 02, 2018","Everything went well from sales to financing. Will recommend. No complaints. Not pushy, very friendly and easy to work with. Very fair deal on my vehicle.",5.0
352,"July 01, 2018",I had a great overall experience at Fenton Nissan. I would recommend them to anyone I know who is looking to buy a new or used vehicle. ,5.0
353,"July 01, 2018",From locking my keys in my car while it was running to appraise it for a trade in. After 2 hours the police came to break into it and the whole time no one was around nor apologetic. The sales rep was rude and not knowledgeable in their products. The financial manager was not responsive and I had to come up to the dealership to get the purchase order to provide to the lender. The car had hail damage that they were to fix and after 3 times in the shop it was fixed.  They damaged my car when attempting to fix the hail damage by denting the door and chipping it. After getting it back we noticed the registration sticker and toll tag were missing. They did give us a cargo package and all weather floor mats to make it up to us and they replaced the stickers. They were acts of good faith but things still happened to continue to go wrong. ,1.4
354,"June 30, 2018",I was really grateful for all the help I received during the purchase for my new vehicle. Amazing experience when I did not think I would be able to get a new car.,4.8
355,"June 30, 2018","I was sold a new vehicle with hail damage that was not disclosed to me. When I got it back from them after being repaired the interior panels were not attached and were falling down. There was also grease hand prints in several places on the interior. The car went to be repaired again and now I have a piece of exterior trim missing and several scratches on the exterior of my vehicle. I spoke with the sales manager, a lady in service and the owner loyalty manager whom will not return my calls. ",1.4
356,"June 29, 2018",I am completely satisfied with the entire process. Single female buying a car can be intimidating......but they worked with me and did not push me over my budget and was able to work with what I was comfortable with. I got the car I wanted!,5.0
357,"June 29, 2018",We wanted to compare Nissan Murano with Toyota Highlander and Kia Soranto. Had all three dealers competing for our business. We were ready to buy.,4.7
358,"June 29, 2018",Worked the deal over text.  Got there and they beat it by another thousand.  Only took 1 trip back to negotiate my trade vehicle which was nice.  I am a three time purchaser from this dealership and all have been great experiences.,5.0
359,"June 29, 2018",Keven St Louis has been with us from the very beginning and has supported us in every way.  We purchase 5 vans for company use and will be looking to purchase 5 more in the near future.  He made the process very easy.,5.0
360,"June 28, 2018","Virgil our salesman was wonderful, friendly and informative.  Jeremy was fast with the closing.  Best car buying ever and got a terrific car for the price.",5.0
361,"June 28, 2018",Fenton Nissan will bend over backwards to help you get the car of your chice in your price range!! Will tell everyone i know to go here!! From Greg Amos and Virgil in sales because i was there twice before getting my car to Oliver and Elvis in finance working to get me the price available even after signing papers!! This place is the best!! I dont cate what Clay says. Don’t go see Clay!!!,5.0
362,"June 28, 2018",I had a great experience at this dealership he was a great seller and he was very nice and very it tells me it’s Shares all the experience he has.I would recommend someone to come to Pete do you have a great experience overall,5.0
363,"June 28, 2018",promised paint problems would be taken care of and brought car in 2 times for this to be done......also oil light for maintenence comes on and was told oil change had just been done...was it or wasn't it done before we bought the car??????,2.2
364,"June 28, 2018","Trey and Oliver really made us feel good about buying the truck, it was just a pleasant experience for my wife and I and we felt like family.",5.0
365,"June 28, 2018","Excellent customer service with entire staff. Chris was so helpful and addressed my concerns.
Easy to get in and have maintenance done on my vehicle",5.0
366,"June 27, 2018","I drove up and Trey Harris the sales advisor met me with a friendly handshake,who seemed to be very knowledgeable about the frontier I was interested in and 4 hours later I drove it home.",4.8
367,"June 27, 2018",The service guys are very informative and take the time to explain what needs to be done or what has been done to your vehicle. ,4.8
368,"June 26, 2018",Great Salesman in Kevin St. Louis. Spent a great deal of time with us on 3 different meetings. Very knowledgeable and helpful throughout the process. Impressed with the facility. Think the price was fair although we did not shop anywhere else.,5.0
369,"June 26, 2018","I cannot grade fenton as well this time as in the past  You failed to meet my basic expectations on my last service.  Advisor tryied to sell me on some things i had already had done.  I have always believed that this was a common tactic in order to bring in unearned revenue from unsuspecting customers.
I believe this tactic is driven by general managers and corporate as well.  This is just not Fenton  I believe this is every where  That is why I don't believe dealerships can expect 10s on surveys,  The answer is for the customer to remain vigil and pay attention to what is going on in the service department",3.4
370,"June 25, 2018",I went to Trophy Nissan first. Friendly staff but very overpriced. I told them I was going to check out Fenton Nissan in Rockwall and they tried everything to stop me from going. They let me test drive the Murrano for a weekend. I decided to test drive it to Fenton in Rockwall. I was greeted with a friendly staff and unbelievable savings. The deal Trophy said was impossible Fenton made it happen!,5.0
371,"June 25, 2018","Fenton Nissan has been a great dealer to us. We have bought two Altima's . They support our school Heath Hawks. We go to several luncheons they provided. We also went to the customer appreciation meal and we won a gift card. Cool! We have had the best realationship we have ever had with a dealership. Thanks
Also the service staff have been great. Sorry I don't remember their names but they have been great. Kudos to those guys too.",4.8
372,"June 25, 2018",Fenton Nissan gave me great customer service beginning with the salesman who worked with my budget and the vehicle that I'd looked at other used car dealerships in the area. ,3.6
373,"June 22, 2018",This was the most painless car buying experience I’ve ever been through. Greg and his team bent over backward to make sure I left in a beautiful new car. ,5.0
374,"June 22, 2018",the salesman was great but when i took the car home and the next morning i told them i was not satisfied with the car and i want to bring it back and look for something else they told me I HAD TO KEEP IT I WOULD BE PAYING 38XXX WITH PAYMENTS AND I COULD NOT HANDLE THIS  I WOULD NOT ADVISE ANYONE TO BUY A CAR FROM YALL I SHOULD HAVE HAT 24 HOURS TO MAKE UP MY MIND,1.0
375,"June 22, 2018","My overall experience with Greg was amazing. He went above and beyond to make sure I was happy with my vehicle and the price. Thank you,  Greg! ",5.0
376,"June 22, 2018","I needed a dependable car and wanted something nice with a few bells & whistles.  Pete Hodges greeted me from the start and was wonderful to work with.  He helped me find exactly what I wanted and was polite and there was no pressure to buy.  He gave me a good deal on my trade in and helped me stay at my desired payment.  I got the car I wanted, the payment I wanted and made a new friend in the process.  Nissan added in a couple of extras and I couldn't be more happy!  Thanks you all for this great experience!",5.0
377,"June 21, 2018","Well first of all I was told on the phone that you had a light color car ,like a champagne,or egg shell white,or Pearl white & I was showed the dark red, & light Grey only so I settled for the Red one because it did look better than the Grey one,& I was also disappointed in me not been able to trade my Toyota  in on it with my payments been the amount that I could afford,so I am stuck with 2 cars & 2 car payments,because my salesman advised me to get someone to take over the payment ,but I can't find no one at the moment,because the car is in a upside down situation & no one can afford to take it over,& I don't want it to go on my credit,I'm in a bad situation at the moment & don;t know what to do,so I'm not enjoying my Nissan  Altima  right know,worried about these 2 car notes,I wish I had of waited,or try going some where else to get a better deal,even though I love the car,just hate the way that I got in the car.",3.4
378,"June 21, 2018",Thank you Virgil Posey in a nutshell I'm completely happy and pleased wouldn't change any of the experience Virgil Posey you are forever in my heart again thank you God knows I needed you to be my salesperson   luvluv you -dawn pratt  ,5.0
379,"June 20, 2018","They were so helpful and easy to talk to. They made me feel very comfortable and I felt they really had my best interest at heart.  They worked with me to get me a great buy on a new car, and step by step took me through the whole process.  I  was very happy with how they handled everything. Very nice people and great dealership.",5.0
380,"June 19, 2018","They made the sales experience easy and did not try to change me to another vehicle, I was given what I wanted at the payment I could afford, and was out of there quickly",5.0
381,"June 19, 2018","We had a great buying experience, and their service has been top notch.  I will definitely buy from them or lease from them again. Thank you for everything.",5.0
382,"June 18, 2018",It was different this visit. I guess it was because you all was short handed.  And then when I got home I notice a screw in my tire.  I guess you all do not look at tires when rotation of tires.   Do you all fix that or do I just take it to a tire shop.  Oil change  interior ,3.0
383,"June 18, 2018","EverythingFrom start to the end was horrible took A-day and a 1/2 to be told my car was delivered after was picked up from tow truck.  My car sat there for 3 weeks, didn't have anything done to it, no parts ordered or even agreement with insurance. The ""they gave me to fix my car was over $5000 in the other dealership fixed it for 2600... I had it towed to the other dealership who fixed it in 2 and a 1/2 days. Will never go back to fenton nissan again. ",1.0
384,"June 18, 2018",Good customer service. First time to do this alone and it was really easier than I thought. I am loving my new car. Thanks so much!,5.0
385,"June 17, 2018","I made appt with one service person, he was not there, but after dealing with Juan I am glad it worked out that way. He was kind and went over all of my car issues and it was a good experience.

I had the oil changed and also had new windshield wipers put on.
",4.8
386,"June 15, 2018","Went for an oil change. They did their multi-point check service as well. They told me items to be watching for that appear will need service or attention soon, but didn't try and sell  me or push me into additional services or items that I didn't originally come in for. They were honest about what they saw and why the concerns, but not pushy by any means. I didn't know that the 1st oil change was free, since it's my first time going there. They didn't have to tell me that, but they did. That says a lot about their honesty and true customer service drive. Definitely go back, and definitely recommend to others. ",5.0
387,"June 13, 2018",This was my first time going to this Nissan dealership for service. I was blown away by the great customer service. The lady who scheduled my appointment over the phone was polite and professional. They were able to get me in the next day and didn’t ask for a ton of information over the phone. When I arrived the greeter was extremely helpful and got all my information put in their system quickly with a tablet. I expressed my concerns and they let me know they would call when it was done. The work was completed quickly and everything was explained to me in a way that was easy to understand. My car had been washed and vacuumed as well!  I highly recommend any Nissan owner to go out of their way to use this service center. ,5.0
