,Date,Reviews,Ratings
235,"August 14, 2018"," I would like to start off saying that the sales department Was professional and courteous except one point and that is the Internet final price was not the final price when I got there the price went up about $1700 because of tinted windows and things like that. I wish they would have stated included in the Internet price,but that is not my main point. After a couple of months I was due for my first free oil change and as I stood in the lobby and look through the windows as they pulled my truck in and out several times I noticed why they were doing that. There are two narrow beams of iron that they are trying to bring my truck between they had to bring my mirrors in and once they pulled my truck into this brand new facility the mechanic could not get out of my truck he had to put the Door up against the metal beam as the other mechanic try to place his hand in between. As I noticed this I walked into the mechanics bay and asked very nicely ,I’m sorry did you have to put my door up against the metal beam  to get out. He said yes but the other guys hand blocked it from getting scratched I thought that was a weird being that this is a brand new facility and I have a Nissan titan and there should be a better place and equipment to change my oil and rotate my tires. I left to have dinner with my parents but when I came back , I realized I must’ve really upset those guys that I asked if they  had put my door up against the metal beam because my seat was completely laid-back pulled back the lumbar was completely blown up my mirror was completely Messed up and had to  readjust and my radio that was on talk radio was now on rap, my medical therapy devices  that I had in my Front passenger seat with my vest, is now in the floorboard one of my clamps was outside of my truck on the ground and the sticker that they placed in the window to remind you when your next or change is supposed to be was 1000 miles over the limit  for the next oil change. Another words If I  would have gone by that sticker I would have driven 6000 miles before my oil change when I’m supposed to get an oil change every 5000.  I called and left the service manager Nick Nicholson several messages he obviously is no manager at all and doesn’t care about  customer service. I now believe they are  only after selling you a vehicle and then not really concerned with your repeat servicing on a new vehicle this is obvious by not receiving one phone call  back from Nick . I would not recommending getting a vehicle serviced year find a better dealership or a small mom and pop that will give you better customer service and actually get to know you and if you do have a problem or issue will return your phone calls .",1.0
236,"August 14, 2018",Customer service was great. Troy (salesman) was professional and developed a connection with us and executed the sale my giving us exactly what we were looking for. Troy solved problems and maintained a professional attitude throughout the process. Excellent experience over all!,5.0
237,"August 14, 2018",Pete was great! He took the time to answer all my questions and get the car in tip top shape! With extras! Wonderful experience and price,4.8
238,"August 14, 2018",I experienced great customer service from the start until the end in purchasing my  new vehicle.  Chris was very supported.  My purchase was quick process and very informative.,5.0
239,"August 13, 2018","Was met with a friendly, curtious and professional attitude. My Titan was serviced and washed in a good time. I was a bit early for my service appointment but was taken right in without waiting for anything other than the actual time to get the job done.",5.0
240,"August 13, 2018","Anthony was very informative & recommended the transmission fluid flush at this time & other items later.  Once the service was completed, he advised me the ""touch up"" paint had to be ordered & he would call us when received.",5.0
241,"August 13, 2018",Fenton made my buying experience very pleasant.  Greg Amos was great to work with I highly recommend visiting and buying from Fenton. I really am enjoying my new Titan!,5.0
242,"August 13, 2018","Had a part order for AC unit under warranty.
Had me in and out in 20 minutes. Three times here and been outstanding at each.",4.8
243,"August 12, 2018","Came in from out of state an had an issue with my truck.  Called Fenton Nissan and told them the problem and they had me drop the vehicle off right away.  They diagnosed the problem right away, got the part in and had me on the road again by the time we were scheduled to return home.  Offered me a loaner car for the stay.  ",5.0
244,"August 10, 2018","Fenton is the next great service center around. You hear about other dealerships & customer satisfaction with them, but we have one right in our back yard! This is the only place I will get my car serviced. A++",4.6
245,"August 10, 2018","We have been shopping and servicing at Fenton Nissan since they opened,  We are servicing all of our vehicles here now, even our company vehicles which are not Nissans.

Thanks to Anthony for your personal attention.

Terri

",5.0
246,"August 10, 2018","I would come back again and recommend my friends to do business with Fenton Nissan
Thank you for all your help and easy transactions.
James Cottrell",5.0
247,"August 09, 2018","I selected the car from Fenton Nissan inventory website. However, Instead of buying case through internet, I came to dealer and see salesman for test drive. It takes me around an hour to complete the deal.     ",5.0
248,"August 09, 2018",We bought a new Nissan NV from this dealership. We found the vehicle on their website and completed the transaction via phone as we live several hours away. The vehicle was delivered to our house several days later and we were perfectly satisfied with the whole process. I would buy again without hesitation from this dealer. ,5.0
249,"August 09, 2018","Anthony was our service tech. He went over and above to help us with little problems,  which were not what we came in for. He was pleasant, knowable and accommodating. ",5.0
250,"August 07, 2018",My service with Fenton was great until I had the problem my 2017.5 Nissan Murano the front fenders pop out I guessing the heat caused it and the passager side door you can hear the wind blowing inside the car they didn’t fix either problem when I left the service department very disappointed.,3.6
251,"August 07, 2018","I bought my Nissan Maxima Platinum from Fenton after reading their reviews.
After initially putting in an inquiry over the internet, Edwayne contacted me immediately and said that he will look after me and give me what I expected for Ford Fusion. When I got there for the test drive, he showed me every feature possible and even gave me more for my Fusion than I expected.
Very easy transaction.
Thanks Edwayne",5.0
252,"August 07, 2018",Troy help me so much with finding the right car. I knew the car I wanted and he made sure to help with finding it,5.0
253,"August 07, 2018","WOW!!!  What great people, great prices and no BS. Just bought my second vehicle from Fenton.  Plan on being a customer for life.  Kacy was a great salesperson. Very knowledgable and easy to work with. Highly recommend seeing him for you next vehicle. ",5.0
254,"August 07, 2018","Even though they were very busy, they treated me like I was the only one there. I have always been treated like I was family.",5.0
255,"August 07, 2018"," Austin and entire staff where kind, got my car fixed , and updated me on progress. Chris was helping to check in customers so they would not have to wait on service tech to come out because of the workload Sat.",4.6
256,"August 06, 2018","At the time of my arrival, I did not make an appt and it was very busy, it took a while for someone to greet me. A gentleman did approach me and led to right person to talk to about getting a service, I felt it took longer than expected. But overall everyone was nice and the gentleman helping me was thorough.",5.0
257,"August 06, 2018",I have asked to be unsubscribed from their call and email lists repeatedly to no avail.  This leaves me with the plan to not buy another car from them.,3.5
258,"August 06, 2018","I won’t deal with a dealership that there salesmen stalk you in the parking lot, this hasn’t happened yet. 
My only problem with my salesman Greg Amos is that he had told the gentleman who recommended me to him a $100.00 referral fee but my friend hasn’t heard from Greg even after texting him. Somebody need to follow through with this it’s just good business ",4.6
259,"August 04, 2018","I went to buy my new car on July 4.  All of the promotional events ect. seemed to be not very well planned out.  I am happy with my car and the salesman, Hayms.",4.3
260,"August 03, 2018","We bought 2 vehicles at once... had a problem with one, were treated poorly in the service department. Not sure we will return. 

Tony Glover ",4.0
261,"August 03, 2018","I had a great experience with Fenton Nissan of Rockwall. My sales advisor was Olivia and she went above and beyond to help me with the details of my purchase. My finance guy was Oliver and he was awesome as well and worked hard to get the finances where I liked them. Their care overall has been wonderful, I have zero complaints about my experience with Fenton Nissan of Rockwall. ",5.0
262,"August 03, 2018","From the moment you drive into the service bay, this dealership exemplifies nothing but courteous, professional service.  All of my experiences with the service department have been very positive.  ",4.8
263,"August 03, 2018","I had a very good experience and was not pressured at all.the salesman worked hard to help me find what I wanted.,he kept me informed on the process as we negotiated the deal.At the end of day they all took care of my needs financing , sales and service. I am completely satisfied with everything. Good Job to : salesman Dallas. !!",5.0
264,"August 03, 2018"," Friendly, family like atmosphere. Called to schedule an appointment to have my oil changed and was told to bring my vehicle in the same day. The wait wasn't long. I would recommend Fenton Nissan to anyone who's looking to purchase a pre-owned  vehicle where the salesman works with you to get you in a vehicle that's priced decent.",4.0
265,"August 02, 2018","So my experience did not start very well at all.  I was being told three different things by three different salesmen.  I had literally written off doing business with them.  Three days later I received a call from a manager.  I gave him the whole story and he asked me what it would take to make it right.  From that point forward things were handled in a much more respectable manner. .  My daughter and I drove four and a half hours to the dealership.  We were treated very well even though I brought up a discrepancy with the actual odometer reading versus what was advertised on the website.  Needless to say they took a little more off of the price.  Finally about to close the deal and they had made an error figuring out wonderful Louisiana taxes.  They ate that as well.  All in all I walked out with a great deal.  I spent well below what I had set out to spend and secured a wonderful, reliable vehicle for my daughter.

",4.6
266,"August 02, 2018","Friendly Crew,, good support, good attention 👍my family feel value, I very sure the customer is priority and very important for Fenton Nissan,, keep working for same direction,,, thanks once again,,,👍🚗",4.0
267,"August 02, 2018","When my husband and I arrived at Fenton Nissan, we were greeted by a very friendly employee.  We told her we were looking for a used vehicle I thought I wanted.  Kacy Pina came over to help us and brought the vehicle out for us to see.  The color wasn't what I wanted. When I let him know I really wanted a white car with a tan interior, he had a beautiful 2018 Nissan Pathfinder brought out for me. It was perfect!  He let me test drive it and when I wasn't sure if it would fit in our garage, he let me take it to the house to try!  This new vehicle was less expensive or about the same price as the the used car I originally came out to see! Kacy has called to make sure everything is okay and I have texted him with a question to which he responded quickly,  We will recommend him and the dealership to our friends and family!!",5.0
268,"August 02, 2018","Helpful and helped me get into a great car, regardless how difficult I was. Servoce was wonderful and a lot of perks that surrounding dealers could not provide! ",5.0
269,"August 02, 2018",I had a good experience at Fenton Nissan. I would and have recommended my family and friends to shop here.  I left in the exact car I wanted and didn't have to settle for less just to get the financing done.  I don't have good credit so it was a bit of stretch and I did have to settle for a higher payment than I was super comfortable with but to get the car I really wanted it was the exception I was willing to make.  I appreciated how nice everyone was and the follow up is exceptional.  ,5.0
270,"August 02, 2018",Ellen Walsh did an awesome job selling me my Nissan Kicks. Love the car and excellent service . I definitely will return in the future and refer friends and family to Fenton Nissan of Rockwall ,5.0
271,"August 02, 2018",We had a very good experience dealing with Greg Amos.  He was kind and funny and just a good person.  We had a good buying experience and he worked with us to get us a good deal.  The experience was good as well as the person himself.  Just a pleasure to meet and do business with.,4.2
272,"August 02, 2018","This is my second pathfinder from Fenton Nissan.
Dealing with them is satisfying And honest!
From the GM to the guys on the service desk there is never a question of sincerity or honest opinion of needed repairs or service! 
Phillip, Scotty or Mike you can count on them!",5.0
273,"August 01, 2018",Chris Shelton was a pleasure to work with.  He is very respectful and did not pressure us in any way.  My wife and I are very hesitant to make quick decisions on a big purchase and he was very patient with us and respectful to our hesitation and gave us the time needed to make a decision.  He helped us accomplish everything we set out for when we went in and we ended up accomplishing those goals and getting the truck we wanted.,5.0
274,"July 31, 2018",Joseph Vickery and Sheddy Rose treated me very friendly and was very helpful and kept their offered price. the finance person was helped me to find out the exact financial plan.,4.2
275,"July 31, 2018","I purchased a new Nissan Titan Pro 4X and my experience was awesome.  From my sales associate,   Chris Shelton to Robert in parts every question I had was answered in a very professional manner. The service department was very helpful with the questions that I had. Last but certainly not least, the Dealerships general manager made a point to thank me for making my purchase with  Fenton Nissan. I will definitely use this dealership for future purchases. ",5.0
276,"July 31, 2018",Joseph Vickery  and Virgil Posey were awesome along with the finance team. They are very knowledgeable and easy to talk to. I'm very satisfied with my KICKS SR. ,5.0
277,"July 31, 2018",I was very impressed with Olivia. She was very knowledgeable the titan truck and what options I might need in my truck. Would recommend her an Fenton to anyone ,5.0
278,"July 30, 2018","Edwayne provided outstanding service on this purchase. Knowledgeable, courteous and patient. I would recommend him and Fenton Rockwall without qualification. They made the experience enjoyable.",5.0
279,"July 30, 2018","The best ""car buying"" experience I have ever had.  Class act from the time I drove into their parking lot until I signed on the dotted line.",5.0
280,"July 30, 2018",found the car I wanted.  Price was right. Trade in was right. I bought the car. The only negative I experienced was the missing SD card.  Service had to order the card and it took two weeks to get it to the dealership and installed.  ,5.0
281,"July 30, 2018","All of my experiences with Fenton Nissan have been positive.  The leasing process was quick and fair, and the follow up by their staff has proven to be very timely.  Keep up the good work y'all.",5.0
282,"July 30, 2018","I went to look at a Jeep Grand Cherokee with no intentions to purchase. I loved the vehicle and they made the process way less stressful then I intended. A big thanks to Kasy, Joe and everyone else for a great experience! Oh & the gentlemen who manned the grill..burgers were on point!! : )",5.0
283,"July 30, 2018","Great place to but a vehicle from. Awesome awesome guys with great service. Justine, ur great man. Thanks for ur help. Love that car, it's great ",5.0
284,"July 29, 2018","It took some time to get the paperwork done but that is always expected when purchasing a car.  In addition, there were many purchases being made the day we were there which is a good thing.",5.0
285,"July 29, 2018","My experience was friendly, funny, and positive. I would definitely recommend this dealership to anyone looking to buy a car. Awesome and patient people there! ",5.0
286,"July 27, 2018",Trey and Will were fantastic to work with in purchasing our new rogue. They both went beyond our expectations in customer service and explanations of the new vehicle ,5.0
287,"July 27, 2018",My salesman was awesome and he will be my first contact from now one.  He was funny and helped us make the best decision with no pressure!! Thank you Kacy!! ,5.0
288,"July 27, 2018","From my salesman - Jett Reed to the sales managers, finance and all the departments this was the best and easiest car leasing experience I’ve ever had! This is a relatively new site but it is beautiful and very up to date with technology. I love my new Rogue and encourage anyone to come in and see for yourself!",5.0
289,"July 27, 2018","We took our SUV to repair and inspection even without an appointment. Timothy Hutchinson , service advisor did a great job. Great care, great service & fantastic customer service. Well done !! Keep it up!! ",5.0
290,"July 27, 2018","I was the first customer to use the online Roadster purchase and even though we had a few hiccups, It makes purchasing and placing a deal on a vehicle from out of town customers like me a whole lot easier. Todd and James(sale mgr) made the process easy and walked me thru. I drove 400 miles to make the purchase because I could not get a better deal here in west Texas at many of the dealerships. I felt confident with the purchase as Todd and James reassured me through the whole process. Boys and wife loved the vehicle, and we got it with all the bells and whistles we have been searching for over the last 3-4 months. In the end, save thousands traveling outside where I live to get a great deal and couldn't be happier.",5.0
291,"July 26, 2018","Great service!!  
I am do appreciative of how easy they made my purchase!  I did it all online and I only had to go into sign.

It would have been amazing to not have gone in, but it was truly a great deal!  My salesperson, Justin was fantastic!! Thank you Fenton Nissan!",5.0
292,"July 26, 2018",Justin Sivils helped us and worked really hard. He showed us what we wanted to see and was not pushy. The sales team put together a great price and sold me a great car. I was very pleased with the service I received.,5.0
293,"July 24, 2018",We took our car in for oil change and inspection.  Antonio Holmes was our service advisor and he took great care of us.  Great experience!,5.0
294,"July 24, 2018",  Everyone has been helpful and positive.  It is a happy place to be. I love that you have free car washes for the life of the car. ,5.0
295,"July 23, 2018", Everyone in customer service was extremely polite kind and thorough getting my cars needs taken care of. I would highly recommend going first thing in the morning. Love the free car wash! ,4.8
296,"July 23, 2018",I had a comfortable wait while my oil was being changed. There was food and drink to make wait better. Antonio was very helpful and friendly!,5.0
297,"July 23, 2018","Every staff member I have ever dealt with is completely knowledgeable, patient and willing to explain in detail information regarding the service of my vehicle.  I really appreciate that!!",4.6
298,"July 23, 2018",I bought a ford focus from this dealership with one free year of oil change which I found out this weekend was a lie plus I was told I had to buy my own air filters bring it to the dealership in order to do oil change. This place is a NISSAN dealership I was told and they do not have anything for a ford vehicle. I don't understand how they can sell a ford.,1.0
299,"July 20, 2018","Fenton Nissan had the best incentives by far, and the experience was flawless from start to finish. Everyone I worked with there was truly top notch.  Will recommend!",5.0
300,"July 20, 2018","My service advisor, Tim, was so friendly in such a sincere, caring way that it broke down my defenses that I normally keep armed when dealing with any Service Department of a car dealership.  I have purchased many cars around the metroplex but was never satisfied with the Service Departments in very many.  I decided to try Fenton and had a very pleasant experience even though I had to return the next day to have the work performed.  Tim kept me advised of the work as it progressed and even gave me a chocolate bar.  Hard to resist a man sharing chocolate!",4.6
301,"July 20, 2018",I loved my experience I found out about them through my email some how. And I went up there with my sister there as no pressure at all. We found the right vehicles and the sales manager Chris put together all the numbers and I walked out not with one car but 2 cars. Thanks for the amazing service and for the sells reps Andrew and Joseph. ,5.0
302,"July 19, 2018"," The front desk Lady was very Polite, My Advisor Timothy Did an Awesome Job, always checking everything was running good with my car, he was so nice, The Other Guy That Put on My Car Plates, was nice and Accurate, another Woman and advisor helped me too, this Place has a very friendly people, I feel Like Home, Everybody seen nice. I will Defintely Recomended this place",5.0
303,"July 19, 2018","Be aware! 

They sent all my paperwork to Nissan auto finance bank without my permission. The finance person ELVIS told me that his manager” forced him to do that”. I was still very patient. I decided to refinance my car through my bank but still had to wait FOR Fenton Nissan in rockwall to send a check to Nissan finance bank for $3000 for a bumper to bumper coverage that I didn’t want. I had to idea it was going to take 2 months...

What ended up happening, since they were taking so long, I had a car loan at 2 different banks just because they were refusing to fix their mistake and simply do their job. I got the car on May 6th, yesterday after over 2 months of me begging them to do it, July 18 the check was finally sent which meant my car was paid of at a Nissan auto finance and they only loan I’m paying is with USAA bank. Of course, I never heard any apology for their lack of professionalism but it’s ok at least I don’t want to deal with them anymore. 

The only good experience I had was with the sales person-Justin who did a great job and I was very pleased but once I had to start dealing with the financial part all of a sudden everyone was too busy to help you out and refused to pick up their phone multiple times as soon as they took my money and I became their “customer” 

Im very disappointed but at least had a great lesson NOT TO DO ANY BUSINESS WITH FENTON NISSAN IN ROCKWALL!",1.0
304,"July 19, 2018","Olivia worked very hard to give us all the options available to us. Very straight forward, honest and personable. I'll recommend her to anyone I know! ",5.0
305,"July 17, 2018","I have purchased several brand new vehicles in my ‘forty-something’ years, but Olivia was the most knowledgeable used AND new car sales representative I have ever had! She did not persuade me into spending more money, she actually listened to what I needed in a car and what I could afford. I was looking at a used car with low mileage and low cost...I left with a BRAND new vehicle and a FAR better deal than I ever thought. GO TO FENTON...and ask for OLIVIA! ",5.0
306,"July 17, 2018","As a female, to go into a dealership by yourself and not once feel like you are being pressured or pushed into anything, is a big deal. So Glad I went to Fenton to get my car!",5.0
307,"July 17, 2018",I always feel like they go above and beyond to help me!!!!!!!!!!!!!!!!!! I have never had a bad experience since I bought my vehicle. I truly feel like they genuinely care. ,5.0
308,"July 16, 2018",Everyone there were so very nice. Our sales person Trey Harris was awesome. The location was very clean as well. Thank you for our New 2018 Nissan Rogue Sport.,5.0
309,"July 16, 2018","I bought a brand new car there and they have hit something with my car twice and now theres a chunk missing from the trunk of my car. I have only had my vehicle for 3 months and it's been in there possession majority of that time. This was my first time buying a brand new vehicle. But my sales guy has been nothing but amazing everytime something happens he makes sure it get fixed. Even 3 months later he still runs over there and helps me! The purchasing people you sign your papers with were awful as well, I tried calling the day after I bought the car to make sure I had gap included and that way if I didn't I could try to add it and they made sure to not answer my calls or call me back for a week till the papers went threw with the bank.",1.6
310,"July 16, 2018","Worked with Jett Reed and Joseph Vickery . Happy to work with them. They are nice and helped me to get my car.

Thank you guys , you helped me a lot.",4.0
