,Date,Reviews,Ratings
155,"September 14, 2015","So I stop by and I'm looking. And Becky Langford immediately wants to know me and what I need. What am I looking for versus what I am needing in my life. 

Okay. So we start our search. And we found a great used vehicle that I thought was me, a 350Z. 

Well, I have a job in the oilfield but it doesn't mean that some bank wants me to take it home. My credit score is shy of greatness, and all I need is another couple thousand on the down payment along with a couple points higher on my credit report...

Becky did everything right and she is most definitely my sales lady!",4.8
156,"September 14, 2015",I came to the dealership and didn't even plan to buy a vehicle but my salesperson Chelsea Price made the process so easy and enjoyable that I couldn't help but purchase a vehicle! If you ever want a good experience go to her and you won't be disappointed!,5.0
157,"September 14, 2015",My expirence at y'all's dealership was awesome! John Ward was very knowledgeable about the cars I asked him about. His test drives are very informational and I like that he lets you get a feel for the car before you talk about prices! Thank yall so much! You should give John Ward a raise for sure! :) ,5.0
158,"September 14, 2015",I had a great experience buying a new car here! Mr. Raney was very informative and helpful in my decision to purchase a vehicle. The atmosphere he created was very comfortable and made the process much easier. ,4.8
159,"September 14, 2015",Had a great experience even though i was not able to get a car due to credit issues (My Bad). Aaron Raney was a huge help in trying to decide what vehicle i wanted to eventually purchase.,4.8
160,"September 14, 2015","Becky Langford made our car buying experience absolutely perfect. She was not pushy like most sales people can be, but was completely personable and helpful. She asked great questions and we ended up leaving with a car that was not only in our budget, but actually BELOW what we thought we would be paying. I love my car and I won't buy from anyone else.",5.0
161,"September 14, 2015","I just want to let everyone know that Adrian Garcia is by far the best! Even though I had credit issues he understood my situation, explained my options and he was till able to make me laugh with charismatic ways! Gotta say, if you're going to buy a car... buy one from Adrian Garcia!",5.0
162,"September 14, 2015",I went in just to browse but Adrian Garcia made this the smoothest and fastest car purchase that I have ever made. He was very informative and knew what car would go with my picky taste. I will continue to recommend him to all of my family and friends because of his patience and knowledge. ,5.0
163,"September 14, 2015","My salesperson was John Ward.  He helped me make a tough decision on whether to buy a Dodge truck or van, and I have to say I'm happy with my new van!  He followed up after the sale and has been very helpful in helping me customize the van in just the way I want it.  I'll definitely do biz here again!",4.6
164,"September 14, 2015","I visited Grapevine Dodge and had Stephanie Stallons as my salesperson. She did the absolute best job ever!! She listened to every detail of the kind of vehicle I was looking for and made sure to find the best ones to match what I wanted! She was very kind and made my visit perfect!! I usually find car buying to be a stressful experience, but she made it an exciting and fun experience!! I will be back and I will make sure I am helped by her! ",5.0
165,"September 14, 2015",This is a great dealership and they give great service. Phil Cruson is wonderful and exceeded my expectations. I would highly recommend this dealership and I would highly recommend Phil Cruson!!!,5.0
166,"September 14, 2015",Had a great experience and really liked working with Mitch.  The dealership has a very large selection which is important also because I prefer to test drive the actual car that I'm purchasing.,5.0
167,"September 14, 2015","The dealership has a huge inventory so that means you have lots of vehicles to choose from.   Mitch Merckling is knowledgeable, listens to what you want, friendly and has a fun personality.  It is a very refreshing experience at a car dealership.  ",5.0
168,"September 14, 2015",Mitch Merckling was very helpful in my car search. He had a lot of knowledge and expertise. I will definitely go back in the future.,4.8
169,"August 25, 2015","Needs a new sales manager ASAP. Beware of this place!  Worst car buying experience ever!!!

The sales person I worked with was excellent and tried to do everything possible to make the deal. The SALES MANAGER on the other hand made sure that I did not walk away with a truck. The experience was so awful!!

I was looking at a certain truck and was working on the price. From the beginning I gave them my payoff for my lease. They gave me a pretty good deal but after driving the truck around town for a couple hours, I realized the truck was a demo (it had 2500 miles on it).  We had already worked out a price prior to my extend test drive but after noticing the miles, I wanted more off the sticker. 

I came back with the truck, tried to make a better deal and the sales manager increased the price! How does that work!
-He didn't have the correct payoff entered which I gave them from the beginning. 
-He said since it was a lease I didn't get a certain rebate which I told them it was a lease from the beginning. 
-He increased my taxes paid due to it being a lease.

I walked out furious and left the dealership saying I wouldn't be back no reason to call. Sure enough about 5 min later the sales manger calls. I was still upset, told him why I was upset. He tried to over talk me while I was explaining the situation, got angry and hung up on me while yelling ""Good luck to you!!!""  Really?  You are the manager? The one that is suppose to be the professional boss?  Sure bud..  Well good luck to you and the dealership...

",1.4
170,"July 14, 2015","I've bought many cars in my life, I'll make this short and to the point, tons of dealer add ons not disclosed until the end of the process.  Pointless dealer add ons not worth the paper it's not printed on. They are ultra shady, there are many other dealerships to use, go somewhere else.  Bait and switch sales tactics.",1.0
171,"July 07, 2015","My wife and I went to this dealership this past weekend (3rd of July) for a used vehicle. When it came to the price and everything, my wife told them she already had financing through a Credit Union at a really low rate, to which the salesman (Stewart) asked to give them a chance to match it/get close and they would be sure to get us a good deal. 

We told them where we wanted to be for monthly payments and the first ""deal"" didn't come even close (they lowballed our trade in). In addition they have a mandatory ""Dealer Accessories"" add-on for $1197 something called Apex that's some kind of GPS/Tracking/Recovery system he boasted is for Android and will soon be for iPhones too (we told him it's useless because my wife has a Windows phone). 

My wife asked what the interest rate was because it wasn't on the sheet they printed out and Stewart said he didn't know but he could find out. He had us sign a sheet to agree that we want to try and make a deal and left the office. When he came back, he gave us more for the trade in but the numbers still weren't good enough. Again my wife asked what the interest rate was and Stewart said he can find out and left the room to talk to his ""boss"". He came back with a ""deal"" that extended the payments from 60 months to 66 months. 

Again my wife asked what the interest rate was and he began questioning why we are worried about a few more payments because we are getting a great deal (they ""increased"" the trade in value). I finally stepped in and said she wants to know the interest rate why won't you just answer the question. He still wouldn't answer (a clear sign they don't want you to know) and asked she sign a paper indicating we would agree to $xxx/month for 66 months. She instead signed and wrote ""I want to know the interest rate thank you"".

While he was out of the office I googled a website on my phone on how to figure out the interest rate and came up with 18%. Stewart came back from talking to his ""boss"" and said he won't divulge that information unless we sign the paper; at this point everything broke down and we ended all negotiations. He started complaining we were hung up on the additional 6 months and we were being ridiculous. 

As we were leaving i took a picture of the price portion of the first ""deal"" and upon doing the math they charged the Accessory Fee of $1197 twice!!!! (that's $2494 extra)

The story doesn't end here. After we left, Stewart began texting my wife over the course of the weekend until I told him to stop on Monday and that their conduct was unprofessional and shady.

Avoid this place like the plague. If they don't want to divulge information you are entitled to, they are hiding something (he admitted in a text message that the interest rate was about quadruple what she was going to get through her credit union). No add-ons should be forced.",1.5
172,"May 22, 2015"," First it was my own fought for not walking out of the deal when the Jeep showed up with an aftermarket top and not reading the bill of sale and other documents closely. Reference the top I asked myself after seeing it if I would have gone ahead with the deal had the salesman been upfront and honest about it. The answer was yes but definitely felt slighted.  I am 56 years old and have bought allot of cars and numerous houses, years ago was nervous and double checked everything. Should have maintained that vigilance but lost it somewhere along the way, probably because most people are honest and have integrity. Unfortunately the finance person, Mr. Zimmerman I believe, reminded me there are still scam artist and unethical peope in the business. NO WHERE during the purchase did anyone mention ""Blue Steel"" or what ever you call it, nor did anyone mention any protection plan, other than the extended service plan and oil change program. Upon reviewing the documents the next day I found three charges of $399 added in. I called and spoke to Kirk W, after much ado he gave $600 of the $1197 back. Mr. Zimmerman is a very good shyster, with his story of heading to his sons baseball game as soon as we were done, quickly grabbing papers as soon as I signed, pointing to where I needed to sign while I tried  to look over docs. Yes, its my fought, just couldn't believe someone like that would work in a reputable dealership. According to the signs it was all recorded, take a look. At least it will not happen again.",1.8
173,"May 04, 2015","I've bought a lot of new cars, and had some excellent experiences, but this is the best one yet. Mitch Merkling and the rest of the staff were excellent. Mitch was polite, responsive and very knowledgeable. I will be going back to Mitch and Grapevine Dodge/Ram for my next purchase.",5.0
174,"April 28, 2015","I went to 6 dealerships including 3 other Chrysler dealerships and I knew I loved the Jeep Wrangler but I couldn't find a sales person or dealership I was comfortable buying from, until I met Mitch Merckling at Grapevine Dodge. He was extremely nice and knowledgeable. No pressure and there is nothing I would have changed about the purchasing process other than not visiting the other dealerships. If you are buying any Dodge Chrysler Jeep or Ram product in Texas PLEASE save yourself some time and a headache and go see Mitch Merckling!",5.0
175,"April 14, 2015",Very good experience with Lewis Diaz. He worked hard getting us what we wanted. Very professional and listened to all our request. This is my second vehicle that I have bought from them and I would recommend the dealership to anyone looking for a good deal...finance manager also very good and professional......,4.4
176,"April 07, 2015","Had such a great experience with Mark L from Jeep Grapevine! Made the process so easy, would highly recommend coming to see these guys. Proud owner of a new Wrangler! :)",5.0
177,"March 01, 2015","My wife and I visited the dealership this weekend looking for a used truck. We found two trucks that interested us online at this dealership and made the drive to see them. One of the trucks was exactly what we wanted and we were ready to make the deal. 

I was already on my iPhone completing a financing application with my bank when our sales person walked back into the office with the ""deal."" It seems the manager was nice enough to INCREASE the price of the truck by about $2,000. We were told it was some ""Blue Shield Protection"" that had been added to the truck. An extra clear coating on the truck to help protect it........

The truck was advertised at a certain price, but when the salesman presented us the numbers, that price had gone up. When I complained about that, I was told that the fine print on the website pricing states that dealer added options may increase the price. I went back to the website and read it thoroughly, nothing about dealer added options changing the price. It did say this ""We promise a no-hassle, no-haggle experience."" Yea - right!  

I needed to stay under $500 / month in payments and the ""new deal"" I was offered was $675 / month, and I had to include a downpayment to get that rate.  I got upset and we started to walk out. Our salesman returned to the managers office and came back with a ""deal"" that took it down closer to about $600 / month. We walked out of the sales office and headed for the car. 

Our sales guy followed us out to the parking lot and asked for us to give him another chance. I told him that he already knew what we needed to get the deal done with us. We sat in our car while he went back to the manager and then returned with another unacceptable deal. Seriously, if I paid the advertised (online, and actually posted on the car) price, paid cash for TTL, then I would have been at $500 / month already. 

When we arrived home, a good 30 miles later, there was a message on our voice mail from the salesman. He thanked us for coming in and then said he really wanted to make the sale. He asked if I could call him back and let him know what it would take for us to purchase that truck. I did call him back and apologized for our exit as I was getting pretty upset. I told him that he already knew the deal we needed, and he said ""let me talk to my manager and then call you right back.""

You are not gonna believe this ..... When he called me back the deal was at $515 / month with no money down. It seems that the truck actually hadn't had the ""Blue Shield Protection"" installed after all. Surprise, surprise. 

After we got home, I began checking out the reviews about this dealership's practices. So many people have had the exact same experience we did - the price changes all of a sudden from the advertised price. I really don't understand why Chrysler doesn't do something about this. ",1.4
178,"January 16, 2015","This was my second purchase from Grapevine Dodge.  I bought a 2014 Dodge Charger R/T and traded in a 2014 Dodge Challenger Redline.  I have to say thanks to Allen in the finance office who was the only finance manager that was able to get a deal financed.  The finance managers at Holt, Allen Samuels and Moritz were useless.  The interest rate was even better than I was expecting.  I have only had limited experience with the service department but it has always been positive.  

Here is where they fell a little short.  They offered me the lowest trade in value of any dealer I shopped including Chevy and I purchased the car from them less than a year ago.  They add a $1,300 plus protection package to every vehicle of dubious products and its mostly dealer markup, so be prepared for a hard negotiation.  

In the end they did get me the car I wanted at the monthly payment I wanted so I would recommend them especially if you have a low FICO score.  If they really want a five star rating from Chrysler they need to tweek their sales practices slightly.  Do yourself a favor and stay away from Holt!  pure slime",4.0
179,"January 10, 2015","Brandon was are salesman who was great! The truck we wanted was online but no pictures so I called and Brandon sent me a few great pics of the truck. The next day we showed up to drive and within 15 minutes after the test drive we were just waiting to go into finance. They gave us a great offer on our trade in and the negotiation process was fast and the easiest I've ever done, and I've bought a lot of cars. Brandon was great and we will send people his way!",4.8
180,"December 31, 2014","My title is the tip of my iceberg of complaints about this dealership. 

I went in for one specific car they had listed and was never shown it. Instead the sales rep took it upon himself to decide what I wanted in a car - and made some piss poor choices in models at that. He never once took into consideration the details I told him I was looking for in a vehicle. So for wasting my time and insulting me I LET him show me the ins and outs of every single vehicle he brought out to show. When he ran out of vehicles I walked away. 

He asked why, and I simply stated ""Out of all the cars you showed me today- the one vehicle I requested was NOT in the line up."" He back tracked trying to save face by stating that the vehicle was no longer available so he wanted to show me his other inventory. (WHY DID HE NOT TELL ME THAT WHEN I ORIGINALLY ASKED??)

Infuriated I got in my car and drove away. Still wishing for the vehicle I had my eye on, I decided I would check online to see if the vehicle was still listed.- IT WAS! I used the online chat to inquire if it indeed was still available and on the lot. The online rep confirmed that IT WAS!

By now I'm ready to flip my desk over. I pose as my fiance and give them her contact info for a sales rep to contact us.

Lloyd Yancy the Pre-Owned Sales Manager contacted her asking her for the info on the vehicle she was interested in because he ""lost it."" She responded with the specifics. ... Its been 3 days and she has sent 3 follow up emails and has revieved NO CONTACT. No, ""Let me double check my inventory for that vehicle and I'll get back to you"" response or phone call. 

All in all the WORST experience and most unprofessional, unsympathetic staff I've run into.

P.S.- To elaborate on my title... When I arrived,  that is exactly what I heard the closing finance rep say to another employee as the door was closing as I entered the dealership. Like I said piss poor staff 
",1.0
181,"September 22, 2014",I am a First time buyer and I have had my Chrysler 300 for 52 days. I have to replace both CV axles and on top of that my car will not come out of park.  I was told that I can pay $400 to fix the CV axles.  When it comes to  being stuck in park they want me to tow it up there on my own expense and charge for looking into and fix it. I talked to the Manager and explained the situation but him and the service center keeps passing me around and ml not trying to resolve this issue.  I rate them a zero if I could! ,1.0
182,"September 16, 2014","I received a mailer from Grapevine DCJ with several offers, among them was 0% for 72 months as well as $4000 down payment assistance (the 0% offer required a max LTV of 90% and a minimum credit score of 720, but both offers were good to be used together. If I used the $4k down payment voucher, I couldn't take advantage of any other rebates). I was looking for a brand new Grand Cherokee V6 4x4 with a sunroof. They didn't have the car there and I was told it would be at the lot on Monday (I went out there on a Friday evening). When it came down to numbers, I was told I needed $7800 and change to be eligible for the 0% offer for 72 months. But since I was about $1k short of that mark, they offered me 3.9% which I refused due to my 790 + credit score. Then they offered me 3.5% which I refused as well. As I was leaving the dealership way past 11 PM, the finance director came out and told me that he'll work on the deal over the weekend. The salesman called on Monday and left me a voicemail saying ""boss says you win."" I called him back and the offer was 2.9% which I refused as well. I visited their website and noticed that they were offering $6100 off MSRP on 2014 Grand Cherokees. I informed the salesman about this and how the $6100 off MSRP will make me eligible for the 0% for 72 months, since that’ll put me at around $8200, an amount that includes my net trade. He told me he would talk to the manager and call me back but he never did. I decided to reach out to the internet manager who emailed me back and told me the car I was looking at had already sold. First of all, I was looking for a brand new car with rather standard features at a dealership that sells these cars. I asked her about that and she said they can't give the car away. I stated that the $6100 off MSRP and 0% offers were good together since there was nothing on the website or on the voucher that said I couldn't combine those two offers. I realize that if I use the $6100 off MSRP I wouldn't be able to use the $4000 down payment voucher, per the fine print. But the 0% and the $6100 were valid together due to the fine print not saying otherwise and due to the fact that the dealership was previously ok with using $4k and 0% together. The only reason I went to the dealership in the first place was because of the mailer. My frustration is that they won't give me the deal I qualify for but would rather give me a higher interest rate, which is completely wrong. One of the many ways dealerships make money is based on the interest rate a client accepts. Banks will offer a rate to the dealership along with a rate cap. This means a bank can offer 1% with a 3 point max, which means the dealership can turn around and charge up to 4% and guess who gets to keep that 3%. This dealership gave me a printout that listed $995 – destination charge – as part of the price of the vehicle. However, the bill of sale had a $500 fee on it with no explanation. When I asked about that $500, I was told it’s a fee the dealership charges “to locate a vehicle.” Even though I got them to waive that unnecessary fee, I ended up not buying from them since they will not offer the deal I qualify for 150%. Please be careful when doing business with these guys as they’re guilty of fee packing, rate hiking and many other shady practices.",1.8
183,"September 01, 2014"," unless you like being held hostage for two hours as they attempt to trick you into horrible finances. Most UNETHICAL UNPROFESSIONAL experience I have ever was had with Used Sales ""Manager"" (If he even really is one. Website says differently.) Adrian Garcia.
 I was helped initially by a salesman named Nick. I was interested in trading in my Chevy Malibu for a 2013 Dodge Charger R/T. We did the test drive, I loved it, and it was in my price range. He took my keys to have my Malibu appraised and came back with an initial finance offer of 6.9% over 72 months. I told him what I was paying on my Malibu and that based on my credit score I should qualify for a lower APR. He said he would ""Go fight for me."" He returned with his ""manager"" Adrian who promptly offers me a lower payment. ""Great"", I thought. However, when I asked him what APR that it was based on, he told me 5.9% for 84 months. Yes, you read that right, EIGHTY FOUR MONTHS. I told him the price was great but I knew my bank would offer me a much lower APR so I would go see my banker and comeback on Tuesday with the financing in place.
Adrian kept leaving to ""see what he could do.""  Each time he would give me an offer with a lower APR it had a higher down payment or vice versa and immediately asked for my signature promising to buy the car. This went on for near an hour. Each time, I requested my keys and was IGNORED, as if they had some sort of legal right to keep my property from me. I'm a grown man and I was with my fiance! It was the most degrading experience of my life. I put the numbers into an Amortization on my phone and kept making the point that my total cost of vehicle wasn't changing (It ranged between $45K and $50K, on a $29K car, as if I were some kind of idiot!!! Simply INSULTING)  Adrian several times demanded my debit card or a blank check and wanting me to initial or sign, promising to buy the car. 
Adrian became increasingly frustrated and began speaking very disrespectfully to me in front of my fiance. Finally he comes back with the offer sheet covered in all caps writing in sharpie marker that said ""OK U WIN 60 MOS @ 2.49%"", as if it were I being the jerk to him and not the other way around. As he does I see Nick, my original salesman slip my keys into his pocket. I finally had the correct offer but holding my keys hostage right in front of me was the last straw. I asked for my keys immediately and Adrian shouts at me ""Whatever dude, go see your banker. You win!"", and stormed off. Needless to say, we got the heck out of there.

Somehow throughout the negotiation process, my trade-in value went from $10,000 to $12,500 and the ""Best rate they could get me"" went from 84 mos. at 6.9% to 60 mos. at 2.49%. Ridiculous way to lose a sale, Adrian.

 HIGH PRESSURE UNETHICAL UNPROFESSIONAL SALES DEPARTMENT. Buy from Carmax if you want to be treated like an adult.",1.0
184,"August 15, 2014","Worst experience I've ever had at a dealership. They are overpriced, the customer service was awful, and they damaged my car then refused to take responsibility when I brought it up to them. I will never be back and anyone smart will stay away from there as well.",1.0
