,Date,Reviews,Ratings
222,"April 07, 2013","Obie Abbor (139482) was very friendly, accommodating, and very knowledgeable as to what I was looking for when I decided to purchase my new Dodge Ram 1500 4X4.  He and the sales Manager made it very easy to decide on the purchase/financing.  I will definitely recommend Grapevine Dodge Chrysler Jeep to anybody who is looking for a new Vehicle.  Everybody who I came in contact with was Very Friendly.",5.0
223,"March 24, 2013","Danial G 139482 was very professional during the sales process and conducted business with enthusiasm. He made us both feel welcome
and assisted us during the entire process with any and all questions we had which were asked and answered quickly w/o reservation.
Now that the sales portion of the entire Grapevine DCJ experience is behind us, we look forward to a continuing relationship in the future for the service and maintenance portion of the deal. We will keep y'all posted...",5.0
224,"March 21, 2013","Nona (Nona James 139482) is my new service representative at Grapevine Jeep. From the initial visit, she was very friendly and attentive. I had a recurrent issue with the car, that had not been resolved. She listened to the description and promised that this time the car would be fixed. She kept me informed and she did get the car fixed. I was very impressed with her and the care of my car. I would highly recommend her as a service representative. ",5.0
225,"March 15, 2013",Peggy Chaney R987654 did a great job in taking care of me and my 300.  In and out quickly with alot of attention to detail.  Even though it was warranty work she treated me as her number 1 customer.  I will definitely ask for her service again.,5.0
226,"March 03, 2013","I would like to thank Peggy for her great help and friendly approach with me .... she is trust worthy and professional ..... Peggy is a great star for Dodge dealer in Grapevine , Tx.",5.0
227,"March 02, 2013","Entered the dealership to scan for any possibilities to trade in my fairly new Jeep Grand Cherokee for a new RAM truck. And it was Collings Ngoma who helped me. He is in one word a true salesman and this dealership should go all the way to keep a guy like him in the team. Energetic, a lot of WOO and although he didn't have all the answers of powers to satisfy my questions and price demand...... He got it work out. Great guy. And as we both speak French we could practice that language. So thanks for the service and the solution we found! Great team! 
And great salesman!



139482
",5.0
228,"January 18, 2013"," I am a return customer I have purchased three Jeeps in the past.I traded my 2012 Jeep wrangler for 2013 Jeep Grand Cherokee. I did not drive this jeep,it had 875 miles on it,I was never told about the mileage,did'nt find out until the next day when I found the oddometer the odometer is small on the jeep,I went back to the dealership and asked about the mileage,I was told by the sales person (Collins) that he had told the sales manager (Chad E. Ivie),But I was never told of the mileage,I was then told by the salesman that it was a demo.I asked to speak to the sales manager (Chad E. Ivie he told me they would give me a Grand Cherokee coffee mug to make up for the mileage on the Jeep. (Value of the mug about $6.00.I then talked to the director of excellence (Jude Ross)She told me another story about the milesge she said they bring in vehcles from different dealerships and have them driven to their dealership)She told me it was cheaper to have them driven then trailered) She asked what she could do to fix the problem I told her to that it was a used Jeep they sold me,and I told her that I thought a refund of $1,500.00 would be in order,She then told me that would never happen End of story.I have since wrote to Chryser about this experence,I am waiting for a reply.The Jeep Wrangler I trade in I had for eleven months and had 7,500 miles on it.I will not buy another vehicle from from Grapsvine Dodge. If you plan on buying from them be sure to check the mileage.
       
                                                    ",1.8
229,"January 09, 2013","This is the worst dealership I have ever dealt with. They are very, very dishonest from the salesman to the top management. They don't follow thru with anything at all they promise. I would not walk, but run from this dealership. From the very begining I  advised them I was looking for a better, safer, longer lasting vehicle,limited income
 for my daughter, single Mom(very limited income), grandsons 2&3 yrs(time of purchase),the van they were driving had appx. 175,000 miles, but pd for. Started to look, I had thought since this was a large dealership, had the Nissan Quest that I was looking for, low miles supposely apprx 50,000, found on their website. Went and looked, drove the van, inside not cleaned, but promised they wld clean, 50,000 miles ?????, dvd player working in the vehicle. It appeared & I was assured numerous times it would be a lot better, safer vehicle, was checked thoroughly by their mechanics. I almost walked away and wish I wld have. The salemans kept preassuring me, stating the van they were currently driving was not a good vehicle wld not last long & we really needed something  more reliable, safe & lower miles for my daughter & granchildren so they would not get stranded in the street. After 3-4 days, sev.long hrs at their office being hounded, I finally caved in, after being assured numerous times, this vehicle wld be so much more reliable, safer & better vehicle. We agreed on price from internet $12,000. approx.& discussed warranty in great detail including price, financing. Once in finance dept to sign docs price had jumped to $14,000.00 appx. when I had refused to sign, they dropped the price, to the orig  price agreed upon. Last minute was advised cld not finance warranty with van, cld not afford(with my limited budget, I wld be paying for this all myself). I was advised by finace dpt, I cld then mk monthly pymt for 24 months(directly to the maint co) this wld be manageble, dwn pymt was not, to keep the deal head of finance pd dwn pymt, signed the deal, then advised cld only do 12 mos, which was too much cld not keep addit monthly amt, Tripled $$$. I was told it was to late, I already signed docs. & I could not back out of the deal. I had asked them to clean vehicle, made 4 trips apprx 80 miles rnd trip, still never really cleaned inside, nasty. Within 2nd wk aft purchase dvd stopped working, wld be appx $1,000.00 or mr to fix(no $$ to fix, still not working)had cont upper management, was directed to manager of service dpt, which promised to look at and fix, upon initial contact, lft numerous messages to set up date & time & never returned calls. Interior lights all quite working apprx 8 weeks after purchasing(not a fuse, told electrical issue $$$$ to locate) After driving vehicle appx 10-12,000 miles, had to take to nissan dealership due to the timing chain went out, appx $1,700.00 to fix, was advised by mechanics very unlikely for this to go out on a vehicle if it had 60,000 original miles, drove another appx 15,000 miles computer chip went out,apprx $2,500.00 to fix, this issue again advised, very unlikely for these types of issues on a vehicle with  less than 80,000 ORIGINAL MILES. Over the course of time numerous sensors have gone out costing again $$$ to fix which I did. Trouble with lights, steering, brakes and numerous other items. This van has been very unreliable, unsafe, broke down  more than it has been running. We have only driven this vehicle less than approx 35,000 miles with all of these issues, not counting smaller issues I did not take the time to discuss. I wish I had trusted my instinct,ran & did not trusted these folks.  We went from a vehicle totally paid for($4,000) more miles ???, but had no major breakdwns I was trying to avoid due to high milage, to a newer vehicle, less miles, no major breakdowns for sometime, reliable and safe I went in debt for $12,000.00 initially, then costs $$$$ for major & minor repairs, for a vehicle driven less than apprx. 35,000. Vehicle now has apprx 83,000 miles has been broke dwn past year more than it worked. Tried numerous times to get assistance at dealership, but to no avail..This company appears to have no morals,or care who they take advantage of or ripoff. ",1.0
230,"December 31, 2012","Everyone seemed friendly in the beginning, but after being hassled from 8:45am-3pm and the salesperson ""trying to get the best deal for me"", my opinions changed. They try to act like they are working in your best interest and take much longer to ""lower your monthly payment"", when they are really just wasting time walking back and forth. Obie was becoming a bit too pushy for my taste, even when I told him I had a set budget. 

Tip: When going to a dealership, go in with a set price for what you are able to pay for the TOTAL cost of the vehicle, do not focus on the monthly payment like dealerships try to do. Ultimately, it is the total cost that matters most.

Look at another dealership. The service dept here seemed pretty friendly, as they were constantly making sure I was being helped. Reception did not look very friendly and some of the other salesmen looked sleezy.",2.2
231,"November 12, 2012","Long time jeep owner and I wanted to purchase a new Wrangler Unlimited.  We had a Yukon for trade in and the staff at Grapevine was fantastic to work with.  They really worked hard to earn our business and were friendly the entire time.  Unlike most places, the 'ordeal' of buying a new car was not painful at all and we drove away in our new Jeep very, very happy!",5.0
232,"November 05, 2012",Awesome experience. Helped me out getting me into the car I wanted!!!! Terrence was very friendly and knowledgable about DCJ vehicles. Thank you for the help and I will be back for more! ,5.0
233,"October 22, 2012","Worst experience I have everhad buying a vehicle.  The deal kept changing and these are not people of their word!

I would drive any additional miles to another dealer.  I will not be going back for service on my 2013 new purchase!",1.4
234,"September 03, 2012","Wow! Where do I start. My Fiance Sebring needs new brakes so she tells me she is going to take it to the Chrysler Dealership that she bought her car from. I told her that everyone that I know says that this Dealership Sucks from Service to Sales. And has since it Opened (Parra's-Lithia-Chrysler-Current Owners). 

She convices me that she has gotten her oil changed there...WooHoo! 3 days before she brings the sebring in her Drivers side window quits working. Nice-Not. 
I recomend she take it to another dealer again! 
She says she still is bringing it to the dealer. 

So I remove the door panel to determine the repair of the window. Is it the motor(easy unplug-3 bolts- plug new one in) or major problem Window regulator is jacked. Of course its the window regulator. Call for part $57 bucks labor to install $188. Brake job is on special $190.

She drops her car off to the dealer for repair.
They call the next day and state a plastic part is missing for the repair of the window. She tells them its just the screw top of the push lock. Never telling her anything Else. They ask her if its okay to assemble the door?? She say sure. It just screws on so you can. push to lock or pull to unlock door. 

We arrive the next day to pick up car on Saturday.
Door is assembled, and they hand us the lock rod that goes inside the door.
We refuse to take delivery, telling them they need to fix it.
Also to call us the next day.
You guessed it no call
And they did not repair the door.

ALSO ASKED WHY THERE WAS A $40+ CHARGE FOR SHOP SUPPLIES + BRAKE FLUID + CLEANER.
I'm okay with the Brake Fluid and Cleaner.
BUT $40+  FOR SHOPS SUPPLIES??
I QUESTIONED THEM - TO GIVE ME THE EXACT SUPPLIES USED.
THAT I AM PAYING FOR.

THEY COULD NOT GIVE ME AN ANSWER.
I ASKED WHY THAT WAS NOT DISCLOSED DURING THE ESTIMATE.
THERE RESPONSE WAS - &quot;OH ITS NORMAL PRACTICE - WE SAID JUST SHOP FEES&quot;
MY RESPONSE WAS WHY DID YOU NOT GIVE US AN EXACT FEE.
THERE RESPONSE WAS - &quot;SORRY IT'S USUALLY 10%&quot;
MY RESPONSE - GEE THE BILL IS $400 SO YOU COULD HAVE TOLD US 10% OR 40+ BUCKS.

GRAPEVINE CHRYSLER DODGE - TEXAS DOES HAVE A DECEPTIVE TRADE PRACTICE LAW.....P.S.

So back to the repair of the Lockrod. I show up the next day on my lunch break to talk to the service manager. I ask him if the door has been repaired his answer is No. And that if I wanted it fixed, that I would have to pay for a $3.00 clip missing and $125.00 in labor to remove door panel and reinstall, Because I had lost it during the removal of the door panel. 
MY RESPONSE WAS: The lockrod was never removed from the door. If it was miss placed or had come off it shurly was in the door or the Tech took it off.
I WAS THEN CALLED A LIAR and it gets better.
Why was I there and not my Fiance? The service manager tells me I have no right to be there because I did not own the car.

MY RESPONSE; LET ME GET THIS RIGHT!
YOU HAVE NO PROBLEM.....TAKING MY MONEY
AND THE REASON I'M HERE IS BECAUSE YOUR TRYING TO RIPP MY FIANCE OFF!

YOU JUST TOLD ME IT NEEDED A $3.00 CLIP TO FIX THE LOCKROD??
SO WHY DIDN'T YOU OFFER TO DO THAT WHEN THE DOOR WAS OFF??
WHAT A BUNCH OF IDIOTS.
AND NOW YOU WANT TO CHARGE ME $125.00 TO TAKE THE DOOR PANEL OFF AND REINSTALL.
WOW!

So I left with the Sebring unrepaired.

Called ALLEN SAMUEL DODGE - ALLIANCE.
Told them of my situation. Asked them how much to install lockrod.
The Service advisor said he would call me back with Estimate.
10 min later Jeff calls me.
He is confused, He states their is no clip for the lockrod.
His tech says that is slides in a hole on the lock panel, slides up and locks in place. Labor to install is $65 1/2 labor. So I bring the Sebring by on Thurs. They install the lock rod in 45 minutes while I wait.
BEST NEWS!
THEY DON'T CHARGE ME.
Jeff, says just keep coming back. And that he is Sorry about our BAD EXPERIENCE at the other DODGE store.

MORAL TO THE STORY.
GRAPEVINE CHRYSLER DODGE has the worst customer service and will/did RIPP YOU OFF!
 



",1.0
235,"August 25, 2012",I have been sitting in service waiting area now for 2 hours and counting.  I just came in to have my tire patched up...apparently this is an extremely labor intensive job. No updates on what is the status of my vehicle since I arrived.  Piss poor!,2.2
236,"July 22, 2012","The rating is based on my sales rep Gerardo.  Although, some of my experience was typical for what you would expect from a dealer, i.e., taking hours and hours anytime a ""manager"" needed to approve some part of the negotiation, Gerardo treated me with enthusiasm, respect, and I felt like he really was looking out for MY best interest.  I have already recommended him to two different friends.",5.0
237,"July 16, 2012",I appreciate working with Terry on an issue with my 2011 Jeep Grand Cherokee.  As a working mother of two I appreciate someone calling me with updates and an ETA of when the car would be ready.  TJ has been excellent and I would not thnk twice about making my next service appointment with him.,5.0
238,"July 14, 2012","I wanted to wright and tell how happy I am with my new 2012 Power Wagon. The last truck I bought was a 2006 1500 Ram 4X4. After 6 years and 180,000 I knew it was time to upgrade. My wife and I Just bought her a new 2012 Jeep Grand Cherokee Last December with Jude Ross. Knowing how happy we were with that we knew we should return to Grapevine Dodge to see what they had. We were hoping to run into into Jude, but we were informed that she no longer worked in sales. I have never been one to enjoy talking to sales folks so I was a little reluctant to meet someone new. Once we were informed of this they introduced up to Sheila Bozeman (189769) to which I found it to be a very pleasant experience. As we walked the lot looking at trucks we found a very nice 2012 2500 4X4 that I fell in love with. As we looked it over, Sheila took us out for a test spin and I knew it was going to be my next truck. I didnt realize at first (it was late evening) that it was a Power wagon. Ive always loved Power Wagons since I was a young kid. I was quite excited to finally own my own. I would like to thank Sheila Bozeman for making it a great experience. I think Grapevine Dodge has a great team and I'd like to thank you for both of our recently new purchases. Keep up the good work.

-Ron Fergeson

Cheers!",5.0
239,"July 02, 2012",We worked with Ron Jones. He was very energetic and we got a great truck. There were a couple small paint chips and they were very quick to arrange a time and fix those for us. Even gave me a rental so that I could get my wife to her doctores appt. Excellent experience all around! 231776,4.8
240,"June 27, 2012","My 1st visit to dealership; after looking at Jeeps in the lot for 20 minutes I finally went inside to requests assistance. It was mid-April 2012, I, and all other customers were exposed to an extremely angry manager/ executive at the dealership that screamed and ranted at the top of his lungs for the 40 minutes I was there. It was very embarrassing, unprofessional, classless, and way beyond excusing under any circumstance. That was when I realized I would never buy a car from them, I was just happy my wife and kids were not exposed to that volatile scene! It appeared the 3 bad stories from friends who shopped there prior to my visit were spot on. I only stayed because my keys were with the manager evaluating my trade-in. I was most embraced for my sales person Jude Ross who was most pleasant and should rethink who she works for. On a separate note, the price quoted on a new wrangler was not competitive as I soon found out via cars.com, but, that has no bearing on my view of this dealership other than I thought it was humorous that the internet priced lost leader,was not exactly the final sales price as advertised (please add another $600-800). My second and final visit came 6/26/2012 when I set up a 2 PM appointment to get an oil change on my recently purchased (4/2012)Jeep Sahara from Greenville Chrysler (I highly recommend shopping them, great experience and the price quoted on the internet was the final price paid). Since I purchased the 100k 6 year extended warrantee and live in Grapevine, I reluctantly thought I would at least give the Service Department a try, how bad could it be?
Well the answer there is a very loud and firm Ditto! I was assured I could get in for the oil change at 2PM which I told the service rep on the telephone was very important since I was coming from Irving during my 1 hour lunch break. At 2PM I was met with a condescending and irritated serevice tech named TJ; who was more concerned with who would possibly tell me I was getting in any time before 3PM than trying to rectify the situation. TJ lacks the basic protocol and customer service assets to be dealing with customers and the awareness necessary to handle the situation as a customer service professional as opposed to unqualified amateur. As I look back at my 2nd and last visit to Grapevine CDJ I get the feeling that this basic lack of customer experience seems to be common there, maybe that manager screaming that day was the man in charge which would explain my experience and others I have heard from. I get a lot of questions on my Jeep everywhere I go, I now make it a point to share the respect I have for the product and make sure I steer them far away from Grapevine CDJ!  Matt Baulier, Grapevine Texas
",1.3
241,"May 30, 2012", Went in to look at new Ram 4 door trucks. I did not have alot of knowlegde of all the different models by Dodge.I have only drove Chevrolets and GMC trucks for the last 20 yrs.Luckly I had a salesman named Cameron Grant that is just starting off in this field of work.He showed me and told all the differences and dealt with me for 3 days.We finally got a deal done with alot of help from him.If you are looking for a salesman that will go the ETRA MILE I recommend asking For Cameroon Grant  employee#6510426 !,5.0
242,"May 27, 2012","Beware of 11,000 rebate on RAM trucks.it is a sale gimmick.They will give 11,000 off but they won't tell you about dealer install and worthless 3 years maintanance deal which combined is 5,000 bucks.So in reality you are only getting 6,000 off the MSRP not 11,000 .I was at Grapevine dodge for 4hrs and when it came to signing paperwork I noticed that the truck instead of being 25700 dollars was more like 29,000 so when I asked how come it was 4,000 more then we agreed on they came back and said how 5000 includes dealer install.Plain and simple I was lied to and I left.I got the same truck with center console shifter and bed liner which grapevine dodge did not come with for 27,200 from another dealership.Be carefull this guys are dishonest and check the papers before you place your signature.",1.0
243,"May 20, 2012","I went in yesterday to buy a Jeep. I was told that I could get 0 percent interest and the only fees would be tax, title and liscense. When I got back to financing, there were charges added on that were not agreed upon. When I asked about the charges, I was told everyone has to pay them. I already had the coverage with my insurance company with the exception of spill protection. It's a jeep with holes in the floor, why do I need that? Buyers beware of added charges! ",1.0
244,"May 16, 2012","I came in for an oil change and was greeted by T.J. White.  He was great, told me I would get a hand wash for my car and said it would all take about 45 minutes.  It did. They checked my car and told me a couple of things I should watch, but never pressured me to get it fixed while I was there.  Every one was friendly and I will definitely be back.  (RO #1212463).",5.0
245,"May 14, 2012","Mario was very helpful and very and very patient. Although my wife and I knew what we wanted. We still wanted to try a few other vehicles. He went and got each vehicle never acted as if it was a problem. He was very knowledgeable of the Jeep Wrangler and answer all our questions.
When it came to the price he worked with us and got us the maximum for our trade in, as well as got all the rebates we had coming to us. He also explained all the financing options and warranties.
Mario is a credit to the dealership.",5.0
246,"May 05, 2012","Service Advisor: Nona James
RO Number: 141929

The service repair was completed and coupons helped reduce cost. Nona has always been a courteous professional service advisor and I recommend her.

This service experience could have been better in a few ways:
1. Nona was not available when I brought my vehicle in, I didn't get the feeling of care but rather just get me signed in and I had to wait longer than I expected.
2. Due to circustances outside of Nona's control my vehicle was in the shop for 3 days when I expected 1 day.
3. The only communication I received on the status of my vehicle was after I called, each day.

",3.8
247,"May 03, 2012","I had a great experience working with Mario Guzman (6483633) at Grapevine Dodge Chrysler Jeep. He was a real gentleman, he did what he said he was going to do and he did those things when he said he would. He was very helpful in explaining all the bells and whistles on our new Jeep Grand Cherokee Overland and I would highly recommend Mario when you are looking to buy a new Dodge, Chrysler or Jeep. FIVE STARS for Mario Guzman and Grapevine Dodge Chrysler Jeep. Thank you Mario and BRAVO!!! Ralph Williams - Fort Worth, TX",5.0
248,"April 14, 2012","I recently purchased a 2012 Jeep Wrangler Unlimited Sahara in a color that I had searched the US for. Nino Mansour, 6208726 was my contact at Grapevine and after the entire process I can say that he provides great customer service with follow ups via phone call, texts, and emails. As I live in Virginia Beach and conducted the entire process long distance I thought that the great service would stop as soon as the paperwork was signed. That has been far from the truth. He continues to answer my questions with patience. I hope to meet him personally one day. If you are looking for an easy, non-pressure sale experience with a great deal then Nino is your person. If things change I'll surely update, but I doubt it will as it has been very good even three weeks after the purchase.",5.0
