,Date,Reviews,Ratings
53,"June 23, 2017",Thomas was professional and courteous through the whole process.  I didn't feel hassled or forced and he found me the exact truck I wanted at the price I needed.  Even after I bought the truck he stayed in touch to answer any questions I had about the vehicle.  Very satisfied that I choose Grapevine Dodge.,5.0
54,"June 05, 2017",Was called by one of the internet sales people last Friday. Asked if I was inquiring about a new vehicle. I explained not through this dealership. Tijuan was one of the people I spoke with on the phone. I explained that my credit wasn't in good shape. So I didn't want to shop for a new vehicle. He said don't worry about the details I'll take care of that. Went to the dealership Saturday. Met with two different sales people. Tijuan didn't show up until the middle of the deal. Right off the bat he says I need your wife to come in for the approval. I told him I didn't want to have my wife on this loan. Kept arguing that he only needed her income. That there is already an approval they just need to verify the income. I go and pick up my wife. They have her fill out an application. They said I would know Monday since the banks are closed. They said we'll call you at eleven o'clock? Monday. About 10:45 one of the customer service reps calls and asks why we couldn't strike a deal. I explained that I was still waiting for a call. She stated that she would have someone call me. Again they were suppose to call me. 12:30 rolls around. No call back. Texted one of the sales people I was dealing with. He said he would find out. 1:30 rolls around no call back. I decide to call the finance manager. He said he will find out what the hold up is. 2:30 rolls around still no call. Text the sales person again. He says it pending. Again I was told by Tijuan that the deal was approved. Now it's pending?? The sales person texts me back at 3:15 to tell me the deal wasn't approved. Again I was told everything was approved. So I wasted 2 hours for nothing. I bought one car from this dealership. Never again. Not recommend this place for anyone.  ,1.3
55,"May 17, 2017","** Useful information first **  If you plan on buying Mopar Lifetime warranty, google ""mopar lifetime warraty"".  There will be at least 3 legitimate website that will give you a quote online.  They will be roughly $1000 cheaper than what these guys offer.  Arm yourself with a knowledge before facing the battle.

Also, make sure your agreed terms are in the paperwork.  I cannot STRESS this enough.  They will try to cheat you if they smell you may be gullible.  If you want to know why I came to that conclusion, read on.

My wife bought a jeep wrangler while I was out of town, and since she was not good at negotiating, I dealt with them over the phone.  A guy named Andrew in Finance agreed to sell me $0 deductible lifetime warranty for $3500.  Upon arriving home, I noticed they did not give her a copy of the warranty contract, and that got me suspicious of a foul play.  I went online and retrieved her warranty on Mopar website, and sure enough, it stated her warranty was $100 deductible plan, which costs $1800 less than $0 deductible plan($2965 vs $4795).  I went to face them, and they had to cut me a check for $500 when I told them I am cancelling warranty (difference for what they were supposed to charge in the first place, not a penny more).  I demanded apology from Andrew for the deception, but the guy kept claiming it was a confusion or miscommunication, never really admit his wrongdoing.  The management got irritated and even hostile when I tried to clarify what really happened.  They don't seem to treat this fraudulent activity seriously, which suggests this may be a common practice for them.

One last thing, the trade-in they give you will be lower than the competition.  They tried to give my wife $10500 for her 2014 Murano.  They had to match the price when I told them the other dealer appraised it at $14000, a whopping $3500 difference.  Now they are selling it at $16991.  The starting price they appraise seems few thousand dollars less, so know your trade-in value at KBB, Edmunds, NADA before the negotiation.

Overall, this dealer was unpleasant, dishonest and highly risky.  I recommend driving few more miles to any of 4 other dealers in DFW area.",1.0
56,"April 13, 2017","Well long story short came in for a light on the dash, waited 15 min until they pretty much just handed me off to whoever. Tell him what's going on and his answer are pretty much one word response (yea, no, etc...). Also told him about the warranty I have and he said he will call and talk to them. I was there early in the morning at 6:45 so I was the first car to get looked at. Again was told I will receive a call regarding what ever was the issue within 3 hours. I was fine with that. Well 2:30 go by and I still have not received a call. I call asking for the status of my car so I can know how to get home from work and why I didn't receive a call. I was told by Chris he didn't say he would call me or my warranty. And that I would have to get a rental car in which they did provide me with one free. The car had a recall on my timing chain so they went ahead and fixed that also. Next day I'm at work about to get off and notice I had a coolant leak. Called the same guy, he gave me a tow truck number that would've charged me instead of them. Called the manager and he gave me the right number and more info that I needed about everything. Also I have big tires so I have wheel locks on my car. The key for the lock were in my cup holder. Got the car back and no lock is in sight. I call Chris asking if they have seen it and pretty much told me bring it up there so they can look in the car. That's the only thing they can do. 
, ",1.0
57,"April 08, 2017",My wife took in our jeep for some recall work the work was done supposeably washed taken to the lot with the lights left on set on the lot for three days she went to pick it up of course the battery was dead told her the battery was bad turned around and charged her for a new one but said they split the retail cost with her never taking responsibility for draining the battery to begin with won't go back,1.0
58,"March 24, 2017","I have had two issues with the service department within the the last six months. Bought my 2016 Charger RT from this dealership. I received two free oil changes part of my service package. Went to the service center to get my oil changed. Was greeted by one of the service advisors. Explained that I needed an oil change, and a tire rotation. She stated she would get a service advisor to help. I saw one service advisor with a customer, and one talking with one of the mechanics, and laughing. I waited outside for ten minutes with no one helping. I see the advisor that was laughing with one of the mechanics got up, and left. I proceeded inside. I ask the service desk if I could get some help. The advisor that was cutting up with his buddy said he as the only advisor here, and was busy. I then stated fine I will go to AutoNation to get my service done. Which were friendly and took care of me. I did complain to the general manager. Which had the service manger contact me. He did say that this is not how they conduct business, and to speak with him when I need help. Now to present day. I'm having issues with my stereo, and speakers. I called the service center today to schedule and appointment. A lady picked up the phone, and I proceeded to explain the problem. I asked if they have a loaner car program. She said yes, but the technician would have to diagnose the problem then they could give me a loaner vehicle. But the vehicle would have to dropped off Monday, through Thursday 7am to 10am. Looked at then everything could go through. So I work a normal job. I have to take off of work to drop my car off for warranty work? That makes no sense to me. This is the second time I have had issues with the service department. I'm setting up an appointment with AutoNation Dodge in Hurst where I can take my car anytime. They have taken care for me. ",1.3
59,"March 23, 2017",Absolutely great experience. I would recommend this dealership to everyone. Great staff and a beautiful lot. Plenty of inventory to choose from. Chuk Aluka was my salesman. Ask for Chuk Aluka. ,5.0
60,"March 23, 2017","I purchased my car at a different dealership. I went back for a problem, the dealership was under new management and all my records could not be located and so they would not reach out to our extended warranty company. In fact they had the audacity to try and say I had ""never"" changed my oil. That was so far from the truth that everything they said and did from that point I couldn't trust. So,  I went to Grapevine Dodge and got the service adviser Chris Martinez. He was awesome! He was so nice and empathetic to my situation. He asked for any outside records I had and he contacted the extended warranty company and he got my work approved. I was so appreciative that I decided to go ahead and do other standard necessary work on my vehicle, including purchasing 4 tires. I normally do not do this type of stuff at a dealership. But I feel Chris had earned my respect and trust. I cannot say enough about my appreciation that someone didn't just blow me off because it wasn't their car or their problem. Chris was different. I will go back when I need other work done. In fact I am looking at purchasing a truck and I will now consider a dodge now and at this dealership. I hope this mentality runs through out the dealership and not just in Chris. Right now they will get the benefit of doubt or no doubt on my part. ",5.0
61,"March 04, 2017","The ""list"" price is purposely misleading.  Didn't include ""fine print"" which included APEX vehicle management and other service costs. Then reached an agreed upon price including TTL, but that isn't what ended up on the financing.  I didn't examine close enough and ended up paying more than the agreement.  Never heard from ""management"" as promised to try and resolve issue.  Don't expect any change -- they got away with the trick.  ",2.0
62,"February 27, 2017","14 Jeep Grand Cherokee with 26,000 miles. Check engine light due to oil pressure switch, hvac system quits, & another recall on transmission electronics done. Cost me $924.00 with only the transmission being covered under warranty. Service writer and service manager ignored wife n I during pick up, didn't care that we bought there or lost another customer. 
Recognized that a dealer is only as good as the manufacturer they represent. In this case I strongly urge folks to check reviews such as this on both before buying, I wish I had. 
Case# 31145371",1.8
63,"January 25, 2017",I traded my car in a couple of times with grapevine dodge. The last time I went instead of trading it in they wrote it off now its on my credit. I put faith in them and its been turned upside down. Make sure you always double check any paper work that you do with them. In fact I still haven't received the paperwork I signed and its been over six months. They wont return my calls and if I call them they get an attitude and hang up.  I wouldn't recommend them to anyone.,1.0
64,"January 08, 2017","Grapevine Chrysler Jeep Dodge - Absolute crooks!  

I spent 3 hours negotiating a deal. After endless back and forth, we finally agreed on a deal which was $7,000 better than what they originally offered.  As we were going through that process, they tried to tell me I was saving $3,000 because I was only paying taxes on the difference between trade truck and new truck and not the full purchase price of the new one. Saving me money?  That is Texas state law. 

To put their stupidity into perspective, they understood that I was a 20 year banker (With experience in auto lending), I've purchased 4 $70,000 + vehicles in the last year and probably 30 over all. I'm not a novice. I mostly negotiate deals by phone and spend no more than 45 minutes at a dealer. 

Following that, it took more than an hour to get to finance and close the deal. The F/I manager was a decent guy, but initially tried to sell me a rate that was far more than a rate for which I qualify - almost 2% higher than what I'm currently paying. I had some back and forth with him and we got to the same rate I'm paying.  This had more to do with misinformation provided by the sales team than him. 

Next, we start reviewing the calculations. They apparently charge you $900 to walk from the showroom to the finance office.  The purchase price increased by $900 from what we agreed to which was also the price advertised on their website and cars.com. The additional charge was ""dealer adds"", one of which was a bed liner which the truck did not have. They could not tell me what ""adds"" were added and this wasn't disclosed to me until I was close to signing the note.  The Sales Manager came into the office to try to convince me that the dealer adds had value (again - adds that they couldn't itemize) and also to find discounts offered by the manufacturer  that they could apply to the inflated price to get me the price THEY ADVERTISED WITH NO DISCLAIMER!!!  

At this point, it was a matter of principle. I told him I wasn't paying 1 cent more than their advertised price and asked him to give me a yes or no answer if he was going to do the deal. He said no and I promptly left. 

These guys are incredibly dishonest and try to squeeze you for every dime. You must be a very shrewd negotiator, experienced buyer and disciplined to stand a chance of not getting screwed. Basically, it is like going back to the 80s and trying to buy a vehicle. Do yourself a big favor and steer clear of Grapevine Chrysler Jeep Dodge.  Make the trip to Bonham or Roger Williams in Weatherford.  Those guys will shoot straight with you.",1.0
65,"January 04, 2017",New car buyers watch out for back door insurance scams also used car buyer's beware be sure to look at paper work and leave with your contact and everything you signed ,1.0
66,"January 04, 2017","This has been the worst experience of my life. They will charge for multiple extended warranties then cancel them get the money sent back to their dealership but you will pay for it. If you have purchased extended warranties call and make sure they don't scam you. I have been requesting a copy of my contract since November 5 Rod is a liar so is Allen as well as moe People please be aware of this dealership they will rip you off ignore your calls hang up on you. Please don't let this dealership take advantage of you cause they definitely will. They scammed me for over 13 grand.., If I could rate this dealership below 1 I would!!!!!!!!!!!",1.0
67,"December 01, 2016","Stu (product spec) & Andrew (finance Mgr) treated me with respect and gave me great customer service this Nkack Friday weekend! The deal was ""crafted"" for me under the terms I requested. Give these guys a chance to ""craft"" a deal for you that will make this new year special! I'm turning heads in my new CHARGER Rallye!",5.0
68,"November 04, 2016","23rd of August I purchased a pre-owned certified Dodge Durango at this dealership. The price advertised on their website was competitive and after some discussions and two visits at the dealership (test drive, etc), I agreed to pay the advertised price + it was agreed a tow bar would be installed at no additional cost. 

The sales person was friendly enough, but during the entire process the dealership applied those typical annoying techniques of trying to get some extra dollars. (At first they ""by mistake"" showed a price much higher than at the web site, etc.)

Anyways, I was under a time constraint and needed to complete the purchase. I had been at dealership for hours and was getting tired. 

At the final step, at the finance dept, I made a big mistake. I was not paying enough attention. I assumed I was in safe hands in an established dealership, but unfortunately that was not the case.

A total of $2689 was added to the bill last minute! I didn’t pay attention, I just paid the total amount (plus tax of course). $1197 was added to the price for some APEX GPS I didn’t ask for. $895 was added for “certification” and another 3*199 for some added warranties. 

Until this day I have received no information about what I paid these added $2689 for and what value it brings me. No documentation came with the car and none has been provided to me despite several requests. No money has been refunded. As a result, the value for me is zero.

I paid an added $2689 for absolutely nothing. I feel taken advantage of, ripped off and I am surprised how this could happen. 

Be very careful if you are going to make business with Grapevine Dodge.
",2.4
69,"October 30, 2016","I went to this dealership with an advertisement that says they are willing to pay 120% of my NADA trade value. Knowing what they want for the vehicle on the lot, and how much my trade is worth, I go to the dealer. I drive the truck I wanted, and then they balusters my trade in. 

They offered me $4000 LESS than it's worth, instead of the 120% in the ad, and my truck is in immaculate condition. 

So, with that valuation being so low, it made about a $10k difference in the numbers making the deal undoable. 

Shady tactics to bring you in and get your hopes up based on that is why I'm giving them a bad review. Be warned going here.",1.6
70,"October 29, 2016","This dealership has rude, unprofessional salesmen. Management is completely dishonest. Their Finance department must be run by Lehman Brothers. Do NOT come to this dealership. Leave Dallas before you come here. And yes, I'm standing here waiting for them to complete my paperwork 1 WEEK later. They finally returned my call yesterday to say it was all done, just come in and sign. Guess what, it's still not done..",1.5
71,"October 27, 2016","                 Had made an appointment about two weeks ahead by telephone.     Was told the service would take about two hours to accomplish and that they could provide me transportation to and from the dealership if I didn’t want to wait.          My 08:30 Arrival was ok, good signage to the service area, however the entry drive had two orange cones set up with no obvious purpose.   Confusing.   I thought, am I to park near the cones?   stay away from cones?  weird.    Entrance to the building was slightly more confusing as the drop area is lined with 1/2 dozen clear windowed doors for offices of service coordinators.    Since most were empty, I took what felt like a shortcut to an open area with a receptionist.   I introduced myself and told her why I was there.    She asked me which person was handling my appointment and I said, ""hmm, I just got here.  I made the appointment with Patty on the phone"".   She said ""oh, Patty is just a scheduler.  Let me find someone"".     I was then introduced to Christy who wrote up a ticket, took my keys, set me up with a ride and said she'd call when my service was finished.      The courtesy ride back to the office was great.    Courteous, knowledgeable and safe driver. 
About 4PM, I started to be concerned about not hearing from anyone.   I was stuck at the office and was counting on the courtesy ride back.      I pulled up  the Grapevine Dodge website and the service phone number was clearly visible.    While unlocking my phone I suddenly get a pop up on the screen asking if I wanted a live chat with a girl who wanted to help me.     I stared typing in my question only to have the screen disappear and the chat end abruptly.    I guess I was too slow.     I got a second request, this time from “Antonio” wanting to know if he could help.    This time I typed my information, including my vehicle info and name on a separate file and pasted it into to chat box.    No more timing out! 
Antonio said “thanks” and asked my name which clearly informed me that he didn’t read my message.   I gave him my name again.    He then provided the service department phone number (the same number staring at me on the middle of the web page).   More time wasted.    No way this could have been a live chat with a real person although it made it appear that way.         
I then phoned the number, and after 17 rings a guy picks up.  I explain my situation.   He puts me on hold.  Upon returning, he says that I must speak with Christy about the vehicle and that she is with another customer right now.    He said she will call me when she is finished. 
After about 50 minutes, still no word from anyone, I decided I better just go there.   Obviously things are not going smoothly. I don’t have a vehicle, so I Uber to the service department and make an inquiry with the original receptionist.    She doesn’t have my paperwork but says I need to wait for Christy.     Well, Christy’s office is right there and she’s with a customer.    She looks very busy and has about ½ dozen service tickets on her desk.  I assume one of them is mine.    I proceed to wait about 20 minutes for Christy.  All the time observing guys walking in and out of offices, gathering for conversations, a few grabbed some items and headed out the door.      Nobody asked why I was there, if I had been helped.   One gave me a quick courtesy “how ya doin” while striding past.    It was clear that one person was taking the bulk of the load that afternoon.     Yes, Christy.  My Christy.    
When Christy got to me she apologized.   After a quick check on her computer she said she’d have to go to the shop and would be right back.   When she returned she reported that they hadn’t started on my vehicle but that they could get on it right away and be finished in a ½ hour.     I was so happy that they hadn’t touched it.     Based on the organization I was seeing at top, no way I wanted added exposure to the shop floor.     I told Christy to have the vehicle brought up, I would be just fine with this ending.     
In the end, Christy was good.   She worked hard to apologize for the dealership and its faults.    There is clearly a management or culture problem effecting this organization.    At least, on the service side.    I am glad it only cost me $12 for the Uber ride to save myself from future exposure to Grapevine Dodge.   
          ",1.7
72,"October 07, 2016","I purchased a certified preowned vehicle for $30,000 only to have to take the time to bring it back to the dealership to fix it in less than 48 hours.  Due to some apparent recall that was never addressed prior to selling the vehicle to me. I cannot believe the way the dealership handled it. I was told that I have to leave my vehicle there so they can tear out the headliner, seats and carpet.  And the sales manager said what do you want me to do?  I expressed I paid for the extra Warrenty so I wouldn't have to deal with this.  He said so you feel like your time is worth 420 which was half of what the special Warrenty that I purchased.  Adrian the sales manager just said will you wasted am hour and half  of our time to close a car deal.  Mind you I was already approved financially.  ",1.4
73,"September 16, 2016",THEY TELL YOU RIGHT THEN YOU GET APPROVED AND A MONTH LATER THEY CALL YOU AND TELL YOU THAT YOU WERE DECLINED AND THEY STILL ASK YOU FOR MORE PROVE OF DOCUMENTS DONT GO AND BUY THERE AND ALL EMPLOYEES WILL LIE AND MAKE UP STORIES ,1.0
74,"August 09, 2016"," We should have known when we had to actually ask for a salesperson to sell us a car.
Bought a  new Jeep Summit   was told to register with UConnect when I arrived home (300 miles away).   Registered UConnect and found out there was a safety recall from May 2016 and my Jeep had not been fixed!  Not only did they let me drive off the lot with an unsafe car for 300 miles, they did not tell me there was a recall!  Called the GM, only to get voicemail.  
I called Jeep customer service  to ask if this is standard practice.  They were not pleased with the recall not being addressed before selling the car. ",1.6
75,"June 23, 2016","Stereotypical used car salesmen. Don't believe the advertised pricing.  Just as other have reported, the dealership will not honor the advertised price.  They will require additional 3rd party warranty and/or other options that for me amounted to an additional $3342 on an advertised $16991 Jeep.  I wanted to pay cash  (advertised price +TLL). Sounded simple to me.  But they refused.  Stay away unless you are prepared to pay an extra 20%.",1.4
76,"May 22, 2016","I bought a 2016 Viper ACR and a Jeep Summit in the same day, about $ 190,000 worth of cars. STAY AWAY from this dealership. Everything about this place sucks, sorry, they do have nice plants out in front, oh and the ac was cold. Stay Away......",1.0
77,"April 11, 2016","Purchased a 2014 Dodge Viper off of Ebay, It arrived with many damaged items. The dealer paid us 6000 to keep the car. Unknown to us and never disclosed to us is that the font end of this car was repainted....
126,880 dollar car with no damage disclosure.

Dealer will not call us back and SRT brand has been no help whatsoever. This being our third SRT vehicle, we will gladly say that we will never purchase another one ever again...


Beware of this dealer, they will never call you back after they have your money...

Lying pieces of garbage.

Dennis Thomas was my sales person..


Cheryl Goodwin",1.0
