,Date,Reviews,Ratings
833,"October 08, 2015","I had a great experience buying my first ever Subaru. I had a couple of sales people because I kept coming back in to test drive vehicles (It was a hard decision lol!). Robbie Dominguez was by far my favorite sales guy. He was knowledgeable, not pushy, never rushed me or made me feel guilty about driving and re-driving cars, and he continued to provide assistance even after he made the sell. He told me If I had any questions about how to operate the features in my new car or set-up anything he would be happy to assist me and he has followed through with that. Also, he never bothered me after I left the dealership to contemplate my options. He made himself available anytime I had questions but never called and asked me where I was at with my decision like so many of the other sales people I have dealt with lately.

Financing was a breeze! I was in his office for 15-20minutes max and then I was out the door with brand new outback minutes later. They made me aware of the extended warranties, service plans, and other options available but there was zero pressure to purchase any of them.  I really appreciated that!

On a lighter note, I found out that any time I have my Subaru serviced at the dealership I can bring my dog inside. They even have a treat jar for your pets. How cool is that!!

I highly recommend Subaru of Clear Lake and Robbie D. They are great people to work with! ",5.0
834,"October 08, 2015","Great service.  Frank even went the extra mile to get past records for my vehicle, which was being service at Gillman Subaru, before this dealership opened in my side of town.
Thank you",4.8
835,"October 07, 2015",Tin Tran was helpful from the very beginning when I walked into the dealership he did everything he could to get me into the car that I wanted the finance manager was exceptionally helpful I believe because Mr Tran went the extra mile and pulled him in also my experience was a very good one and I would definitely recommend your dealership,5.0
836,"October 07, 2015","Just purchased a 2016 Legacy. My experience was most pleasant, especially compared to some dealers. My sales person (Drew Spence), was polite and pleasant to work with. He answered all my questions without guessing or referring to other sources for information. His excellent product knowledge led to my purchase of my new car.  Not to mention, he was not too pushy as most sales types are. He has a certain charm about him.
The showroom and dealership overall was very clean and well maintained, even the service and parts areas.  Drew scheduled my first maintenance service during the sale (first time a sales person ever did that for me), and followed up by phone with me after the sale which was nice
I have monitored the Subaru brand for years and have finally go my hands on one. Hope to have it for a long time.",4.8
837,"October 06, 2015","Excellent service.
 Transparent honest process.
 Courteous and helpfull staff.
If they said they will give you certain Price, they will definitely stick to their promise.
 I was able to negotiate Price, by e-mail in couple of days.
 On arrival to dealership, purchase process was very smooth without any nonsense.
 I will recommend dealership to all my friends and family,without any hesitation.",5.0
838,"October 05, 2015","We were very pleased with our new legacy. chase was very helpful about the features on the car, and was very knowledgeable as well. he did not let us drive off without explaining how everything worked",5.0
839,"October 04, 2015","Let me preface this review by saying I generally don't enjoy the car buying experience.

 My wife and I went to Subaru of Clear Lake looking for a ""sporty but practical"" sedan. The salesman who assisted us initially, Robbie Dominguez was a tremendous help, guiding us to the Subaru WRX, which we hadn't really considered (though he happily let us test drive the BRZ we originally went to see as well).

I was pleasantly surprised when Robbie didn't try any of the usual strong arm tactics when we told him we weren't ready to purchase that day. When we returned a few days later with the whole family, he was knowledgeable, helpful, and patient. I explained that I didn't want to waste a lot of time hearing about credit insurance, etc. and I'm happy to report I didn't have to.

Yesterday we bought the car we wanted, at a price I felt was competitive, after almost no haggling back and forth. The whole process was about as smooth as I've experienced in two decades of buying cars. Everyone at the dealership was pleasant and professional, but Robbie Dominguez was the star. If you're in the market for a Subaru, head on out to this dealership and ask for him. ",4.8
840,"October 02, 2015","
I had briefly emailed back and fourth with Chase but I was late to my initial appointment timing so Dallas took over the sale once I got there. I had seen and been interested in 3 used vehicles that I wanted to take a look at. 1 was a Honda and 2 were Subaru's. He brought out both of the Subaru's for me to be able to compare the differences. Dallas was VERY knowledgeable on the Subaru's which I knew nothing about Subaru's so that was very important. He went over the differences in Subaru AWD and other makes AWD, the engine and all the features about each Subaru. We took the one I liked the most out on a test drive, loved it! ",5.0
841,"October 02, 2015","My experience at Subaru of Clear Lake was just as there motto states ""truly exceptional"". From the no pressure sales staff to the clean facilities this place exceeded all of my expectations. Next time you are in the market for a new subaru make sure you ask for Dallas, you will be so glad that you did.",5.0
842,"October 01, 2015",I was emailed by Chase regarding a 2016 WRX and found out they had 2 in stock. I picked my color and made a deal with him. Moments later I was contacted by another dealership and I did the mistake of going to Gilman Subaru and test driving the sales person was rude there. So I contacted Chase again and he beat the offer that Gilman had told me for a brand new 2015 WRX. When I got to Clear Lake Subaru the color I had picked for the WRX was sold. But Chase gave me a option for another color. And he told me he would try to compensate for the color which did work out because I did receive some extra bonuses with the car. After me and chase filled out the paper work I was introduced to Ryan Wiseman. And at first I thought Ryan would be like a normal finance guy rude and eager to just get paper work done. But I was surprised. Ryan was the complete opposite he helped lower my APR to 1.9% and also worked out some more deals with me sat down and took his time to explain my payments and warranty options which I did end up getting. These two guys are probably the best people I have met while car shopping The process at this dealership was quick and simple with no hassle. I would recommend Ryan and especially Chase Wilson to any other person going to Clear Lake Subaru. My Brother is going back there next week to actually pick up a car because of the treatment and the deal we received from them. ,5.0
843,"September 30, 2015","One of the best car buying experiences I have had.  Start to finish everybody was extremely easy to work with.  Courtney Morelle was the sales person. She new just about everything about the car and when she was unsure of something she researched it and got back to me in a timely manor.  My last 4 autos have been BMW's or Audi's.  Working with the staff of Subaru of Clear Lake was every bit as pleasant and professional if not more so the either the BMW or Audi dealerships.  Managers that were very helpful were Casey Newton, Tom Wood and Ryan Wiseman.          ",5.0
844,"September 26, 2015","I have to admit I'm a terrible customer! I couldn't make up my mind and I was at the dealership over 3 hours. My salesman, Dallas, has the patience of a saint. We test drove 4 cars and they got my payments were I needed to be and I never felt pressured to make a hasty decision. God bless you Dallas! I'll be back!",5.0
845,"September 25, 2015","From the moment I walked in the staff at SoCL made me feel at home. I was welcomed and beckoned to sit down. That's when I had the pleasure of meeting Tin Tran. He was smiling, courteous, ready to roll, as he had the 2006 Subaru Baja I had come in to look at waiting for my test drive. During my test drive he answered all my questions, but never resorted to the overly ""friendly"" small talk practiced by most used car salespeople. He was there to sell me a car, not become my BFF, for which I was grateful. I didn't have to haggle, as the price had already been reduced to what I was hoping to haggle for when I got there. He laid out the final price with TT&L and gave me an idea of what my payments would be. It was a simple, painless, hassle free process amiably handled by the remarkable and efficient Tin Tran. His manner was top drawer, my experience, FIRST RATE!",4.8
846,"September 24, 2015","
From the moment you arrive you automatically feel welcome. Everyone from the receptionist to the service department goes out of their way to help you feel welcome. Our salesperson, Dallas, took the headache out of car shopping and made it very enjoyable actually. Highly recommend!",5.0
847,"September 24, 2015","My wife and I bought a used car that ended up being a dud after a month of having it. When we had trouble, Vince Carnovale helped us get the car fixed in a timely manner. When we decided to get out of the dud car, Robbie Dominguez helped us find the perfect car for our situation and our family. Then Robbie, Craig Mesenbrink,  Andrea Rogers, and even the GM Casey Newton helped us get a great deal on our new Subaru. When we need a second car for our family, we plan to go right back to Robbie and the rest of the Subaru crew to find the perfect car for us. We trust the people at this dealership, and they are all very helpful. ",5.0
848,"September 23, 2015","I had been searching for an Acura ILX for months before I came across the one on the used lot at Clear Lake Subaru.  I made contact on a Thursday evening and made the trip from New Orleans Saturday morning for a final inspection and test drive.  We were able to work through financing, a car wash and gas tank fill up within 2 hours!  

In addition to Tin and Ryan, everyone there was beyond courteous and friendly.  This was, by far, the easiest car buying experience I've ever had.  Thanks again! ",5.0
849,"September 17, 2015",Richard along with the rest of the team at Subaru of Clear Lake made buying a car a pleasure. Thanks very much to all the courteous staff!,5.0
850,"September 12, 2015","My wife and I have for the last several years been Ford owners. At least the last four vehicles each have been Fords. Her's have been Explorers and Expeditions and mine, Ford Trucks ( I continue to drive a Ford F150 FX4). We have not been unhappy with them, however; we needed something smaller that she could better handle and ranked high on safety. After much research we decided to look at the Subaru Outback. After contacting (via the internet) several dealerships we decided that Subaru of Clear Lake was more likely to have what we wanted in stock. We found them to be very friendly and helpful and after a couple of days we found the car we wanted. They dealt with us fairly, without any high pressure tactics. So far they have continued to be friendly and helpful",5.0
851,"September 11, 2015",I felt very welcome as soon as I came into the dealership. Everyone was very friendly and helpful. I had been talking to Dallas before coming in and I could tell this was a good guy. Very honest. I'd recommend Dallas and Subaru to everyone!,5.0
852,"September 09, 2015","I have never bought a car online or by phone and internet! I have to say that it was the most pleasing, exciting and most professional experience I have ever had. Taylor was very attuned to my needs as to what I needed and wanted for a good vehicle. He delivered a very awesome sale to me and also delivered a very awesome Cross Trek to my front door over 200 miles away. I am so happy with my Subaru and I feel so safe with my six Year old! Thank You Taylor Fuqua and Thank You Subaru!! Glad to be a part of the family! ",5.0
853,"September 07, 2015","I am a new Subaru car owner. I just had a wonderful experience during the time I acquire my Outback. I thought the honeymoon will stop right there. However, Subaru clear lake continues to amaze me during my first car service experience. Frank and Dennis were doing honest to goodness customer service and I am so happy I am good hands.",4.8
854,"September 07, 2015","Had a great experience during the entire process. My sales person, Chase, and the Sales Manager, Josh,  were very accommodating and knowledgable about the Subaru brand. Since it was my first time ever exploring Subaru, I asked a lot of questions.  Even the receptionist was great - we were there late and she made sure that the children were occupied and did not get restless.  Great customer service and I love my new Subaru Forester!",5.0
855,"September 06, 2015","Getting a new car at Subaru of Clear Lake was an amazing experience.  The showroom, lot and service center were all clean and welcoming.  The staff was all friendly and knowledgeable, especially Taylor. He worked with me to find the car and features that I wanted and was not one of those pushy salesman types at all.  I am very happy with my new 2016 Outback and I look forward to working with Taylor again for my car needs in the future. ",5.0
856,"September 05, 2015","Drew the englishman was very friendly and excellent in customer service,
so was Robbie Dominguez.  My sister might be in the market for a new car,
I told her to see Drew at Subaru of Clear Lake.",5.0
857,"September 04, 2015","This place has a state of the art building from their showroom to their service bays. Excellent customer service by Tin Tran and his full management staff that was actually AVAILABLE and not in the other room. Highly recommended for anyone looking for a Subaru and I've gotta say it.... at Subaru of Clear Lake ""its the way to go""!",5.0
858,"September 04, 2015","A competitively priced, no hassle buying experience. Chase didn't pressure me but was available to answer any questions I had and when it was time to purchase they made the buying process quick and easy.  ",5.0
859,"September 04, 2015","These people are great!  After shopping around other Subaru and non-Subaru dealerships in Houston, my wife and I chose to go with Subaru of Clear Lake because we felt most comfortable with how we were treated here.  Their customer service is simply excellent, as is their inventory—and the store itself is immaculate.  During our first visit, TAYLOR FUQUA helped us test drive two different vehicles and was very patient and knowledgeable and answered all our questions about Subarus in general (it was our first time driving one).  His enthusiasm and genuine interest in our purchase was crucial to our coming back to Clear Lake after experiences at other dealerships.  When we did return to make a purchase, COURTNEY MORELLE was just as patient and helpful, answering our questions and keeping the sales experience and negotiating process as low pressure and comfortable as possible, even though it was quite late when we all left the store.  We felt we were able to negotiate a fair price and the finance/paperwork process was straightforward.  The icing on the cake, though, came after the purchase was complete.  We loved everything about our new Subaru Forester except for one issue.  When I returned two days later, TOM WOODS, the sales manager, listened carefully to our concern and took the initiative to finding a solution.  The matter was resolved quickly and to our satisfaction and the solution exceeded what one would expect from your normal car dealership.  But Tom went beyond the norm--which is what we had hoped for from a company like Subaru--and now we love every inch of our new car!  You can trust the people at Clear Lake to be friendly, fair and to go the extra mile that makes all the difference when it comes to such an important--and expensive--decision.  My wife and I have no regrets!",4.8
860,"September 01, 2015",We were delighted that this dealership had the Outback in the color we wanted.  Chase was helpful online and picked us up from the airport in our new car!  It was a pleasant experience and we LOVE our new car! ,5.0
861,"August 31, 2015",Our salesperson was Courtney. She was very knowledgeable and easy to work with. The manager was also extremely helpful. We have never had such an easy car buying experience before. We will definitely pay a visit to Subaru of Clear Lake when we need a car again.,5.0
862,"August 31, 2015","Staff (Mr. Erwin and Mr. Woods) were friendly, did not attempt to up-sale me, did not attempt to pressure me and did not rush me. As soon as I entered the dealership, I was immediately greeted and asked if I needed any assistance (I've actually been ignored/discriminated against at other dealerships in the past). The financial guy (can't remember dudes name--but very cool guy) was very knowledgeable was able to answer all my questions quickly. In addition, everyone I spoke to was a ""car guy."" They all knew about cars, loved cars,  and had hobbies outside of work involved cars. Would recommend this place to anyone just for the above, but in addition to all of the above, they gave the better price than any dealership in Houston and Dallas.",5.0
863,"August 29, 2015","Very nice vehicle. The Outback has about every bell and whistle you can put on it. My wife is 4'6"" and has had a hard time finding something she can see out of when driving. With only a 4in. foam pad to sit on, she says this is the first vehicle she can see in all directions. The only thing that I can find wrong is the stereo, plain and simple, IT SUX. For a 30K+ vehicle you would think it would be a lot better sounding. ",4.8
864,"August 29, 2015","They stayed with me late at night, working with the banks to get the deal done. I would recommend this dealer to anyone that is looking for a Subaru. The best car buying experience that I have ever had.",5.0
865,"August 28, 2015","I have always been a FORD guy, but I have been browsing for something new and different. I browsed a lot of car dealerships before I came to Subaru. After speaking with Dallas he really helped me understand the benefits of owning a Subaru, not just in the short term but of owning it in the long term. I haven't made up my mind yet, but I'm pretty sure I'll be seeing Dallas Monday to buy that Outback. ",4.8
866,"August 27, 2015","Good experience. I worked with Robbie Dominquez, good guy and a straight shooter. No games just an emphasis on getting things done quick, easy and right. Mike McDonald was the manager that pulled the details together with a couple special request and got me a fair deal on exactly what I asked for in my new 2016 Outback. 
Ryan in finance was a pro and didn't keep in his office a minute more than I needed to be there.
Of all the cars I've purchased over the the past twenty five years, this is one of the few times when I've bought a vehicle from a dealership and I didn't feel like I was run through the mill... Love the car.",4.8
867,"August 27, 2015","I wanted desperately to be able to give a 5-star review.  We love the Subaru and expected our customer experience to reflect our same experience with the Subaru product we've come to love for the past 10 years.

The sales and finance process were painful.  We've spent 8 hours over the course of 3 days, waiting and waiting and waiting.  First, waiting for Sales to find the car, then when the car was located we were called to come in to do the paperwork.  I asked how long this would take and was told ""not long at all"".  After waiting 2 1/2 hours to get in to meet with Finance to sign the paperwork, we got tired of waiting and left.  The next day was another 2 hours going through the paperwork and car inspection and review process, only to find that it did not come equipped with the accessories we wanted and were told it would have.  We left.  Again.  And without the car until they got the accessories installed.  

The sales staff are very inexperienced and do not understand the importance of delivering an efficient and positive customer experience.  One Finance person writing contracts is not sufficient when you have more than one customer buying a car.  

I can't speak for the Service Dept here, but lack confidence in its ability to meet the Subaru service standards based upon our buying experience.

Suggestion to Management:  Ensure staff who answer the phone know all employee names.  When we called and asked for our sales rep by phone, we were told there is no one there by that name.  Also, when customers come into the dealership, the receptionist who sits at the entrance should do whatever it takes to determine why the customer is there and to connect them with the appropriate person who can help them.  We went to the dealership 5 times in 3 days and not once did the receptionist attempt to get us connected with the person we needed to see who could help us.",2.5
868,"August 26, 2015","Very helpful, great to work with, I think my time and my questioned got answered. I enjoyed working with the team and it didn't take 8 hours to get everything done.",5.0
869,"August 26, 2015","I purchased my Outback from here, love the car, loved the sales person (Courtney), and overall had a really great experience. Will definitely consider going back when it's time for my next car. ",4.4
870,"August 26, 2015",I had a great experience buying my new Crosstrek at Subaru of Clear Lake! Taylor was a great help showing me the premium and limited models. He was courteous and provided excellent customer service.,5.0
871,"August 22, 2015",I've shopped for many cars in my life but never have I come across a salesman as unprofessional as Jacob Moniz. He was actively using profanity in a conversation with his coworkers. Dealership was clean and there were plenty of amenities. Overall I wouldn't recommend anyone with manners to shop here. ,1.3
872,"August 22, 2015","My wife and I went to Subaru Clear Lake last weekend to buy her a new auto.  I was in the market for some new wheels, too, but wife came first.  A sales rep named Taylor met us.  He was affable and product-knowledgeable and, of course, eager to help us select.  His enthusiasm about Subaru products was contagious and within 20 minutes I was ready to buy - even before my wife.  That happens very seldom because I'm a hard-sell, and that it happened at all speaks to an extraordinarily high level of professionalism and courtesy shown by Subaru's staff during every step in the process.  I now own a cool new black-on-black-in-black Crosstrek.  I love it!    ",5.0
873,"August 22, 2015","Martin Genbe went the extra mile at every step.  No surprises and did an amazing job.  His management support team of Josh and Ryan were amazing, too.  Super experience buying our 2016 Forester.  Awesome job!",5.0
