,Date,Reviews,Ratings
558,"July 05, 2016","I was looking at 3 dealers to purchase new auto.  Very impressed walking into Subaru showroom.  I had many, many questions to ask, never owned a Sabaru, no experience with awd or 4 cyn. engine.  My salesman Rick Erwin, was very professional, patient and answered all my questions.  I continued shopping other dealers.  I returned several weeks later, had test ride and purchased a 2017 Forester",5.0
559,"July 05, 2016","Jacob and Dallas were my salesmen, and they were both fantastic. Very knowledgable about the cars they sell, and willing to offer the best information possible to help you make the best decision. My experience was wonderful, and I highly recommend Subaru of Clear Lake. I drove away with an awesome vehicle and very, very happy! Thanks, Dallas and Jacob! ",5.0
560,"July 04, 2016","My experience at Clear Lake Subaru was great!! Andy, my car salesman, was super helpful and very friendly. My credit wasn't the best, and I knew that while I was shopping around for a new car, but Andy and the finance guy, Tim, worked hard to get me into a new WRX with a very reasonable down payment and monthly payment. Great experience, highly recommend this dealer.",5.0
561,"July 03, 2016",My experience at Subaru of Clear Lake was phenomenal! Dallas Hardwick and Drew the Englishman went above and beyond to make my car leasing adventure worth every moment I spent! They got me out of a horrible situation with my other car. I will be forever grateful for this experience and these guys!,5.0
562,"July 02, 2016","We were wowed by Drew ""The Englishman"" Spence knowledge, he shared all kinds of information that Gillman's did not, so we bought from Drew!
",4.8
563,"June 30, 2016","Dallas was a great dude, knew exactly how to help me, knew when I entered the building i knew what i wanted and didn't belittle the knowledge i had of Subaru. Anyone looking for a Subi needs to speak with Dallas. Finance man was straight forward and honest.",4.8
564,"June 30, 2016",Bought my new forester from Tim and Dallas and could not be happier. At first there were some miscommunications that occurred but Dallas went above and beyond to make things right. I was able to get a great deal and could not be happier with my new Subaru. I would like to thank Dallas and Tim again for there hard work. Will buy their again when the time comes.,5.0
565,"June 29, 2016",I will definitely come back to this dealership to purchase a vehicle again. This was the best car buying experience I have ever had. Dallas was very genuine and honest with me and helped me to get the best deal possible. I wish all dealerships were as ethical as Dallas was to me. ,5.0
566,"June 28, 2016","Worked with Andy Hollister and had a great buying experience.  I went in knowing what I wanted, I let Andy know my criteria for what I wanted in the vehicle.  He chose good example models for me to test drive, before I settled on the one I wanted.  I went in knowing my credit score, what I wanted my interest rate to be, the trade value of my previous car, and the price I wanted to pay for the new car.  Andy and the rest of the team were very good at listening to my expectations for the purchase.  We came to a sales agreement in a fairly short period of time; a result that I believe all parties were happy with.  I would definitely purchase from them again.  ",5.0
567,"June 28, 2016","Good Experience. Dallas was awesome and helped me get approved for my first loan. Very satisfied with the car! I wish I would have gotten a little more on my trade, but the price on the car was already great.",4.8
568,"June 27, 2016",It was a good experience that I had at this dealership. Dallas was very honest and professional. The place was clean and had great coffee. Would recommend to family and friends.,5.0
569,"June 26, 2016","I drove all they way from Austin,TX to get car from them. Speaks volume about how competitive their prices are. They will try their best to beat quotes from any dealership and are extremely friendly and helpful in getting you best deals for your car. Shout out for James, my sales person for excellent work.",5.0
570,"June 23, 2016","Everyone is pretty awesome at this dealership - I had a tire replaced on my Subaru and saw that it had to be ordered. That experience was kinda frustrating. I imagine being a Subaru dealership you would carry the tires that go on the cars. The pricing on the tire was also a little steep.

Regardless, Great dealership overall.
",4.4
571,"June 23, 2016",I just bought my new Subaru Outback from Subaru of Clear Lake.  Andy Hollister was able to answer all of my questions and was not the typical pushy car salesman.  I feel like a got a good deal and I love my Subaru Outback. Andy was able to show me how to work the various navigation applications and I'm very happy with the service he provided. ,5.0
572,"June 22, 2016","Very friendly, helpful staff. You are treated like you are someone special no matter what your need. They take the time to explain what needs to be done, about how long it will take and give you a choice to do it now or make an appointment at a more convenient time. If you do have an appointment they get you in on time. Other dealers I have dealt with take your car at the  appointment time, but don't start working on it at that time! Vincent, the service manager has his finger on the pulse of his department and makes sure everything runs smoothly. ",5.0
573,"June 20, 2016","We left with a good deal on a new Outback. Then, when shortly thereafter we needed a little help undoing the effects of a family reunion and a water balloon slingshot, our salesman Bobby Parker was able to get us the help we needed. Looking forward to seeing the staff again at oil-change time. Thanks!",5.0
574,"June 16, 2016",Really Good buying experience and very friendly staff. We bought 2016 Subaru Legacy from them.  Bobby Parker really helped us find the perfect car. He was very patient and friendly to us and made the car buying process very easy. I would definitely recommend Bobby Parker!!,5.0
575,"June 15, 2016","Subaru of Clear Lake is one of my best car buying experience! RoDo is the Man! aka Robbie Dominguez. He is very friendly and accommodating. My purchase experience went nice and smooth got all the numbers that i want for trade and purchasing a new car, hassle free. I would recommend this dealership to friends and family. Very pleased with my purchase!
",4.8
576,"June 15, 2016","I wanted to take the time to let the powers that be how my experience was at Subaru Clear Lake.  Bobby Parker was my sales person and if humanly possible Bobby will be my only salesperson when it comes to purchasing vehicles.  
I was wanting to purchase an Escalade but with my credit issues put me in a Expedition which I like even better.  He was honest and upfront about possibilities of not getting qualified and most importantly was courteous and ""non-judgmental"" of my difficult situation.  We even talked about the resale value's, early payoff benefits, and my next purchase which will probably be three years from now.  I even had an ignition issue the first day and Bobby scheduled my repair and I was out the same day.

I am in the ""Customer Service"" Industry, and Bobby is a good one.  Subaru Clear Lake should be happy to have him.

Robert Harper
832-888-5589",5.0
577,"June 13, 2016",I was in and out on time. The work was completed to my satisfaction. Waiting area comfortable with all the amenities. All my questions answeted knowledgably.,5.0
578,"June 09, 2016","A miscommunication lead to the wrong oil being in the car - and they were wonderful about fixing it!  Vince calmly told me the issue, had it fixed, and let me know the progress.  Very respectful and calm about the mixup.  It's not how you are treated when everything goes correctly - it's about how you are treated when things get bumpy.  The respect levied on me as the customer was GREATLY appreciated.  Excellent service!",4.8
579,"June 09, 2016","Subaru of Clear Lake is a top notch dealership. My family worked with Andy Hollister and it was a great experience. He was very knowledgeable, friendly and accommodating. I would not hesitate on recommending this dealership to friends and family. I am very happy with my purchase! ",5.0
580,"June 08, 2016","My Sales Specialist was Robert Parker , and he gave us the best customer I could ever ask for. I purchased a Certified Pre-Owned 2013 Subaru Legacy. He wasn't pushy, and did everything possible to make the process smooth and simple, and even made sure the car was detailed while we took care of the paperwork. 
Despite being fairly new, he was very knowledgeable as well, and always made sure to get the right answers for any questions we had that he wasn't sure of.
I'd highly reccomend him over anyone else at Subaru of Clear Lake!",5.0
581,"June 08, 2016",I brought in a Cadillac for an oil change as their pricing was cheaper than the local jiffy lube etc. Friendly staff and it was a quick process!,5.0
582,"June 06, 2016","i found the staff very friendly and accomodating, There was excellent communication from the top on down, Salesman Tin Tran really went the extra mile !",4.8
583,"June 05, 2016","My wife and I are both very happy with the service provided by Mr. Andrew Spence. During our car buying process, he carefully listened to our needs and went one step further to find the best solution for us. This is definitely an AWESOME experience! We would recommend Andrew to anyone who is looking for an amazing deal and pleasant service! 
",5.0
584,"June 04, 2016","Clear Lake Subaru you are awesome. I had the pleasure of working with Bobby Parker, who is very patient, kinda & professional. Bobby Parker helped me find the best Legacy with all the must have features I wanted & all the great safety features to keep me safe, confident & comfortable on all adventures near or far.  Keep up the great work CL Subaru. ",5.0
585,"June 04, 2016","I could not have asked for a better experience than I had with Dallas!  He was patient when he needed to be, and efficient when he needed to be. By far, this is the best experience I have ever had ato a car lot.  I would recommend Dallas to anyone needing some one on one attention. He truly cares about his customers. A+",5.0
586,"June 04, 2016",The Sales rep listened to what I wanted and brought 2 vehicles for me to choose from.   I found the exact vehicle I was looking for.   The price and closing on the vehicle was fair and efficient.,5.0
587,"June 03, 2016","We had a great ""no pressure"" buying experience at Subaru of Clear Lake.  Our salesperson was Robbie Dominquez.  He understood that we were just looking that first day, gave us a test drive, answered all of our questions and never asked for a sale.  Three days later we bought the car we wanted.  The paperwork was handled by Tim and he also did not pressure us with up-sales.  We will return to this dealer without hesitation. ",5.0
588,"June 03, 2016",Employees were very courteous.  They performed my 6000 mile maintenance on my Subaru Forester and did it quickly and well.  It was my first experience with Subaru of Clear Lake maintenance and it was a very good one.,5.0
589,"June 02, 2016","Very well done.  The salesperson was very patient and made it easy to make my decision.  Overall, it was a great experience and I have had good reviews of Subaru in general before my own purchase.",4.8
590,"June 01, 2016","Succint and efficient- to the point and addressed our questions, not his agenda. Respectful and did not come across as condescending. Knew the product well. ",5.0
591,"June 01, 2016","Just bought our first Subaru at Clear Lake Subaru. Had an awesome experience. Our salesperson, Christian Williams, was excellent. He was upfront and very knowledgable and friendly. Overall great car buying experience.",5.0
592,"June 01, 2016","We recently went to Subaru of Clear Lake to purchase a vehicle. Our salesman, Robbie Dominguez, was attentive and provided excellent customer service. We would definitely do business with this dealership again, and we would absolutely send friends and family to Robbie!",5.0
593,"May 31, 2016",Mr. Moniz had contacted me the day before I bought my vehicle. He was warm and sociable yet to the point. I appreciated his professional dialogue and was clearly knowledgeable about the vehicle he was selling to me. He also worked extremely hard to solve possible issues with a used vehicle and ensured I got the best financing opportunity possible. Mr. Millican was also quite helpful with the financing and did not hesitate to answer any of my questions.,4.8
594,"May 30, 2016",Excellent service! Dallas Hardwick really cares about his customers and he tries to do everything possible to make the satisfaction. I would highly recommend this guy! ,5.0
595,"May 30, 2016","I would like to thank Christian Williams at Subaru of Clear Lake for making it possible for me to walk away with a new car. My car buying experience there was pain free.  No pressure, very fast.   He was very professional, honest, and informative.  This was my 2nd purchase of an outback and thought I knew all about the car.  Christian took the time to make sure I knew the important details of the car and to my surprise; there was a lot I didn’t know.   I would describe him as professional, knowledgeable, friendly and really works with you to make sure you are happy with your purchase.  The entire experience was fantastic and I appreciate all the people at the Subaru of Clear Lake who helped me get the car I wanted. (Let’s not forget the finance guys!)  I will definitely recommend my friends and family members to go to Clear Lake Subaru and ask for Christian Williams.  (Anyone at the dealership can you help but my personal favorite is Christian Williams!)",4.6
596,"May 27, 2016","I do not like purchasing cars at all. But it was time for me to to bite the bullet and get my new Subaru. I just wanted to come into the dealership, sign the paper work and leave. Dallas did a great job of making this happen. ",5.0
597,"May 27, 2016",Went in an knew exaxtly what i wanted and got everything and was out in 2 1/2 hours. The dealership was very nice and and was vrry comfortable. I wouldnt recommend any other dealership. ,5.0
598,"May 26, 2016",The facilities were clean and pet friendly. The service department is one of the b st that I have ever seen. The management and sales staff are very knowledgeable and friendly (Dallas). Would buy here again.,5.0
599,"May 24, 2016","Our experience here at Clear Lake Subaru was excellent! Drew ""The Englishman"" Spence was very helpful and informative. Great customer service and follow up. I would highly recommend him as a salesman and this dealer to anyone in search of there next vehicle. Great Experience!",5.0
600,"May 22, 2016",It's was very good and he helped me get the car I wanted. Also was very friendly and considering of the everything and I will truly recommend anyone looking for a car to go rictus dealership ,5.0
601,"May 21, 2016",I didn't buy my Outback at this dealer but its the place where I have it serviced. Excellent shop and knowledgeable head mechanic. Better by far than my BMW experience.,5.0
602,"May 20, 2016","Purchased my Subaru Outback here a couple of months ago and was impressed with the whole experience. What has really exceeded my expectations was what happened after I purchased my vehicle. Dallas has always been there to answer my questions and even sent several hand written notes thanking me for everything. No Dallas, thank you for making this the best car buying experience I have ever had.",5.0
603,"May 20, 2016","Went to Subaru of Katy first and their sales staff was not attentive nor wanted to get me a good deal on the purchase.  It felt as if they have a no haggle policy the salesman there did not even go to sales manager to see if my ask price is ok.  However at Subaru of Clear Lake, Robbie came out and met me within few minutes of me looking at vehicles on the lot was very helpful and got me the best deal to purchase my new 2016 Outback.",5.0
604,"May 18, 2016","I recently purchased a 2016 Impreza Sport. The first question out of my mouth when approached by Dallas was ""Do they come with manual transmissions."" He told me ""No, only the base model Impreza's come with manual's but they dont have the sport package."" Along with Dallas I talked to 
Courtney Merelle
Richard Erwin
Calvin Ngo
Marcus Millican
and every one of them told me that the Impreza Sport does not come with a manual transmission. Only the base model Impreza's come with manual. A few days after my purchase a friend from Phoenix sent me a link showing me that the Impreza Sport does in fact come with a manual transmission. The only different being it does not have Eyesight or a Moonroof. If Dallas had actually been paying attention to what I was saying he would have heard that I couldn't care less about moon roof's and eyesight. A manual transmission was the most important thing to me. Its my fault, I should have waited and I should done a larger search radius while looking for the Impreza I wanted. Needless to say Im a bit angry, especially since the Impreza Sports withe the manual I found were almost 5000K cheaper because they dont have the moonroof, eyesight and their horrible ""INFOTAINMENT touch screen that doesnt even come with NAV! I though I would make an appeal to them to see if this could be corrected, 4 days after I bought this car, 200 miles on it, the manager Casey Newton
tells me that they're willing to take the car back as a trade in, giving me exactly $4,700.00 less then I just paid 4 days prior! Does that sound like a fair deal?!!!! 

I will never go back into this dealership! I suggest all potential buyers stay away from these people!  ",1.0
605,"May 18, 2016","Brought my Subaru WRX in for 22,000 mile service. Facilities were clean and comfortable with snacks, coffee, and water available. Staff were professional, courteous and helpful. Work was of good quality. ",4.8
606,"May 17, 2016",We went in and had an awesome buying experience.  Traded off one vehicle for a new more gas eficent one.  Sales men where in too of everything and made us comfortable.,5.0
607,"May 17, 2016",Took care of my recall and worked to understand and resolve an issue I thought I had with the car. Good coffee and comfortable waiting area.,5.0
608,"May 13, 2016","I've never dealt with a more professional, self driven, courteous, polite and ambitious individual. Jacob Moniz was all smiles and nothing but a joy to be around while I was picking out my new car. Being around someone like that made me feel so much more comfortable and at ease about buying a car, when everyone knows buying a car is a giant investment and can become a very scary thing, but Jacob walked me through everything step by step and made things so clear. He was quick and clean as I would say kind of as a figure of speech. But I will recommend this dealership and especially this Sales Agent to anyone. Personally the Agent Jacob Moniz needs to be the general manager because this guy knows his stuff! Thanks again for making my experience the best I've ever had and for making me not afraid to buy a car. I will return on my next buy without a doubt!",5.0
609,"May 13, 2016",I made my appointment via the website without any problems. They were ready for me when I arrived and service was accomplished quickly. Employees were very friendly. I was completely satisfied with the service.,5.0
610,"May 12, 2016",Didn't realize buying a car could be fun. I am used to the process being painful and dealing with shady car salesman. Dallas exceeded my expectations and was completely honest about everything and made sure I understood every step that was going on through the purchase of buying the car.,5.0
611,"May 12, 2016",Just leased two cars from Robert and Drew at Subaru of Clear Lake.  They did a great job.  I still can't believe we got such incredible cars for the price.  You are crazy if you buy or lease a vehicle from another dealer without driving a Subaru. ,5.0
612,"May 11, 2016",I have always purchased Toyota's before and was looking for something different. I did my research and became interested in learning more about Subaru. I came into the dealership to learn more about Subaru and was very impressed. Dallas did a great job helping me to find the exact car that I wanted and spent extra time making sure I knew all of the features of my new car. This was the best car buying experience that I have ever had!,5.0
613,"May 10, 2016",I have never felt happier to buy a vehicle. Jacob Moniz made me feel welcomed and made me feel comfortable to buy a car. I always told myself I wouldn't buy a new car. But jacob made it easy to trust them and easy to communicate with them about my needs. They were understanding and very upfront on everything which I loved. Most dealerships try to screw you over or give you something you don't want but Jacob put me in exactly what I was looking for and fit my needs and gave the best and greatest customer service ever. Thank you Jacob and Subaru of clear lake for all that you have done for me in putting me in my new car and when I'm ready for another one I know exactly where I'm going and who I'm going to see. Never been more happy and satisfied in my life.,5.0
614,"May 06, 2016",I purchased my vehicle from Dallas Hardwick and have to say it was the best experience I have ever had purchasing a vehicle. This is the place to go when you need to purchase a vehicle.,5.0
615,"May 04, 2016","Attentive and professional staff, followed up with me during the purchasing process, added value to the car when it was not prepared for delivery as promised. ",5.0
616,"May 04, 2016","Purchasing our used vehicle was surprisingly quick. Subaru of Clear Lake gave us a fair trade in toward our used car, which was an upgrade for us and our family. Overall it was an enjoyable experience, with excellent service from everyone. ",4.8
617,"May 03, 2016",Christian was very professional and never pressured me.he listened to my concerns and needs and directed me to a vehicle that fit what I wanted.this was my second Subaru in 13 mos and they're fantastic.GM Casey Newton was there from step 1 and got all the help and info available to me.Tony in finance closed with all my questions answered .Great dealership with plenty of choices and never any sales pushes.Get to Clear lake Subaru and check out this gem.,5.0
618,"May 02, 2016","I worked with Christian to purchase a pre-owned 2008 Ford Mustang GT. Not only was he able to help me out on the price, but he was able to ensure that all the maintenance issues were addressed to MY level of satisfaction.  He even held on to the car while indeive from Colorado to see it. I will buy my next car through him.",5.0
619,"May 01, 2016",Easy dealing with staff. Made it right .lost one of the keys but got us replacement within a few days car clean at pick up. ,4.7
620,"April 30, 2016","I traded in my car for a used vehicle and everyone was extremely nice and very helpful. Chase was the one helping me and I feel he went above and beyond to make sure I was completely satisfied. I went to 5 dealerships before I came to this Subaru, and the service was by far the best. ",5.0
621,"April 30, 2016"," My husband already left a review but I wanted to share my experience of our new purchase. Dallas is a great person and a wonderful salesman. He did not pressure me or my husband at all and in fact told us to take our time that he was in no hurry to sell us a car and wanted to make sure that  we were making the right decision. So my husband and I left the dealership and we prayed on it and realized that this was unlike any other car purchase experience we have ever had. I can't stop raving to my friends the no pressure, relaxed atmosphere that this dealership has. I wanted to share this with everybody and hopefully Dallas's manager read this and give him his three minutes off praise LOL. Best car buying experience ever! ",5.0
622,"April 29, 2016",I was very happy with my experience purchasing my new Subaru Outback. The dealership is beautiful and very clean. Dallas Hardwick was exceptional and was very patient with me. Have to say that I plan on purchasing all of my vehicles from him and this dealership.,5.0
623,"April 29, 2016",Martin was a low key no pressure totally informative sales rep. Very knowledgable and patient with us  He really knew the vehicles and was sensitive to our buying habits,5.0
624,"April 28, 2016","I came in for warranty work and the service and friendly nature of the staff here makes me wish I'd bought my vehicle from this location. 

I will remember this and when it comes time to trade up for another model, I will see who can facilitate this. much appreciated!!!!",5.0
625,"April 27, 2016","Even though the dealership is far away, I would prefer to take my car for servicing and concerns to them. When it comes to taking care of my Forester, they are efficient, friendly, and knowledgeable. I always have a pleasant experience.",5.0
626,"April 25, 2016","This is my 3rd Subaru.  My second Outback.  We also have a Forester and my son has a Crosstrek.  We have thoroughly enjoyed the cars!  Andy did a really great job handling the purchase of our new 2016 Outback. Andy was very knowledgeable about the cars, understood what we were looking for, and presented several options to select from.  Andy completed the sale very professionally and in a most timely manner.  ",5.0
627,"April 25, 2016","They take care of vehicle as if their own and treat customers as friends
Easy to make appointment and work is done quickly 
Service bay is clean and nicest around 
Worst part is this survey ",4.8
