,Date,Reviews,Ratings
551,"March 24, 2016","I drove 2.5 hours down to CJ Wilson because they had the certified pre-owned car I wanted at the price I could afford and it included a warranty. I worked with Tom; he was no pressure, knowledgeable, and friendly. Kris, who was in finance, went over the paper work with me. He tried to tack on some weird security feature price and when I said I didn't want it he said that amount would just go back onto the sticker price. Again I said no, that wasn't part of the deal, he then agreed and we moved on.
 
I am enjoying my car, it is just what I wanted. However, I thought it could have been detailed a little better on the inside and there was only a quarter tank of gas when I drove off the lot. After I purchased the car, but before I drove it off the lot I noticed some chipped paint around the gas tank and asked if I could get some touch up paint and I would do it myself. I was told they didn't have any and that I could get it somewhere else (can't remember the suggested place). I thought that was strange that they could not accommodate that request. I have had my car for almost one month now. Just yesterday I noticed there was a problem with the passenger side window, the window will not roll down. I have an appointment after the weekend with the mazda dealer near me, I hope this is covered in my warranty. 

I am a first time car buyer with high standards so not sure if all this is normal when purchasing a vehicle. I am overall satisfied with CJ Wilson and their staff, and would definitely recommend them to others and consider them when making my next purchase.   ",4.0
552,"March 24, 2016",I was in a position where I needed a car but was unable to put  a decent down payment at this time because of an upcoming wedding which I am paying for you guys where willing to work with me and satisfy my needs and I was able to drive a brand new car for my wife that day with the payments I wanted and was able to get all the perks included.,4.0
553,"March 22, 2016","First time I went to any MAZDA dealership (March 20, 2016 CJ WILSON MAZDA) and what a wonderful experience it was.  Walk around the lot and I thought they were closed coz nobody was there to ask you questions and then this guy came over in his casual attire (no ties, no dress clothes.) and introduced himself as AJ.  Very polite , honest and did not feel any pressure  at all.  I told him what we were looking for, which they don't have in stock so he made all the effort to compare it to a similar car expect for the body. Test drove it and we loved the car.  They looked for the car we want online and have it delivered the next day for us to pick up.  I highly recommend   CJ WILSON MAZDA of VENTURA especially AJ Briones.  I'm thinking and planning to go back to buy the CX3.",5.0
554,"March 22, 2016",Thank you for your prompt service when I came in during very busy hours. You were able to pull up multiple items to be taken care of on my car and washed my car afterwards!,5.0
555,"March 15, 2016","Everytime i bring my car here for whatever i no that they always take care of my car and i leave feeling HAPPY!!! they steam cleaned my engine for 50$ and you can literally eat off the engine;) considering you couldn't even see the engine it was soooo Dirty...and they always keep me informed when service is due,cause often we get super busy n forget...so thank you guys for keeping my car in Tip Top shape;)
and Jen you are the Best!!!!",4.6
556,"March 15, 2016","Buying a new car can be stressful but it was actually a good experience at CJ Wilson Mazda. Never was there any pressure. The sales team worked to get me a good deal and were friendly, courteous and professional, giving me as much time and information as I needed to make my purchase. I love my new car. ",5.0
557,"March 14, 2016","Service appointment for an airbag recall. The service was done within the promised time. On top of that, they fave a complimentary 99 pt vehicle diagnostic test.  Thank you CJWilson Mazda & Ryan. ",5.0
558,"March 12, 2016",I didn't expect to get in on Thursday for my problems but she had room.  The nav system was not working and the low tire pressure light was on.  The Mazda 3 originally belonged to my son and he never got the nav system fixed once it crashed.  Jen and the service guys fixed both problems in less then 2 hours and did an oil change too. And to top it off they washed the auto.  I was very impressed with both their professional work and I was very pleased with Jen's friendliness.  I WILL get the auto serviced by CJ Wilson in the future.,5.0
559,"March 12, 2016","Jennifer Lange is so helpful.  And she really knows her stuff.  Just by my description of what was occurring with my transmission, she told me what it possibly could be and as it turned out she was right.  Great communication and very friendly.",5.0
560,"March 09, 2016","Straight forward sales, no weird funny business, to the point. I was in and out of there before lunch driving a new/used vehicle that I purchased. ",5.0
561,"March 07, 2016","Took my car in for an oil change and a tire rotation , Jen helped me at check in and looked over my car and any recalls (found one) and advised me about what should be done , she gave me an estimated time of 2 hours and was right on. I was comfortable in the waiting area.Overall great service!",5.0
562,"March 04, 2016","I was happy with my experience. My rattle was fixed, thank you!
Just waiting on a window part, then my CX5 will be all set.
Ryan Seuffert was great to deal with.",5.0
563,"March 01, 2016",Nice people; great service; reasonably priced. Especially like working with Ryan Seuffert.  Never try to sell you work your vehicle doesn't need. Would start--and probably end--here if I needed a new vehicle.,5.0
564,"March 01, 2016","The reason I have given this score of excellence is because it was exactly that, from the time I made the appointment to the time I  got there and left, I  was welcomed inside the service center with open arms. Everyone who worked there was all smiles. It felt like they were not only happy to serve me, (that is the most important part of customer service), but happy to see me. Ryan my service advisor was so friendly and helpful, I wouldn't want anyone else helping because he was the best part of the experience, and Clint the service manager was awesome and helpful so overall it was the best experience at a dealership and service department combined! I will be telling my friends and will most certainly return, the business was clean, affordable and full of happy friendly and willing to help employees with positive attitudes! Needless to say I am impressed!!",5.0
565,"February 29, 2016",Always Dealership staff are very friendly and helpful. Service provided to my Mazda 5 was great! Ryan was very helpful as well as other staff that helped. Thank you!,5.0
566,"February 29, 2016","I had gotten TWO flat tires within a matter of TWO days. I will say I was just about in the worst mood ever and done with my car when I got to Big Brand in Camarillo. However, I called Mazda of Ventura and they told me to come right in and that they could help me with the cost of the tire because I had just recently got serviced there. 

Upon arriving, I was greeted warmly by the service, and after explaining how I was late two days in a row at work Ryan went above and beyond to get my car serviced quickly. The whole time he was extremely attentive and helpful and even washed my car to get me back to work with a new tire and clean car in the same time it took another company the prior day just to patch my tire. Fantastic service!! ",5.0
567,"February 22, 2016","The Service Reps are very caring to my car and to me.  It's my impression every time I go to CJWilso that they want to help, they want to listen, and they want to get every detail right. I honest to goodness don't feel like I'm a ""get em in get em out"" customer.  They take time to listen and ale time to show they care!",5.0
568,"February 19, 2016","I was early for my 7:30 AM service appointment and Ryan was waiting and ready to get things done. 
Very professional, polite and sensitive to my timing issues for the rest of my day. 
Work was done promptly, no bad surprises, a car wash and out the door in under the time I had alloyed. 
Many thanks. ",5.0
569,"February 18, 2016",I( was so impressed with Jen that I called the General Manager and told him how great she was.  This store has been excellent from start to finish!  Thank you so much!,5.0
570,"February 17, 2016",I appreciated the non sales approach from the sales team and the high level of customer service  I was given throughout the process and after buying the car.  And the service team is equally supportive. ,5.0
571,"February 17, 2016",As soon as I arrived at the dealership James came out to greet myself and my family. He was very friendly and patient while we looked at several vehicles to make sure we picked the right one to fit our needs. I truly feel like James and Ryan did everything possible to get us a good deal on our Mazda 3. Would definitely highly recommend this dealership to anybody I know.,5.0
572,"February 17, 2016",Jenn was great. She is as helpful as they come. I got an oil change and car wash. A recall issue was taken care of and a piece of the dash board that was bubbled which Jenn noticed was replaced. Thank you Jenn!,5.0
573,"February 16, 2016","It was a quick oil change and my tire was patched up from a screw. The carwash, however, was just a spray down unfortunately. Still had water runs and rims were dirty. Business is business though. Love Jenn Lange. She's always upbeat despite not much help around her in a busy department. Both times I've been waiting for service, I've seen her handle a bevy of customers where I think other dealership individuals elsewhere would have complained or gave attitude. She's stays true to personality. Great employee, along with AJ in sales who sold me the car. Only difference is Jenn is easier on the eyes, from a man's point of view!",4.6
574,"February 15, 2016","I recently purchased a CX-5 from CJ Wilson.  It was a pleasure dealing with this dealer.  I was extremely satisfied with the purchase price, the salesman was helpful and did not pressure me, and the finance department was courteous and respectful.  This was the first car I bought in four decades where the salesman sat with me and went through all the features of the vehicle after I bought it.  He spent 45 minutes with me, showing me how to use all the technology on the vehicle.  I am looking forward to servicing my new car with this dealer.  They were terrific!  ",5.0
575,"February 15, 2016","First I have to say that my wife and I love our 2015 Mazda 3 5 door Grand Touring and this complaint has nothing to do with our car, only the service provided at CJ Wilson.  We were encouraged to purchase the VIP package because we would get a ""loner"" car when we get our scheduled service. This was the only reason we purchased the package because my wife and I have very busy schedules. There has never been one available. We have tried to schedule our appointment when a loner car was available but they will not let you do that. We have been the first one in line when they open to ensure we get the loner car but there never seems to be one. I believe they don't have any it's just a lie to get you to buy the package. Also if you are looking forward to the free car washes, don't. My teenage son could do a better job and every time they put another little scratch in it. So if you care about your car don't let them wash it. The only reason I gave it 2 stars is because we love our car so much! ",2.6
576,"February 12, 2016","Smart people, easy scheduling, work completed efficiently, prices that don't break the bank and their focus is all Mazda. It all works for me.",5.0
577,"February 12, 2016",They have excellent service... one of the best places to buy a car from in California ...salesman are friendly ..good selection of new and used cars ,5.0
578,"February 12, 2016","Drove in (without an appointment) because of a recall notice and also it was time to have my oil changed, filters checked, and tires rotated,  Was greeted by Jennifer with her big smile and she said they could squeeze me in and have me out in an hour and 10 minutes.  She was so pleasant and so good about explaining things to me   They returned the car to me at the quoted time and cost.  Even though my regular dealer is over 10 miles closer to where I live, I will bring my car back for servicing because everything was done well and excellent customer support was provided.",4.6
579,"February 11, 2016","I took in my car for a full inspection due to noises that were concerning me in the front right passenger side wheel area, I was suspecting it was my timing chain which wasn't the case which was fabulous news, but I am still hearing noises in my engine usually after the engine gets hot which worries me even after getting it diagnosed. Jennifer was very helpful and kind! She definitely has spectacular customer service skills and definitely made my first experience a lot better. However there were issues that were concerning me that did not get taken care of, I specified that I was hearing noises in the rear of the car when running over bumps, kinda like a clunking noise, researching it, it appears the sway bar end links get loose?

I really wanted a full diagnostic to ensure everything was in good running condition with the car but there were still issues that were not resolved and I really have no idea whom to take my car to now to have all my concerns taken care of.

",3.4
580,"February 10, 2016","All my visits for service at CJ Wilson Mazda so far left an excellence  impression.
The service staff is really helpful and very nice. With all the benefits which come with buying a new car from them, there is no need at all to go to a low cost oil change.
I can highly recommend this service center.",5.0
581,"February 03, 2016",RYAN SEUFFERT ALWAYS NICE AND FRIENDLY VERY HELPFUL. THERE SERVICE IS ALWAYS FAST QUICK AND EASY GREAT EXPERIENCE  LIKE THE SERVICE PEOPLE AT CJ WILSON MAZDA OF VENTURA. ,5.0
582,"February 03, 2016","We went to CJ Wilson because they seem to have a affordable lease deal on the CX5. We worked with Jimmy who was great with my son. He spent a good 30 minuntes going over every detail of the car - stayed late to finish the deal. 

Negotiations were typical - always seems to be a catch on that side. Very disappointed once we got to finance to find out our education rebates come back at $250 but advertised at $500. CJ Wilson website showed 12k miles per year which was part of the reason we came there. They wouldn't honor that - said the Mazda Inc website was only 10k.

Over all - my son loves the car - gets a year of free car washes and oil changes.",4.8
583,"February 03, 2016","I went to this dealership expecting to go through an upsetting, mood-ruining, hair-pulling day, but Esteban Shannon-Bernardy changed my perception of the whole car buying cliche.  I have put off buying another car because of all the horror stories, but I stepped out of this dealership about a little over an hour afterwards (including the test drive) smiling and with a really great car at a great deal - a car I've always wanted but thought I would never buy because of the price.  Esteban did not go for the hard sell, and took his time listening to my concerns.  He was pleasant to deal with (as with Ryan Keith and the rest of the staff, including the driver when they delivered my car to my place), and I never felt any pressure or haste during the entire the process.  Thank you, guys, for a great buying experience!",5.0
584,"January 29, 2016","Leased a Mazda3, sales person Heather M. did a great job of showing us vehicle, very helpful, answered all questions. John A. and Ryan K. also were very professional.
",4.2
585,"January 29, 2016",Everyone dreads buying a car it doesn't have to be an all day event . This is the second purchase we have made here at This dealership. Amazing customers service We chose a Mazda for a second vehicle due to how the dealership treated us and how quick we were in and out. ,5.0
586,"January 29, 2016",I purchased a new car ans was one of the easiest purchases I have ever made at an auto dealership. Excellent service! Go check them out. ,5.0
587,"January 28, 2016","This was one of the best dealerships that I have been to. No one hassled me into purchasing a car and AJ is one of the best car reps in Ventura. And for financing, Ryan is the guy to work with. I would definitely recommend this dealership to anyone.",5.0
588,"January 27, 2016",Really great to deal with CJ Wilson.  Everyone is friendly and a place to get some work done while waiting for service.  Thanks to the team there for the continued great service.,5.0
589,"January 27, 2016","I found a nail in my 2015 CX-5 and within 20 minutes, I was at the dealership and Jen had it being looked at.  She was also able to complete my scheduled oil change at the same time!  Always friendly, always accommodating. ",5.0
590,"January 27, 2016",Being distracted from reviewing my final contract with chit chat and sign here and there I failed to see that my final price wasn't the same as agreed upon with salesman and the APR was very high. My stupidity in buying a new car and thinking that the dealership was out to help me in that process is reflected in the contract that wasn't explained line by line or even addressed at all. Of course I am ultimately responsible for not reviewing my paperwork. ,2.3
591,"January 26, 2016","I have had great service from the folks here. I make an appointment, they get me in and out quickly and do what I asked for without trying to add things that I don't need. They let me know about issues
that I need to address in the future. I have had some very bad experiences with other dealerships for service.(with other makes of cars) so of course, even getting a oil change I was concerned at first.
 The price is fair,  and I know I don't have to worry about them doing it right or ""sabotaging"" my car. 
After a truck tire and rim hit me on the 101 I needed some tweaking to fix what the body shop recommended. They provided me with a loaner car and got the job done right as fast as parts availability would allow,(2 days)  Another plus is that they don't have an employee turn around issue for me there like other places  that I have dealt with,  so they accutally know who I am. Jennifer and Clint in the service dept. as well as the parts staff are easy to deal with. Even the mechanics are friendly. I rarely wright a review about anything inless it's a bad one to warn people to stay away. So I hope you have a good experience as well and this helps you out.",5.0
592,"January 26, 2016",This is by far one of my best experience in the service department. From the moment you walk in to the moment that you are out they are constantly updating you with the status of your vehicle. Great team! Got a chance for a one on one and it was detailed and no gimmicks to make money. ,5.0
593,"January 23, 2016","It's been a long time since I bought a new car, and I wasn't looking forward to doing it again based on experiences at other dealerships. But from the moment we met, Jimmy at CJ Wilson Mazda in Ventura was a friendly, knowledgeable source of help and information. Jimmy actually listened when I reeled off the list of features I was looking for (manual transmission, hatchback, etc.) -- and he made it happen. The time he spent helping us get to know the car's features after purchase was also invaluable. So, thanks, Jimmy! I love my new Mazda 3!
I'd also like to give a shout out to Ryan in finance, who helped make the car-buying process as quick and painless as possible. ",5.0
594,"January 21, 2016","CJ Wilson Mazda of Ventura's service dept is phenomenal! Fast and efficient, great customer service and awesome leadership! Great place to service your new or used vehicles! Great job ",5.0
595,"January 19, 2016","The customer service I received from the service department, particularly Jen, was superior to say the least.  She kept me informed throughout the whole process and provided me with cost effective options. It's reassuring to know that there are service departments that exist that aren't just about how much they can squeeze out of every customer. ",4.8
596,"January 19, 2016","Ryan, the service manager provided excellent customer service and the price for my oil change and tire rotation was very reasonable. Everyone in the service department were friendly and helpful.",5.0
597,"January 16, 2016","My current car was a Mazda 3 that I've owned for 5 years and I've not had one single problem with it. I had been looking into purchasing a CX5 since I'm expecting a child later this year. I emailed them first to inquire about 2 different vehicles and was contacted the same day. 


On a Tuesday afternoon I went to CJ Wilson Mazda.  My boyfriend and I shopped the lot on our own without any problems, and we were greeted as soon as we walked inside. Our salesman, David, was very helpful and willing to answer any questions. I was able to take the car for a few days to feel it out, free of charge, however I was pretty sold on the car and completed the lease the same day. Their department was willing to work with me on the down payment and monthly payments which was a stress reliever. Overall, our experience was easy and satisfying. ",5.0
598,"January 15, 2016","My car was serviced and washed in less than an hour without an appointment. I will continue to have my car serviced here. Thanks again Ryan!
",5.0
599,"January 13, 2016",Both Jennifer and Ryan are excellent service advisers.   My recall service for my air bag inflator was completed in a very reasonable amount of time.   I was provided a ride home and was also picked up when my car was completed.   Not to mention the free car wash.   Thanks guys.,5.0
600,"January 10, 2016","This car buying experience was very different from my previous experience. The staff was very knowledgeable and friendly - not the ""sales"" persona of my past experience. I left the dealership with my new car and a high level of confidence that I had gotten a great car from a dealership that I can depend on for years to come. Great job  C. J. Wilson!",4.6
601,"January 06, 2016","This is my second purchase from CJ...I received an offer from the dealership using TrueCar on the Internet.  I worked with AJ and Bassam on my purchase.  I was treated professionally and warm.  All of my questions were answered to my satisfaction. The vehicle itself was explained from top to bottom.

The actual deal was not stressful at all.  I think each purchase has its own unique set of goals and we arrived at our purchase price in a few minutes....

The finance person, Kris....explains the financial aspect of the deal in such an understandable manner that we could chat about other things going on in the world...

I would highly recommend CJs in Ventura...I enjoy my Mazda 6 and I know I will enjoy my Mazda 3...
I hope to return in the future for my retirement car....

Another reason to try CJ is the service department.  I am always treated with great service and if needed, a loaner vehicle for as long as the service takes....this is where I believe the package comes together.....they also wash your vehicle and return it clean...
On top of that...you have a nice area to watch tv, read the paper and drink coffee or a beverage of your choice....",4.8
602,"January 05, 2016",I had a fantastic experience while buying a new car at CJ Wilson Mazda of Ventura. They offered an amazing deal within my limited budget. David and Ryan were extremely friendly and helpful. I highly recommend purchasing a car at this dealership!  ,5.0
603,"January 05, 2016",I took my car in for service and it took lots longer than they estimated. Since I'm from out of town and had to wait so long they gave me a nice discount on the service. Thanks.,5.0
604,"January 05, 2016",From the moment I walked in Ryan in finance greeted my parents and I and was very nice and polite. He then introduced us to Jimmy D'Angelo in sales. Jimmy was very polite and never made us feel pressured or rush. He made this experience very easy and not stressful. He is a great saleman with great customer service! I will definitely be sending friends and family his way!,5.0
605,"January 05, 2016",I went in to see what options may be available with my limited budget. Jimmy was absolutely wonderful to work with. He was able to get me into a new car when I had been expecting to buy used. No games and no getting jerked around on pricing - Just good old fashioned customer service. ,4.8
606,"January 05, 2016","My daughter and I came to this dealership because the 2016 Mazda3 sport in white was in stock. This was our first stop and last. I normally don't buy at the first dealer, but, James and his team worked with our needs and met our expectations in a non-intimidating professinal manner.",5.0
607,"December 31, 2015","I hate buying cars but this was such a great experience.  No pressure at all, very helpful and great price!  I don't know if I'll ever buy anywhere else.  Thanks to all for being such a great dealership.",5.0
608,"December 30, 2015",My salesman AJ Briones was fantastic. The was never any pressure to buy or make up my mind. He answered all my question and even offered assistance should I need anything later on. I am very happy that I went to this dealership and will continue to do busy with them in the future. I really appreciate the wonderful deal that the manager John Ahern gave me and can't say enough about the great treatment that I received. I highly recommend this dealership and will send all my friends and family. ,5.0
