,Date,Reviews,Ratings
380,"November 07, 2016","I love the convenience and help I get every single time I have to take my car to C.J. Wilson. It's actually an experience I look forward to because I know I will get what needs to be done as well as advice on what may need to be looked at for my next 5,000 mile check up. The relaxed atmosphere gives me time to unwind a bit since I go straight from work. The service department is amazing. ",4.8
381,"November 07, 2016","Excellent!  People were great.  Checked in right on time.  Nice little lounge to hang out.  Coffee, snacks, TV and CURRENT magazines. Wi-Fi. Didn't take a minute longer than I thought it should.  Nice that it includes a wash.  Good experience.  Routine service, so assuming the work matched the customer service. No way of knowing really.",5.0
382,"November 03, 2016","I recently selected a car off of your lot a few months back, Mazda 2014 and a month later drove to Texas and had a leak in my tire and when I went in they stated that if I would have tried to drive back to California I would have blew a tire out. Secondly I took my car to get serviced yesterday and the brakes are worn almost to nothing and again I have only had the car for a few months.",3.6
383,"October 31, 2016","I came in to get oil change on my cars as I always have, come to find out the prices went from $40 to $75 so yeah but that includes a tire and brake inspection. Well I get that done in my tire store as do most people for free. So I left. I did not get the oil changed nor will I get any future oil changes there ever. I don't know why dealers especially feel the need to rip people off and then disguise it is a good deal. Just the other day I recommended you for an oil change to 2 of my friends I'm trying to call them to stop that from happening now
",1.6
384,"October 25, 2016",Clint went beyond the call of duty to help me out with some issues I was having with my truck and I am happy with the repairs . Thanks again ,4.0
385,"October 24, 2016","Recently brought my car in for service. I was very pleased with how friendly the staff was. My service appointment was done even faster than I had anticipated, and was still thorough. They even included a free car wash. ",4.6
386,"October 24, 2016",Living near the beach makes it important to keep the Mazda wiper blades and spray system in good condition for the winter.  I also like to be sure the batteries in the key fobs are fresh and strong.  Other maintenance points were discussed and notated. Great car wash included.,4.8
387,"October 20, 2016","Eric and AJ were both helpful and laid back.  Didnt feel any pressure that you get from other dealerships.  I was actually having difficulty with the bluetooth feature on my vehicle and AJ not even being my sales guy, stepped in helped me out and resolved the issue.  ",5.0
388,"October 19, 2016",Center console problem...called Jen in service and she said come right over...it was fixed and I was back on road within an hour...marvelous service!!!!!,5.0
389,"October 17, 2016","Took several days to identify the problem, and I got frustrated with the situation, but they answered all my questiins and got the job done to my satisfaction. ",4.0
390,"October 15, 2016","Brought the car in for standard seRvice was expecting a long wait time, to my surprise they had me in and out in about an hour, and Raymond was friendly, polite.",4.8
391,"October 14, 2016",Second time coming in for a service on my '15 Mazda 6. Clint is very professional and has been my adviser both times. The car has been serviced quickly and efficiently. The cost is fair and the time to complete the service has been quicker than a previous dealer I had been going to. Will be coming back again!,5.0
392,"October 13, 2016",Always a great service at cj wilson mazda always super fast with the service and great on prices for a mazda dealer. thanks again happy customer.  ,5.0
393,"October 12, 2016","I stopped in because the clip on my center console had broken and I needed the part ordered. I was helped within minutes, was told the part was in stock and it was promptly replaced!  ",5.0
394,"October 11, 2016","Just received my first service after purchasing my Mazda CX-5. Dropped it off and my car was ready about an hour and fifteen later with the oil changed, tires rotated and nicely washed. The whole process was super easy starting with the online appointment access. Best part, I got a free pumpkin at pickup : ) Very very happy with my car and the service at CJ Wilson!!!",5.0
395,"October 10, 2016","I'd been hesitating having my car serviced, as it seems that every time I'd been to a Mazda dealer in the past I left feeling over-charged and under-serviced. Not the case at CJ Wilson! Thanks so much guys for the outstanding service and quality of work.",5.0
396,"October 10, 2016",THis was my first oil change. I was pleased with the speedy and courteous service. The only thing I would like them to add is a vacuum of the interior along with their car wash. Other dealers I have brought my cars to in the past did that also.,4.8
397,"October 09, 2016","I leased a 2016 Mazda 3 from CJ Wilson in Oxnard. I had visited many other dealers and encountered everything from the swarm of salespeople to the three-tiered manager system. It became an exhausting task mostly because of the back and forth with the hierarchies within the dealerships. CJ Wilson Mazda was the most refreshing experience I have ever had. It starts with the staff. Excellent, helpful and low-pressure. General manager Bassam has cultivated the dream-team of employees who were always helpful and easy going. Wow, normal, nice people who are there to fascilitate. What a concept!! Heather is fantastic. Thanks for a great deal and a great experience. David T.",5.0
398,"September 29, 2016","I'm really sorry for the poor review, but I'm very frustrated with how the dealership handled my first new car buying experience. I bought a 2016 Mazda Cx-3 from here. The salesman, Jimmy, was pretty cool - good salesman, but the lot techs there aren't anything to brag about. They ran my car through the car wash and never bothered to wipe down the door jams or clean the windows. I've never even bought a used car that wasn't detailed, so you can imagine my disappointment when I bought a NEW car and it wasn't clean. There was fingerprints all over the windows where the sticker and stock number had been, and the techs just left them there. There was still sticker residue on the window where the price tags were. It was very frustrating. Of all things that really got to me though, it had to be the credit application that they emailed me, instead of having me sign at the dealership, and I feel really dumb for stating that it was ok to email it to me, because now, my social security number is stuck on some servers somewhere. Lastly, I don't know what happened to the credit application that I verified on the computer screen, but the one I signed had my date of birth wrong, my rent payment wrong, and the first round of emails, Estaban never verified my email was correct so now there's an unknown person who could potentially be stealing my identity right now, and yes, I know it's partially my fault, so sorry Estaban, this bus might hurt a bit. Overall, my experience with CJ Wilson Mazda of Ventura was just OK. I love the new car, but I'm frustrated with how you handled the situation. Thanks Jimmy and John you two were great, but I feel like I could've gotten a better financing rate, better deal on a 2016 model, and I probably won't be making any more 3 hour trips to your dealership to feel like I got ripped off, again - Based on KBB's fair price of the car, I paid $1,000 too much. ",3.4
399,"September 27, 2016","Always a pleasure to have my Mazda serviced at your dealership. Love you Jenn!
I would never go to another dealership. Sales to service are the best!",5.0
400,"September 26, 2016","My wife went to you dealer with check engine light.  I was told over the phone that the code was P0128 ""coolant temperature below thermostatic temperature regulating temp"" and that both a coolant control sensor and the thermostat had to be replaced.

There was no attempt to diagnose the problem as one time event due to a long down hill coast that brought the coolant temp too low for a short time.  That could have been done by re-setting the code and driving a short distance.  The service people refused to re-set the code.  

I beleive the service department took advantage of my wife, since she was on a trip and did not have any other options.  The description of the problem was over-exagerated and I believe we were ripped off with an unnecessary repair.  This code appeared a few years ago and was re-set at the Santa Barbarsa Mazda dealer and never re-appeared until this time.

In addition, the paperwork provided to my wife on payment showed no information about the codes that were read and no indication of what work was done!  ",1.0
401,"September 23, 2016",I went to CJ Wilson Mazda of Ventura to look at the new CX3 and CX5. AJ greeted me outside. He was awesome. He gave me all the details of the cars and was very knowledgeable. I decided on the CX5 Sport and they happily stayed open past their closing time to do all the paper work with me. Thanks AJ and Ryan for the great car! ,5.0
402,"September 20, 2016","We went to CJ Mazda because we had already purchased a Mazda from the same location three years prior. After much research, we decided we were interested in purchasing a Mazda CX5 through the Costco car purchasing program. The first person to contact us was Tom from CJ's. An appointment was set up for the following day. We thought Tom was great! Tom was courteous, professional, and was not overbearing. We went for a test-drive. We liked the car. Everything was cool, but now the work was to begin! We were shown the Costco price we would be paying. We were shown the invoice to verify the numbers. We asked for $11,900 for the trade-in of our 2013 Mazda3 with 18,700 miles, which was based on the KBB quote. We were offered $11,000.  At first, I balked at the low trade-in offer, but we were made to feel the Costco deal gave us no room for negotiation. We received the customer loyalty discount of $500, and at our request, the Labor Day discount of $250. They didn't even know what we were talking about. I found this discount on the Mazda website. We also wanted the 0%  loan rate that they were offering customers who qualified (that was us!). When we went to sign the loan papers, the loan rate was listed at over 4.5%. The deal was going to be off if that rate was not changed. Needless to say, the finance guy went down to 0.9%. We took it. What I'd like to know is, if Mazda was offering low financing, why did we have to ask for the lower rate? Between the low trade-in and the questionable financing, we left with a feeling of distrust. Our dealings with Tom were A+. Our dealings with the financial part of purchasing the car is why we give it a three-star rating.

",3.0
403,"September 19, 2016","As my first service, everything went well.  The customer service rep was nice and approachable. My car looks great.  And I got free coffee and snacks.  Thank you!",5.0
404,"September 17, 2016","Service staff, especially Jennifer, are very helpful and interested in meeting your needs for any kind of maintenance or repair.  I have an older Mazda, with some unique quirks, and Jennifer has met each challenge with complete competency and a cheerful ""can do"" attitude.  I really appreciate a ""no pressure"" atmosphere, and willingness to prioritize maintenance expenses by considering both safety and my budget! ",5.0
405,"September 16, 2016","As always, Jennifer Lange gets me in & out quickly, explains everything clearly, shows that she always goes the extra mile. Great communicator, knows her stuff. ",5.0
406,"September 16, 2016","Jimmy was very helpful when I came in to check out a 2016 Mazda6 lease deal. He worked with me to trade in my old car without any issues, he was very knowledgeable about the car I was looking to lease, and the overall experience was fantastic. I would definitely recommend coming to CJ Wilson Mazda to my friends and family!",4.8
407,"September 15, 2016","The sales team in particular (Jimmy and AJ) really went out of their way to help me and then us find this amazing car. AJ helped via email and then gave me his ""desk partner's"" name, so Jimmy was able to help me the day I first cam to the showroom. The car has so many extra perks as well as the great quality of Mazda. My husband is still driving his 2002 Protege, so we know Mazda. And then today, a tin of fresh baked cookies arrived from CJWilson Mazda...what a nice touch!",5.0
408,"September 11, 2016","There are far too many dealerships out there that are just trying to spread open your wallet or pry into your bank account and take every available dime you have to spare... Not here! This is our second purchase of a Mazda and the reason that we came back was for the support in not only finding the best car for our money but also matching the car to my wife and her needs. To begin, we were met with a smile and a hand shake, followed by the John and I talking about what I was looking into getting. After the long list of awesome features in comparison to my wife's 2011 Mazda 3 grand touring that were available on the new model as well, we jumped to the cx 5 which I figured would fit her better. The whole time the dealership was busy and he did not miss a beat! Then worked with the general manger Mr. Bassam to ensure that we not only had the best price for our trade but also the best price on the cx-5 my wife had decided on. This was not only refreshing but enlightening, as I have bought many cars in the past but have never sat down with a friendly gm to go over pricing and details of the sale. After everything was finished and set, Mr. Bassam, referred us over to Heather who greated us with a smile and walked us through all the features and helped set up all of my wife's setting for her. This was the fastest buying experience and most pleasant I have ever had! Five star service and two thumbs way up for them!",5.0
409,"September 11, 2016","It was a great experience, our saleswoman Heather, was wonderful. I had shopped all Labor Day weekend and had just about given up hope of finding a car when we found this dealership. Within minutes we were signing papers and talking to finance, another stress free experience!!",5.0
410,"September 10, 2016","To all Prespective Mazda buyers:

From the moment my husband and I drove into the parking lot (by the way we drove down from Santa Barbara because we heard good reports on this Mazda dealership) and entered the showroom, we were greeted and treated professionally. My father sold cars for 50 years both full-time and part-time, and I sold new cars myself for a year, nearly 8 years ago. So, having been around dealerships all my life, I was still nervous, as I wanted to make sure I was buying the right car for the right price. We did our homework and had been looking for the past 3 months for a smaller SUV with great features: safety, moon roof, sound system, back-up camera, leather seats, good looking wheels, etc.

I was pleasantly surprised to realize the lady holding the door for us as we entered asked ""if she could help us"", and of course delighted to work with another female salesperson. Heather Massey was knowledgable, listened as both my husband and I were asking numerous questions (at the same time, I may add) and I loved she owned the Mazda we were considering. 

Maybe the most amazing part is Heather met our price. We would be leasing and needed a low monthly payment to make it work.  We were willing to walk away if we could not come close, but she met our price and I drove home in a beautiful Soul Red CX-5 Grand Touring Mazda. 

During the process we also met the General Manager Bassam, who was equally accomodating as well as Kris in Finance.

Make sure you go to CJ Wilson Mazda of Ventura before you purchase!

Sincerely,
Renée 
(A happy CJ Mazda customer)
",5.0
411,"September 10, 2016","I had an excellent experience due to the fact that all the  employees including, but not limited to, Sales Consultants, Service consultants, Financing and Cashiers, were professional.  The Sales consultant listened to the specs I need in a car, suggested some and I even test drove one the same day.  The deal went smooth and after the sale and financing, he introduced me to the whole department.  That made me feel at home.  Couple of days later, to my surprise, I received a box in the mail.  It was their way of saying thank you for the purchase.  Thank you C.J. Wilson Mazda dealer of Ventura, you made my purchase an interesting experience.",4.8
412,"September 09, 2016","My wife went in for a free oil change an offer that was sent to us in the mail. We misplaced the coupon so my wife called dealership before driving down and man on phone said no problem, just come on down. When she arrived the man didn't want to honor the offer and flat out told her that she never called that morning n spoke with him.

We were seriously considering trading in our 2014 cx-5 for new cx-9. Unfortunately we will no longer take our buisness to this dealership. ",1.4
413,"September 09, 2016","As usual, super friendly and professional staff.  Great service,always on time. Highly recommend! I will only have my CX5 serviced here. Thank you!   We will be back.  ",5.0
414,"September 08, 2016","I am so in love with my new 2016 Mazda CX5 GT AWD that when I noticed a defect in the leather on my driver seat about six months after purchase I was ready to cry! On the next regular service visit my husband mentioned the seat defect in passing to Jennifer who was very quick to follow up with us and get the warranty inspection process started. When I arrived for the warranty service I wasn't fully aware of the amount of work involved and so did not prepare a ride home. Not to worry, though, as CJ Wilson Mazda provided a loaner car of comparable size and even trim level! I so appreciated the loaner as it meant I was able to keep my appointments with my clients and shuttle my daughter to and from daycare. Jennifer kept me updated at every turn and really went above and beyond to make my service experience the best! While I was disappointed at the defect, it was minor and by no means has changed my opinion of the car - because defects do happen. What really impressed me was the lengths to which the CJ Wilson Mazda team went to provide excellent service - for the car AND the customer! I will continue to recommend not only the Mazda brand but specifically CJ Wilson Mazda of Ventura at every available opportunity!",5.0
415,"September 07, 2016","I had read the good reviews of the new CX-9 but wanted to see it in person. When the time came that I needed to buy a car, I was intimidated to do it alone as my husband was out of town. However, from the minute I stepped on the lot, salesperson Esteban Shannon-Bernardy was great. The whole process was a positive one. He was patient with all my questions and I never felt like he was rushing or pressuring me. I didn't even go look at any of the other cars on my list. The CX-9 has everything I needed and more and I was in love with it the minute I saw it and drove it. I have no regrets and would recommend this dealership to anybody who is apprehensive about the car-buying process.",5.0
416,"September 07, 2016","For the first time being there my experience was awesome this includes all staff , Keep up the good service and Jen most helpful... also for the accessories person that helped me greet you with a smile.
I will be back to continue my business with them. Thank you very much for the service with a smile...",5.0
417,"September 05, 2016","Wow! Everyone here is so nice, kept me notified about timing and I was in and out really quick.
I highly reccomend this dealership for its wonderful service!",5.0
418,"August 31, 2016","Tom & John were Great!  We were looking for a SUV and we stopped at CJ Wilson Mazda first. Only because it was the first dealer in line.  We drove the CX-5 and was impressed with the features, but we wanted to compare with other SUV's.  John and Tom encouraged us to check out the competition and we did!  After viewing and driving many others we knew the CX-5 was going to be the vehicle.  We contacted John by phone the next day and he got the ball rolling.  The new lease was painless and we drove off in our new CX-5 within a couples hours.  They washed and fueled it and Tom took time to explain all the fine details about the car.

Cant forget Ryan!  He had everything in order and made signing papers easy.

Thanks Tom!

Blane & Krista Schloo",5.0
419,"August 29, 2016","Jennifer is terrific! Attentive and on top of her game...Makes it almost a joy to get my Mazda serviced! I would strongly recommend Service Department


",5.0
420,"August 26, 2016","I stated ""Tust your Local dealers for several reason, for one Ventura is a small city, and good independent auto shops are few and far between, and when you find a good one their price's are higher than your Dealers price's (not like before when the Dealers price were rediculously higher). Another is the Dealers give your car a through inspection, no matter what you brought it in for (at least they do at C J Wilson Mazda), if this is done at an Independent Shop they charge you for inspections. Finally I will tell why I trust these Dealers, I own a Mazda RX8, and there was one Independent that would even work on that model, anyway I toke my car to I won't mention their name (Dependable on Wells Rd.) because I detected a smell like my clutch was burning, and for them to check it out. I was told the smell was from oil leaking on my exhaust pipe, which they repaired, but two weeks later my clutch went out so back to the shop it went. So here's the Kicker, I had a recall on my air bag so I had to take it to C.J. Wilson for replacement, they gave my car a full inspection, and found out that my transmision had one bolt missing, and three bolts loose. To add more insult to injury I inquired about how much th charged for clutch replacement, I was quoted a price that was $500 to $600 less. Needless to say I will never go to an Independent Shop again, An will always Trust My Local Dealer....
    and a Special Thank-You to Clint Stremcha",4.4
421,"August 24, 2016","Heather Massey is Awesome!! She held my hand through the car buying process. Putting up with my many questions, concerns and silly requests. She helped me to get the exact car I wanted, for the price I wanted. I am totally in love with my new car!! Many, many thanks to Heather. It was also super refreshing to work with a woman at a car dealership, which is a very male dominated field, way to go CJ Wilson Mazda!! ",5.0
422,"August 24, 2016","The service center is always ready to help me when I arrive. On this instance when I went into the service department to get my car the person who was sitting at one of the desks was eating and I felt bad for interrupting her lunch. She asked if I was there to pick up my car, and if so I should just go to the cashier to check out. The cashier had me sign a couple of items and then I left.",4.4
423,"August 24, 2016","We had a great experience at CJ Wilson Mazda in Ventura, our sales consultant AJ was knowledgeable and helpful without being pushy. Best Car buying experience ever.",5.0
424,"August 24, 2016","I went to the Mazda dealer for a recall and for some additional work.  I spoke to the service department ahead of time, about the Warranty that I had purchased from Mazda, and about the work that I wanted done.  Victor in the Service Dept could not find the Warranty, and when we arrived no one had information about the repair that I had discussed.  Victor could not explain how the dealer would use the Warranty, but emphasized that we would be billed for repairs.  Finally Jennifer intervened, found the Warranty online, and set up the service.
We left the car over the weekend to wait for parts.  On Monday, I never got a call letting me know when the car would be ready.  When I called in the afternoon, Victor told me he was ""waiting to get paid"" from the Warranty, and I had difficulty finding out when my car would be finished.
Customer service was poor, as we were not greeted when we arrived (2 representatives ignored us at the service desk, then one told us they were ""multi-tasking"" and would get to us later).  When we picked the car up, Victor gave the completed paperwork to the cashier without reviewing or discussing the service.  We were left to find the car out in the parking lot ourselves.
In the end, we paid for diagnostics which we believe were covered by the dealer Warranty.  The recall was completed to our satisfaction, but we declined to have the dealer do repairs because of poor customer service and communication.  
I have dealt with many car dealers, and this is the worst service I have ever received.  I will not return, and will take my Mazda elsewhere for service and repairs.",1.6
425,"August 24, 2016",It was our very first visit at this dealership. Everyone was very friendly. AJ was very well informed about the Mazada C-5. He was very friendly and kind and good customer service. Thank you very much.,5.0
426,"August 19, 2016",Jennifer is the best!    She always takes excellent care of me when I come in for service.  She also keeps me well informed throughout the process. ,5.0
427,"August 18, 2016","I had 2 CX-5's serviced and C J Wilson did a super job. Clint and Jennifer were very polite, professional and extremely helpful.",5.0
