,Date,Reviews,Ratings
223,"July 19, 2017","I negotiated a nice price online and was happy with the deal I received. Kudos to Kevin and Bassam. They were great representatives for Mazda,",5.0
224,"July 18, 2017","One of the highest forms of praise for a dealership is to be a repeat customer. This was my second purchase from CJWilson of Ventura (my previous 2016 purchase was totaled in an auto accident). This dealership is the best. Its friendly, low pressure, comfortable, and clean. All of the staff were great. I got the same sales person, Heather. She's great. She communicates and LISTENS very well. She got me exactly what I wanted (basically a 2017 version of my 2016), right down to the same matching color. She went over the different features between the two models to make sure I was comfortable in my new car. Bassam & Kris handled my financing. I am very pleased with the financing plan. I happily refer family / friends that want a Mazda to this dealership. ",5.0
225,"July 17, 2017",Jennifer and service team is awesome! I would recommend to family and friends. They got my car done quick and washed it ahead of schedule! Amazing!!! ,5.0
226,"July 16, 2017","Mazda.....C J Wilson treated me with such respect and proffessionalism.KNOWING my deadline to get back to work, washing car and sending me on my way.....thank yo",5.0
227,"July 16, 2017","Outstanding experience! Easy, no pressure, quick.  Rick was very responsive with excellent communication. The follow up Cookie gift was a nice surprise! I highly recommend this dealership.",5.0
228,"July 12, 2017",I love CJ Wilson Mazda. Everyone especially Kevin made my visit enjoyable and the experience as easy as buying a new car could be. I sincerely appreciate all the attention my wife and I received. Thanks for your help with my trade in too...,5.0
229,"July 10, 2017","First timer - After parking all the way in the back with a 94 honda, boy did I feel outta place. An employee named Nick, fine looking chap, led me inside the dealership in a cheerful manner. After I eluded to him I had spoken to certain lady on the phone, I was introduced to Heather.

Friendly. Courteous. Professional, yet had a casual demeanor. Very inviting smile.

Heather was easy to talk to, no pressure did I feel to walk out with something I wasn't sure about. She'd welcome any questions, and used any downtime to make endearing conversation (also brought us drinks).

I'd say the visit took the better part of an hour, and it wasn't overwhelmingly tedious.

Heather was a pivotal character in the game of purchasing this car. Call ahead, ask to meet up with her, and you'll enjoy the company of a stellar sales rep.
",4.8
230,"July 06, 2017","I would recommend your dealership to friends and family and I would highly recommend Heather as their salesperson. She was friendly, and she knew what I was looking for. ",5.0
231,"July 04, 2017","Came in for a service oil change and of course was taken care of by Jen an Clint. They treat us like family, always friendly, great customer service, speedy service, we love them! ",5.0
232,"July 01, 2017","Heather did such an amazing job. Last year she helped me purchase my first Mazda, and now she helped me trade in my old Mazda. With her help I was finally able to get my ""dream car"". She went far and beyond to help me though the whole process, making it an amazing experience. Thank you so much Heather.

Kris was also very helpful, he made the finance processs simple and informative. He did a great job by getting me a great deal. ",5.0
233,"June 30, 2017","I was in a pretty tough spot when I went to CJ Wilson. My car of 10 years died suddenly. It was old and worthless. I recently moved to the central cost so my savings were pretty much cleaned out. Not having any money for a down payment, I just showed up thinking I'd be looking around and figuring out how much money I'd need to save. I've had my eye on Mazdas for a while so I stopped by CJ Wilson to see what the new cars were like to drive. I fell in love with a little firey Mazda 3 and started to talk to them about my financial situation. I thought I was just researching but they got me into a lease without having to put anything down. They amortized the down payment, delivery fees, tax, title, and licensing over the whole lease period and even made the first payment(s) for me. I drove off with a brand new car at the exact trim level I wanted and averted a potential crisis thanks to Heather!

Considering my car died suddenly and inconveniently, this turned out to be a happy accident. Love my new car, I'm so impressed with Mazda's build quality, and would sincerely recommend this dealership anyone. Now my fiancé wants to buy a Mazda from them! ",5.0
234,"June 30, 2017","I had the best experience in buying a car thanks to Heather Massey, she goes above and beyond. Very helpful and so patient with me. I will tell friends, family and people I run into to buy from her, best experience ever, THANK U HEATHER",5.0
235,"June 30, 2017","25% sale is done during initial contact and subsequent followup with the customer. The next 25% when he or she walks into the dealership to buy car of their choice. Remaining 50% is not done until deal is closed and signed. We should not sideline role of each and every individual directly or indirectly related to this process. Someone who is showing you the car, taking you to the test drive, getting it ready for you is as important as the person who is responsible in ensuring best in class service is delivered. One may have been reading, watching videos, doing comparisons but something has to be reinforced to make initial contact into sales. We can bring in a customer one time by offering incentives, discounts, rebates etc but building a long term relationship requires more than that which ultimately translates customers into clients or family of clients. If one person has bough a car from a dealership and has confidence in the deal and value they got they will definitely bring more members or convince their friends to see what is so special about it. So those unheard or hidden customers then become your real customers.  For example if someone is brand loyal they may have many members buying same brand, make or model. Customer retention is a big challenge not only for dealerships but so many other organizations. People, processes, and Technology are critical but human is most important among all. 

My experience of Mazda dealership was as pleasant and friendly as I could think of. Bassam and team was very professional, polite, and have done their homework well. I sincerely hope it will go a long way and I will keep my trust and confidence in their offering and top quality service.   
Prior to visiting Mazda dealership, I walked out of 5 dealerships. Typically, they pushed you so much that you end up buying their car and later regret your decision. So no pressure sales ever. At the end I would like to say we should always treat people with respect and dignity and they return your favor. If they do not then they are not going to respect or like or worth time investing in.

Saad ",5.0
236,"June 28, 2017","if you want to buy a Mazda, this is a great place.  Friendly, not pushy.  Benny responded to my email inquiry promptly and invited me to check out the inventory. When I arrived, he introduced me to Mina who was just great. Mina was patient and took the time to find out what I liked and didn't like about the various cars I'd looked at.  She put the time in to figure out what I really wanted without trying to convince me otherwise.  There was no pressure but I felt a genuine interest in putting me in the right car.  She searched the entire inventory to find just the right fit.  She put the time in to explain the features of the car and the service program.  She didn't try to push me on the add ons but went through each one with a detailed explanation of the benefits.  I'll refer all I can to Mina. Thanks!",5.0
237,"June 28, 2017","I love going to CJ Wilson Mazda it was truly a great experience they had no openings for a tire change, yet managed to get me in and fixed everything in less than 2 hours. They also washed my car and made sure my car was ready when I got there. I recommend this dealership for everyone. ",5.0
238,"June 27, 2017",Happy friendly dealership that worked hard to get me the car and deal I wanted. Thanks Mina and Kris. For all the help and hard work ,4.5
239,"June 27, 2017","Kevin seems like a genuinely good guy, sweet man, family man. I've spent over 7 years in sales so I get how a shameless, sleazy office culture can seem normal once you're part of it. I purchased a 2016 new Miata grand touring, electing to finance. I was shopping around on cargurus and auto trader. CJ Wilson's price was discounted but $1,000 above another dealership. Kevin says he has approval to match and beat their price. He texts me I'll be saving $5600. I told him I'm not driving to his location to save only $1 or $10 because the other dealership is 20 miles closer. We talk and text during the day and he says I'm going to be very happy with the price, but he can't guarantee an exact quote over the phone. In good faith, I let him run my credit. My FICO is 792.  
Example 1: At the dealership, time to talk numbers. He quotes me $5 less than the other dealership. This is also less than the $5600 in savings he texted. He says sheepishly, ""but that's why I'm taking you out to lunch after.""
Example 2: re: numbers. I'm wondering why my monthly payments are as much as they are. FICO is 792 and I'm putting down more than $2k which should cover taxes and licensing. He says we're either going to get you on a large downpayment or we're going to 'get you' on a high interest rate.

Wouldn't you be insulted by this xxxxxxxx? Why would I want to have lunch with someone that just screwed me in any way?  

Example 3: human error. The dealership is suppose to give you 2 keys. Somehow one of the keys was for the wrong car. Kevin took a picture of the overnight package, but didn't send it till I, as the consumer, took responsibility for the expense to ship the key back. Does that seem professional to you?

Again, I do think Kevin is a good guy, and he probably doesn't think he did anything wrong. Because 'we all need to get paid' and 'that's just the way things are'. I get it. ",2.4
240,"June 26, 2017","I recently leased a 2017 CX-5 from CJ wilson and was extremely happy about my experience there. Heather Massey was my sales person, who did a phenomenal job of giving us every detail about the car. She was very knowledgeable, as well as attentive, and overall just had awesome customer service skills. I would absolutely recommend family & friends to CJ wilson, especially to Heather. ",5.0
241,"June 26, 2017",Ray & Jennifer are great! They are flexible with scheduling and do a terrific job keeping you up to date on your vehicle status. Love this service center...,5.0
242,"June 26, 2017","If there was a zero star I would give that rating, even below zero! In June 21st, 2017, I took my Mazda CX-5 2016 for oil change and a regular service. Jennifer from service department aggressively took over my car once she knew I might trade in my car for a new CX-5 2017. She wouldn't release paperwork to me, she kept saying it is not your car, it is not your car! I was telling her I have not made a deal yet and it is my car give me the copy of the service papers but she refused!  Bennie from sales had invited me for a promotional plan to upgrade with no penalty release of my lease on my Mazda CX-5 2016. He told me I have equity on my car and I need to bring in my car for him to give me a payment on a new car. When I met him that day he introduced me to Heather Massey the sales person and said she'll help you. I asked Heather how much equity they want to pay on my Mazda CX-5 2016, and how much the monthly  payments would be on a new Mazda 2017. Heather kept going back and forth to Mahmud the general manager's office and eventually came back with a piece paper on her hand saying that they would pay $950 on my 2016 as is and they will pay off the remaining lease meaning I do not need to make any payments in June and I will pay the payment at the end of July for the new 2017.  She said my payments will be $410/ month.  I told her that my car is clean, in a very good shape has low milage of 11056 since we leased it in Dec 2015 and I had an allowance of 15000 miles per year. Heather went back to Mahmud's office and came back saying that's what Mahmud is paying for my 2016 car $950 as is, I wouldn't pay anything for that car and they would pay for the remaining balance on the lease.  Regarding the payments I negotiated with Mahmud and he agreed to bring down the payments to $390/ month on the newCX-5, 2017 and he agreed to the rest of the foregoing.  Since it was late, they kept my old car not to put milage on it Mahmud said and I went back home with their loaner car. The next day, Heather called and said my new car is ready , so I drove back to Ventura to CJMazda. It took two hours for Mahmud to prepare the lease agreement. Heather kept saying they are going to give you all the paperwork at the end when I was asking about the trade in of my CX-5, 2016 and the amount of $950 equity documents and how it is going to be applied on the ending of this lease and starting a new one. Heather kept saying they will give you that in the finance department, when from the beginning I was asking for it.  Eventually Mahmoud came and took me to Andtew the finance guy's room and said he will have you sign the lease agreement while he sat next to me and took every piece paper that they asked me to sign with himself to his room and it took more time for him to come back with an envelope handing me saying these are your copies, When signing I asked Mahmud how much did you purchase my old car and he never mentioned anything about negative equity and never pointed out that he had not applied that $950 equity promised to me. He said you don't need to pay June payment on Mazda 2016 any more and we will pay off the remaining lease balance. So the first payment  on the new car was waived. Also, your 35 payments for the new Mazda 2017 will begin in the end of July.
Then they made me to pay $2000 as a down payment on the new Mazda 2017.
Exhusted and drained from this slow paced tedious process eventually I left the dealership with the new car! 
Once I sat in the car, I had a gut feeling that something is off, therefore, I started reviewing the lease but I could not find the $950 equity for my trade in in any part of the lease. Immediately, I contacted Mahmud and asked him where did he apply the $950 that was promised to me for my old car's trade in. Mahmud started yelling at me that you had no equity on your car, you had negative equity and he pointed out for me to look into number 4 the part that had the breakdown. I couldn't believe it that he had duped me in this way, the negative sign was hidden on the line of the paper and he had put $1911.00 that I owed on my old car which then he had added to the price of the new car!  I told him that this is not right and it is not based on what we agreed upon my trade in because if Mahmud had told me he wants to give negative equity on my old Mazda 2016 I would never ever agreed with this deal to trade in my Mazda CX-5 2016. My car had 11056 miles on it and I kept it clean, it was running great and with no accidents. The value of complete similar milage Mazda online is $27,000 and Mahmud has given a trade in purchase value of $22,000 then has made me liable for the $1911.00 and as I said added that amount to the value of the new Mazda 2017. 
Such shyster and violent person that when I went back the same day (June 22,2017)to the dealership (CJ Wilson Mazda Ventura) for him to rectify this fraudulent lease he hid in his office, Heather lied again that he is with the customer. Heather lied saying that they had never offered me $950 equity on my old car. My daughter over the phone had witnessed our conversation with Heather and I had discussed the $950 equity with my daughter in front of Heather while we were sitting at her desk! Heather blatantly lied and denied ever telling me about $950 trade in and later she became vicious towards me and started verbally abusing me yelling that I am disgusting! I called my daughter to join me in the dealership(CJMazda Ventura) because I felt threatened and alone under attack of Heather. Mahmud never came out of Hiding in his office to resolve this matter. I found the used car manager to discuss what had happened to us that day. Heather was standing outside his office looking through the windows telling me I am disgusting, then she began video taping with her phone and giving me looks, shaking her head and harassing my daughter and I. Since the dealership was closed we got up to leave, Mahmud showed up talking to Heather, my daughter felt scared so she asked the used car manager to escort us outside to our car! Meanwhile, Mahmud joined Hearher bullying  us and verbally abusing my daughter. On our way out, Mahmud violently invaded my daughter's space while telling my daughter she is disgusting! Then, while pushing us out vehemently slammed the door at my daughter's face while she was going out! I wanted to call the police and report Mahmud's assault and violent conduct, verbally abusing us, but my daughter said mother lets go home once she saw that I am drained and traumatized from this whole ordeal. 
(I am told by my doctor that I should avoid stress because I am heart attack prone) so that my daughter was afraid for my health condition.  Therefore, we left feeling blathered and abused that night and still after six days past we feel damaged and hurt! I wake up at night with heart pulpitition and my daughter cried for what she witnessed that day her mother and herself being verbally abused and attacked by Heather (sales person) and Mahmud 
(general manager) at CJ Wilson Mazda  Ventura!
We have consulted an attorney and we are told that definitely Mahmud and Heather has used deception in making sales and trade in which is illegal and fraudulent!
I am writing this in the hope that others will read it and no one would fall prey into the lies and deceptions
 of Mahmud and Hearher in CJ Wilson  Mazda Ventura. Mahmud is definitely a shyster and a crook using his position to defraud trusting people Like us.He is violent, obnoxious and unprofessional! He hid in his office and did not come out to talk amicably with us instead he yelled at me, verbally abused us and violently slammed the door at my daughter's face!  Mahmud should not be in the management position that he is right now at CJ Wilson Mazda Ventura because he doesn't know how to be civil and interact with customers. His gang like appearance and behavior frightened my daughter and I , we regret ever going there!  If Heather and Mahmud showed their true face in the first place we would never set foot in CJ Wilson Mazda Ventura let alone buy a car from them!
Therefore, I urge customers not to fall into Mahmud and his accomplice Heather's trap and be fooled by their false friendly smiles because once they set  their claws on you their true face and true color which is so ugly and evil comes out! If they did it to us, I am sure they have done it to others too. Buyers Be Aware!  Don't go CJ Wilson Mazda because they will dupe you and abuse you and take advantage of you in the process of purchasing or trading in your car!  Definitely not worthed to go through what we went through with dishonest low lives such as Mahmud and Heather at CJ Wilson Mazda Ventura!




",1.0
243,"June 23, 2017",Jennifer was  friendly and courteous and listened to our comments and checked out  and corrected the problem satisfactorily. We are pleased with the service that C.J. Wilson provides.,5.0
244,"June 21, 2017","I thoroughly enjoyed/trusted working with Tom Straszewski and all others I encountered. I believe my ""deal"" was pretty decent and they too made money.",4.6
245,"June 21, 2017","I needed a new car, and the whole staff was super helpful, from the UC manager, to finance, to Heather. I'm really happy with my car, and it didn't take long for the whole process, from start to finish. I'd happily recommend the dealer to anyone looking for a Mazda.",5.0
246,"June 19, 2017","The CJ Wilson team is really outstanding and customer friendly from the Vice President & General Manager to the sales and finance team.  I had an excellent experience in all phases. Started with an email from Eric checking on a response.  Bassam took over and we agreed on pricing terms over email saving me from driving 40 miles to haggle.  When we arrived Esteban and Bassam greeted us and Esteban was a great host and representative for Mazda throughout the test drive process, explaining the features and answering all my questions. Finally got to Ryan in finance and he was very efficient and friendly.

The standout moment that really made a great impression was after the deal was done, I had the keys and the dealership was closed. I was parked next to the dealer waiting for my daughter to return from the local store so we could drive home together.  Esteban called my mobile asking if everything was okay. We were all tired, but he took that extra second to check in after seeing me parked. Above and beyond for sure.

I have been a long time Toyota owner and this is my first Mazda, but based on this experience it won't be my last.  Love my CX-5.",5.0
247,"June 13, 2017",i would like to say that every time I have taken my car in for servicing it has been wonderful. Excellent customer service!!! I highly recommend CJ Wilson to anyone looking for to buy or just regular service maintenance this is the place. Thank you for everything,5.0
248,"June 10, 2017",The service department is doing a great job taking great care of me and my Mazda cx5 very friendly and listening to all my concerns ,5.0
249,"June 09, 2017","Squeezed me in, got me out early, applied discount coupons - a totally satisfactory service experience!  Did I mention that the cost was both reasonable and exactly what they quoted.",4.8
250,"June 09, 2017","When an emergency warning light came on, they worked me in without an appt, my car was done in a couple of hours. CJM Service professionals keep my 2-year old CX-5 safe for the roughly 700 miles I drive to & from work every week. I love the car, but it's the service that has ensured my next car will also be a Mazda.",5.0
251,"June 07, 2017",Great Service done in a timely manner. Appreaciate the car wash. Service with a Smile. Highly Recommend the Dealership for service and purchase of a new car.,4.8
252,"June 05, 2017","I found CJ Wilson Mazda online and they had the lowest prices around, about 230 miles away from where I reside. Even when their prices where low they still lowered it more just to make it work for me, my salesman Tom was great and knew what he was talking about, also he didn't waste time and made it a easy time for my wife, four boys and myself. Then we completed our work with Ryan the finance specialist, who again worked fast and efficient, both Ryan and Tom had great customer service and worked fast and effective in order to get us on our way which was 230 miles. Will recommend and return to CJ Wilson Mazda again!",5.0
253,"June 05, 2017","The service center people were friendly and prompt. Car looked great and the work was ready before the promised time. Cashier was welcoming and prompt as well.
",5.0
254,"June 05, 2017",I have to give Orchids to Jennifer at CJ Mazda.....had my 6 in for service and my service writer Jennifer noticed my rims had some flaking....she came in and proceeded to make an inquiry about getting them fixed....she informed me that she got an approval and had me bring my vehicle in for repairs.....All the scratches were fixed and they look new....I appreciate your staff very much.....Jennifer thank you again for providing service at the highest level......and it didn't cost a penny.....Happy Dance....,5.0
255,"June 03, 2017","Clint Stremcha provided excellent service.  

I would suggest that Mazda put people first that actually show up for service rather than making phone customers their priority.  Clint did not do this, but others have and I find it very annoying that we drive into Mazda for service and the priority is their phone calls, which from what I understand is Mazda's policy.   This is a great service center and I will be back.  Lucky them.  HA HA   Thank you.  ",5.0
256,"June 03, 2017","CJ Wilson Mazda is a relaxed, friendly environment/dealership. The sales staff, Mina and Heather are friendly and informative, Bassam, the GM is a congenial man, wants to give satisfaction to buyers by approving the best deal possible. No long waits or game playing with negotiating pricing. The financial director (Kris) is a straight shooter and willing to go the extra mile to explain the contract paperwork.  Jen is service is great to work with, too. These folks are honest people, selling a very nice make of car. 5 stars.",5.0
257,"June 02, 2017","The sell representative has full knowledge about the car’s equipment and operations, in great details.

Final price negotiation is simple, quick, and honest. Not going through the “in-and-out-of-managements” hassle and nightmare.
",4.8
258,"June 02, 2017",Jen  went out of her way to make sure I was able to get my car back even though I had about very tight deadline. ,4.2
