,Date,Reviews,Ratings
0,"September 11, 2018",Kenneth was very nice and friendly and listen to my request very well. The atmosphere of the service department is better than my last visit.,5.0
1,"September 02, 2018","Better than the service center in Westlake. Drove 30 minutes out of my way to not deal with Westlake again. Thinking about the Westlake shop makes me angry. Price at both are a little to high too. But at least Oxnard shop was nice about it. Not cold, mean, and heartless like Westlake. Also Mazda needs to update their ""safety check"" across all on Cali to include headlight check and horn check. Drove off the lot without either working. I was driving an illegal car off of YOUR lot that YOU were suppose to check and make sure was, not only legal, but safe!!!!!! Your guys response? ""Bring it back at your earliest inconvenience and we will charge you more money for your inconvenience, Thank You for choosing Mazda Certified Service...where we do just try enough according to company standards, not state/moral standards"". The negative comments I have are mostly about Westlake, but you guys need to fix your ""standards"" state wide. I would not recommend a New or Used Mazda car to a friend buying a car in Cali right now. Your standards aren't up to snuff state wide. Sorry, but if the truth hurts, but then again, you guys weren't sorry for my inconvenience either.",4.0
2,"September 01, 2018","Great follow up after we purchased our vehicle, great service assistance. Really pleased with my first experience in buying new.  The car is amazing and the staff were very friendly, helpful and attentive,",4.8
3,"August 31, 2018","The staff help us figure out the required maintenance needed, performed a pre-check, and performed the maintenance required. Fast, and efficient. We will be coming back for our next service.",5.0
4,"August 30, 2018",Good follow up. Good efficient service. Nice people. They said they would contact me when the service was completed and they were true to their word.,5.0
5,"August 27, 2018","The staff there helped me figure out a problem on the car.   Fast, and not a hassle.  I’ll be coming back here again for next service. ",5.0
6,"August 20, 2018","Thomas Groebel was very efficient and friendly. Very responsive to questions. His follow-up and personal inter-action was much appreciated and went beyond what is normally expected.

Also would like to add that Mina Vasquez was a pleasure to work with during the purchase process.
",5.0
7,"August 14, 2018","I came in to CJ Wilson on a Friday morning with multiple problems occuring with my newer vehicle.  It was busy, but they were super efficient with checking me in, and putting me in a loaner vehicle.  I had the loaner g
For about a week which worked out nicely since it was more of an up grade for me.  Once my vehicle was ready, I received a call to come in.  The customer service crew did a fantastic job getting my car back to me better than new.  Great experience over all.",5.0
8,"August 14, 2018",I originally found the Mazda6 we wanted to buy on their website.  The finance manager Ryan Keith was extremely helpful and diligent getting us an excellent deal on the car which we took advantage of.  Mina Vasquez also did a great job helping us through the buying process and following up with us after the sale.  Cannot recommend this dealership enough! ,5.0
9,"August 09, 2018","I purchase a new Mazda Miata MX5 - Hardtop and absolutely love it. Tom helped me and answered all my questions without hesitation.  Kris Wardak made the paperwork so easy. It was a piece of cake. By far the easiest I've ever done!
Thanks Mazda Ventura :)",5.0
10,"August 09, 2018","Purchased my Mazda3 Touring from Heather Massey and she made the process as pleasant as possible.  Kris Wardak made sure the paperwork process was properly explained,  Stephen Barra conducted the test drive and explained all the vehicle bells and whistles.",4.0
11,"August 09, 2018",Tom and Kris where amazing to deal with and they worked hard to make me a great deal. They were patient and understanding. Truly a great experience ,5.0
12,"August 09, 2018","We bought in May our CX-9, it was SO easy! The team is really professional. 
For our secondary car, of course, we decided to buy again with CJ Wilson few weeks ago.
We have now 2 Mazda from CJ Wilson Ventura and you’re making happy customers! :)
Thank you to Kris, Bassam and Erik! You’re fantastic! ",4.8
13,"August 09, 2018","My first service visit at CJ Wilson was perfect.  I was immediately greeted at the door by Thomas, who got the ball rolling for me very quickly.  He was extremely personable and seemed genuinely interested in meeting my concerns/needs.  Most importantly, he impressed me with his honesty - which can sometimes be a source of concern at a car dealership.  Thomas checked on us several times while our car was being serviced, and made sure we were updated as to it's progress in service.  It was a great service experience thanks to Thomas and the guys in the Service Department.",5.0
14,"August 08, 2018",I always look forward to my service visits at CJ Wilson.  They treat me like family deserving of very special treatment.  This visit they took extra  care to make sure my car was safe for an upcoming long trip.  Very much appreciated.,4.6
15,"August 06, 2018","Thomas is alway upbeat and extremely helpful when I bring my car in for service. He's a pleasure to deal with every time. You're killing it, Thomas! Keep up the good work.",5.0
16,"August 06, 2018","The team at CJ Wilson was fast and friendly.  My sales rep, Mina knew all about the car I wanted, and we enjoyed my test drive.  We negotiated a fair deal, even on my old trade-in.    Ryan was experienced with all of the required paperwork and got me out in less than an hour.   Really nice experience and now I have a gorgeous new (new to me) car.   ",5.0
17,"August 06, 2018","Thomas was extremely professional, yet personable. I actually enjoyed the experience due to his diligence in making certain that I was accommodated. 
He's a great asset.  ",4.8
18,"August 06, 2018","Thomas the Service Advisor couldn't be more helpful, and he's also such a nice guy! He asked Carlos, the Tech, to look at a rattling issue I was having and within minutes he figured out the issue and fixed it. The oil change and tire rotation was also done within a short amount of time. They also offer a free car wash with the service and free snacks and drinks while you wait. 

The only thing about this Mazda dealership that is irritating is the obnoxious recording/hold music where the announcer sounds like they are shouting as people talk over each other! That really should be changed as no one wants to have anxiety as they are calling to have an issue addressed with their car. ",5.0
19,"August 02, 2018","My first experience on a test drive with John was friendly and adequate but I realized, later, that I was not made aware of many of the features the car offered.  Upon returning, Mina took me on another friendly but much more informative test drive - I was motivated to buy.  Service dropped a little during negotiation and purchasing process - long and wasn't informed as to what was happening.  Bassam never made his way out to me (I was told he was busy with numerous deals at the time), but did greet/appreciate another person next to me.  Kris was a great end to the process - he was efficient, informative and friendly.  Mina followed up with driving to make a personal delivery of some floor mats - appreciated the extra effort.  Overall a good experience.",4.0
20,"August 02, 2018",Stephan and Bassam made the car shopping experience easy and professional.  No gimics. I left feeling like I got a great deal on a great car.  I was introduced to the service team as well.  I left feeling like a valued customer.,5.0
21,"August 02, 2018","Needed a new running light and it turned out that it required an entirely new headlight assembly.  The car was out of warranty by 3 months although it only had 17000 miles.   It turned out that the assembly wasn't covered in my Mazda aftermarket warranty.  The service person was astounded that it wasn't covered as was I.  He talked to them for 50 minutes before he found out that it wasn't covered.  He then submitted an after warranty claim to Mazda and they agreed to cover the very expensive assembly. I commend him for pursuing the issue. Also,  I appreciate Mazda stepping up to the plate on this issue.  It is ridiculous that the motorized assembly is not covered under the after market warranty and recommend that Mazda look very hard at finding other insurance.  
Second, I spent over 50 years in research and development and find it incredible that the entire headlight assembly had to be replaced just to replace the LED running light.  The designers certainly were not looking out for the buyer.",5.0
22,"August 01, 2018","Your sales team helped us get the Mazda CX-5 that we had been looking for.
Eric and Bassam made us feel that WE were in the driver seat and made sure
we got everything with this car that we wanted. Thanks guys.",5.0
23,"July 31, 2018",I was In and out so quickly and treated like vip's always. I will continue to bring my car here. Best Service in Ventura County! ,4.8
24,"July 31, 2018","I was able to get in and out of there quickly, which was my main goal. Nice staff, nice boss, all around good experience. Thanks.",5.0
25,"July 31, 2018","I purchased my car, used with a Mazda warranty, from CJ Wilson. When I brought it in for a problem, Thomas Groebel reviewed the warranty with me and explained which items were covered. He provided a detailed estimate and clearly communicated with me, via text message, the status. No oversell, no hassle. They sent a car to pick me up which really helped too. This experience was much better than a previous one I had where I'd gone through the sales staff.",4.6
26,"July 28, 2018","I received prompt, personable, professional service. My appointment went by quickly. I love the amenities- coffee, snacks, internet access, tv. The staff was friendly and informative.",5.0
27,"July 25, 2018",I had an issue with my head lights and they made sure to check every possible outcome. If it would have been an electric issue it would have costed more money. When I explained the problem in more detail they found out the issue and fixed it right away and made sure I paid the right amount for what was being fixed. Very honest and reliable.,5.0
28,"July 25, 2018","Best experience after visting 3 other dealerships , they were not pushy , very knowledgeable  and they went above and beyond to get me the payment i wanted. 
Amazing team",5.0
29,"July 24, 2018","When I  arrived,  Heather came out and greeted me. She was very friendly and knowledgeable and explained  things clearly to me so I was able to understand.
Kris, in the finance dept. was nice to work with too. He also explained to me clearly how my lease and everything worked.
Everyone was very accommodating and I felt very comfortable doing business there. In no way did I ever feel pressured.
I have visited other dealerships in the past and dealt with aggressive sharks that just wanted to make a sale.",5.0
30,"July 24, 2018","From the beginning to the end, my sales experience was very enjoyable. It is a tough choice choosing the right vehicle for you, but Mina made this buying experience very, very easy. Then she turned me over to Bassam to finish out my purchase with signatures and this was an easy process as well. Keep up the great work because this kind of team is what every dealership should be like. Thanks again to everyone at CJ Wilson Mazda of Ventura!",5.0
31,"July 24, 2018",Everyone was very kind and helpful. I did not feel pressured to get something I did not want or that was too expensive for me. The entire team was wonderful. I highly recommend them ,5.0
32,"July 23, 2018",Mina made it an easy unstressful experience with her good attitude. Made us feel comfortable during our time there. Has great customer service. And to top it off made my children comfortable every second while we where there. Thanks Mina! ,4.8
33,"July 23, 2018","All of the employees at this site are very friendly and helpful. As much as I like to keep taking my car to the dealership that I bought my CX5 from, I don't think that I will be willing to pay $100 for simple services such as an oil change and tire rotation. I feel as though the free car wash was a nice perk but the last two times that I have gotten it washed, it looks just as dirty as it did before they ""washed it"". I literally had to drive down the street to go clean my own windows at a gas station, not to mention there were water spots and giant bird messes still on my car.",3.2
34,"July 23, 2018",Ben was my dude and hooked me up every step of the way. It felt amazing to walk out of the with my brand new car :),5.0
35,"July 19, 2018","I was very happy to have the opportunity and stop by Mazda dealer and request my car
It is really CJ Wilson is a good place to purchase your car",4.8
36,"July 18, 2018",This dealership had my car for almost a month then charged me a large sum only for me to find out they did not fix my problem. They never called I always had to. ,1.5
37,"July 17, 2018",I bought my car a year ago from them and still they treat me as a new customer every time I walk in for service.  I've yet to pay for an oil change because they have good incentives. I will definitely  be buying my next cat from them again.,5.0
38,"July 17, 2018",Very friendly and knowledgeable Staff just all out good people Definitely recommending to friends and family and will be back in the future Thanks CJ Wilson Mazda.,5.0
39,"July 13, 2018","After shopping around different dealers and brands in Ventura County, I purchased a 2018 Mazda 6 from CJ Wilson in Ventura. Ben and Bassam were low pressure, knowledgeable, honest, straight forward and professional to work with. They gave me a very competitive price and sent me down the road a happy new Mazda owner. Highly recommend CJ Wilson.",5.0
40,"July 11, 2018","The service team are friendly, caring and concerned about our needs. Thank you Ray for all your help! I will return for our future service needs.",5.0
41,"July 11, 2018","Excellent customer service. We were welcome and toured to the dealership to look at the cars that we were intarested. All our inquiries about the cars were aswered.  I highly recommend CJ Wilson Mazda. Great job, keep it up!",5.0
42,"July 11, 2018",Good service and timely. The explanations for needed service items were clear and on point. Comfortable wait space area. Vehicle returned washed and ready for another 5000 miles. ,5.0
43,"July 10, 2018","The folks at the dealership were super helpful and no pressure whatsoever! Heather helped me over the internet while I was looking for a used Mazda 6 and had the car sparkling clean and ready to drive when I arrived for a test drive. She answered all of my questions, took the time to walk me through all of the controls and infotainment screen and gave me an excellent deal on a pristine certified pre-owned car! My wife bought her new CX5 from them as well a few years ago and both of our experiences were great! We'll be back!",5.0
44,"July 10, 2018","I had a very good deal with them starting from 0 downpayment, low interest rate & free carwash forever. Their sales representative Mina is very approachable.",5.0
45,"July 10, 2018","I missed my morning appointment.  I called an hour later and they were very understanding and got me in later that day.  I dropped off my car, and it was ready in an hour!  They were very friendly and accommodating. ",5.0
46,"July 02, 2018",I had quick service and was back on the road at no time wasted and I had updates via txt the enitre time which makes things great.,5.0
47,"July 02, 2018",I always receive excellent service when visiting CJ Wilson Mazda. The waiting area is very comfortable and they offer free refreshments. Highly recommend this dealership.,5.0
48,"June 26, 2018",Thomas was great!  I didn't have to wait long for my car. Clean dealership. Very friendly staff and the prices were reasonable. Thank you.,5.0
49,"June 26, 2018","Nice selection, friendly staff, no pressure experience. They answered my questions and allowed me to take the car I purchased on an extended test drive. When I returned I bought it! Eric LOPEZ is an excellent associate. ",5.0
50,"June 26, 2018",Thomas was great. I have had my vehicle serviced here regularly since purchased new and am always impressed with the level of professionalism. Its just great service that is fairly priced and without the predictable upsell that is present other places I have visited.  I'll keep bringing my vehicle back for sure.  ,5.0
51,"June 25, 2018","This dealership goes out of its way to be helpful but a special shout out to Thomas Goebel in
service.  Makes going to service fun and helpful!  Fantastic man!  Danka",5.0
52,"June 25, 2018","No pressure.  Got the deal done quick.   Mina was very friendly, and I thouroughly.enjoyed buying a car from her.  We are very happy with how things turned out.",4.2
53,"June 25, 2018",The Sales Staff (Eric and Basam) were great to deal with. The deal I got was very fair and I couldn't pass it up. Wonderful to work with these folks and I am happy to recommend them to my friends and family.,5.0
54,"June 23, 2018","I worked with multiple mazda dealerships and have even purchased before with another dealer and I couldn’t be happier with the service I received at CJ! Tom was very helpful, responsive and stayed late twice to get me the car I wanted. He made sure all the paperwork was taken care of upon arrival and had my new car all clean and ready for me to test drive. Thank you Tom and thank you CJ :) I will definitely be back for my car purchasing needs and already am recommending to everyone I know!! 
",5.0
55,"June 22, 2018","I was welcomed in to the service department by Thomas . I did make an appt. and got it and serviced within an hour. I even received a cleaned , washed vehicle back. ",5.0
56,"June 22, 2018",Came I looking to purchase a new MX-5 RF. Had the vehicle I wanted and made the process very easy. Thanks to both Mina(Sales Consultant) and Kris(Finance). ,5.0
57,"June 22, 2018","Salesman Eric and GM Bassam were really helpful and gave me a really fair deal. So much so, I wasn't even really looking to buy a car that day but I couldn't pass up the car or the deal. This is the second Mazda I have bought in the past year from CJ Wilson and it won't be the last! ",5.0
58,"June 22, 2018",Buying our new car came down to the difference in dealerships and salesman and CJ WILSON Mazda  was the best with the best attitude by far,4.8
59,"June 21, 2018",5 star service.  Thanks for everything I would recommend you all in a heartbeat.  The next time I need a car my first stop will be to you all. ,5.0
60,"June 21, 2018","Initially I walked in interested in an automatic mx-5. Heather helped me but they had no automatics. I came back later that night and dealt with Eric. I explained I was interested in going for one of the manuals on the lot. Eric helped me out and was super personable. It was late and we called it a day. 

I arrived on a Saturday morning and dug my heels in. I let them know the only way I would buy the car is if I fell in love with the numbers. They put up a good fight for awhile. Heather stepped back in the picture and began to pressure me quite a bit. Eventually, I was able to talk directly with the sales manager as I had asked at least two or three hours after I originally asked. They weren’t willing to budge on price or my trade in values. Heather came out and told me both my cars had accidents on their car faxes. I know for a fact she lied to me as one of the cars I traded in I bought a year earlier and had a completely clean car fax. The car that supposedly had an accident on the Carfax is on their lot right now for $12k!  Haha. I had no accidents while owning it. The other car I wasn’t positive, I should have covered my bases. Anyways, the sales manager came out and I finally got things rolling. We eventually were able to work out a deal that I was comfortable with. 

Finance guy was great and explained everything to us. We were able to get an extended warranty thrown in for free, along with lifetime car washes and a guaranteed loaner. These guys will play ball if you push them hard enough. After 8 hours, I walked out with my mx-5 with a smile. Thank you to Heather and Eric. I’ll recommend y’all, I’ll excuse the false report on my Carfax though. ",4.5
61,"June 21, 2018","Thomas was great and clearly communicated throughout the process. I was a little disappointed with the amount of time I had to wait for the part. Any other dealership I’ve dealt with always overnights parts. They did not. The part then came in and was the wrong  color. They reordered the part and had it overnighted. 

They did cover it and didn’t charge me a thing, which I appreciate. The waiting room is a bit small but they offer fast Wifi and snacks. 

Thanks guys! ",4.8
62,"June 21, 2018",They explained all the details about the car/financing to make sure I understood everything and really worked with me to get the price I was looking for.,5.0
63,"June 19, 2018","The Service Crew at CJ Wilson Mazda were polite, fast and efficient in servicing my vehicle. Really appreciated the free car wash! Thanks so much!",5.0
64,"June 18, 2018","So far, I’m very happy with CJ Wilson Mazda.  The staff are friendly, helpful, and do their best to take care of your needs.  I’ve dealt with several employees, who are always pleasant and have a great attitude.  Good customer service is underestimated and important to keep your clients happy and well taken care of.  So far, thumbs up for CJ Wilson Mazda.",5.0
65,"June 12, 2018","I drove into the dealership for my first visit at 7:55 am. At 7.56 am I was greeted by Daniel who was very helpful. He took me into the service area and made me coffee!  
I knew it was too early for an oil change but I had some questions and there was what appeared to be a brake fluid leak between my front and rear tires.  The tech servicing my car assured me that all fluid levels were full, the removed panel under the engine showed no leaks at all.  I was on my way with a clean car in less than an hour.
Later in the day, I realized that about 3 weeks before I noticed the leak on the floor I had been driving back from Fresno when the pickup truck in front of me dropped an entire case of brake fluid cans on the freeway. I hit one and obviously it squirted up onto the frame of my car.  It took three weeks for it to get hot enough to drip onto my floor.
Thank you Daniel and your excellent tech.  The tech took plenty of time telling me what he thought the problem was.  I am very happy with my new 2018 Mazda and my service people. Thank you.
",5.0
66,"June 12, 2018",I scheduled an appointment for Saturday morning . I decided to wait for the vehicle. I was checked in with a welcoming attitude and was made sure I was comfortable . The service appt. was quick and efficient. ,5.0
67,"June 11, 2018",I want to say that I had an outstanding experiance. It was easy to book an appointment and when I got there I was greeted like I had been going there for years.,5.0
68,"June 09, 2018","honest and caring service in a very homey atmosphere. always a good and positive experience,
the service center is very clean and customer friendly. always feel welcome",5.0
69,"June 08, 2018","We were treated fair and felt valued by CJ Mazda.  Excellent sales experience, was painless and everyone was vary knowledgeable, in particular, Tom,  We appreciated dealing with honest sales and finance team.",5.0
70,"June 08, 2018","We arrived at CJ Mazda when the light on the dash of our 2015 6 Grand touring indicatied we needed to check our battery management system. Everyone was friendly as usual and offered to check. After examination we were told that they were unable to see if our iloop was working properly, because their $4000 machine was broken and the dealer did not see the value in buying a new machine since the iloop has been discountined. Also, they were unable to tell us if the battery was the problem, since they didn’t have ONE $450 battery to replace ours  At that time we were told to go to another dealer that had a working machine or another battery. 
Up until this day we were planning on buying our next car at Mazda, but we are reconsidering. Our vehicle has only 50,000 miles on it and had my daughter been driving it cross country (like she has) to school, and this had happened....I would want to know that the dealer would find a battery at another dealer, take a battery out of a car on the lot, take my car on a truck to another dealer that has a working diagnostic machine or give a loaner vehicle. 
Warning; do not purchase the additional bumper to bumper warranty, as thus far nothing has been covered or honored under this agreement including peeling finish on the wheels that we paid extra for.
Now we are left to find a solution on our own. ",2.3
71,"June 05, 2018","I was previously very impressed with the professionalism of your service center when 
Jennifer Lange worked there. The experience is now completely different.  There is a real lack of maturity and competence.
 Her professionalism and competence made me feel confident that my car would be serviced appropriately. ",2.6
72,"June 05, 2018",Went in to fix my recall and they were all very attentive and so friendly :) I appreciated all the efforts by everyone of them definitely might come in to get my tires changed see you all very soon ,5.0
