,Date,Reviews,Ratings
358,"November 14, 2018",great to purchased my first Benz car in Long Beach. It’s very close from my office and Mr Sato was friendly to finish all of purchase process.  ,5.0
359,"November 14, 2018","Christian was a great customer service rep and was able to take care of all my concerns,  quickly and simply.  Great service and great coffee too! ",5.0
360,"November 13, 2018","Rebecca Lee got me in and out in record time because I told her I had another appointment in two hours.
Good job and I appreciated it.",5.0
361,"November 13, 2018","I did not haggle with the price because the offer was reasonable based on the research and quotes I gathered. When I showed for the contact, the staff were very accommodating to my tight schedule that day.",5.0
362,"November 13, 2018",Went just as scheduled.  They even called about the time they said it would be completed.  Thanks MB of LB.  Good Job !!  The car runs great.,5.0
363,"November 11, 2018","We purchased our vehicle at a dealership near San Francisco, but have it serviced in Long Beach. They are highly competent and professional. We appreciate the care and friendliness of the service advisors and the quality of the work done. Long Beach Mercedes-Benz offered us better support than the original dealership!",5.0
364,"November 11, 2018","Great service from Ali, and management, they helped get us over the line by offering us a price we could not refuse.  We would return. ",5.0
365,"November 10, 2018","Lee Mehlman was Excellent customer services and knowledge of Mercedes Benz, He was very helpful for any question and friendly , good on follow up by email and phone . ",5.0
366,"November 09, 2018","Christian Magaña provides an excellent service every time it's programmed for my car and every time an unexpected situation arise!

Great knowledge of Mercedes Benz products!
Very friendly attention!
Great follow up by emails, phone calls and texts messages! 

",5.0
367,"November 09, 2018","Nicholas Ortiz was very helpful in servicing my car quickly (within 4 hours), and providing me with a loaner vehicle. I called the day before to schedule the service, and was accommodated. 
",5.0
368,"November 08, 2018","I brought the car in for a regular service. I also wanted to point out where my drivers seat upholstery was splitting. Before I could mention it, my service advisor pointed it out and wanted to make sure it was also taken care of. A loaner car was available for me (5 stars), so I went on my way. Rebecca kept me posted on the upholstery repair, and found it covered by warranty. The seat looks brand new. My appointment for service was at 7:00 am. I was in the loaner car, headed to work by 7:30. (5 stars)",5.0
369,"November 07, 2018","First time I took my car for service work completed as promised two hours 
Very friendly and professional service I will highly recommend recommend your services ",5.0
370,"November 06, 2018","Excellent service and all done and completed in a most timely manner.
Treated like a real person, not just a number, Jesse updated me at every turn.",5.0
371,"November 03, 2018","I came on time as my appointment schedule and the result was excellent . Nick is knowledgeable, very friendly. If possible, I  would like Nick Ortiz to be the service advisor on my next appointment.",5.0
372,"November 02, 2018",Christian was a pleasure to work with as always.  He had my car ready when it was promised and made sure the work was done to m satisfacton.,5.0
373,"November 02, 2018",I had to come in for my second service on my car. I am always in and out of there with no hassle from my amazing service rep Rebecca. She is so personable every time I go in and went beyond and over and even had a part replaced on my car because it was a little loose. They had my loaner car ready for me and I was in and out within 10 minutes. This is what I call service and I know that with the help of Rebecca my car is always taken so well care of. Thank you to Rebecca and team for aways making my visits stress free! ,5.0
374,"November 01, 2018","I had a run flat tire that was losing air, so I called from the freeway and explained what was going on and was told to safely and quickly get to the dealership so that they could inspect the tire and give me their recommendations. The tire had to be replaced and I was told how the replacement policy worked. Thanks for the great staff!",4.8
375,"November 01, 2018","Such helpful and friendly service!  Love this dealership. Very Helpful and on time with service appointment.  Would recommend this dealership to anyone. Thank you, Jesse Lopez. ",5.0
376,"November 01, 2018","Had to do my first service call for my Sprinter chassis based Motorhome.
Was welcome by Debbie and felt like a king even if it it was just a van.
All service steps were thoroughly explained.
Even if it is a bit far from home. I will drive the extra mile to visit this dealership.
Thank you
",5.0
377,"October 31, 2018","My service rep was one of the best reps I've had the pleasure of working with in 40 years.  He was knowledgeable of the service I needed, explained projected costs and worked with me to not overspend on service I did not need.  My car is running great and completely up to date on all routine service requirements.  Thanks Christian!
I am looking forward to working with him again next week with my other car.",4.6
378,"October 31, 2018","Rebecca Lee provided excellent service. I would recommend Rebecca Lee, but I can not recommend this dealership based on the experiences  I had with previous MB cars in the service dept. Also, the last time I attempted to purchase a car, back in about 2012, the sales rep reneged on the price of my trade in. I left the dealership and went next door and bought a BMW and then another BMW in 2015.",4.8
379,"October 31, 2018",This dealership has outstanding service - the quality of their training is obvious.  This is a very customer focused team.  I really appreciate their efficiency and focus.,5.0
380,"October 24, 2018",Had a pleasant experience. No pressure. I initially wanted a used car but bought a new one because of the offered price. Lee and Joel were great to interact with.,4.8
381,"October 21, 2018",The streamlined service I received in getting my new car lease was unbelievable.  Kristine Robes and Jose are great.  I have nothing but praise for them.,5.0
382,"October 20, 2018",I have left my Rv for service twice and my most resent service was this month. My service representative has been Debbie Auman who I found is knowledgeable about the vehicles she service and committed to providing excellent customer service. ,5.0
383,"October 19, 2018",I hope you realize what a great employee you have in Nick Ortiz! He went above and beyond in helping me!! I want to give him a 10 star rating not 5! He really explained everything in plain English to me. He’s a very nice person!! He truly made my experience at your dealership very special!! Also the person in parts that changed the battery in my key fob was very nice! And a couple of other people that helped us were very nice! I intend to go back to your dealership in the future! Fabulous employees!!!,5.0
384,"October 19, 2018","Nick Ortiz is awesome, not only is he professional, conscientious and kind, he makes sure he explains thoroughly what will be happening to your car and how often he will communicate with you while the car is there. ",5.0
385,"October 18, 2018",Christian is the best service advisor that I have ever dealt with at ANY Mercedes Benz dealer. He always ensures that I am well taken care of. ,4.8
386,"October 16, 2018",My first purchase experience has been very positive. John and David made the car buying process so easy. I would definitely go back and refer everyone I know to them. Excellent service and outstanding + helpful employees. ,5.0
387,"October 15, 2018","Professional, fast, easy and convenient.  Makes getting a new car an enjoyable experience.  We have leased  six cars from Toshi Sato.  We always ask for him by name. ",5.0
388,"October 15, 2018","Harry Reid was very friendly, knowledgeable and extremely informative about the various system questions I had about my car. Thank you for all your assistance!",5.0
389,"October 14, 2018",Nick was great to work with. I really appreciated his honesty and help with my SUV. I will most definantely book another appointment with Nick. ,5.0
390,"October 14, 2018",Great experience visit the dealership yesterday. Thank you for making my service experience the best!!! I was in and out in record time. I would recommend Christian Magana. ,5.0
391,"October 12, 2018","I have been driving Mercedes Benz vehicles for over 30 years.  They have always been purchased and serviced here in Long Beach from the time the Mercedes dealership was Palmer Motors on Atlantic until the present day.  My current service technician, Nick Ortiz, is outstanding, as have the ones been in my past.  He is always so polite and helpful.  He schedules my appointments into the future, so I never miss a servicing.  He explains things thoroughly  without ""talking down"" to me.  He seems genuinely interested in making sure that my car is in top mechanical condition at all times.  He informs me of pricing before work is done, keeps me informed during the process, and arranges for transportation when I need it.  Taking the car in for routine maintenance is never a pain.  It is always a pleasant experience because the people at my Mercedes dealership are all friendly and helpful.  The work is completed correctly the first time.  I have never had to go back to have something corrected. The car is also returned to me cleaner than when I brought it in.   I will always be a Mercedes driver and will always have it serviced at Mercedes-Benz of Long Beach.  I am a happy, loyal Mercedes owner. ",5.0
392,"October 09, 2018","Always easy and a real pleasure to get my car serviced. Each person I have worked with over the last 20 years has far exceeded my expectations. I'm a Mercedes owner for life. 
Thanks!!! ",5.0
393,"October 09, 2018",Raymond has been consistent with advice and  service for the last 8 plus years.. Always being proactive with a call or a text regarding my upcoming scheduled maintenance and a follow up call re. The service performed . Raymond has consistently delivered the Mercedes Quality !!,5.0
394,"October 07, 2018",Selene takes care of all that is required and more.  She is easy to talk to and  keeps you informed of what is happening with your car. Always completed wwhen promised . ,5.0
395,"October 07, 2018",Helpful and friendly service.  Ensured I was comfortable and had WiFi while waiting for car. Provided me with a tour of the waiting area room.,4.8
396,"October 06, 2018","Schedule service for my 2014 Mercedes was on time and the service adviser got me in and told me when my vehicles would ready. also gave me an estimated price,  but when I picked it up, it was a lot lower than expected. Glad to have service done to keep my vehicle running good as new.",5.0
397,"October 05, 2018",see the above great servoce department will be using this service dept in the future  give them  a try and tell them Bert sent you,5.0
398,"October 05, 2018",I initially called Torrance dealer but was told they don't provide loaner cars for recall service.  Also quoted $298 for Service A.  Signal Hill DID provide loaner for recall so I gave them the service work & they were $100 less than Torrance.  1st experience here & I will return :-) ,5.0
399,"October 05, 2018",I highly recommend Long Beach Mercedes benz to my friends and family especially Kristine Robes at sales.We bought to brand new from her she take care of us. If i can give her more than excellent i will. Thanks again Kristine.,5.0
400,"October 04, 2018","Always have had an excellent experience with Desbien in sales over a number of years 
and cars.  He has always been accurate in his auto information and sales data.",5.0
401,"October 03, 2018","I've bought a number of cars throughout the years - generally luxury sports cars - but I've never had a dealership experience as positive as I did working with Paul Ortega and Erin Say at Mercedes of Long Beach. From beginning to end it was an exceptional experience, as Paul worked with me to find the right car, the right deal, and didn't pressure me to make a decision until I had done everything I needed to do on my end, while Erin made the paperwork an absolute breeze. 

I would and will easily recommend this dealership to anyone who asks.",5.0
402,"October 02, 2018",Had a nail in the tire and had it taken care off. Well service. Good dealership. Will come again. Will recomend to friends and family.,4.8
403,"October 01, 2018",Toshi and Lisa provide the best no-nonsense experience to purchase my car.  This is the 4th Mercedez that I bought thanks to their great prices and excellent service.  I will not buy from anyone else.,5.0
404,"October 01, 2018","My first time at Mercedes Benz of Long Beach, it was very fast, professional and straightforward. I recommend this place to everyone either to buy a car or for service.",5.0
405,"September 24, 2018","Everyone provided friendly, prompt service.   Colby explained patiently and in detail service options and  provided quick updates so that I had my car ready by early afternoon.",5.0
406,"September 20, 2018","John was the first person we talked to about buying a new Mercedes and the last one that sealed the deal. I did extensive shopping and it always brought us back to John at Long Beach Mercedes. He kept in touch with us and truly cared about our Mercedes journey. We were looking for a long term relationship and we found it. Love our new Mercedes and we are looking forward to many more years with Long Beach Mercedes! Thank you John for your patience and support. So happy to know you!!
Keven and Lori Loza",5.0
407,"September 19, 2018",Toshi and Lisa are great. I’ve been super happy customer of them for past 9 years. I recommend them to all of my friends and coworkers. Thanks Toshi and Lisa!!,5.0
408,"September 19, 2018","Nick (SERVICE ADVISER ) is the prime example of why I did not lease from Maserati again. I miss this this impeccable service! 

And Toshi (FLEET SALES) is the ultimate in customer service, listening to what and making it happen. I will be a repeat lease customer!",5.0
409,"September 19, 2018",Took care of the service and explaining the function of the system happy with the service will be back next service thankyou and will recommended ,5.0
410,"September 19, 2018",MZB of LB provides excellent customer service and care. Thank you Jesse Lopez and Mae Gant! They were both very helpful. They adding quality to my visit.,4.8
411,"September 17, 2018","My car was washed after being serviced.  Honestly, it looked better before it went in for service.  There was no attention to detail and there are now scratches near the driver's door handle, looks like someone did not use a soft towel.  Quality of work for simply washing a car was not acceptable. ",5.0
412,"September 16, 2018","As always, the service department was great. What I like most is having a Service Advisor or Concierge really, who is always the same person. In a depersonalized world this is a luxury I truly appreciate. I know him, he knows me, and the text system is the best. I know if the car will be longer, ready sooner, or any other details pertinent to the appointment. I leased this vehicle after an offer so good I couldn't refuse. It is so much more car than I thought. The longer I have it the more I enjoy it. Once you go AMG you can never go back!  ",5.0
413,"September 14, 2018",Awesome customer service. Really helped me get into a car I love! Issa made me feel right at home. Also he is very knowledgeable about the cars he sel...,5.0
414,"September 13, 2018",Awesome customer service. Really helped me get into a car I love! John made me feel right at home. Also he is very knowledgeable about the cars he sells. ,5.0
415,"September 13, 2018","Overall service is very good. 
But a recall from MB manufactory can't be done again (more than 2 years already) and I have to wait another 6 more months",4.6
416,"September 11, 2018","Appt was on time. Loaner car was perfect and I got my car back that evening. Nick was friendly, kind, professional and efficient. All in all a pleasant experience ",5.0
417,"September 11, 2018","I live closer to the Signal Hill Mercedes Benz but I purchased my car at House of Imports in Buena Park.  I tend to get my car serviced at either location based on customer service and/or price.  This appointment I experienced excellent service was very pleased. I came in to get my airbags replaced due to a recall, my spare tire fixed, and a few light bulbs replaced.  We received a good rate on replacing my air filter and decided to have that done as well.  Christian was very helpful!  My next visit will most likely be at Signal Hill again!",5.0
418,"September 09, 2018",I wasn’t planning to lease a car and I hated lease but David the sales manager was awesome he even made me love Mercedes and the lease thing. as long as that sales manager is there I think I’ll be always feeling that I am in good hands.,5.0
419,"September 09, 2018",We have always had a good experience with this dealership.  service is prompt and professional and staff is courteous and helpful.  We have also gotten good deals on the 3 new cars we have bought from them.,5.0
420,"September 08, 2018",Everyone is very helpful and friendly.  The tire alignment and the replacement of the auxiliary battery were completed within the time estimated.  Payment was quick and convenient.,4.8
421,"September 08, 2018","Raymond at Service was the best. He made sure I got picked up and dropped off on time, had my car ready at the time expected, and kept me updated on progess. He was absolutely exemplary.",5.0
422,"September 06, 2018","Dropped my car off to have engine light looked at.  I requested the shuttle to take me home, but was offered a loaner vehicle instead.  Rebecca Lee very helpful and the employee who processed my loaner vehicle paperwork was very nice and friendly.",5.0
423,"September 06, 2018","Jesse is awesome!!   He accommodates my needs.  I am a pain at times and he still helps me lol He is the best.  Also, the repair team needs recognition, too, because they are the ones fixing the issues and keeping me safe. 

thanks to all!",5.0
424,"September 06, 2018","I found the used car I wanted on cars.com and contacted Mercedes Benz of Long Beach.  Lee helped me with the questions I had about the car and got back to me within a half hour.  When I decided I wanted the car, Lee got things started quickly.  Erin, the financial manager, then took over the financing, and immediately started all of the paperwork to purchase the car.  Whenever I inquired on a matter, either Lee or Erin responded with the answers.  All in all, I am very pleased with the help of both Lee and Erin, and their efficiency in getting the purchase through quickly and painlessly.  ",4.8
425,"September 06, 2018","MBLB always makes me feel like a Valued Customer. I am always greeted promptly and professionally, and made to feel that my business really matters! I am Very Appreciative.",4.8
426,"September 05, 2018","Great customer service ,  Kristin was wonderful and she took care of everything very quickly. This is my second vehicle from this dealership in two years . ",5.0
427,"September 02, 2018","Despite an unorganized check in process, the overall experience was positive. My appointment was never acknowledged and three people had to ask why I was there before I was helped. Once Nicholas Ortiz helped me everything was great. He was helpful and professional. A great guy who I want to thank for the great help. Car was ready when promised. ",4.4
428,"August 31, 2018","Debbie is our service advisor for our Forester motorhome. She was so professional and helpful in answering all our questions that were not done by the RV dealership. Have told everyone how great she is, so happy we found her.",5.0
429,"August 30, 2018","Mercedes Benz of Long Beach has been my dealership for over 10 years.  I continue my business with them because I get great service there.  From the moment I drive in to the moment I drive away their goal is to make sure I am happy and satisfied with my Mercedes Benz experience. I love my new car and all the bells and whistles.  Mae Gant Customer Satisfaction& Guest Services, Taidy Garcia and Corey in Service, Erin in Finance, Jose Quintana and Kristine Robes in Sales all worked together to make my new car purchase a joy!",4.8
430,"August 29, 2018","My contact was Nick in service. He was extremely professional while also very personable. I bought my car in March from Fletcher Jones, primarily because I wasn’t getting feedback from sales and there never seemed to be inventory of what I wanted. 
However, your facility is directly on my way to work and I always planned(hoped) to utilize your service. My experience with Nick confirmed for me that this will be my plan going forward. ",5.0
431,"August 23, 2018",Good experience.  Very accommodating.  Took my car in even without an appointment.  Could not get anybody to answer the phone early in the morning.  OK once I took my car in.,4.8
432,"August 21, 2018","Colby was very nice and very knowledgeable.  I would like Colby to be my permanent service advisor. 
Highly recommendable and great ! 

Looking forward to have nice deal when we buy another car.",4.8
433,"August 21, 2018",I have never had a bad experience with your dealership. Raymond Gambia has been my service advisor for many years and has been the main reason for my returning to your dealership for service. Keep up the good work!,5.0
434,"August 19, 2018","Toshi-san and this crew epitomizes THE BEST OR NOTHING AT ALL.  
It makes servicing your car much less stressful when you arrive to smiling people who are genuinely interested in your needs and willing to help you have the best experience possible.",5.0
435,"August 18, 2018",I’ll be using the dealership for future service needs. Had a good experience with excellent customer service.  My warranty repair was completed within a few hours.,5.0
436,"August 17, 2018","Called late thurs for a oil change was asked when I wanted service and I replied how about in the next 45 minutes I will bring it in at 3:00 and wait. It worked out well with a good timely job and I was
Back home by 5:00. Jessie was very efficient.
Thanks,
Jim Hagin",5.0
437,"August 17, 2018","Thankyou, Christian Magana for your amazing service !
We drive all the way from Corona because of the great customer service you provide for our Mercedes.
",5.0
438,"August 17, 2018","Very warm and pleasant service advisor , Mr Raymond... car service done at promised time.. courtesy drop off and pick up greatly appreciated.. great customer service from service staff.. keep it up!👍",4.6
439,"August 15, 2018","This is my third car I've leased from Joel Turett at MBZ Long Beach. I've always hade terrible experiences with other dealerships. Joel got me in and out in less than a few hours and listened to our needs.
This was my first time dealing with Ahmed in Finance and he was exceptional as well",5.0
440,"August 15, 2018","This was my first visit. I recently moved from AZ and needed to schedule a service. I called the dealership to schedule an appt and it wasn’t a good experience. The receptionist asked me for my info and she couldn’t find my info in the system. She transferred me and didn’t let me know, I was tossed back and forth between calls not being answered, I became frustrated, hung up and scheduled an appt online. When I arrived at my appt time and date, it was very busy. I let the gentleman at the counter know of my appt time. He allowed me to go in front of the long line. Not long, Selene Torres came to help me. She asked if I was getting picked up or getting an Uber. I let her know I requested a loaner when I booked my appt online. She then stated, they may not have a loaner since I booked online. I instantly became upset and explained to her about my call in and my experience with them so far is not going well. She apologized for the experience and said should would take care of me and provided her contact info to call her direct for further service appts. She kept me informed through the entire service process. Thank you turning what started experience into a great experience and made sure I was taken care of. Please recognize Selene for her excellent customer service and a great customer experience. 

I look at reviews and rating was questionable but it’s the closest dealership to me. ",4.8
441,"August 15, 2018","
Great customer service, loved the loaner and quick turnaround on the brake job. 
Highly recommend this dealership if you are interested in purchasing and service. ",5.0
442,"August 13, 2018","I have an older MB, but it always feels like new when I leave here. The service representative is Rebecca Lee, who keeps in contact with me using text messages, which I really like. Plus she gets me discounts on everything I have done. They seem to do a great job in diagnosing needed fixes. I have also been able to get a loaner, which makes it way easier on my schedule. And my car comes out sparkling clean from their car wash!",4.6
443,"August 11, 2018","I brought my car in for a service recall and in the course of that service it was determined that I needed a new battery.  I receive a text letting me know, and after confirmation that I wanted to have it replaced, it was done quickly, and my car was ready to go after a car wash, which was included.  Selene, my service adviser, took the time to explain to me a couple of features that my car has which I was previously unaware of.  ",4.8
