,Date,Reviews,Ratings
0,"March 26, 2020",Best car buy every time !   He running around look for car we want and he got it for us. Super highest recommendation anyone looking for a car.  Go visit Toshi now !,5.0
1,"March 25, 2020","Dylan and his team there at Mercedes of long beach were fantastic!!  No hard sale, just super helpful.  My next car will be from them.",5.0
2,"March 19, 2020",We liked out Sales manager Dylan. He was personable and not pushy. Product was excellent value and was in almost perfect order. Would of been even better if the vehicle was fully charged as I only had 2 miles left on the battery as I pulled in my driveway after a 67 mile drive. A bit scary when the warnings came up .. get charge Very Soon.  We also liked the finance manager as he was very easy to deal with. A good experience overall.,5.0
3,"March 17, 2020","My service manager, Colby, and technician, Danally, really exceeded my expectations. Both went above and beyond to ensure I had the best customer service/ car servicing I could get. Very grateful I was able to work these fine gentleman!",5.0
4,"March 14, 2020","Dylan did an amazing job listening to what I was looking for and helping me find an amazing vehicle. I am excited to drive my GLC AMG 43. Got s great car, excellent service and a good deal ",5.0
5,"March 14, 2020","Excellent customer service.  Always takes the  time to answer question.  Rental car is quick and easy, Everyone is friendly and always goes the extra mile. I have return 3 times to this location due too excellent customer service I and my family have received from Steve Weiss. The Manger Steve will bring us back to LB   ",5.0
6,"March 13, 2020","Clear explanations, quick turnarounds, quality loaner cars. All of this order and efficiency among the chaos of the construction site orchestrated by Christian and the rest of the LB MBZ service department. ",4.8
7,"March 06, 2020","I can always expect excellent service at Mercedes-Benz of Long Beach. Honest assessment and courteous treatment is much appreciated. Colby Shaffer is the best,",5.0
8,"March 04, 2020","I have been to several dealership service departments  BMW JEEP CHEVY and MERCEDES OF LONG BEACH by far the BEST EXPERIENCE!!! Great customer service friendly polite and very positive attitude he helped me step by step explained the whole process with great details I’m even thinking of purchasing my next car here just because of the service!! Thank you again!!
",5.0
9,"March 02, 2020","They took very good care of my care and gave me a clean, nice rental to use. The concierge service worked well too. Thank you!",5.0
10,"March 02, 2020","Car was repaired quickly and the service was excellent. The car had a bad rattle and they repaired by replacing the dash cover. Colby was great to deal with. He was easy to contact and friendly to deal with.
.",5.0
11,"March 01, 2020","Our salesman, John Blackledge, was terrific, made everything quick and easy. Would highly recommend this dealer and salesman. No pressure, and made the process seamless from start to finish.",5.0
12,"February 29, 2020","Derek Nguyen, Internet Sales Manager went extra mile to provide me all possible offers and sold the GLC 300 I purchased. It was the great experience since I was looking at several vehicles listed on internet. He spent enough time to turn my search  into owner of Mercedes Benz I dreamed of owning. It is the most satisfying experience I had with Derek and Ahmed (Finance).
~ Mahesh Chokshi",5.0
13,"February 28, 2020",Everything went smoothly.  Rented a loaner while my car was being serviced.  Everyone very efficient  and came away very satisfied.  They finished my service in about three house and washed my car at the end.  ,5.0
14,"February 27, 2020","It was a pleasure working with Tony Calderon.  I appreciate it when they tell you what services you should think about doing, but no pressure.",5.0
15,"February 27, 2020", I have been a customer of Mercedes Benz of Long Beach for many years.  They always go above and beyond!  They make sure you walk away pleased!!,5.0
16,"February 26, 2020",Nick was easy and pleasant to work with. The only glitch was I had to reach out to him to learn the status of my car several hours after I had left it. ,5.0
17,"February 25, 2020",I will say this the person that was helping me with getting me loaner was awesome. Just the timing with getting the car out was a problem do to cars that where getting serviced was blocking the loaner cars so getting in and out was fun at all. Other than that service was good.,4.0
18,"February 23, 2020",I send everyone who wants a Mercedes to Joel Turrett. He's transparent about everything and that makes the process so much easier. A big thanks!,5.0
19,"February 20, 2020",Joel Turett did a great job in getting me a competitive price on the purchase of my lease end vehicle. He said it would take about an hour to complete the transaction and he came close. I appreciate the efficiency.   ,5.0
20,"February 20, 2020",Nick does a great job of getting me in and out!! He makes car service/repair a super simple process. I would highly recommend him and this dealership.,5.0
21,"February 19, 2020","Kristine Robes, was outstanding very friendly. and helpful .thank you very much i'm very happy with my new 2020  GLB 250 4matic suv thanks ",4.8
22,"February 19, 2020","Joel in sales was great. I was able to handle most of the details over text, so when I got to the dealership it was quick and easy to finalize the deal.",5.0
23,"February 15, 2020",Corey was outstanding very friendly. Keep me updated on the process and called me when my car was ready. Very good employee you have there.,5.0
24,"February 15, 2020","Excellent service and follow up.  I look forward to having a great working relationship.  The car operation has been outstanding. 

Corey Butler provided excellent support and service.",4.0
25,"February 15, 2020","Service writers, Christian and Selene are always outstanding as is Daisy at the loaner desk.  Always getting the work done on time and with quality results",5.0
26,"February 11, 2020",Very thorough and professional. I was given an appointment time and they were prepared for me. I was told what would be done and what time it would be finished.  ,5.0
27,"February 09, 2020",I have purchased 2 cars from this dealership. I have always received excellent service from professional employees. Corey was my Service person this time. He took the time to explain everything and answered all my questions. I was very happy with my visit.,5.0
28,"February 08, 2020","Ali sold me a car 3 years ago, and this is my second time he helped me. The work was smooth and easy. Also, Micheal of finance department is great!
Thank you so much.",5.0
29,"February 08, 2020","  Service was outstanding.  Was not happy with the problems I am encountering on my vehicle.  My perception is that MB is a better quality vehicle which does not match my experience.  For example,  having to replace motor/transmission mounts with 50K miles on a 8 year old vehicle does not make sense to me.",4.4
30,"February 06, 2020",Nick always does a great job for us!  I have confidence in the diagnosis he provides and his communication. I’ll be back for sure. ,5.0
31,"February 02, 2020","This is the 3rd car we have bought at Long Beach Mercedes. We are always treated so well. We have bought our cars from Steve Sweiss and have always felt like family with him. He is kind and professional. The finance department, always easy to work with, and Jose had my tech equipment hooked up and taught to me in 20 minutes! ",5.0
32,"January 29, 2020","Dylan Stewart was thorough in preparing the car for the initial test drive and assisted with the trade in arrangements.  

Erin in Finance was a whiz in preparing the documents and explained everything clearly.  Overall a pleasant experience for my wife and I doing business with Mercedes-Benz of Long Beach.",4.8
33,"January 29, 2020",Joel Truett is a great sales and provide you a excellent deal. He helps me to get several MB vehicles in the past. I am happy to get two cars with him this time. ,5.0
34,"January 28, 2020","I had a great experience last week at Long Beach Mercedes Benz - 2nd car that I leased through this dealership - driving 2 hours from Palm Desert was worth the trip.

They found me a unique car that met my needs and at the same time was able to meet my budget requirements.  My sales person was efficient - listed to what I was looking for and the finance dept was swift  - they were able to get me out within 2 hours.  

I'll be back!

Karen Ioli",5.0
35,"January 24, 2020",CUSTOMER SERVICE AND SUPPORT ARE GREAT TO DEAL WITH. OUR SPRINTER WAS SERVICED IN A TIMELY FASHION AS WELL AS ALL THE ISSUES TAKEN CARE OF THE FIRST TIME AROUND.,5.0
36,"January 18, 2020","A minute or so after entering the dealership, I was approached by a sales rep (Steve S.).  He took the time to listen to what I was looking for, he explained the differences in the vehicles, and willingly got keys for the cars I wanted to view/test drive.  My experience at this dealership was great.   Steve works without pressuring you to buy, he works with a “what’s best for you” approach.  Awesome !",5.0
37,"January 17, 2020","Colby Shaffer, is a great service advisor always return messages and very polite. He made a big different  when you deal with someone that understand clients needs. Thanks Colby for all you help see you soon.",5.0
38,"January 15, 2020",Even with  all the construction going on the service & customer support was excellent and the car was washed and ready when I picked it up.,4.8
39,"January 12, 2020",I had the pleasure of meeting Ali Mosavi.  He is truly the BEST.  Ali truly went out of his way to make me happy.  Nothing was too much trouble - what a wonderful experience.  Thank you Ali so much!!!,5.0
40,"January 12, 2020",I was impressed with Abel Vargas dedication in making this deal very smooth. This is my second time to get a car through him. I will certainly recommend him to my acquaintance.,5.0
41,"January 10, 2020",I was absolutely pleased with the service. Colby Shaffer took great care from start to finish. Will definitely come back for future services and recommend friends.,5.0
42,"January 09, 2020",They are fast in doing the service. Fast in communicating to customer like us. They accommodated us fast and the work was done in a timely manner,5.0
43,"January 09, 2020","Overall I had an excellent experience at the dealership. I made an appointment prior to my visit and I was able to drop my car off in a timely manner and they ordered me an Uber to take me back home. I had a few issues with my car, and the overall cost was a bit expensive, but everything was done on the same day and I was able to pick up my car before the end of the business day.

Thanks for your help.",4.6
44,"January 09, 2020","Conducted the entire transaction: from parking my old car to selecting a new vehicle, arranging financing, prepping new vehicle, and driving off the lot in my new mercedes in 2 1/2 hours.
Incredibly ""hassle-free"".",5.0
45,"January 09, 2020",I love working with Toshi Sato.  This is my second Mercedes with Toshi.  His customer service is second to none.  He's the only SA that I know who will treat you like a family.  ,5.0
46,"January 07, 2020",Our service advisor Christian Magana never let me down. I'm very happy with the greatest service and always on time. Offer loaner every time  when needed. ,5.0
47,"January 07, 2020","I returned my 2017 for my new 2020. Joel Turett had everything ready to go for me, and as always, I got a great deal. I am a satisfied, returning customer and will be getting my next car from Mercedes-Benz of Long Beach.",5.0
48,"January 06, 2020",Best experience ever buying a car!!! Thank you for making it painless!! We will be back! John is the best!!! We love our new Mercedes GLC!,5.0
49,"January 06, 2020","John Blackledge was very professional and efficient. He was also very responsive to our requests and questions. Unlike many other dealers and salesmen, John was low key and very pleasant to work with. We never felt pressured by him or the others we interfaced with. We would strongly recommend Long Beach Mercedes Benz and would give it the highest rating of 10/10.
",5.0
50,"January 04, 2020","Sophie is the best commercial sales person around.  Got us exactly the work van we needed and made the process painless and quick! We maybe spent a total of an hour on the lot, start to finish. ",5.0
51,"January 03, 2020","Everyone was very helpful and kind! I schedule the service, left my car on time and with in 3 hours car was ready! Love the customer care!",5.0
52,"December 31, 2019",Nick was well mannered and polite and professional.He greeted me he went over the service afterwards it was very clear and precise Keppra friendly smile on his face what more can I say,5.0
53,"December 27, 2019","Christian was very polite, knowledgeable, and explained the options we had in regards to the repairs we needed, but made sure to do what we asked for! ",5.0
54,"December 27, 2019","This is the second van we have purchased from Sophany and the third from Long Beach Mercedes. 
Cam here from another Mercedes dealer because the service was so much better. 
Once again a great job by Sophany getting me in and out with exactly what we needed. ",5.0
55,"December 24, 2019","I had been in the market for a car for about a month. I had previously been with BMW/Mini for the last 10 years and leased 3 different vehicles from them. When my lease was up, I had planned on releasing either a BMW or Mini. Unfortunately, not only were their lease deals expensive, they offered little to no customer loyalty cash / rewards towards a new vehicle. 

I never saw myself as a ""Mercedes Guy."" I thought they were too far over my budget and not sporty enough. I was completely wrong about that. My super fantastic sales associate (John Blackledge) gave me a deal so good that no other car company could come close (includes Subaru, VW, BMW, Audi, Mini). He had my 2020 GLA250 deal completed over email and even found me the color and options I wanted. The next day, I found my shiny new car with a bow in front of the dealership waiting for me...WOW!!! Excellent, no pressure sales person. I cannot stress how wonderful my experience was with John at Long Beach Mercedes.

I also wanted to commend Jose Quintana for helping me learn the tech on the car. He is a very patient, attentive and knowledgeable advisor. Also a shout out to parts specialist Jovanny for helping me track down roof racks for my car. I truly appreciate your help!",5.0
56,"December 20, 2019","Joel Turett is an excellent sales rep. He respond to my email right away.  He gave me the lowest quote on a car, that I was looking at compared to other dealers. ",5.0
57,"December 12, 2019","Mercedes-Benz of LB found the fully loaded car that i wanted, with leather. Sales person Steve is an outstanding sales person.  He listed to what I wanted and was respectfully. Being a women most auto sales person don't give women respect.  STEVE was WONDERFUL. 
Love Him...  ",5.0
58,"December 12, 2019","I had an unexpected service emergency (flat tire) and Raymond took great care of me from start to finish. Wonderful, quick, and top notch service experience! ",5.0
59,"December 11, 2019","This dealer does provide excellent services for RVs with an MB chassis. However, they could improve their after service wash/clean up process somewhat by making it more thorough inside and out and perhaps add more wax into the soap solution.",4.6
60,"December 11, 2019","My go to place to shop for a new car.
Ali Mosavi has always go out of his way to make sure that he is giving me the best deal and making sure that I am getting the car that I want. He has never fail to answer any questions that I have about the car features. He is like a family to me. My number 1 go to sales person.
His manager David Gonzales has also been a very helpful and approachable person. Both him and Ali work as a team to deliver the best deal they have and making sure that I am
Comfortable with the payment.
I couldn’t thank them enough for their help recently in getting a new suv after a car accident.
Definitely will recommend them to anyone who is looking for a Mercedes.


",5.0
61,"December 10, 2019",Its  pleasure working with Dez Desbiens for the second time.  He is a straight shooter and I trust working with him.  He is very patient through the sales process and makes sure all my questions get answered.  He is the reason I keep coming back.,5.0
62,"December 10, 2019",I was very happy with my overall experience in having my car serviced. I am very pleased with the attention Nick gave to me and the service to my car.  ,5.0
63,"December 09, 2019",I purchased Mercedes from Toshi. It’s my second time. He and Risa are very kind and always very thoughtful for customers. Great experience. I will recommend everyone. ,5.0
64,"December 06, 2019","I am extremely pleased with this dealership and how easy it was to purchase my new car. I also highly recommend Joel Turett, the internet sales manager. The dealership was also very helpful when it came to pointing out all the features of my new vehicle and explaining how each works. The entire process was professional and fast. I also feel that I got a good price. I will definitely return to this dealership and to Joel in the future.  ",5.0
65,"November 17, 2019","Henry by far was the most honest person to work with , he understood my service needs and helped me understand maintenance for my vehicle , thank you for the good work. 

Mb of long beach is my preferred location for my repair needs.",5.0
66,"November 17, 2019","Amazing service , Henry was very professional and like always Mercedes delivers exceptional service. Definitely look forward to working with Henry again. Cant wait to see new renovation
",5.0
67,"November 10, 2019","Toshi sato gave me excellent service and guidance in obtaining my car.  The car was in excellent  condition for a 2017, and I was pleased with the attention, information and service  as I made my final decision.   I will readily recommend Toshi and Mercedes-Benz of Long Beach to anyone I know interested in their vehicles.",4.6
68,"November 09, 2019","As always, we get unbelievable service.  We get treated superbly.  Nick and Kostas are the best!!!  We highly recommend Long Beach Mercedes-Benz to anyone looking for the best service and prices out there.",5.0
69,"November 07, 2019",Great great Raymond is very good for the service to my car. Great service by Raymond to my Mercedes-Benz vehicle for the required checkup.,4.6
70,"November 06, 2019","Nick was amazing. He listened attentively to my concerns and addressed them accordingly. I couldn’t ask for a more professional and knowledgeable person to be my advisor. I would like to give him the highest marks possible.
However, I’m very disappointed at the fact that I was charged $8.72 for gas reimbursement. I did in fact refuel the loaner car with an amount  I thought was substantial . I only wish someone would have told me I needed to add more fuel. I’m not at all happy about being charged dealer gas prices . I would have gone to another gas station and spent less money. This is my 4th purchase from Long Beach Mercedes and this is actually the first time I didn’t feel valued by your dealership . I hope to get over my disappointment soon. This is giving me serious second thoughts about where to get my next service and purchase from. It’s the principle and I do accept responsibility for my error. I should’ve asked if everything was ok when I returned the loaner car. 
Thank you for checking out my review, Donna Dixon, a loyal and faithful customer ",5.0
71,"November 05, 2019","From the moment we drove on to the lot ,We were treated like royalty.  Purchasing a car is my least favorite thing to do. But Steve Swice made it painless. I will recommend this dealership to everyone.",5.0
72,"November 05, 2019",from the very start of my interest in purchasing a GLA250 - Dylan was great with our back and forth emailing/texting/phone calls and he was gracious with everything and Dylan offered us a great price so throughout the whole process - Dylan was beyond GREAT!,5.0
73,"November 02, 2019",Totally enjoyable and stress-free. Pleasant and professional. They set the bar for other dealerships. Was  worth driving a little further from Orange County. Can't wait to get another car. ,5.0
74,"November 01, 2019"," We had to purchase two cars in less than 10 days due to older cars failing in that same time period!
Abel Vargas and Wally in Finance took great care of us during this untimely purchase!
Thanks guys!",4.0
75,"October 31, 2019",Abel Vargas and David Gonzalez have treated us like home and there was no pressure to buy my GLE 350.  I would recommended my friends and family to this dealership.,5.0
76,"October 24, 2019","My husband and I researched and test drove a number of cars in our search for a new car. We went with a Mercedes in large part because of the quality of the car, but also because of the service we received. There wasn’t any pressure to buy from them. We were told the price to purchase the car and we either accepted it or not. The price was less than the Genesis and Lexus that we were looking at. We returned a second time to look at other models and actually purchased a higher end Mercedes than we had anticipated because the quote was unbeatable. We were very happy with the white glove service we were given. Ali was patient, answered all of our questions, showed us the different models, helped us test drive 3 different models, and was so friendly and polite. We looked forward to seeing him.",5.0
77,"October 23, 2019","I have been a Mercedes owner for more than 10 years. All employees are nice, quick and try to help you the best. Best dealer ever.",5.0
78,"October 22, 2019","My experience began with Keven Castillo, great customer service and was happy how I only working with him directly and not another person. Overall the service was great simple and had my car serviced and complete by 2:00 pm. ",5.0
79,"October 22, 2019",Staff was so friendly and resourceful! Nick Ortiz was awesome! Made an appointment with ease. Car rental was great. Was in and out of dealership. ,5.0
80,"October 16, 2019",Selene always is great to me and continues to be an outstanding service rep for MB LB!  Easy to work with and always goes the extra mile to make sure everything is great!!!,4.8
81,"October 16, 2019",The main battery on my MBZ Sprinter / RV needed replacing.  My appointment was at 0945 and I was on the road by 1115.  Excellent Service!,4.8
82,"October 16, 2019",Joel made things very easy as I turned in my old lease and got a new lease on a GLC 300.  The girl in Finance was also very nice to work with. ,5.0
83,"October 16, 2019","He knows everything what we need and everything is well prepared.  Paper work is fast.  No stress at all.  Excellent service!! 
Thank you Toshi-San! ",5.0
84,"October 10, 2019","I am a first time buyer and was scared to dive in the whole new car process. But, with the help of Ali he made it to be such a easy and nice experience. I love my new car. Thank you so much!!",5.0
85,"October 09, 2019","Dez is a great person to work with and provides a very high level of customer service.
This is our 4th transaction with him.
Thank you, Dez!",5.0
86,"October 05, 2019",The Service Advisor Scott Krause was very helpful and  kept me informed in a timely manner as to all work that I needed to have done.,4.8
87,"October 03, 2019","Toshi is an excellent person to work with, this is our 4th vehicle we have purchased from him, will continue to do so! Thank you Toshi!",5.0
88,"October 03, 2019","I'm from San Diego. I enquired about a used GLC 300 with Joel. It became apparent that the vehicle was not equipped they way I needed. Joel worked with me to find a vehicle that did meet my requirements. I was able to get into a brand new GLC 300 in my price range with the equipment I needed. This whole thing was done via texting. When I arrived to sign the papers, everything was ready. No waiting. No hassle. Probably the easiest car purchase I have ever done. Except for the traffic on the way up and back!! I highly recommend this dealer.",5.0
89,"October 02, 2019","Clean and neat location near Long beach.
Excellent customer service! Service will taken care in half day. Very satisfied with service rep Colby Shaffer. Thank you",5.0
90,"October 02, 2019","Excellent service by Nick and would recommend him in the future.  I appreciate everything that was done to fix my car.  Yes, I am happy. ",5.0
91,"September 29, 2019","Dez is knowledgable about the products he's selling.  He answered all my questions and the whole transaction was completed sight unseen by me.  I trust Dez and this is the second vehicle I've purhased from him.  I've kept in contact over the years since my first purchase in 2009 of a new  C350.  Periodically, I'd contact him regarding a particular vehicle on MBZ website.  He never made me feel like I was wasting his time,

We came down from the Central Coast, based on our trust in Dez for the purchase of the GLK350.

Whatever he's earning at MBZ Long Beach, his salary should be doubled.  He's excellent in customer service and a tremendous asset to MBZ Long Beach.
Arlene Cox",5.0
92,"September 28, 2019",The dealership staff are very helpful.  They can answer all questions or they know where to get the answers.  They try hard to meet all your requests,5.0
93,"September 28, 2019",I had a great experience. Smooth and very fast! I can’t believe I bought a car in under 3 hours! I also got a great price for my car! I’m so happy. ,5.0
