,Date,Reviews,Ratings
176,"May 16, 2019",It was easy to get an appointment and a loaner. All the work was carefully explained by Christian and no unneeded items were pushed on me.,5.0
177,"May 15, 2019","Excellent service. I would definitely recommend mercedes Benz of Long Beach to all my family and friends. Thank you for all your help.
Sincerely  Lawanda ",4.8
178,"May 12, 2019","Every time I bring my car to the dealership, the staff greet me as though I’m the most important customer they have. Thank you so much, I know I can go elsewhere, but the staff here and the workmanship is what keeps me coming back.",5.0
179,"May 10, 2019",The service was outstanding and everyone is so friendly and helpful. John helped me to get my first Mercedes and made the experience a great one. He was so patient and very informative. April in the finance department made it very easy and was extremely helpful. She was a pleasure to work with as well. I highly recommned this dealership and dont plan to go anywhere else once its time for our next car. ,5.0
180,"May 07, 2019",This isn’t the closest dealership to me but I’ve been coming here for 9 years and they treat everyone with respect and they’re friendly and honest. ,5.0
181,"May 02, 2019","This dealership is a bit further than the Torrance dealership but, so worth the drive.

Rebecca Lee, my service advisor went above and beyond to make sure we were taken cared off, my wife has a brand new car that had an issue which is rare but, we made it work. 

I called the Torrance dealership and inquired about a loaner.. none available until almost 5 days later!?
We need both our cars to work and i decided to call Long Beach, immediately totally different experience, they said, yes we can accommodate you and yes we have a loaner now.! 

I drove there and met with Rebecca Lee, she made it a very enjoyable experience and got me on the road right away, she was handling a few clients at the same time, I was impressed as she didn’t make me wait or anything. 

One other great point is that she was on top of the service request, even thou it took longer than expected she checked in and connected with me to keep me updated, it is the little things like this that makes this a very memorable experience and sets Mercedes apart from the competition. 

I will definitely come back to the Long Beach Mercedes whenever we need anything else. 

Thank you so so much!!!
",5.0
182,"May 02, 2019","Excellent service provided by Raymond, and all other staff members . All personnel are courteous and friendly. Facility is customer friendly and well maintained. Would recommend Long Beach MB to all my friends👍",5.0
183,"May 02, 2019","Rebecca Lee is very professional, very helpful, and focused on getting a great service to you.  The service is fast.  Their suggestions are right on point and mindful. ",5.0
184,"May 02, 2019",Dylan made my purchase easy and fast. He responded to my messages fast and kept in touch. Will definitely recommend Mercedes of Long Beach to my friends ,5.0
185,"April 29, 2019","Everyone was respectful and helpful. Every time I had a question, the team followed up and got back to me quickly. Happy to be and remain a customer. ",5.0
186,"April 28, 2019","I liked being treated  with respect and having all of my questions answered, as well as being shown the inside panels & how everything worked. Most important finding the car that matched my desires and finances.",5.0
187,"April 28, 2019","Debbie is always great, willing to please you in our need. Great smile. Very friendly customer service and our car was ready just 4 hours after we dropped.",5.0
188,"April 27, 2019","Rebecca Lee made the service as quick and efficient as possible while being friendly, upbeat and personable! I come all the way from Orange County to service my car and the whole process is seamless. I look forward to my rental car and the coffee!",5.0
189,"April 27, 2019",Very helpful and not overbearing.  Joel had everything ready for my son and daughter-in-law prior to our arrival and answered all of their questions since they are the ones that will be using the car.  ,5.0
190,"April 26, 2019","I always have  a good experience at LB Mercedes.
The purchase process and service center are always friendly and professional.
I do recommend the staff at LB Mercedes",4.8
191,"April 26, 2019",My experience was awesome.  I chose to wait for my car and the service was completed in a very timely manner.  I had some concerns but Christian was very reassuring and patient.  I am so thankful to all the employees at MB of LB especially Ali and now Christian. ,5.0
192,"April 24, 2019","I needed a tire, Rebeca took good care of me. Excellent service. This is my 3rd Benz. I always bring my cars here for service. I have been a Benz girl for 20 Years. Love my E350!!!!",5.0
193,"April 24, 2019","Mr Colby Shaffer was my Service advisor and from start to finish I really enjoyed my experience. I was greeted by Oliver in the service drive then onto my Service Advisor Mr Shaffer. He explained everything & what to expect, if I wanted my car cleaned and what time to expect them to finish. He offered me a loan car which I didn’t need he showed me where the customer lounge was and where all the refreshments were too. He promptly called me when my car was ready and before I knew it I was back on the road! Great service guys! ",5.0
194,"April 24, 2019","Dez made the leasing experience stress free, and I really appreciate how responsive he’s been to all my questions about our new GLE 450.  ",5.0
195,"April 22, 2019","Everything went smoothly. Rebecca Lee was my client service advisor and she was friendly, courteous and thorough. the wait was a bit long but it was Friday so the dealership was busy. ",5.0
196,"April 21, 2019","Shopped around for a while. Decided to wait. Then Dez shot me another email with updated price and I couldn’t pass it up. Dez is fantastic to work with. Responsive, honest, and great follow up. Deciding to buy and second vehicle from him now, and it’s great to know that I don’t even need to shop around for pricing.  Thanks againDez!!",5.0
197,"April 20, 2019","Everything about my process was awesome 
Thank you again for your services . I will continue to buy from Long Beach Mercedes. They will make it happen ",5.0
198,"April 20, 2019","My service advisor kept me in the loop at all stages of the service process.  He returned my calls promptly, gave me realistic expectations, and was very accommodating to my schedule.",5.0
199,"April 20, 2019",Nicholas Ortiz is the best.  He explained everything that was going to be done and he got it done! I was very pleased with his service. Couldn't have been better,5.0
200,"April 19, 2019","Nick called with updates, he was very efficient, and helpful. Price for service was reasonable for Mercedes. The only problem was I saw some scratches on my car that I didn’t see there previously. Otherwise I will definitely go back. Thanks Nick!",5.0
201,"April 14, 2019",Staff has always exhibited excellent customer service skills.  Patience and knowledge is a plus.  Standing ovation to Nick Ortiz for his unwavering dedication to customers.,4.6
202,"April 13, 2019",Nick is a wonderful representative.  He takes time to go over findings and makes recommendations without pressure.  Shows concerns for the client and is very polite.,4.8
203,"April 13, 2019",Debbie/Sophany make the experience of the dealership invaluable. I drive all the way from Colorado to have my servicing done.....and would buy another from them too!,4.6
204,"April 13, 2019","Always my go to person Nick Ortiz is attentive, knowledgeable and overall great customer service. He got me in and out of the dealership when he recognized I’m running behind on schedule. ",5.0
205,"April 12, 2019","Debbie Auman helped us with our Sprinter servicing.  Her knowledgeable, helpful service is terrific.  Not all MB dealerships have great Sprinter service with the appropriate software, parts and larger service bays.  Our only observation is that this dealership could use a little more space to hold all the cars and Sprinters waiting for service.

 We will be back!",4.8
206,"April 11, 2019",Courteous friendly Service. Facilities were clean and comfortable. All employees were very courteous and helpful. I did have to wait 10-15 minutes for my advisor which was a little irritating ,3.8
207,"April 09, 2019",The service and price was better than any other place. I have been shopping around and someone told me to go to the dealer and they were right. Great ,5.0
208,"April 09, 2019",I just had to bring my car in to have the airbags changes out because of the recall.  Christian Magana helped me and was very nice to deal with.  It did not take long for me to drop my car off.  They finished the work very quickly which I appreciated.,5.0
209,"April 06, 2019",Nick is always providing excellent customer service! I would recommend Nick to my friends and family for all of their service needs. Very happy with my experience with Mercedes Benz.,5.0
210,"April 05, 2019","Christian was excellent, as always!! Every time I come in I am greeted with the warmest welcome! He definitely makes my experience personal! Always a pleasure! ",5.0
211,"April 03, 2019","Colby Shaffer is great.  I always ask for him when servicing our cars. I appreciate his expertise, friendly attitude and timely response to my inquiries.",5.0
212,"April 03, 2019","After a few weeks of searching for which car I really wanted.. I decided to come here. I got the 2019 Mercedes Benz A220. The technology in this car is beyond amazing! 

Toshi and his wife Lisa went above and beyond for me. Toshi even stayed past 9PM just to make sure everything was good to go. There was an issue with the battery and he did everything he could to have it replaced for me, so that I could take it home that night instead of waiting a few days. I'm so grateful for that. The next day, I had to come back to get the extra key and his wife Lisa showed me how to use some of the controls in the car. She's so cute and funny! I totally and highly recommend buying or leasing a car with Toshi! He is the best!

I'm so very happy to have met them and the amazing service they both provided me. Such a great experience!",5.0
213,"April 01, 2019","Rebecca is always so tentative to my needs for servicing my car, and she is so personable, friendly and pleasant.  Great Customer Service Skills!!!  She makes sure her customers are satisfied.",5.0
214,"March 30, 2019","
My sales associate Steve worked hard to get my loan approved and I am forever appreciative. I will be sure to recommend Mercedes Benz of Long Beach to my friends and family.",5.0
215,"March 29, 2019",Greeted in time and car was ready as promised. I enjoy working with Rebecca for service. She's always in top of letting me know what's going on with my car. ,5.0
216,"March 28, 2019",TK and David were able to meet my car needs with my financial preferences and to get a deal done that we were all happy with.  Very happy to be driving my new MB!  Thanks MBLB!,5.0
217,"March 27, 2019","Debbie of Sprinter service was professional, very helpful and the air bag warranty work was done in a timely manner.  The bonus was the vehicle was washed!",5.0
218,"March 26, 2019","Christian Magaña always provide a very professional, very knowledgeable and very friendly service!
He walks the extra mile to resolve my concerns. All staff at Service Department and Loaner cars are superb. ",5.0
219,"March 26, 2019",Great service from Colby who was very friendly and very helpful.  I would highly recommend the whole service staff as everyone who I encountered was professional..,5.0
220,"March 25, 2019","Never could a spot be better situated for furtherance at Long Beach Mercedes-Benz. Furthermore, our visit was to gaze what choices of vehicle we would like to purchase rather, we gone home with vehicle which we can enjoy. The team of Long Beach Mercedes-Benz were attentive, and active with our yearning of vehicle choices. The team had provided us the choices and we proceed the purchased.",4.4
221,"March 24, 2019","Great service and customer care from all of you most especially Selene Tores .  Right from the reception to finish, everybody was fast and polite. Keep up the good work .",4.6
222,"March 23, 2019","We would have not had the experience we had without Steve Sweis. He was wonderful! He was patient, he did not pressure us and always remained upfront an honest. Everyone that would pass by was friendly and warm.",5.0
223,"March 22, 2019",Very professional and prompt. I would recommend this service center to anyone. My car was ready when promised and they were very courteous and accommodating. ,4.2
224,"March 22, 2019",This was my 2nd purchase with this dealership and it was just as good as the first one.  Joel took care of me and had me out of the dealership within 2 hours driving home in my new vehicle.  The whole staff that I dealt with and I apologize for not remembering your names were phenomenal also.,5.0
225,"March 21, 2019","We had the please in having Toshi and his wife Lisa assist us with our purchase on a GLC300, he was able to pre-approve us and run the number for us before we went to the dealership.  We were able to test drive and go straight to financing.  Wonderful experience, loving our Mercedes-Benz so happy to be back in a Mercedes.  Thank you.",5.0
226,"March 21, 2019", Been a long Custmer of Long Beach Merceds Great service great help love the assistance and quick action from the staff especially  Rebecca Lee and nael Issa thanks a lot ,5.0
227,"March 19, 2019","I had to wait for a B service on my Sprinter, which could have taken up to six hours but Debbie Auman was able to cut that time in half, much appreciated.  She does a great job and I recommend Long Beach Mercedes to my other friends that own Roadtreks on the Sprinter chassis.  I also appreciated the discount coupon that was mailed to my house even though I still spent a lot of money.",5.0
228,"March 18, 2019", Abel had done a great job and make the purchase process simple and easy. The finance advisor (Ms. Say) were efficient and friendly as well.,5.0
229,"March 17, 2019","This is my first Mercedes, and I will never go to any other dealership after my great experience with David the manager and my amazing sales person John B. They made it impossible for me to not leave with the car I wanted. I've had my car for a week now, and I am so excited! Everything was seamless. The lady in finance was great! All in all, a wonderful experience! ",5.0
230,"March 16, 2019","Toshi and his staff were very personable, knowledgeable and just all around SUPER!!! I hadn’t purchased a new vehicle in almost 20 years...Toshi & Co quickly dispelled any anxiety I may have been experiencing with purchasing  a big ticket item. Toshi(and  staff) provided a gracious and extremely courteous atmosphere for the entire purchase (including the finance). I left MB-LB more than satisfied...I have a “new attitude”...”living my best life” in my 450e.  ",5.0
231,"March 16, 2019",It was great working with Joel in ordering my GLC 300. Everyone is friendly and very helpful. I would recommend this place anytime.. Thanks again.,5.0
232,"March 15, 2019",My truck is running well to now be 9 years old. Happy with the service I have been provided. I will continue to hand my trucked worked on here ,4.6
233,"March 12, 2019","Herb i know for a long time. Order all my sprinters with him.
Sophany was very knowledgeable.

Special mention to Debbie Aumann - she is the most important person at M. B. L. B.  AFTER the sale.
She understands commercial fleet operators and
tries her utmost best to get the vehicle repaired asap.",4.8
234,"March 11, 2019","I took my car to the dealership with a rip in the seat cushion on the driver's side.  My service representative, Selene, checked for availability and I left my car overnight at the dealership.  I was given a loan car and early the following day I was notified that the repair had been made.  I returned the loan car the following day and my car was as good as new.",4.8
235,"March 09, 2019","I called to set up an appointment for a service, Selene called me back right away, when I brought my car she was there, she welcome us with a smile, I am very happy that  it was her that helped us, very professional, I will call her next time for my next service, well recommended.

thank you Selene...",5.0
236,"March 09, 2019","Christian Magana was very helpful, attentive  and courteous. i appreciate that he was able to provide a service schedule for me on a short time notice ",5.0
237,"March 08, 2019",Great Service...Easy Drop Off and Pick Up...Told in detail what they did and the cost of repair was actually less than estimated..Highly Recommended,4.8
238,"March 08, 2019","I would say no one ever really looks forward to having their car serviced, at least I know I don't.  But working with Nick to have my 2015 CLS 400 serviced was just about the most pleasant car servicing experience I have ever had in almost 20 years of Mercedes ownership! ",4.8
239,"March 08, 2019",LB MBZ is a fantastic dealership. very clean and very professional. I would highly recommend it for service. I always feel like they take really good care of you. ,5.0
240,"March 07, 2019",Raymond Yambao is very knowledgeable and explained everything to me.  I was concerned because I have a brand new car.  Mr. Yambao went the extra mile to make sure I was a happy customer. ,5.0
241,"March 05, 2019",Great experience. Issa is the best and made the process enjoyable. Loooking forward to our next purchase! We love driving the car and everything about it.,5.0
242,"March 05, 2019","I was looking for a newer used car when my friend recommended that I check out MBZ of Long Beach. Steve showed me a 2018 Civic Si and was willing to work with me more than any of the Honda Dealers would. The next time I buy a car, I'll definitely check with Steve to see if he has any more good deals for me. 10/10 would shop again",5.0
243,"March 04, 2019","My wife and I had an amazing experience at this dealership. Yuzu and David helped us out and I can't say enough nice things about the experience. When you make a purchase like this you want to know you have people looking out for and you also want it to be a quick process, both of which they nailed.",5.0
244,"March 03, 2019","Great overall experience, super courteous, friendly, and customer satisfaction oriented. Found my new MB dealership for my cars needs. Rebecca was amazing, and made sure my car was in and out fast. ",5.0
245,"March 02, 2019","Paul Ortega handled everything for us, from our internet communication through the test drive and finally the purchase. Thank you so much for helping us. We had a safe and enjoyable 12-hour drive home.
",5.0
246,"March 01, 2019",I almost always arrive at the service center without an appointment  and i still receive the same high quality attention service on the spot. Awesome ,5.0
247,"March 01, 2019","Very satisfied with the services , the only thing im not satisfied is the cleaning ans washing please do something to improve the washing services, Christian is a very helpful person.",5.0
248,"March 01, 2019",We received excellent customer service from MBLB.  We worked with Joel Turett on the details of our lease and he was very easy to work with.  Joel met our expectations and went above and beyond to ensure we received everything we were promised.  Everyone at the dealership was friendly and helpful.,5.0
249,"February 27, 2019",Nicholas Ortiz has been very helpful and also takes the extra mile to help us. He answers and addresses any concerns we have right away. Mercedes at Long Beach is very lucky to have him. His service is exceptional! Great person.,5.0
250,"February 26, 2019","I love the MBLB service department, Its very easy to bring your car in and get serviced.  Everyone is very helpful especially Selena my service advisor.  She makes me want to bring my car there.  Its never stressful.  I've been to other dealerships and its like a whole ordeal just to get your car in.  I have 
a 2017 GT, 2017 S550, and 2018 G653.    Always first class service and a great experience!  Thank you MB Long Beach and Thank you Selene!!!!  


",5.0
251,"February 26, 2019",I purchased my first Mercedes a week ago. I had my first issue with the car and came in to the dealership worried about how much it was going to costs. Mercedes took great care of me and I’m happy to be apart of the family. ,5.0
252,"February 24, 2019","The entire process was smooth and easy. Our salean Dez was very friendly and efficient, I’d love to do business with him in the future as well. ",5.0
253,"February 22, 2019",Pleasant.  Ran out of time to fully understand car. Time goes so fast. Otherwise order in meals for customers and sales people because process is so long. ,4.0
254,"February 22, 2019","Needed service in a hurry and once again Christian comes to the rescue.   Thank you sir!   You continue to make life easy for me when I need your help.

",5.0
255,"February 22, 2019",Jesse Lopez my service advisor is always professional and friendly.  The valet associates always has a smile when greeting customers. The ladies at the loaner desk are nice as well,5.0
256,"February 21, 2019","supportive. It started when I called the dealership, the person that answered the phone was very helpful....next it was Chris, he went out of his way to fix my problem. Lastly, Nick was also very helpful and stuck to his commitment",5.0
257,"February 19, 2019",Great service. Didn't have the car I wanted at first but made sure to get it right away. Very attentive and friendly from front desk to finance. ,5.0
258,"February 17, 2019","Everything went well, I had a loaner waiting for me. Debbie explained what was needed. The service was completed sooner than I expected. The coffee and the pastries were an added bonus. I have recommended the dealership to my friend, who also has a Sprinter.",4.8
259,"February 17, 2019",Selene Torres has exceptional customer relations skills and understood my needs as a client delivering the highest quality of work to service my car. I highly recommend her to other customers.,5.0
260,"February 16, 2019","You did an excellent job.The people were courteous,knowledgeable and helpful.Lee even came out  an programmed my garage door.He went way beyond what was necessary..",4.8
261,"February 15, 2019","Selene Torrez is a stellar advisor. She is knowledgable, professional and provides excellent service. I have a 2014 Mercedes Benz 350 E. She always provides me with detailed information prior to providing service. ",4.8
262,"February 10, 2019",Toshi made the process haggle free and professional. It is because of him I keep coming back to Long Beach MBZ to buy or lease my cars.,5.0
263,"February 07, 2019",We just purchased a GLC 300 and our experience was second to none. My wife and I were purchasing our first new car since 2006 so we wanted to make sure we picked out a car my wife loved. We went to many dealerships over a few day period to drive every mid size SUV on the market. I can tell you without a doubt the best dealership experience and salesman we dealt with was at LB Mercedes. The salesman went as far as telling us to pull into the Dodge dealership next door and park next to a Jeep Grand Cherokee Altitude to compare them since my wife was stuck between the two choices. We did not do it but it was nice that the salesman was not just trying to sell us a car he wanted us to get but the best car for us and best car for the price point. We made several trips to the dealer and changed what exterior and interior combo my wife wanted three times and our salesman gave us the best car selection for each request over a three day period until we finally signed the papers. The finance person was great to deal with as well. I don’t think my wife and I will ever shop for a car anywhere else in the future. ,5.0
264,"February 07, 2019",Toshi & Lisa are Amazing!!!! They have the best customer service & made our experience outstanding ! We appreciate the great deal and being treated so well! We would recommend family and friends !,5.0
265,"February 06, 2019","PROFESSIONAL,  FOLLOW UP CALLS, EXTRA MILE TO HELP VERY.
MY ONLY COMPLAIN IS THAT I DID NOT RECEIVE  MY CAR POOL  STICKERS SAME DAY AS THEY DID AT THE ARCADIA MERCEDES BENZ WITH MY PREVIOUS LEASE IN 2015",5.0
266,"February 05, 2019","Debbie took care of business! Great Job! She had vehicle sooner than expected due to the urgency, she took care of our driver, the person dropping off and picking up vehicle.",5.0
267,"February 02, 2019","I brought my car in for the appointment I scheduled from an email I recieved.  I didn't need to come in at all come to fined out, but they checked a noise I heard and did not find anything.  Better safe than sorry, right?
Rebecca is a doll.
",5.0
268,"February 02, 2019","Steve took the time to LISTEN to us and understand what we were looking for. He was never pushy to make a sale and genuinely interested in what we wanted. I highly recommend him. Also, Erin in the Financing department was awesome! She wasn't pushy and got us out in about 2 hours. The customer service was exceptional!!!",5.0
269,"February 02, 2019",I drove down from Silicon Valley because Joel said he could. What do I mean by that? I was only 14 months into a lease and the dealerships in Silicon Valley said I was wasting my time by considering the new model. I called Joel and he said let me run some numbers.  Joe took extra effort to make sure that he could work this deal and he did! He truly treated me like I was the only customer that  mercedes-Benz of Long Beach had. I will send more customers from the Bay Area for sure!,5.0
